"No.","Time","Source","Destination","Protocol","Length","Info"
"1","2022-01-19 22:48:38.202445","10.8.0.1","edge-mqtt-shv-01-iad3.facebook.com","TCP","74","34118  >  443 [SYN] Seq=0 Win=65535 Len=0 MSS=1460 SACK_PERM=1 TSval=2148199658 TSecr=0 WS=1024"
"2","2022-01-19 22:48:38.213544","edge-mqtt-shv-01-iad3.facebook.com","10.8.0.1","TCP","54","443  >  34118 [SYN, ACK] Seq=0 Ack=1 Win=65535 Len=0"
"3","2022-01-19 22:48:38.213588","10.8.0.1","edge-mqtt-shv-01-iad3.facebook.com","TCP","54","34118  >  443 [ACK] Seq=1 Ack=1 Win=65535 Len=0"
"4","2022-01-19 22:48:38.220675","10.8.0.1","edge-mqtt-shv-01-iad3.facebook.com","TLSv1.3","453","Client Hello"
"5","2022-01-19 22:48:38.220763","edge-mqtt-shv-01-iad3.facebook.com","10.8.0.1","TCP","54","443  >  34118 [ACK] Seq=1 Ack=400 Win=65535 Len=0"
"6","2022-01-19 22:48:38.221722","10.8.0.1","edge-mqtt-shv-01-iad3.facebook.com","TLSv1.3","461","Change Cipher Spec, Application Data"
"7","2022-01-19 22:48:38.221778","edge-mqtt-shv-01-iad3.facebook.com","10.8.0.1","TCP","54","443  >  34118 [ACK] Seq=1 Ack=807 Win=65535 Len=0"
"8","2022-01-19 22:48:38.299152","10.8.0.1","edge-mqtt-shv-01-iad3.facebook.com","TCP","74","34122  >  443 [SYN] Seq=0 Win=65535 Len=0 MSS=1460 SACK_PERM=1 TSval=2148199744 TSecr=0 WS=1024"
"9","2022-01-19 22:48:38.302438","edge-mqtt-shv-01-iad3.facebook.com","10.8.0.1","TCP","54","443  >  34122 [SYN, ACK] Seq=0 Ack=1 Win=65535 Len=0"
"10","2022-01-19 22:48:38.302477","10.8.0.1","edge-mqtt-shv-01-iad3.facebook.com","TCP","54","34122  >  443 [ACK] Seq=1 Ack=1 Win=65535 Len=0"
"11","2022-01-19 22:48:38.303362","10.8.0.1","edge-mqtt-shv-01-iad3.facebook.com","TLSv1.2","311","Client Hello"
"12","2022-01-19 22:48:38.303473","edge-mqtt-shv-01-iad3.facebook.com","10.8.0.1","TCP","54","443  >  34122 [ACK] Seq=1 Ack=258 Win=65535 Len=0"
"13","2022-01-19 22:48:38.354151","edge-mqtt-shv-01-iad3.facebook.com","10.8.0.1","TLSv1.3","1432","Server Hello, Change Cipher Spec, Application Data"
"14","2022-01-19 22:48:38.404301","10.8.0.1","edge-mqtt-shv-01-iad3.facebook.com","TCP","54","34118  >  443 [ACK] Seq=807 Ack=1379 Win=65535 Len=0"
"15","2022-01-19 22:48:38.404592","edge-mqtt-shv-01-iad3.facebook.com","10.8.0.1","TLSv1.3","1434","Application Data [TCP segment of a reassembled PDU]"
"16","2022-01-19 22:48:38.404654","10.8.0.1","whatsapp-chatd-msgr-mini-edge-shv-01-iad3.facebook.com","TCP","74","41416  >  5222 [SYN] Seq=0 Win=65535 Len=0 MSS=1460 SACK_PERM=1 TSval=2780872830 TSecr=0 WS=1024"
"17","2022-01-19 22:48:38.407058","whatsapp-chatd-msgr-mini-edge-shv-01-iad3.facebook.com","10.8.0.1","TCP","54","5222  >  41416 [SYN, ACK] Seq=0 Ack=1 Win=65535 Len=0"
"18","2022-01-19 22:48:38.407104","10.8.0.1","edge-mqtt-shv-01-iad3.facebook.com","TCP","54","34118  >  443 [ACK] Seq=807 Ack=2759 Win=65535 Len=0"
"19","2022-01-19 22:48:38.407119","10.8.0.1","whatsapp-chatd-msgr-mini-edge-shv-01-iad3.facebook.com","TCP","54","41416  >  5222 [ACK] Seq=1 Ack=1 Win=65535 Len=0"
"20","2022-01-19 22:48:38.408606","10.8.0.1","whatsapp-chatd-msgr-mini-edge-shv-01-iad3.facebook.com","TCP","58","41416  >  5222 [PSH, ACK] Seq=1 Ack=1 Win=65535 Len=4 [TCP segment of a reassembled PDU]"
"21","2022-01-19 22:48:38.408706","whatsapp-chatd-msgr-mini-edge-shv-01-iad3.facebook.com","10.8.0.1","TCP","54","5222  >  41416 [ACK] Seq=1 Ack=5 Win=65535 Len=0"
"22","2022-01-19 22:48:38.408726","10.8.0.1","whatsapp-chatd-msgr-mini-edge-shv-01-iad3.facebook.com","TCP","61","41416  >  5222 [PSH, ACK] Seq=5 Ack=1 Win=65535 Len=7 [TCP segment of a reassembled PDU]"
"23","2022-01-19 22:48:38.408761","whatsapp-chatd-msgr-mini-edge-shv-01-iad3.facebook.com","10.8.0.1","TCP","54","5222  >  41416 [ACK] Seq=1 Ack=12 Win=65535 Len=0"
"24","2022-01-19 22:48:38.408773","10.8.0.1","whatsapp-chatd-msgr-mini-edge-shv-01-iad3.facebook.com","TCP","58","41416  >  5222 [PSH, ACK] Seq=12 Ack=1 Win=65535 Len=4 [TCP segment of a reassembled PDU]"
"25","2022-01-19 22:48:38.408826","whatsapp-chatd-msgr-mini-edge-shv-01-iad3.facebook.com","10.8.0.1","TCP","54","5222  >  41416 [ACK] Seq=1 Ack=16 Win=65535 Len=0"
"26","2022-01-19 22:48:38.411847","10.8.0.1","whatsapp-chatd-msgr-mini-edge-shv-01-iad3.facebook.com","TCP","590","41416  >  5222 [ACK] Seq=16 Ack=1 Win=65535 Len=536 [TCP segment of a reassembled PDU]"
"27","2022-01-19 22:48:38.411971","whatsapp-chatd-msgr-mini-edge-shv-01-iad3.facebook.com","10.8.0.1","TCP","54","5222  >  41416 [ACK] Seq=1 Ack=552 Win=65535 Len=0"
"28","2022-01-19 22:48:38.411990","10.8.0.1","whatsapp-chatd-msgr-mini-edge-shv-01-iad3.facebook.com","TCP","590","41416  >  5222 [PSH, ACK] Seq=552 Ack=1 Win=65535 Len=536 [TCP segment of a reassembled PDU]"
"29","2022-01-19 22:48:38.412022","whatsapp-chatd-msgr-mini-edge-shv-01-iad3.facebook.com","10.8.0.1","TCP","54","5222  >  41416 [ACK] Seq=1 Ack=1088 Win=65535 Len=0"
"30","2022-01-19 22:48:38.412035","10.8.0.1","whatsapp-chatd-msgr-mini-edge-shv-01-iad3.facebook.com","TCP","213","41416  >  5222 [PSH, ACK] Seq=1088 Ack=1 Win=65535 Len=159 [TCP segment of a reassembled PDU]"
"31","2022-01-19 22:48:38.412071","whatsapp-chatd-msgr-mini-edge-shv-01-iad3.facebook.com","10.8.0.1","TCP","54","5222  >  41416 [ACK] Seq=1 Ack=1247 Win=65535 Len=0"
"32","2022-01-19 22:48:38.439034","edge-mqtt-shv-01-iad3.facebook.com","10.8.0.1","TLSv1.3","534","Application Data"
"33","2022-01-19 22:48:38.489202","10.8.0.1","edge-mqtt-shv-01-iad3.facebook.com","TCP","54","34118  >  443 [ACK] Seq=807 Ack=3239 Win=65535 Len=0"
"34","2022-01-19 22:48:38.489251","10.8.0.1","edge-mqtt-shv-01-iad3.facebook.com","TLSv1.3","112","Application Data"
"35","2022-01-19 22:48:38.489413","edge-mqtt-shv-01-iad3.facebook.com","10.8.0.1","TCP","54","443  >  34118 [ACK] Seq=3239 Ack=865 Win=65535 Len=0"
"36","2022-01-19 22:48:38.489434","10.8.0.1","edge-mqtt-shv-01-iad3.facebook.com","TCP","590","34118  >  443 [ACK] Seq=865 Ack=3239 Win=65535 Len=536 [TCP segment of a reassembled PDU]"
"37","2022-01-19 22:48:38.489491","edge-mqtt-shv-01-iad3.facebook.com","10.8.0.1","TCP","54","443  >  34118 [ACK] Seq=3239 Ack=1401 Win=65535 Len=0"
"38","2022-01-19 22:48:38.489537","10.8.0.1","edge-mqtt-shv-01-iad3.facebook.com","TCP","590","34118  >  443 [PSH, ACK] Seq=1401 Ack=3239 Win=65535 Len=536 [TCP segment of a reassembled PDU]"
"39","2022-01-19 22:48:38.489572","edge-mqtt-shv-01-iad3.facebook.com","10.8.0.1","TCP","54","443  >  34118 [ACK] Seq=3239 Ack=1937 Win=65535 Len=0"
"40","2022-01-19 22:48:38.489587","10.8.0.1","edge-mqtt-shv-01-iad3.facebook.com","TLSv1.3","590","Application Data [TCP segment of a reassembled PDU]"
"41","2022-01-19 22:48:38.489671","edge-mqtt-shv-01-iad3.facebook.com","10.8.0.1","TCP","54","443  >  34118 [ACK] Seq=3239 Ack=2473 Win=65535 Len=0"
"42","2022-01-19 22:48:38.489689","10.8.0.1","edge-mqtt-shv-01-iad3.facebook.com","TLSv1.3","279","Application Data"
"43","2022-01-19 22:48:38.489716","edge-mqtt-shv-01-iad3.facebook.com","10.8.0.1","TCP","54","443  >  34118 [ACK] Seq=3239 Ack=2698 Win=65535 Len=0"
"44","2022-01-19 22:48:38.569397","edge-mqtt-shv-01-iad3.facebook.com","10.8.0.1","TLSv1.2","3227","Server Hello, Certificate, Server Key Exchange, Server Hello Done"
"45","2022-01-19 22:48:38.619617","10.8.0.1","edge-mqtt-shv-01-iad3.facebook.com","TCP","54","34122  >  443 [ACK] Seq=258 Ack=3174 Win=65535 Len=0"
"46","2022-01-19 22:48:38.619686","10.8.0.1","edge-mqtt-shv-01-iad3.facebook.com","TLSv1.2","180","Client Key Exchange, Change Cipher Spec, Encrypted Handshake Message"
"47","2022-01-19 22:48:38.619819","edge-mqtt-shv-01-iad3.facebook.com","10.8.0.1","TCP","54","443  >  34122 [ACK] Seq=3174 Ack=384 Win=65535 Len=0"
"48","2022-01-19 22:48:38.726433","edge-mqtt-shv-01-iad3.facebook.com","10.8.0.1","TLSv1.2","105","Change Cipher Spec, Encrypted Handshake Message"
"49","2022-01-19 22:48:38.776678","10.8.0.1","edge-mqtt-shv-01-iad3.facebook.com","TCP","54","34122  >  443 [ACK] Seq=384 Ack=3225 Win=65535 Len=0"
"50","2022-01-19 22:48:38.776747","10.8.0.1","edge-mqtt-shv-01-iad3.facebook.com","TLSv1.2","322","Application Data"
"51","2022-01-19 22:48:38.776919","edge-mqtt-shv-01-iad3.facebook.com","10.8.0.1","TCP","54","443  >  34122 [ACK] Seq=3225 Ack=652 Win=65535 Len=0"
"52","2022-01-19 22:48:38.827494","whatsapp-chatd-msgr-mini-edge-shv-01-iad3.facebook.com","10.8.0.1","TCP","164","5222  >  41416 [PSH, ACK] Seq=1 Ack=1247 Win=65535 Len=110 [TCP segment of a reassembled PDU]"
"53","2022-01-19 22:48:38.827550","10.8.0.1","whatsapp-chatd-msgr-mini-edge-shv-01-iad3.facebook.com","TCP","54","41416  >  5222 [ACK] Seq=1247 Ack=111 Win=65535 Len=0"
"54","2022-01-19 22:48:38.835834","10.8.0.1","whatsapp-chatd-msgr-mini-edge-shv-01-iad3.facebook.com","TCP","98","41416  >  5222 [PSH, ACK] Seq=1247 Ack=111 Win=65535 Len=44 [TCP segment of a reassembled PDU]"
"55","2022-01-19 22:48:38.835992","whatsapp-chatd-msgr-mini-edge-shv-01-iad3.facebook.com","10.8.0.1","TCP","54","5222  >  41416 [ACK] Seq=111 Ack=1291 Win=65535 Len=0"
"56","2022-01-19 22:48:38.959501","whatsapp-chatd-msgr-mini-edge-shv-01-iad3.facebook.com","10.8.0.1","TCP","100","5222  >  41416 [PSH, ACK] Seq=111 Ack=1291 Win=65535 Len=46 [TCP segment of a reassembled PDU]"
"57","2022-01-19 22:48:39.009757","10.8.0.1","whatsapp-chatd-msgr-mini-edge-shv-01-iad3.facebook.com","TCP","54","41416  >  5222 [ACK] Seq=1291 Ack=157 Win=65535 Len=0"
"58","2022-01-19 22:48:39.010002","edge-mqtt-shv-01-iad3.facebook.com","10.8.0.1","TLSv1.2","87","Application Data"
"59","2022-01-19 22:48:39.010122","whatsapp-chatd-msgr-mini-edge-shv-01-iad3.facebook.com","10.8.0.1","TCP","141","5222  >  41416 [PSH, ACK] Seq=157 Ack=1291 Win=65535 Len=87 [TCP segment of a reassembled PDU]"
"60","2022-01-19 22:48:39.010144","10.8.0.1","edge-mqtt-shv-01-iad3.facebook.com","TCP","54","34122  >  443 [ACK] Seq=652 Ack=3258 Win=65535 Len=0"
"61","2022-01-19 22:48:39.010167","10.8.0.1","whatsapp-chatd-msgr-mini-edge-shv-01-iad3.facebook.com","TCP","54","41416  >  5222 [ACK] Seq=1291 Ack=244 Win=65535 Len=0"
"62","2022-01-19 22:48:39.066401","10.8.0.1","edge-mqtt-shv-01-iad3.facebook.com","TLSv1.2","104","Application Data"
"63","2022-01-19 22:48:39.066562","edge-mqtt-shv-01-iad3.facebook.com","10.8.0.1","TCP","54","443  >  34122 [ACK] Seq=3258 Ack=702 Win=65535 Len=0"
"64","2022-01-19 22:48:39.116851","10.8.0.1","edge-mqtt-shv-01-iad3.facebook.com","TCP","590","34122  >  443 [ACK] Seq=702 Ack=3258 Win=65535 Len=536 [TCP segment of a reassembled PDU]"
"65","2022-01-19 22:48:39.117013","edge-mqtt-shv-01-iad3.facebook.com","10.8.0.1","TCP","54","443  >  34122 [ACK] Seq=3258 Ack=1238 Win=65535 Len=0"
"66","2022-01-19 22:48:39.117027","10.8.0.1","edge-mqtt-shv-01-iad3.facebook.com","TLSv1.2","78","Application Data"
"67","2022-01-19 22:48:39.117048","edge-mqtt-shv-01-iad3.facebook.com","10.8.0.1","TCP","54","443  >  34122 [ACK] Seq=3258 Ack=1262 Win=65535 Len=0"
"68","2022-01-19 22:48:39.167241","10.8.0.1","edge-star-shv-01-iad3.facebook.com","QUIC","1274","Initial, DCID=0f5ebaafc499eaa3, PKN: 11266594, CRYPTO, PADDING"
"69","2022-01-19 22:48:39.260600","edge-star-shv-01-iad3.facebook.com","10.8.0.1","QUIC","1274","Initial, SCID=6ddc89d2697c70af, PKN: 15116665, ACK, PADDING"
"70","2022-01-19 22:48:39.260668","10.8.0.1","edge-star-shv-01-iad3.facebook.com","QUIC","113","0-RTT, DCID=0f5ebaafc499eaa3"
"71","2022-01-19 22:48:40.285571","edge-mqtt-shv-01-iad3.facebook.com","10.8.0.1","TLSv1.2","120","Application Data, Application Data"
"72","2022-01-19 22:48:40.285649","10.8.0.1","edge-star-shv-01-iad3.facebook.com","QUIC","1274","Initial, DCID=0f5ebaafc499eaa3, PKN: 11266596, CRYPTO, PADDING"
"73","2022-01-19 22:48:40.399156","edge-star-shv-01-iad3.facebook.com","10.8.0.1","QUIC","1274","Initial, SCID=6ddb865bcfc91dd0, PKN: 11692847, ACK, PADDING"
"74","2022-01-19 22:48:40.399211","10.8.0.1","edge-star-shv-01-iad3.facebook.com","TCP","74","51886  >  443 [SYN] Seq=0 Win=65535 Len=0 MSS=1460 SACK_PERM=1 TSval=1734644978 TSecr=0 WS=1024"
"75","2022-01-19 22:48:40.401753","edge-star-shv-01-iad3.facebook.com","10.8.0.1","TCP","54","443  >  51886 [SYN, ACK] Seq=0 Ack=1 Win=65535 Len=0"
"76","2022-01-19 22:48:40.401793","10.8.0.1","a23-39-16-76.deploy.static.akamaitechnologies.com","TCP","74","53290  >  443 [SYN] Seq=0 Win=65535 Len=0 MSS=1460 SACK_PERM=1 TSval=2412500356 TSecr=0 WS=1024"
"77","2022-01-19 22:48:40.405108","a23-39-16-76.deploy.static.akamaitechnologies.com","10.8.0.1","TCP","54","443  >  53290 [SYN, ACK] Seq=0 Ack=1 Win=65535 Len=0"
"78","2022-01-19 22:48:40.405139","10.8.0.1","ec2-34-197-203-72.compute-1.amazonaws.com","TCP","74","36064  >  443 [SYN] Seq=0 Win=65535 Len=0 MSS=1460 SACK_PERM=1 TSval=1512814733 TSecr=0 WS=1024"
"79","2022-01-19 22:48:40.406749","ec2-34-197-203-72.compute-1.amazonaws.com","10.8.0.1","TCP","54","443  >  36064 [SYN, ACK] Seq=0 Ack=1 Win=65535 Len=0"
"80","2022-01-19 22:48:40.406774","10.8.0.1","a23-221-63-66.deploy.static.akamaitechnologies.com","TCP","74","35956  >  443 [SYN] Seq=0 Win=65535 Len=0 MSS=1460 SACK_PERM=1 TSval=2540907416 TSecr=0 WS=1024"
"81","2022-01-19 22:48:40.425572","a23-221-63-66.deploy.static.akamaitechnologies.com","10.8.0.1","TCP","54","443  >  35956 [SYN, ACK] Seq=0 Ack=1 Win=65535 Len=0"
"82","2022-01-19 22:48:40.425637","10.8.0.1","ec2-35-80-215-203.us-west-2.compute.amazonaws.com","TCP","74","44426  >  443 [SYN] Seq=0 Win=65535 Len=0 MSS=1460 SACK_PERM=1 TSval=3112459403 TSecr=0 WS=1024"
"83","2022-01-19 22:48:40.431921","ec2-35-80-215-203.us-west-2.compute.amazonaws.com","10.8.0.1","TCP","54","443  >  44426 [SYN, ACK] Seq=0 Ack=1 Win=65535 Len=0"
"84","2022-01-19 22:48:40.431987","10.8.0.1","a23-39-16-76.deploy.static.akamaitechnologies.com","TCP","74","53298  >  443 [SYN] Seq=0 Win=65535 Len=0 MSS=1460 SACK_PERM=1 TSval=2412500747 TSecr=0 WS=1024"
"85","2022-01-19 22:48:40.439588","a23-39-16-76.deploy.static.akamaitechnologies.com","10.8.0.1","TCP","54","443  >  53298 [SYN, ACK] Seq=0 Ack=1 Win=65535 Len=0"
"86","2022-01-19 22:48:40.439640","10.8.0.1","edge-mqtt-shv-01-iad3.facebook.com","TCP","54","34122  >  443 [ACK] Seq=1262 Ack=3324 Win=65535 Len=0"
"87","2022-01-19 22:48:40.439656","10.8.0.1","edge-star-shv-01-iad3.facebook.com","TCP","74","[TCP Retransmission] [TCP Port numbers reused] 51886  >  443 [SYN] Seq=0 Win=65535 Len=0 MSS=1460 SACK_PERM=1 TSval=1734645990 TSecr=0 WS=1024"
"88","2022-01-19 22:48:40.450749","edge-star-shv-01-iad3.facebook.com","10.8.0.1","TCP","54","[TCP Retransmission] 443  >  51886 [SYN, ACK] Seq=0 Ack=1 Win=65535 Len=0"
"89","2022-01-19 22:48:40.450788","10.8.0.1","edge-star-shv-01-iad3.facebook.com","TCP","54","51886  >  443 [ACK] Seq=1 Ack=1 Win=67107840 Len=0"
"90","2022-01-19 22:48:40.450797","10.8.0.1","edge-star-shv-01-iad3.facebook.com","TLSv1","461","Client Hello"
"91","2022-01-19 22:48:40.450821","edge-star-shv-01-iad3.facebook.com","10.8.0.1","TCP","54","443  >  51886 [ACK] Seq=1 Ack=408 Win=65535 Len=0"
"92","2022-01-19 22:48:40.450829","10.8.0.1","a23-39-16-76.deploy.static.akamaitechnologies.com","TCP","54","53290  >  443 [ACK] Seq=1 Ack=1 Win=65535 Len=0"
"93","2022-01-19 22:48:40.450836","10.8.0.1","ec2-34-197-203-72.compute-1.amazonaws.com","TCP","54","36064  >  443 [ACK] Seq=1 Ack=1 Win=65535 Len=0"
"94","2022-01-19 22:48:40.450845","10.8.0.1","a23-39-16-76.deploy.static.akamaitechnologies.com","TLSv1.2","571","Client Hello"
"95","2022-01-19 22:48:40.450887","a23-39-16-76.deploy.static.akamaitechnologies.com","10.8.0.1","TCP","54","443  >  53290 [ACK] Seq=1 Ack=518 Win=65535 Len=0"
"96","2022-01-19 22:48:40.450894","10.8.0.1","ec2-34-197-203-72.compute-1.amazonaws.com","TLSv1.2","571","Client Hello"
"97","2022-01-19 22:48:40.450910","ec2-34-197-203-72.compute-1.amazonaws.com","10.8.0.1","TCP","54","443  >  36064 [ACK] Seq=1 Ack=518 Win=65535 Len=0"
"98","2022-01-19 22:48:40.450916","10.8.0.1","a23-221-63-66.deploy.static.akamaitechnologies.com","TCP","54","35956  >  443 [ACK] Seq=1 Ack=1 Win=65535 Len=0"
"99","2022-01-19 22:48:40.450924","10.8.0.1","a23-221-63-66.deploy.static.akamaitechnologies.com","TLSv1.3","571","Client Hello"
"100","2022-01-19 22:48:40.450938","a23-221-63-66.deploy.static.akamaitechnologies.com","10.8.0.1","TCP","54","443  >  35956 [ACK] Seq=1 Ack=518 Win=65535 Len=0"
"101","2022-01-19 22:48:40.450946","10.8.0.1","ec2-35-80-215-203.us-west-2.compute.amazonaws.com","TCP","54","44426  >  443 [ACK] Seq=1 Ack=1 Win=65535 Len=0"
"102","2022-01-19 22:48:40.450953","10.8.0.1","ec2-35-80-215-203.us-west-2.compute.amazonaws.com","TLSv1.2","571","Client Hello"
"103","2022-01-19 22:48:40.450978","ec2-35-80-215-203.us-west-2.compute.amazonaws.com","10.8.0.1","TCP","54","443  >  44426 [ACK] Seq=1 Ack=518 Win=65535 Len=0"
"104","2022-01-19 22:48:40.450985","10.8.0.1","a23-39-16-76.deploy.static.akamaitechnologies.com","TCP","54","53298  >  443 [ACK] Seq=1 Ack=1 Win=65535 Len=0"
"105","2022-01-19 22:48:40.450993","10.8.0.1","a23-39-16-76.deploy.static.akamaitechnologies.com","TLSv1.2","571","Client Hello"
"106","2022-01-19 22:48:40.451007","a23-39-16-76.deploy.static.akamaitechnologies.com","10.8.0.1","TCP","54","443  >  53298 [ACK] Seq=1 Ack=518 Win=65535 Len=0"
"107","2022-01-19 22:48:40.451013","10.8.0.1","edge-star-shv-01-iad3.facebook.com","TCP","54","[TCP Dup ACK 89#1] 51886  >  443 [ACK] Seq=408 Ack=1 Win=67107840 Len=0"
"108","2022-01-19 22:48:40.542262","a23-221-63-66.deploy.static.akamaitechnologies.com","10.8.0.1","TLSv1.3","1502","Server Hello, Change Cipher Spec, Application Data"
"109","2022-01-19 22:48:40.592584","10.8.0.1","a23-221-63-66.deploy.static.akamaitechnologies.com","TCP","54","35956  >  443 [ACK] Seq=518 Ack=1449 Win=65535 Len=0"
"110","2022-01-19 22:48:40.592787","a23-221-63-66.deploy.static.akamaitechnologies.com","10.8.0.1","TCP","2810","443  >  35956 [PSH, ACK] Seq=1449 Ack=518 Win=65535 Len=2756 [TCP segment of a reassembled PDU]"
"111","2022-01-19 22:48:40.642938","10.8.0.1","a23-221-63-66.deploy.static.akamaitechnologies.com","TCP","54","35956  >  443 [ACK] Seq=518 Ack=4205 Win=65535 Len=0"
"112","2022-01-19 22:48:40.649248","ec2-34-197-203-72.compute-1.amazonaws.com","10.8.0.1","TLSv1.2","4188","Server Hello"
"113","2022-01-19 22:48:40.699450","10.8.0.1","ec2-34-197-203-72.compute-1.amazonaws.com","TCP","54","36064  >  443 [ACK] Seq=518 Ack=4135 Win=65535 Len=0"
"114","2022-01-19 22:48:40.699905","a23-39-16-76.deploy.static.akamaitechnologies.com","10.8.0.1","TLSv1.2","4129","Server Hello, Certificate, Certificate Status, Server Key Exchange, Server Hello Done"
"115","2022-01-19 22:48:40.700115","a23-221-63-66.deploy.static.akamaitechnologies.com","10.8.0.1","TLSv1.3","979","Application Data, Application Data, Application Data"
"116","2022-01-19 22:48:40.700280","ec2-34-197-203-72.compute-1.amazonaws.com","10.8.0.1","TLSv1.2","1355","Certificate, Server Key Exchange, Server Hello Done"
"117","2022-01-19 22:48:40.700314","10.8.0.1","edge-star-mini-shv-01-iad3.facebook.com","TCP","74","55720  >  443 [SYN] Seq=0 Win=65535 Len=0 MSS=1460 SACK_PERM=1 TSval=2513896512 TSecr=0 WS=1024"
"118","2022-01-19 22:48:40.715437","edge-star-mini-shv-01-iad3.facebook.com","10.8.0.1","TCP","54","443  >  55720 [SYN, ACK] Seq=0 Ack=1 Win=65535 Len=0"
"119","2022-01-19 22:48:40.715514","a23-39-16-76.deploy.static.akamaitechnologies.com","10.8.0.1","TLSv1.2","4110","Server Hello, Certificate, Certificate Status, Server Key Exchange, Server Hello Done"
"120","2022-01-19 22:48:40.715543","10.8.0.1","a23-39-16-76.deploy.static.akamaitechnologies.com","TCP","54","53290  >  443 [ACK] Seq=518 Ack=4076 Win=65535 Len=0"
"121","2022-01-19 22:48:40.715619","ec2-35-80-215-203.us-west-2.compute.amazonaws.com","10.8.0.1","TLSv1.2","4418","Server Hello, Certificate, Server Key Exchange, Server Hello Done"
"122","2022-01-19 22:48:40.715631","10.8.0.1","a23-221-63-66.deploy.static.akamaitechnologies.com","TCP","54","35956  >  443 [ACK] Seq=518 Ack=5130 Win=65535 Len=0"
"123","2022-01-19 22:48:40.715637","10.8.0.1","ec2-34-197-203-72.compute-1.amazonaws.com","TCP","54","36064  >  443 [ACK] Seq=518 Ack=5436 Win=65535 Len=0"
"124","2022-01-19 22:48:40.715641","10.8.0.1","edge-star-mini-shv-01-iad3.facebook.com","TCP","54","55720  >  443 [ACK] Seq=1 Ack=1 Win=65535 Len=0"
"125","2022-01-19 22:48:40.715646","10.8.0.1","a23-39-16-76.deploy.static.akamaitechnologies.com","TCP","54","53298  >  443 [ACK] Seq=518 Ack=4057 Win=65535 Len=0"
"126","2022-01-19 22:48:40.715650","10.8.0.1","ec2-35-80-215-203.us-west-2.compute.amazonaws.com","TCP","54","44426  >  443 [ACK] Seq=518 Ack=4365 Win=65535 Len=0"
"127","2022-01-19 22:48:40.764191","10.8.0.1","edge-star-mini-shv-01-iad3.facebook.com","TLSv1.3","571","Client Hello"
"128","2022-01-19 22:48:40.764273","edge-star-mini-shv-01-iad3.facebook.com","10.8.0.1","TCP","54","443  >  55720 [ACK] Seq=1 Ack=518 Win=65535 Len=0"
"129","2022-01-19 22:48:40.814521","10.8.0.1","ec2-34-197-203-72.compute-1.amazonaws.com","TLSv1.2","180","Client Key Exchange, Change Cipher Spec, Encrypted Handshake Message"
"130","2022-01-19 22:48:40.814761","ec2-34-197-203-72.compute-1.amazonaws.com","10.8.0.1","TCP","54","443  >  36064 [ACK] Seq=5436 Ack=644 Win=65535 Len=0"
"131","2022-01-19 22:48:40.865158","10.8.0.1","ec2-35-80-215-203.us-west-2.compute.amazonaws.com","TLSv1.2","180","Client Key Exchange, Change Cipher Spec, Encrypted Handshake Message"
"132","2022-01-19 22:48:40.865294","ec2-35-80-215-203.us-west-2.compute.amazonaws.com","10.8.0.1","TCP","54","443  >  44426 [ACK] Seq=4365 Ack=644 Win=65535 Len=0"
"133","2022-01-19 22:48:40.865417","edge-star-mini-shv-01-iad3.facebook.com","10.8.0.1","TLSv1.3","2812","Server Hello, Change Cipher Spec, Application Data, Application Data"
"134","2022-01-19 22:48:40.865434","10.8.0.1","a23-221-63-66.deploy.static.akamaitechnologies.com","TLSv1.3","134","Change Cipher Spec, Application Data"
"135","2022-01-19 22:48:40.865476","a23-221-63-66.deploy.static.akamaitechnologies.com","10.8.0.1","TCP","54","443  >  35956 [ACK] Seq=5130 Ack=598 Win=65535 Len=0"
"136","2022-01-19 22:48:40.865542","10.8.0.1","edge-star-mini-shv-01-iad3.facebook.com","TCP","54","55720  >  443 [ACK] Seq=518 Ack=2759 Win=65535 Len=0"
"137","2022-01-19 22:48:40.865569","10.8.0.1","a23-221-63-66.deploy.static.akamaitechnologies.com","TLSv1.3","436","Application Data"
"138","2022-01-19 22:48:40.865588","a23-221-63-66.deploy.static.akamaitechnologies.com","10.8.0.1","TCP","54","443  >  35956 [ACK] Seq=5130 Ack=980 Win=65535 Len=0"
"139","2022-01-19 22:48:40.915846","a23-221-63-66.deploy.static.akamaitechnologies.com","10.8.0.1","TLSv1.3","341","Application Data"
"140","2022-01-19 22:48:40.915930","ec2-34-197-203-72.compute-1.amazonaws.com","10.8.0.1","TLSv1.2","105","Change Cipher Spec, Encrypted Handshake Message"
"141","2022-01-19 22:48:40.915993","edge-star-mini-shv-01-iad3.facebook.com","10.8.0.1","TLSv1.3","540","Application Data"
"142","2022-01-19 22:48:40.916004","10.8.0.1","a23-39-16-76.deploy.static.akamaitechnologies.com","TLSv1.2","180","Client Key Exchange, Change Cipher Spec, Encrypted Handshake Message"
"143","2022-01-19 22:48:40.916033","a23-39-16-76.deploy.static.akamaitechnologies.com","10.8.0.1","TCP","54","443  >  53298 [ACK] Seq=4057 Ack=644 Win=65535 Len=0"
"144","2022-01-19 22:48:40.916041","10.8.0.1","a23-221-63-66.deploy.static.akamaitechnologies.com","TCP","54","35956  >  443 [ACK] Seq=980 Ack=5417 Win=65535 Len=0"
"145","2022-01-19 22:48:40.916103","10.8.0.1","ec2-34-197-203-72.compute-1.amazonaws.com","TCP","54","36064  >  443 [ACK] Seq=644 Ack=5487 Win=65535 Len=0"
"146","2022-01-19 22:48:40.916111","10.8.0.1","edge-star-mini-shv-01-iad3.facebook.com","TCP","54","55720  >  443 [ACK] Seq=518 Ack=3245 Win=65535 Len=0"
"147","2022-01-19 22:48:40.917622","10.8.0.1","ec2-34-197-203-72.compute-1.amazonaws.com","TLSv1.2","434","Application Data"
"148","2022-01-19 22:48:40.917692","ec2-34-197-203-72.compute-1.amazonaws.com","10.8.0.1","TCP","54","443  >  36064 [ACK] Seq=5487 Ack=1024 Win=65535 Len=0"
"149","2022-01-19 22:48:40.967999","a23-221-63-66.deploy.static.akamaitechnologies.com","10.8.0.1","TLSv1.3","341","Application Data"
"150","2022-01-19 22:48:40.968077","ec2-35-80-215-203.us-west-2.compute.amazonaws.com","10.8.0.1","TLSv1.2","105","Change Cipher Spec, Encrypted Handshake Message"
"151","2022-01-19 22:48:40.968091","10.8.0.1","a23-221-63-66.deploy.static.akamaitechnologies.com","TCP","54","35956  >  443 [ACK] Seq=980 Ack=5704 Win=65535 Len=0"
"152","2022-01-19 22:48:40.968101","10.8.0.1","ec2-35-80-215-203.us-west-2.compute.amazonaws.com","TCP","54","44426  >  443 [ACK] Seq=644 Ack=4416 Win=65535 Len=0"
"153","2022-01-19 22:48:40.970376","10.8.0.1","ec2-35-80-215-203.us-west-2.compute.amazonaws.com","TLSv1.2","509","Application Data"
"154","2022-01-19 22:48:40.970469","ec2-35-80-215-203.us-west-2.compute.amazonaws.com","10.8.0.1","TCP","54","443  >  44426 [ACK] Seq=4416 Ack=1099 Win=65535 Len=0"
"155","2022-01-19 22:48:41.020679","10.8.0.1","edge-star-mini-shv-01-iad3.facebook.com","TLSv1.3","118","Change Cipher Spec, Application Data"
"156","2022-01-19 22:48:41.020883","edge-star-mini-shv-01-iad3.facebook.com","10.8.0.1","TCP","54","443  >  55720 [ACK] Seq=3245 Ack=582 Win=65535 Len=0"
"157","2022-01-19 22:48:41.020982","ec2-34-197-203-72.compute-1.amazonaws.com","10.8.0.1","TLSv1.2","1105","Application Data"
"158","2022-01-19 22:48:41.021057","a23-221-63-66.deploy.static.akamaitechnologies.com","10.8.0.1","TLSv1.3","397","Application Data"
"159","2022-01-19 22:48:41.021069","10.8.0.1","edge-star-mini-shv-01-iad3.facebook.com","TLSv1.3","590","Application Data"
"160","2022-01-19 22:48:41.021102","edge-star-mini-shv-01-iad3.facebook.com","10.8.0.1","TCP","54","443  >  55720 [ACK] Seq=3245 Ack=1118 Win=65535 Len=0"
"161","2022-01-19 22:48:41.021116","10.8.0.1","edge-star-mini-shv-01-iad3.facebook.com","TCP","590","55720  >  443 [PSH, ACK] Seq=1118 Ack=3245 Win=65535 Len=536 [TCP segment of a reassembled PDU]"
"162","2022-01-19 22:48:41.021140","edge-star-mini-shv-01-iad3.facebook.com","10.8.0.1","TCP","54","443  >  55720 [ACK] Seq=3245 Ack=1654 Win=65535 Len=0"
"163","2022-01-19 22:48:41.021147","10.8.0.1","edge-star-mini-shv-01-iad3.facebook.com","TCP","590","55720  >  443 [ACK] Seq=1654 Ack=3245 Win=65535 Len=536 [TCP segment of a reassembled PDU]"
"164","2022-01-19 22:48:41.021175","edge-star-mini-shv-01-iad3.facebook.com","10.8.0.1","TCP","54","443  >  55720 [ACK] Seq=3245 Ack=2190 Win=65535 Len=0"
"165","2022-01-19 22:48:41.021184","10.8.0.1","edge-star-mini-shv-01-iad3.facebook.com","TCP","590","55720  >  443 [PSH, ACK] Seq=2190 Ack=3245 Win=65535 Len=536 [TCP segment of a reassembled PDU]"
"166","2022-01-19 22:48:41.021206","edge-star-mini-shv-01-iad3.facebook.com","10.8.0.1","TCP","54","443  >  55720 [ACK] Seq=3245 Ack=2726 Win=65535 Len=0"
"167","2022-01-19 22:48:41.021214","10.8.0.1","edge-star-mini-shv-01-iad3.facebook.com","TCP","590","55720  >  443 [ACK] Seq=2726 Ack=3245 Win=65535 Len=536 [TCP segment of a reassembled PDU]"
"168","2022-01-19 22:48:41.021235","edge-star-mini-shv-01-iad3.facebook.com","10.8.0.1","TCP","54","443  >  55720 [ACK] Seq=3245 Ack=3262 Win=65535 Len=0"
"169","2022-01-19 22:48:41.021245","10.8.0.1","edge-star-mini-shv-01-iad3.facebook.com","TCP","590","55720  >  443 [PSH, ACK] Seq=3262 Ack=3245 Win=65535 Len=536 [TCP segment of a reassembled PDU]"
"170","2022-01-19 22:48:41.021279","edge-star-mini-shv-01-iad3.facebook.com","10.8.0.1","TCP","54","443  >  55720 [ACK] Seq=3245 Ack=3798 Win=65535 Len=0"
"171","2022-01-19 22:48:41.021288","10.8.0.1","edge-star-mini-shv-01-iad3.facebook.com","TCP","590","55720  >  443 [ACK] Seq=3798 Ack=3245 Win=65535 Len=536 [TCP segment of a reassembled PDU]"
"172","2022-01-19 22:48:41.021325","edge-star-mini-shv-01-iad3.facebook.com","10.8.0.1","TCP","54","443  >  55720 [ACK] Seq=3245 Ack=4334 Win=65535 Len=0"
"173","2022-01-19 22:48:41.021336","10.8.0.1","edge-star-mini-shv-01-iad3.facebook.com","TCP","590","55720  >  443 [PSH, ACK] Seq=4334 Ack=3245 Win=65535 Len=536 [TCP segment of a reassembled PDU]"
"174","2022-01-19 22:48:41.021359","edge-star-mini-shv-01-iad3.facebook.com","10.8.0.1","TCP","54","443  >  55720 [ACK] Seq=3245 Ack=4870 Win=65535 Len=0"
"175","2022-01-19 22:48:41.021366","10.8.0.1","edge-star-mini-shv-01-iad3.facebook.com","TCP","590","55720  >  443 [ACK] Seq=4870 Ack=3245 Win=65535 Len=536 [TCP segment of a reassembled PDU]"
"176","2022-01-19 22:48:41.021397","edge-star-mini-shv-01-iad3.facebook.com","10.8.0.1","TCP","54","443  >  55720 [ACK] Seq=3245 Ack=5406 Win=65535 Len=0"
"177","2022-01-19 22:48:41.021406","10.8.0.1","edge-star-mini-shv-01-iad3.facebook.com","TCP","590","55720  >  443 [ACK] Seq=5406 Ack=3245 Win=65535 Len=536 [TCP segment of a reassembled PDU]"
"178","2022-01-19 22:48:41.021465","edge-star-mini-shv-01-iad3.facebook.com","10.8.0.1","TCP","54","443  >  55720 [ACK] Seq=3245 Ack=5942 Win=65535 Len=0"
"179","2022-01-19 22:48:41.021474","10.8.0.1","edge-star-mini-shv-01-iad3.facebook.com","TCP","590","55720  >  443 [PSH, ACK] Seq=5942 Ack=3245 Win=65535 Len=536 [TCP segment of a reassembled PDU]"
"180","2022-01-19 22:48:41.021502","edge-star-mini-shv-01-iad3.facebook.com","10.8.0.1","TCP","54","443  >  55720 [ACK] Seq=3245 Ack=6478 Win=65535 Len=0"
"181","2022-01-19 22:48:41.021510","10.8.0.1","ec2-34-197-203-72.compute-1.amazonaws.com","TCP","54","36064  >  443 [ACK] Seq=1024 Ack=6538 Win=65535 Len=0"
"182","2022-01-19 22:48:41.021607","10.8.0.1","a23-221-63-66.deploy.static.akamaitechnologies.com","TCP","54","35956  >  443 [ACK] Seq=980 Ack=6047 Win=65535 Len=0"
"183","2022-01-19 22:48:41.021617","10.8.0.1","edge-star-mini-shv-01-iad3.facebook.com","TCP","590","55720  >  443 [ACK] Seq=6478 Ack=3245 Win=65535 Len=536 [TCP segment of a reassembled PDU]"
"184","2022-01-19 22:48:41.021650","edge-star-mini-shv-01-iad3.facebook.com","10.8.0.1","TCP","54","443  >  55720 [ACK] Seq=3245 Ack=7014 Win=65535 Len=0"
"185","2022-01-19 22:48:41.021658","10.8.0.1","edge-star-mini-shv-01-iad3.facebook.com","TCP","590","55720  >  443 [PSH, ACK] Seq=7014 Ack=3245 Win=65535 Len=536 [TCP segment of a reassembled PDU]"
"186","2022-01-19 22:48:41.021679","edge-star-mini-shv-01-iad3.facebook.com","10.8.0.1","TCP","54","443  >  55720 [ACK] Seq=3245 Ack=7550 Win=65535 Len=0"
"187","2022-01-19 22:48:41.021686","10.8.0.1","edge-star-mini-shv-01-iad3.facebook.com","TCP","590","55720  >  443 [ACK] Seq=7550 Ack=3245 Win=65535 Len=536 [TCP segment of a reassembled PDU]"
"188","2022-01-19 22:48:41.021706","edge-star-mini-shv-01-iad3.facebook.com","10.8.0.1","TCP","54","443  >  55720 [ACK] Seq=3245 Ack=8086 Win=65535 Len=0"
"189","2022-01-19 22:48:41.021715","10.8.0.1","edge-star-mini-shv-01-iad3.facebook.com","TCP","590","55720  >  443 [PSH, ACK] Seq=8086 Ack=3245 Win=65535 Len=536 [TCP segment of a reassembled PDU]"
"190","2022-01-19 22:48:41.021735","edge-star-mini-shv-01-iad3.facebook.com","10.8.0.1","TCP","54","443  >  55720 [ACK] Seq=3245 Ack=8622 Win=65535 Len=0"
"191","2022-01-19 22:48:41.021742","10.8.0.1","edge-star-mini-shv-01-iad3.facebook.com","TLSv1.3","590","Application Data, Application Data"
"192","2022-01-19 22:48:41.021761","edge-star-mini-shv-01-iad3.facebook.com","10.8.0.1","TCP","54","443  >  55720 [ACK] Seq=3245 Ack=9158 Win=65535 Len=0"
"193","2022-01-19 22:48:41.021769","10.8.0.1","edge-star-mini-shv-01-iad3.facebook.com","TCP","590","55720  >  443 [PSH, ACK] Seq=9158 Ack=3245 Win=65535 Len=536 [TCP segment of a reassembled PDU]"
"194","2022-01-19 22:48:41.021789","edge-star-mini-shv-01-iad3.facebook.com","10.8.0.1","TCP","54","443  >  55720 [ACK] Seq=3245 Ack=9694 Win=65535 Len=0"
"195","2022-01-19 22:48:41.021796","10.8.0.1","edge-star-mini-shv-01-iad3.facebook.com","TCP","590","55720  >  443 [ACK] Seq=9694 Ack=3245 Win=65535 Len=536 [TCP segment of a reassembled PDU]"
"196","2022-01-19 22:48:41.021821","edge-star-mini-shv-01-iad3.facebook.com","10.8.0.1","TCP","54","443  >  55720 [ACK] Seq=3245 Ack=10230 Win=65535 Len=0"
"197","2022-01-19 22:48:41.021830","10.8.0.1","edge-star-mini-shv-01-iad3.facebook.com","TCP","590","55720  >  443 [PSH, ACK] Seq=10230 Ack=3245 Win=65535 Len=536 [TCP segment of a reassembled PDU]"
"198","2022-01-19 22:48:41.021849","edge-star-mini-shv-01-iad3.facebook.com","10.8.0.1","TCP","54","443  >  55720 [ACK] Seq=3245 Ack=10766 Win=65535 Len=0"
"199","2022-01-19 22:48:41.021856","10.8.0.1","edge-star-mini-shv-01-iad3.facebook.com","TCP","590","55720  >  443 [ACK] Seq=10766 Ack=3245 Win=65535 Len=536 [TCP segment of a reassembled PDU]"
"200","2022-01-19 22:48:41.021875","edge-star-mini-shv-01-iad3.facebook.com","10.8.0.1","TCP","54","443  >  55720 [ACK] Seq=3245 Ack=11302 Win=65535 Len=0"
"201","2022-01-19 22:48:41.021884","10.8.0.1","edge-star-mini-shv-01-iad3.facebook.com","TCP","590","55720  >  443 [PSH, ACK] Seq=11302 Ack=3245 Win=65535 Len=536 [TCP segment of a reassembled PDU]"
"202","2022-01-19 22:48:41.021905","edge-star-mini-shv-01-iad3.facebook.com","10.8.0.1","TCP","54","443  >  55720 [ACK] Seq=3245 Ack=11838 Win=65535 Len=0"
"203","2022-01-19 22:48:41.021912","10.8.0.1","edge-star-mini-shv-01-iad3.facebook.com","TCP","590","55720  >  443 [ACK] Seq=11838 Ack=3245 Win=65535 Len=536 [TCP segment of a reassembled PDU]"
"204","2022-01-19 22:48:41.021932","edge-star-mini-shv-01-iad3.facebook.com","10.8.0.1","TCP","54","443  >  55720 [ACK] Seq=3245 Ack=12374 Win=65535 Len=0"
"205","2022-01-19 22:48:41.021941","10.8.0.1","edge-star-mini-shv-01-iad3.facebook.com","TCP","590","55720  >  443 [PSH, ACK] Seq=12374 Ack=3245 Win=65535 Len=536 [TCP segment of a reassembled PDU]"
"206","2022-01-19 22:48:41.021961","edge-star-mini-shv-01-iad3.facebook.com","10.8.0.1","TCP","54","443  >  55720 [ACK] Seq=3245 Ack=12910 Win=65535 Len=0"
"207","2022-01-19 22:48:41.021968","10.8.0.1","edge-star-mini-shv-01-iad3.facebook.com","TCP","590","55720  >  443 [ACK] Seq=12910 Ack=3245 Win=65535 Len=536 [TCP segment of a reassembled PDU]"
"208","2022-01-19 22:48:41.022025","edge-star-mini-shv-01-iad3.facebook.com","10.8.0.1","TCP","54","443  >  55720 [ACK] Seq=3245 Ack=13446 Win=65535 Len=0"
"209","2022-01-19 22:48:41.022036","10.8.0.1","edge-star-mini-shv-01-iad3.facebook.com","TCP","590","55720  >  443 [PSH, ACK] Seq=13446 Ack=3245 Win=65535 Len=536 [TCP segment of a reassembled PDU]"
"210","2022-01-19 22:48:41.022057","edge-star-mini-shv-01-iad3.facebook.com","10.8.0.1","TCP","54","443  >  55720 [ACK] Seq=3245 Ack=13982 Win=65535 Len=0"
"211","2022-01-19 22:48:41.022063","10.8.0.1","edge-star-mini-shv-01-iad3.facebook.com","TCP","590","55720  >  443 [ACK] Seq=13982 Ack=3245 Win=65535 Len=536 [TCP segment of a reassembled PDU]"
"212","2022-01-19 22:48:41.022084","edge-star-mini-shv-01-iad3.facebook.com","10.8.0.1","TCP","54","443  >  55720 [ACK] Seq=3245 Ack=14518 Win=65535 Len=0"
"213","2022-01-19 22:48:41.022093","10.8.0.1","edge-star-mini-shv-01-iad3.facebook.com","TCP","590","55720  >  443 [PSH, ACK] Seq=14518 Ack=3245 Win=65535 Len=536 [TCP segment of a reassembled PDU]"
"214","2022-01-19 22:48:41.022123","edge-star-mini-shv-01-iad3.facebook.com","10.8.0.1","TCP","54","443  >  55720 [ACK] Seq=3245 Ack=15054 Win=65535 Len=0"
"215","2022-01-19 22:48:41.022131","10.8.0.1","edge-star-mini-shv-01-iad3.facebook.com","TCP","590","55720  >  443 [ACK] Seq=15054 Ack=3245 Win=65535 Len=536 [TCP segment of a reassembled PDU]"
"216","2022-01-19 22:48:41.022165","edge-star-mini-shv-01-iad3.facebook.com","10.8.0.1","TCP","54","443  >  55720 [ACK] Seq=3245 Ack=15590 Win=65535 Len=0"
"217","2022-01-19 22:48:41.022175","10.8.0.1","edge-star-mini-shv-01-iad3.facebook.com","TCP","590","55720  >  443 [PSH, ACK] Seq=15590 Ack=3245 Win=65535 Len=536 [TCP segment of a reassembled PDU]"
"218","2022-01-19 22:48:41.022202","edge-star-mini-shv-01-iad3.facebook.com","10.8.0.1","TCP","54","443  >  55720 [ACK] Seq=3245 Ack=16126 Win=65535 Len=0"
"219","2022-01-19 22:48:41.022210","10.8.0.1","edge-star-mini-shv-01-iad3.facebook.com","TCP","590","55720  >  443 [ACK] Seq=16126 Ack=3245 Win=65535 Len=536 [TCP segment of a reassembled PDU]"
"220","2022-01-19 22:48:41.022237","edge-star-mini-shv-01-iad3.facebook.com","10.8.0.1","TCP","54","443  >  55720 [ACK] Seq=3245 Ack=16662 Win=65535 Len=0"
"221","2022-01-19 22:48:41.022246","10.8.0.1","edge-star-mini-shv-01-iad3.facebook.com","TCP","590","55720  >  443 [PSH, ACK] Seq=16662 Ack=3245 Win=65535 Len=536 [TCP segment of a reassembled PDU]"
"222","2022-01-19 22:48:41.022276","edge-star-mini-shv-01-iad3.facebook.com","10.8.0.1","TCP","54","443  >  55720 [ACK] Seq=3245 Ack=17198 Win=65535 Len=0"
"223","2022-01-19 22:48:41.022284","10.8.0.1","edge-star-mini-shv-01-iad3.facebook.com","TLSv1.3","590","Application Data, Application Data"
"224","2022-01-19 22:48:41.022305","edge-star-mini-shv-01-iad3.facebook.com","10.8.0.1","TCP","54","443  >  55720 [ACK] Seq=3245 Ack=17734 Win=65535 Len=0"
"225","2022-01-19 22:48:41.022314","10.8.0.1","edge-star-mini-shv-01-iad3.facebook.com","TCP","590","55720  >  443 [PSH, ACK] Seq=17734 Ack=3245 Win=65535 Len=536 [TCP segment of a reassembled PDU]"
"226","2022-01-19 22:48:41.022377","edge-star-mini-shv-01-iad3.facebook.com","10.8.0.1","TCP","54","443  >  55720 [ACK] Seq=3245 Ack=18270 Win=65535 Len=0"
"227","2022-01-19 22:48:41.022386","10.8.0.1","edge-star-mini-shv-01-iad3.facebook.com","TCP","590","55720  >  443 [ACK] Seq=18270 Ack=3245 Win=65535 Len=536 [TCP segment of a reassembled PDU]"
"228","2022-01-19 22:48:41.022409","edge-star-mini-shv-01-iad3.facebook.com","10.8.0.1","TCP","54","443  >  55720 [ACK] Seq=3245 Ack=18806 Win=65535 Len=0"
"229","2022-01-19 22:48:41.022418","10.8.0.1","edge-star-mini-shv-01-iad3.facebook.com","TCP","590","55720  >  443 [PSH, ACK] Seq=18806 Ack=3245 Win=65535 Len=536 [TCP segment of a reassembled PDU]"
"230","2022-01-19 22:48:41.022436","edge-star-mini-shv-01-iad3.facebook.com","10.8.0.1","TCP","54","443  >  55720 [ACK] Seq=3245 Ack=19342 Win=65535 Len=0"
"231","2022-01-19 22:48:41.022442","10.8.0.1","edge-star-mini-shv-01-iad3.facebook.com","TCP","590","55720  >  443 [ACK] Seq=19342 Ack=3245 Win=65535 Len=536 [TCP segment of a reassembled PDU]"
"232","2022-01-19 22:48:41.022458","edge-star-mini-shv-01-iad3.facebook.com","10.8.0.1","TCP","54","443  >  55720 [ACK] Seq=3245 Ack=19878 Win=65535 Len=0"
"233","2022-01-19 22:48:41.022466","10.8.0.1","edge-star-mini-shv-01-iad3.facebook.com","TCP","590","55720  >  443 [PSH, ACK] Seq=19878 Ack=3245 Win=65535 Len=536 [TCP segment of a reassembled PDU]"
"234","2022-01-19 22:48:41.022477","edge-star-mini-shv-01-iad3.facebook.com","10.8.0.1","TCP","54","443  >  55720 [ACK] Seq=3245 Ack=20414 Win=65535 Len=0"
"235","2022-01-19 22:48:41.022483","10.8.0.1","edge-star-mini-shv-01-iad3.facebook.com","TCP","590","55720  >  443 [ACK] Seq=20414 Ack=3245 Win=65535 Len=536 [TCP segment of a reassembled PDU]"
"236","2022-01-19 22:48:41.022494","edge-star-mini-shv-01-iad3.facebook.com","10.8.0.1","TCP","54","443  >  55720 [ACK] Seq=3245 Ack=20950 Win=65535 Len=0"
"237","2022-01-19 22:48:41.022501","10.8.0.1","edge-star-mini-shv-01-iad3.facebook.com","TCP","590","55720  >  443 [PSH, ACK] Seq=20950 Ack=3245 Win=65535 Len=536 [TCP segment of a reassembled PDU]"
"238","2022-01-19 22:48:41.022512","edge-star-mini-shv-01-iad3.facebook.com","10.8.0.1","TCP","54","443  >  55720 [ACK] Seq=3245 Ack=21486 Win=65535 Len=0"
"239","2022-01-19 22:48:41.022517","10.8.0.1","edge-star-mini-shv-01-iad3.facebook.com","TCP","590","55720  >  443 [ACK] Seq=21486 Ack=3245 Win=65535 Len=536 [TCP segment of a reassembled PDU]"
"240","2022-01-19 22:48:41.022534","edge-star-mini-shv-01-iad3.facebook.com","10.8.0.1","TCP","54","443  >  55720 [ACK] Seq=3245 Ack=22022 Win=65535 Len=0"
"241","2022-01-19 22:48:41.022542","10.8.0.1","edge-star-mini-shv-01-iad3.facebook.com","TCP","590","55720  >  443 [PSH, ACK] Seq=22022 Ack=3245 Win=65535 Len=536 [TCP segment of a reassembled PDU]"
