"No.","Time","Source","Destination","Protocol","Length","Info"
"1","2022-01-19 21:48:03.353381","10.8.0.1","ord38s32-in-f2.1e100.net","TCP","74","42588  >  443 [SYN] Seq=0 Win=65535 Len=0 MSS=1460 SACK_PERM=1 TSval=1881640821 TSecr=0 WS=1024"
"2","2022-01-19 21:48:03.356071","ord38s32-in-f2.1e100.net","10.8.0.1","TCP","54","443  >  42588 [SYN, ACK] Seq=0 Ack=1 Win=65535 Len=0"
"3","2022-01-19 21:48:03.356109","10.8.0.1","ec2-52-17-143-157.eu-west-1.compute.amazonaws.com","TCP","74","50770  >  443 [SYN] Seq=0 Win=65535 Len=0 MSS=1460 SACK_PERM=1 TSval=1016793593 TSecr=0 WS=1024"
"4","2022-01-19 21:48:03.360443","ec2-52-17-143-157.eu-west-1.compute.amazonaws.com","10.8.0.1","TCP","54","443  >  50770 [SYN, ACK] Seq=0 Ack=1 Win=65535 Len=0"
"5","2022-01-19 21:48:03.360475","10.8.0.1","ord38s32-in-f2.1e100.net","TCP","54","42588  >  443 [ACK] Seq=1 Ack=1 Win=65535 Len=0"
"6","2022-01-19 21:48:03.360485","10.8.0.1","ord38s32-in-f2.1e100.net","TCP","590","42588  >  443 [ACK] Seq=1 Ack=1 Win=65535 Len=536 [TCP segment of a reassembled PDU]"
"7","2022-01-19 21:48:03.360507","ord38s32-in-f2.1e100.net","10.8.0.1","TCP","54","443  >  42588 [ACK] Seq=1 Ack=537 Win=65535 Len=0"
"8","2022-01-19 21:48:03.360514","10.8.0.1","ord38s32-in-f2.1e100.net","TLSv1.3","92","Client Hello"
"9","2022-01-19 21:48:03.360528","ord38s32-in-f2.1e100.net","10.8.0.1","TCP","54","443  >  42588 [ACK] Seq=1 Ack=575 Win=65535 Len=0"
"10","2022-01-19 21:48:03.360533","10.8.0.1","ec2-52-17-143-157.eu-west-1.compute.amazonaws.com","TCP","54","50770  >  443 [ACK] Seq=1 Ack=1 Win=65535 Len=0"
"11","2022-01-19 21:48:03.362374","10.8.0.1","ec2-52-17-143-157.eu-west-1.compute.amazonaws.com","TLSv1.2","571","Client Hello"
"12","2022-01-19 21:48:03.362438","ec2-52-17-143-157.eu-west-1.compute.amazonaws.com","10.8.0.1","TCP","54","443  >  50770 [ACK] Seq=1 Ack=518 Win=65535 Len=0"
"13","2022-01-19 21:48:03.465258","10.8.0.1","edge-mqtt-shv-02-ort2.facebook.com","TCP","74","39848  >  443 [SYN] Seq=0 Win=65535 Len=0 MSS=1460 SACK_PERM=1 TSval=3493067146 TSecr=0 WS=1024"
"14","2022-01-19 21:48:03.469383","edge-mqtt-shv-02-ort2.facebook.com","10.8.0.1","TCP","54","443  >  39848 [SYN, ACK] Seq=0 Ack=1 Win=65535 Len=0"
"15","2022-01-19 21:48:03.469420","10.8.0.1","edge-mqtt-shv-02-ort2.facebook.com","TCP","54","39848  >  443 [ACK] Seq=1 Ack=1 Win=65535 Len=0"
"16","2022-01-19 21:48:03.473388","10.8.0.1","edge-mqtt-shv-02-ort2.facebook.com","TLSv1.3","453","Client Hello"
"17","2022-01-19 21:48:03.473499","edge-mqtt-shv-02-ort2.facebook.com","10.8.0.1","TCP","54","443  >  39848 [ACK] Seq=1 Ack=400 Win=65535 Len=0"
"18","2022-01-19 21:48:03.491452","10.8.0.1","edge-mqtt-shv-02-ort2.facebook.com","TLSv1.3","461","Change Cipher Spec, Application Data"
"19","2022-01-19 21:48:03.491533","edge-mqtt-shv-02-ort2.facebook.com","10.8.0.1","TCP","54","443  >  39848 [ACK] Seq=1 Ack=807 Win=65535 Len=0"
"20","2022-01-19 21:48:03.518330","10.8.0.1","ord38s18-in-f14.1e100.net","TCP","74","54714  >  443 [SYN] Seq=0 Win=65535 Len=0 MSS=1460 SACK_PERM=1 TSval=3598292279 TSecr=0 WS=1024"
"21","2022-01-19 21:48:03.522870","ord38s18-in-f14.1e100.net","10.8.0.1","TCP","54","443  >  54714 [SYN, ACK] Seq=0 Ack=1 Win=65535 Len=0"
"22","2022-01-19 21:48:03.522909","10.8.0.1","ord38s18-in-f14.1e100.net","TCP","54","54714  >  443 [ACK] Seq=1 Ack=1 Win=65535 Len=0"
"23","2022-01-19 21:48:03.524719","10.8.0.1","ord38s18-in-f14.1e100.net","TCP","590","54714  >  443 [ACK] Seq=1 Ack=1 Win=65535 Len=536 [TCP segment of a reassembled PDU]"
"24","2022-01-19 21:48:03.524812","ord38s18-in-f14.1e100.net","10.8.0.1","TCP","54","443  >  54714 [ACK] Seq=1 Ack=537 Win=65535 Len=0"
"25","2022-01-19 21:48:03.524823","10.8.0.1","ord38s18-in-f14.1e100.net","TLSv1.3","63","Client Hello"
"26","2022-01-19 21:48:03.524839","ord38s18-in-f14.1e100.net","10.8.0.1","TCP","54","443  >  54714 [ACK] Seq=1 Ack=546 Win=65535 Len=0"
"27","2022-01-19 21:48:03.536552","10.8.0.1","edge-mqtt-shv-02-ort2.facebook.com","TLSv1.3","350","Application Data"
"28","2022-01-19 21:48:03.536633","edge-mqtt-shv-02-ort2.facebook.com","10.8.0.1","TCP","54","443  >  39848 [ACK] Seq=1 Ack=1103 Win=65535 Len=0"
"29","2022-01-19 21:48:03.546604","10.8.0.1","edge-mqtt-shv-02-ort2.facebook.com","TLSv1.3","106","Application Data"
"30","2022-01-19 21:48:03.546682","edge-mqtt-shv-02-ort2.facebook.com","10.8.0.1","TCP","54","443  >  39848 [ACK] Seq=1 Ack=1155 Win=65535 Len=0"
"31","2022-01-19 21:48:03.597513","10.8.0.1","edge-mqtt-shv-02-ort2.facebook.com","TLSv1.3","331","Application Data"
"32","2022-01-19 21:48:03.597619","edge-mqtt-shv-02-ort2.facebook.com","10.8.0.1","TCP","54","443  >  39848 [ACK] Seq=1 Ack=1432 Win=65535 Len=0"
"33","2022-01-19 21:48:03.597703","10.8.0.1","edge-mqtt-shv-02-ort2.facebook.com","TLSv1.3","291","Application Data"
"34","2022-01-19 21:48:03.597726","edge-mqtt-shv-02-ort2.facebook.com","10.8.0.1","TCP","54","443  >  39848 [ACK] Seq=1 Ack=1669 Win=65535 Len=0"
"35","2022-01-19 21:48:03.597742","10.8.0.1","edge-mqtt-shv-02-ort2.facebook.com","TLSv1.3","424","Application Data"
"36","2022-01-19 21:48:03.597756","edge-mqtt-shv-02-ort2.facebook.com","10.8.0.1","TCP","54","443  >  39848 [ACK] Seq=1 Ack=2039 Win=65535 Len=0"
"37","2022-01-19 21:48:03.597762","10.8.0.1","edge-mqtt-shv-02-ort2.facebook.com","TLSv1.3","353","Application Data"
"38","2022-01-19 21:48:03.597774","edge-mqtt-shv-02-ort2.facebook.com","10.8.0.1","TCP","54","443  >  39848 [ACK] Seq=1 Ack=2338 Win=65535 Len=0"
"39","2022-01-19 21:48:03.624693","10.8.0.1","151.101.66.133","TCP","74","40928  >  443 [SYN] Seq=0 Win=65535 Len=0 MSS=1460 SACK_PERM=1 TSval=3052998938 TSecr=0 WS=1024"
"40","2022-01-19 21:48:03.626991","151.101.66.133","10.8.0.1","TCP","54","443  >  40928 [SYN, ACK] Seq=0 Ack=1 Win=65535 Len=0"
"41","2022-01-19 21:48:03.627032","10.8.0.1","151.101.66.133","TCP","54","40928  >  443 [ACK] Seq=1 Ack=1 Win=65535 Len=0"
"42","2022-01-19 21:48:03.629967","10.8.0.1","151.101.66.133","TLSv1.2","571","Client Hello"
"43","2022-01-19 21:48:03.630046","151.101.66.133","10.8.0.1","TCP","54","443  >  40928 [ACK] Seq=1 Ack=518 Win=65535 Len=0"
"44","2022-01-19 21:48:03.631554","ord38s32-in-f2.1e100.net","10.8.0.1","TLSv1.3","272","Server Hello, Change Cipher Spec, Application Data"
"45","2022-01-19 21:48:03.681695","10.8.0.1","ord38s32-in-f2.1e100.net","TCP","54","42588  >  443 [ACK] Seq=575 Ack=219 Win=65535 Len=0"
"46","2022-01-19 21:48:03.681878","edge-mqtt-shv-02-ort2.facebook.com","10.8.0.1","TLSv1.3","2812","Server Hello, Change Cipher Spec, Application Data, Application Data"
"47","2022-01-19 21:48:03.682010","10.8.0.1","ord38s32-in-f2.1e100.net","TLSv1.3","118","Change Cipher Spec, Application Data"
"48","2022-01-19 21:48:03.682057","ord38s32-in-f2.1e100.net","10.8.0.1","TCP","54","443  >  42588 [ACK] Seq=219 Ack=639 Win=65535 Len=0"
"49","2022-01-19 21:48:03.682066","10.8.0.1","whatsapp-chatd-msgr-mini-edge-shv-01-ort2.facebook.com","TCP","74","38476  >  5222 [SYN] Seq=0 Win=65535 Len=0 MSS=1460 SACK_PERM=1 TSval=1822377843 TSecr=0 WS=1024"
"50","2022-01-19 21:48:03.683862","whatsapp-chatd-msgr-mini-edge-shv-01-ort2.facebook.com","10.8.0.1","TCP","54","5222  >  38476 [SYN, ACK] Seq=0 Ack=1 Win=65535 Len=0"
"51","2022-01-19 21:48:03.683913","10.8.0.1","edge-mqtt-shv-02-ort2.facebook.com","TCP","54","39848  >  443 [ACK] Seq=2338 Ack=2759 Win=65535 Len=0"
"52","2022-01-19 21:48:03.683923","10.8.0.1","ord38s32-in-f2.1e100.net","TLSv1.3","561","Application Data"
"53","2022-01-19 21:48:03.683948","ord38s32-in-f2.1e100.net","10.8.0.1","TCP","54","443  >  42588 [ACK] Seq=219 Ack=1146 Win=65535 Len=0"
"54","2022-01-19 21:48:03.683954","10.8.0.1","whatsapp-chatd-msgr-mini-edge-shv-01-ort2.facebook.com","TCP","54","38476  >  5222 [ACK] Seq=1 Ack=1 Win=65535 Len=0"
"55","2022-01-19 21:48:03.686117","10.8.0.1","whatsapp-chatd-msgr-mini-edge-shv-01-ort2.facebook.com","TCP","58","38476  >  5222 [PSH, ACK] Seq=1 Ack=1 Win=65535 Len=4 [TCP segment of a reassembled PDU]"
"56","2022-01-19 21:48:03.686174","whatsapp-chatd-msgr-mini-edge-shv-01-ort2.facebook.com","10.8.0.1","TCP","54","5222  >  38476 [ACK] Seq=1 Ack=5 Win=65535 Len=0"
"57","2022-01-19 21:48:03.686183","10.8.0.1","whatsapp-chatd-msgr-mini-edge-shv-01-ort2.facebook.com","TCP","61","38476  >  5222 [PSH, ACK] Seq=5 Ack=1 Win=65535 Len=7 [TCP segment of a reassembled PDU]"
"58","2022-01-19 21:48:03.686197","whatsapp-chatd-msgr-mini-edge-shv-01-ort2.facebook.com","10.8.0.1","TCP","54","5222  >  38476 [ACK] Seq=1 Ack=12 Win=65535 Len=0"
"59","2022-01-19 21:48:03.686202","10.8.0.1","whatsapp-chatd-msgr-mini-edge-shv-01-ort2.facebook.com","TCP","58","38476  >  5222 [PSH, ACK] Seq=12 Ack=1 Win=65535 Len=4 [TCP segment of a reassembled PDU]"
"60","2022-01-19 21:48:03.686228","whatsapp-chatd-msgr-mini-edge-shv-01-ort2.facebook.com","10.8.0.1","TCP","54","5222  >  38476 [ACK] Seq=1 Ack=16 Win=65535 Len=0"
"61","2022-01-19 21:48:03.687821","ord38s18-in-f14.1e100.net","10.8.0.1","TLSv1.3","257","Server Hello, Change Cipher Spec, Application Data"
"62","2022-01-19 21:48:03.738057","10.8.0.1","ord38s18-in-f14.1e100.net","TCP","54","54714  >  443 [ACK] Seq=546 Ack=204 Win=65535 Len=0"
"63","2022-01-19 21:48:03.738234","edge-mqtt-shv-02-ort2.facebook.com","10.8.0.1","TLSv1.3","532","Application Data"
"64","2022-01-19 21:48:03.738248","10.8.0.1","ord38s18-in-f14.1e100.net","TLSv1.3","118","Change Cipher Spec, Application Data"
"65","2022-01-19 21:48:03.738295","ord38s18-in-f14.1e100.net","10.8.0.1","TCP","54","443  >  54714 [ACK] Seq=204 Ack=610 Win=65535 Len=0"
"66","2022-01-19 21:48:03.738306","10.8.0.1","whatsapp-chatd-msgr-mini-edge-shv-01-ort2.facebook.com","TCP","590","38476  >  5222 [ACK] Seq=16 Ack=1 Win=65535 Len=536 [TCP segment of a reassembled PDU]"
"67","2022-01-19 21:48:03.738328","whatsapp-chatd-msgr-mini-edge-shv-01-ort2.facebook.com","10.8.0.1","TCP","54","5222  >  38476 [ACK] Seq=1 Ack=552 Win=65535 Len=0"
"68","2022-01-19 21:48:03.738403","10.8.0.1","whatsapp-chatd-msgr-mini-edge-shv-01-ort2.facebook.com","TCP","590","38476  >  5222 [PSH, ACK] Seq=552 Ack=1 Win=65535 Len=536 [TCP segment of a reassembled PDU]"
"69","2022-01-19 21:48:03.738424","whatsapp-chatd-msgr-mini-edge-shv-01-ort2.facebook.com","10.8.0.1","TCP","54","5222  >  38476 [ACK] Seq=1 Ack=1088 Win=65535 Len=0"
"70","2022-01-19 21:48:03.738430","10.8.0.1","whatsapp-chatd-msgr-mini-edge-shv-01-ort2.facebook.com","TCP","213","38476  >  5222 [PSH, ACK] Seq=1088 Ack=1 Win=65535 Len=159 [TCP segment of a reassembled PDU]"
"71","2022-01-19 21:48:03.738443","whatsapp-chatd-msgr-mini-edge-shv-01-ort2.facebook.com","10.8.0.1","TCP","54","5222  >  38476 [ACK] Seq=1 Ack=1247 Win=65535 Len=0"
"72","2022-01-19 21:48:03.738449","10.8.0.1","ord38s18-in-f14.1e100.net","TCP","590","54714  >  443 [ACK] Seq=610 Ack=204 Win=65535 Len=536 [TCP segment of a reassembled PDU]"
"73","2022-01-19 21:48:03.738461","ord38s18-in-f14.1e100.net","10.8.0.1","TCP","54","443  >  54714 [ACK] Seq=204 Ack=1146 Win=65535 Len=0"
"74","2022-01-19 21:48:03.738467","10.8.0.1","edge-mqtt-shv-02-ort2.facebook.com","TCP","54","39848  >  443 [ACK] Seq=2338 Ack=3237 Win=65535 Len=0"
"75","2022-01-19 21:48:03.738472","10.8.0.1","ord38s18-in-f14.1e100.net","TLSv1.3","70","Application Data"
"76","2022-01-19 21:48:03.738482","ord38s18-in-f14.1e100.net","10.8.0.1","TCP","54","443  >  54714 [ACK] Seq=204 Ack=1162 Win=65535 Len=0"
"77","2022-01-19 21:48:03.788627","10.8.0.1","edge-mqtt-shv-02-ort2.facebook.com","TLSv1.3","112","Application Data"
"78","2022-01-19 21:48:03.788737","edge-mqtt-shv-02-ort2.facebook.com","10.8.0.1","TCP","54","443  >  39848 [ACK] Seq=3237 Ack=2396 Win=65535 Len=0"
"79","2022-01-19 21:48:03.788851","151.101.66.133","10.8.0.1","TLSv1.2","1398","Server Hello"
"80","2022-01-19 21:48:03.788880","10.8.0.1","edge-mqtt-shv-02-ort2.facebook.com","TCP","590","39848  >  443 [ACK] Seq=2396 Ack=3237 Win=65535 Len=536 [TCP segment of a reassembled PDU]"
"81","2022-01-19 21:48:03.788902","edge-mqtt-shv-02-ort2.facebook.com","10.8.0.1","TCP","54","443  >  39848 [ACK] Seq=3237 Ack=2932 Win=65535 Len=0"
"82","2022-01-19 21:48:03.788913","10.8.0.1","edge-mqtt-shv-02-ort2.facebook.com","TCP","590","39848  >  443 [PSH, ACK] Seq=2932 Ack=3237 Win=65535 Len=536 [TCP segment of a reassembled PDU]"
"83","2022-01-19 21:48:03.788927","edge-mqtt-shv-02-ort2.facebook.com","10.8.0.1","TCP","54","443  >  39848 [ACK] Seq=3237 Ack=3468 Win=65535 Len=0"
"84","2022-01-19 21:48:03.788933","10.8.0.1","edge-mqtt-shv-02-ort2.facebook.com","TLSv1.3","590","Application Data [TCP segment of a reassembled PDU]"
"85","2022-01-19 21:48:03.788945","edge-mqtt-shv-02-ort2.facebook.com","10.8.0.1","TCP","54","443  >  39848 [ACK] Seq=3237 Ack=4004 Win=65535 Len=0"
"86","2022-01-19 21:48:03.788954","10.55.49.164","157.185.177.248","TCP","66","58220  >  443 [FIN, ACK] Seq=1 Ack=1 Win=89 Len=0 TSval=1496703185 TSecr=3974414280"
"87","2022-01-19 21:48:03.789004","157.185.177.248","10.55.49.164","TCP","54","443  >  58220 [ACK] Seq=1 Ack=2 Win=65535 Len=0"
"88","2022-01-19 21:48:03.789034","157.185.177.248","10.55.49.164","TCP","54","443  >  58220 [FIN, ACK] Seq=1 Ack=2 Win=65535 Len=0"
"89","2022-01-19 21:48:03.789041","10.8.0.1","edge-mqtt-shv-02-ort2.facebook.com","TLSv1.3","268","Application Data"
"90","2022-01-19 21:48:03.789055","edge-mqtt-shv-02-ort2.facebook.com","10.8.0.1","TCP","54","443  >  39848 [ACK] Seq=3237 Ack=4218 Win=65535 Len=0"
"91","2022-01-19 21:48:03.789061","10.8.0.1","151.101.66.133","TCP","54","40928  >  443 [ACK] Seq=518 Ack=1345 Win=65535 Len=0"
"92","2022-01-19 21:48:03.789067","10.55.49.164","157.185.177.248","TCP","66","58220  >  443 [ACK] Seq=2 Ack=2 Win=89 Len=0 TSval=1496703188 TSecr=3974414280"
"93","2022-01-19 21:48:03.789462","151.101.66.133","10.8.0.1","TLSv1.2","2810","Certificate [TCP segment of a reassembled PDU]"
"94","2022-01-19 21:48:03.789607","ec2-52-17-143-157.eu-west-1.compute.amazonaws.com","10.8.0.1","TLSv1.2","1502","Server Hello"
"95","2022-01-19 21:48:03.789627","10.8.0.1","151.101.66.133","TCP","54","40928  >  443 [ACK] Seq=518 Ack=4101 Win=65535 Len=0"
"96","2022-01-19 21:48:03.789634","10.8.0.1","ec2-52-17-143-157.eu-west-1.compute.amazonaws.com","TCP","54","50770  >  443 [ACK] Seq=518 Ack=1449 Win=65535 Len=0"
"97","2022-01-19 21:48:03.791448","ec2-52-17-143-157.eu-west-1.compute.amazonaws.com","10.8.0.1","TCP","1432","443  >  50770 [PSH, ACK] Seq=1449 Ack=518 Win=65535 Len=1378 [TCP segment of a reassembled PDU]"
"98","2022-01-19 21:48:03.841609","10.8.0.1","ec2-52-17-143-157.eu-west-1.compute.amazonaws.com","TCP","54","50770  >  443 [ACK] Seq=518 Ack=2827 Win=65535 Len=0"
"99","2022-01-19 21:48:03.841755","ec2-52-17-143-157.eu-west-1.compute.amazonaws.com","10.8.0.1","TCP","1432","443  >  50770 [PSH, ACK] Seq=2827 Ack=518 Win=65535 Len=1378 [TCP segment of a reassembled PDU]"
"100","2022-01-19 21:48:03.891873","10.8.0.1","ec2-52-17-143-157.eu-west-1.compute.amazonaws.com","TCP","54","50770  >  443 [ACK] Seq=518 Ack=4205 Win=65535 Len=0"
"101","2022-01-19 21:48:03.892026","151.101.66.133","10.8.0.1","TLSv1.2","1117","Certificate Status, Server Key Exchange, Server Hello Done"
"102","2022-01-19 21:48:03.892055","10.8.0.1","151.101.66.133","TCP","54","40928  >  443 [ACK] Seq=518 Ack=5164 Win=65535 Len=0"
"103","2022-01-19 21:48:03.896880","10.8.0.1","151.101.66.133","TLSv1.2","147","Client Key Exchange, Change Cipher Spec, Encrypted Handshake Message"
"104","2022-01-19 21:48:03.896968","151.101.66.133","10.8.0.1","TCP","54","443  >  40928 [ACK] Seq=5164 Ack=611 Win=65535 Len=0"
"105","2022-01-19 21:48:03.947214","10.8.0.1","64.4.251.12","TCP","74","47578  >  443 [SYN] Seq=0 Win=65535 Len=0 MSS=1460 SACK_PERM=1 TSval=1810250817 TSecr=0 WS=1024"
"106","2022-01-19 21:48:03.949366","64.4.251.12","10.8.0.1","TCP","54","443  >  47578 [SYN, ACK] Seq=0 Ack=1 Win=65535 Len=0"
"107","2022-01-19 21:48:03.949452","ec2-52-17-143-157.eu-west-1.compute.amazonaws.com","10.8.0.1","TCP","1432","443  >  50770 [PSH, ACK] Seq=4205 Ack=518 Win=65535 Len=1378 [TCP segment of a reassembled PDU]"
"108","2022-01-19 21:48:03.949468","10.8.0.1","151.101.193.35","TCP","74","33872  >  443 [SYN] Seq=0 Win=65535 Len=0 MSS=1460 SACK_PERM=1 TSval=37200129 TSecr=0 WS=1024"
"109","2022-01-19 21:48:03.951085","151.101.193.35","10.8.0.1","TCP","54","443  >  33872 [SYN, ACK] Seq=0 Ack=1 Win=65535 Len=0"
"110","2022-01-19 21:48:03.951118","10.8.0.1","151.101.193.35","TCP","74","33874  >  443 [SYN] Seq=0 Win=65535 Len=0 MSS=1460 SACK_PERM=1 TSval=37200129 TSecr=0 WS=1024"
"111","2022-01-19 21:48:03.952867","151.101.193.35","10.8.0.1","TCP","54","443  >  33874 [SYN, ACK] Seq=0 Ack=1 Win=65535 Len=0"
"112","2022-01-19 21:48:03.952899","10.8.0.1","64.4.251.12","TCP","54","47578  >  443 [ACK] Seq=1 Ack=1 Win=65535 Len=0"
"113","2022-01-19 21:48:03.952909","10.8.0.1","ec2-52-17-143-157.eu-west-1.compute.amazonaws.com","TCP","54","50770  >  443 [ACK] Seq=518 Ack=5583 Win=65535 Len=0"
"114","2022-01-19 21:48:03.952917","10.8.0.1","64.4.251.12","TLSv1.3","571","Client Hello"
"115","2022-01-19 21:48:03.952942","64.4.251.12","10.8.0.1","TCP","54","443  >  47578 [ACK] Seq=1 Ack=518 Win=65535 Len=0"
"116","2022-01-19 21:48:03.952949","10.8.0.1","151.101.193.35","TCP","54","33872  >  443 [ACK] Seq=1 Ack=1 Win=65535 Len=0"
"117","2022-01-19 21:48:03.952956","10.8.0.1","151.101.193.35","TLSv1.3","571","Client Hello"
"118","2022-01-19 21:48:03.952970","151.101.193.35","10.8.0.1","TCP","54","443  >  33872 [ACK] Seq=1 Ack=518 Win=65535 Len=0"
"119","2022-01-19 21:48:03.952992","10.8.0.1","151.101.193.35","TCP","54","33874  >  443 [ACK] Seq=1 Ack=1 Win=65535 Len=0"
"120","2022-01-19 21:48:03.953527","10.8.0.1","151.101.193.35","TLSv1.3","571","Client Hello"
"121","2022-01-19 21:48:03.953592","151.101.193.35","10.8.0.1","TCP","54","443  >  33874 [ACK] Seq=1 Ack=518 Win=65535 Len=0"
"122","2022-01-19 21:48:03.955262","10.8.0.1","api.paypal.com","TCP","74","38006  >  443 [SYN] Seq=0 Win=65535 Len=0 MSS=1460 SACK_PERM=1 TSval=3787037943 TSecr=0 WS=1024"
"123","2022-01-19 21:48:03.956837","api.paypal.com","10.8.0.1","TCP","54","443  >  38006 [SYN, ACK] Seq=0 Ack=1 Win=65535 Len=0"
"124","2022-01-19 21:48:03.956867","10.8.0.1","api.paypal.com","TCP","54","38006  >  443 [ACK] Seq=1 Ack=1 Win=65535 Len=0"
"125","2022-01-19 21:48:03.956931","151.101.66.133","10.8.0.1","TLSv1.2","328","New Session Ticket, Change Cipher Spec, Encrypted Handshake Message"
"126","2022-01-19 21:48:03.956943","10.8.0.1","151.101.66.133","TCP","54","40928  >  443 [ACK] Seq=611 Ack=5438 Win=65535 Len=0"
"127","2022-01-19 21:48:03.957802","10.8.0.1","api.paypal.com","TLSv1.3","571","Client Hello"
"128","2022-01-19 21:48:03.957926","api.paypal.com","10.8.0.1","TCP","54","443  >  38006 [ACK] Seq=1 Ack=518 Win=65535 Len=0"
"129","2022-01-19 21:48:03.963397","10.8.0.1","151.101.66.133","TLSv1.2","482","Application Data"
"130","2022-01-19 21:48:03.963494","151.101.66.133","10.8.0.1","TCP","54","443  >  40928 [ACK] Seq=5438 Ack=1039 Win=65535 Len=0"
"131","2022-01-19 21:48:04.013806","ord38s32-in-f2.1e100.net","10.8.0.1","TLSv1.3","1179","Application Data, Application Data"
"132","2022-01-19 21:48:04.013997","whatsapp-chatd-msgr-mini-edge-shv-01-ort2.facebook.com","10.8.0.1","TCP","164","5222  >  38476 [PSH, ACK] Seq=1 Ack=1247 Win=65535 Len=110 [TCP segment of a reassembled PDU]"
"133","2022-01-19 21:48:04.014058","ec2-52-17-143-157.eu-west-1.compute.amazonaws.com","10.8.0.1","TLSv1.2","780","Certificate, Server Key Exchange, Server Hello Done"
"134","2022-01-19 21:48:04.014148","10.8.0.1","ord38s32-in-f2.1e100.net","TCP","54","42588  >  443 [ACK] Seq=1146 Ack=1344 Win=65535 Len=0"
"135","2022-01-19 21:48:04.014160","10.8.0.1","whatsapp-chatd-msgr-mini-edge-shv-01-ort2.facebook.com","TCP","54","38476  >  5222 [ACK] Seq=1247 Ack=111 Win=65535 Len=0"
"136","2022-01-19 21:48:04.014168","10.8.0.1","ec2-52-17-143-157.eu-west-1.compute.amazonaws.com","TCP","54","50770  >  443 [ACK] Seq=518 Ack=6309 Win=65535 Len=0"
"137","2022-01-19 21:48:04.027940","10.8.0.1","whatsapp-chatd-msgr-mini-edge-shv-01-ort2.facebook.com","TCP","98","38476  >  5222 [PSH, ACK] Seq=1247 Ack=111 Win=65535 Len=44 [TCP segment of a reassembled PDU]"
"138","2022-01-19 21:48:04.028040","whatsapp-chatd-msgr-mini-edge-shv-01-ort2.facebook.com","10.8.0.1","TCP","54","5222  >  38476 [ACK] Seq=111 Ack=1291 Win=65535 Len=0"
"139","2022-01-19 21:48:04.078406","151.101.66.133","10.8.0.1","TLSv1.2","366","Application Data"
"140","2022-01-19 21:48:04.078499","ord38s18-in-f14.1e100.net","10.8.0.1","TLSv1.3","1358","Application Data, Application Data, Application Data"
"141","2022-01-19 21:48:04.078510","10.8.0.1","ord38s32-in-f2.1e100.net","TCP","74","42636  >  443 [SYN] Seq=0 Win=65535 Len=0 MSS=1460 SACK_PERM=1 TSval=1881641497 TSecr=0 WS=1024"
"142","2022-01-19 21:48:04.081004","ord38s32-in-f2.1e100.net","10.8.0.1","TCP","54","443  >  42636 [SYN, ACK] Seq=0 Ack=1 Win=65535 Len=0"
"143","2022-01-19 21:48:04.081038","10.8.0.1","ord38s30-in-f10.1e100.net","QUIC","1292","Initial, DCID=1ce9e32b80ac91f5, PKN: 1, PADDING, CRYPTO, CRYPTO, CRYPTO, PADDING, PING, CRYPTO, PADDING, CRYPTO, PADDING"
"144","2022-01-19 21:48:04.152228","ord38s30-in-f10.1e100.net","10.8.0.1","QUIC","1292","Initial, SCID=1ce9e32b80ac91f5, PKN: 1, ACK, CRYPTO, PADDING"
"145","2022-01-19 21:48:04.152280","10.8.0.1","ec2-52-72-198-199.compute-1.amazonaws.com","TCP","74","48332  >  443 [SYN] Seq=0 Win=65535 Len=0 MSS=1460 SACK_PERM=1 TSval=49639077 TSecr=0 WS=1024"
"146","2022-01-19 21:48:04.154754","ec2-52-72-198-199.compute-1.amazonaws.com","10.8.0.1","TCP","54","443  >  48332 [SYN, ACK] Seq=0 Ack=1 Win=65535 Len=0"
"147","2022-01-19 21:48:04.154840","151.101.193.35","10.8.0.1","TLSv1.3","4391","Server Hello, Change Cipher Spec, Application Data, Application Data, Application Data, Application Data, Application Data"
"148","2022-01-19 21:48:04.154902","151.101.193.35","10.8.0.1","TLSv1.3","4391","Server Hello, Change Cipher Spec, Application Data, Application Data, Application Data, Application Data, Application Data"
"149","2022-01-19 21:48:04.154967","whatsapp-chatd-msgr-mini-edge-shv-01-ort2.facebook.com","10.8.0.1","TCP","150","5222  >  38476 [PSH, ACK] Seq=111 Ack=1291 Win=65535 Len=96 [TCP segment of a reassembled PDU]"
"150","2022-01-19 21:48:04.154990","10.8.0.1","ord38s30-in-f10.1e100.net","TCP","74","38912  >  443 [SYN] Seq=0 Win=65535 Len=0 MSS=1460 SACK_PERM=1 TSval=1958958477 TSecr=0 WS=1024"
"151","2022-01-19 21:48:04.159159","ord38s30-in-f10.1e100.net","10.8.0.1","TCP","54","443  >  38912 [SYN, ACK] Seq=0 Ack=1 Win=65535 Len=0"
"152","2022-01-19 21:48:04.159193","10.8.0.1","ord38s18-in-f14.1e100.net","TCP","54","54714  >  443 [ACK] Seq=1162 Ack=1508 Win=65535 Len=0"
"153","2022-01-19 21:48:04.159207","10.8.0.1","ord38s32-in-f2.1e100.net","TCP","54","42636  >  443 [ACK] Seq=1 Ack=1 Win=65535 Len=0"
"154","2022-01-19 21:48:04.159219","10.8.0.1","ord38s32-in-f2.1e100.net","TCP","590","42636  >  443 [ACK] Seq=1 Ack=1 Win=65535 Len=536 [TCP segment of a reassembled PDU]"
"155","2022-01-19 21:48:04.159253","ord38s32-in-f2.1e100.net","10.8.0.1","TCP","54","443  >  42636 [ACK] Seq=1 Ack=537 Win=65535 Len=0"
"156","2022-01-19 21:48:04.159262","10.8.0.1","ord38s32-in-f2.1e100.net","TLSv1.3","92","Client Hello"
"157","2022-01-19 21:48:04.159281","ord38s32-in-f2.1e100.net","10.8.0.1","TCP","54","443  >  42636 [ACK] Seq=1 Ack=575 Win=65535 Len=0"
"158","2022-01-19 21:48:04.159290","10.8.0.1","ord38s18-in-f14.1e100.net","TCP","74","54758  >  443 [SYN] Seq=0 Win=65535 Len=0 MSS=1460 SACK_PERM=1 TSval=3598292849 TSecr=0 WS=1024"
"159","2022-01-19 21:48:04.160856","ord38s18-in-f14.1e100.net","10.8.0.1","TCP","54","443  >  54758 [SYN, ACK] Seq=0 Ack=1 Win=65535 Len=0"
"160","2022-01-19 21:48:04.160921","10.8.0.1","ord38s30-in-f10.1e100.net","QUIC","1292","Initial, DCID=1ce9e32b80ac91f5, PKN: 3, CRYPTO, CRYPTO, PADDING, CRYPTO, PADDING, CRYPTO, CRYPTO, PADDING, PING, PADDING, CRYPTO, CRYPTO, PADDING"
"161","2022-01-19 21:48:05.162172","10.8.0.1","ec2-52-17-143-157.eu-west-1.compute.amazonaws.com","TLSv1.2","180","Client Key Exchange, Change Cipher Spec, Encrypted Handshake Message"
"162","2022-01-19 21:48:05.162441","ec2-52-17-143-157.eu-west-1.compute.amazonaws.com","10.8.0.1","TCP","54","443  >  50770 [ACK] Seq=6309 Ack=644 Win=65535 Len=0"
"163","2022-01-19 21:48:05.162678","64.4.251.12","10.8.0.1","TLSv1.3","3898","Server Hello, Change Cipher Spec, Application Data, Application Data, Application Data, Application Data"
"164","2022-01-19 21:48:05.162834","api.paypal.com","10.8.0.1","TLSv1.3","153","Hello Retry Request, Change Cipher Spec"
"165","2022-01-19 21:48:05.163048","ord38s32-in-f2.1e100.net","10.8.0.1","TLSv1.3","272","Server Hello, Change Cipher Spec, Application Data"
"166","2022-01-19 21:48:05.163098","10.8.0.1","ord38s30-in-f10.1e100.net","QUIC","1292","Initial, DCID=1ce9e32b80ac91f5, PKN: 4, ACK, PADDING"
"167","2022-01-19 21:48:05.240100","ord38s30-in-f10.1e100.net","10.8.0.1","QUIC","136","Initial, SCID=1ce9e32b80ac91f5, PKN: 10, CC"
"168","2022-01-19 21:48:05.240307","10.8.0.1","ec2-52-72-198-199.compute-1.amazonaws.com","TCP","54","48332  >  443 [ACK] Seq=1 Ack=1 Win=65535 Len=0"
"169","2022-01-19 21:48:05.240327","10.8.0.1","whatsapp-chatd-msgr-mini-edge-shv-01-ort2.facebook.com","TCP","54","38476  >  5222 [ACK] Seq=1291 Ack=207 Win=65535 Len=0"
"170","2022-01-19 21:48:05.240421","whatsapp-chatd-msgr-mini-edge-shv-01-ort2.facebook.com","10.8.0.1","TCP","91","5222  >  38476 [PSH, ACK] Seq=207 Ack=1291 Win=65535 Len=37 [TCP segment of a reassembled PDU]"
"171","2022-01-19 21:48:05.240439","10.8.0.1","ord38s30-in-f10.1e100.net","TCP","54","38912  >  443 [ACK] Seq=1 Ack=1 Win=65535 Len=0"
"172","2022-01-19 21:48:05.240453","10.8.0.1","ord38s30-in-f10.1e100.net","TLSv1.3","571","Client Hello"
"173","2022-01-19 21:48:05.240490","ord38s30-in-f10.1e100.net","10.8.0.1","TCP","54","443  >  38912 [ACK] Seq=1 Ack=518 Win=65535 Len=0"
"174","2022-01-19 21:48:05.240503","10.8.0.1","ord38s18-in-f14.1e100.net","TCP","54","54758  >  443 [ACK] Seq=1 Ack=1 Win=65535 Len=0"
"175","2022-01-19 21:48:05.240557","10.8.0.1","ord38s18-in-f14.1e100.net","TCP","590","54758  >  443 [ACK] Seq=1 Ack=1 Win=65535 Len=536 [TCP segment of a reassembled PDU]"
"176","2022-01-19 21:48:05.240628","ord38s18-in-f14.1e100.net","10.8.0.1","TCP","54","443  >  54758 [ACK] Seq=1 Ack=537 Win=65535 Len=0"
"177","2022-01-19 21:48:05.240641","10.8.0.1","ord38s18-in-f14.1e100.net","TLSv1.3","63","Client Hello"
"178","2022-01-19 21:48:05.240664","ord38s18-in-f14.1e100.net","10.8.0.1","TCP","54","443  >  54758 [ACK] Seq=1 Ack=546 Win=65535 Len=0"
"179","2022-01-19 21:48:05.240676","10.8.0.1","ec2-52-72-198-199.compute-1.amazonaws.com","TLSv1.2","571","Client Hello"
"180","2022-01-19 21:48:05.240706","ec2-52-72-198-199.compute-1.amazonaws.com","10.8.0.1","TCP","54","443  >  48332 [ACK] Seq=1 Ack=518 Win=65535 Len=0"
"181","2022-01-19 21:48:05.240745","10.8.0.1","ec2-52-17-143-157.eu-west-1.compute.amazonaws.com","TCP","180","[TCP Spurious Retransmission] 50770  >  443 [PSH, ACK] Seq=518 Ack=6309 Win=65535 Len=126"
"182","2022-01-19 21:48:05.240775","ec2-52-17-143-157.eu-west-1.compute.amazonaws.com","10.8.0.1","TCP","54","[TCP Dup ACK 162#1] 443  >  50770 [ACK] Seq=6309 Ack=644 Win=65535 Len=0"
"183","2022-01-19 21:48:05.240810","10.8.0.1","ord38s30-in-f10.1e100.net","QUIC","1292","Initial, DCID=1ce9e32b80ac91f5, PKN: 6, PADDING, PING, PADDING"
"184","2022-01-19 21:48:05.350214","ord38s30-in-f10.1e100.net","10.8.0.1","QUIC","136","Initial, SCID=1ce9e32b80ac91f5, PKN: 10, CC"
"185","2022-01-19 21:48:05.350307","10.8.0.1","ec2-52-72-198-199.compute-1.amazonaws.com","TCP","74","48348  >  443 [SYN] Seq=0 Win=65535 Len=0 MSS=1460 SACK_PERM=1 TSval=49639409 TSecr=0 WS=1024"
"186","2022-01-19 21:48:05.352610","ec2-52-72-198-199.compute-1.amazonaws.com","10.8.0.1","TCP","54","443  >  48348 [SYN, ACK] Seq=0 Ack=1 Win=65535 Len=0"
"187","2022-01-19 21:48:05.352647","10.8.0.1","ord38s30-in-f10.1e100.net","TCP","571","[TCP Spurious Retransmission] 38912  >  443 [PSH, ACK] Seq=1 Ack=1 Win=65535 Len=517"
"188","2022-01-19 21:48:05.352686","ord38s30-in-f10.1e100.net","10.8.0.1","TCP","54","[TCP Dup ACK 173#1] 443  >  38912 [ACK] Seq=1 Ack=518 Win=65535 Len=0"
"189","2022-01-19 21:48:05.352700","10.8.0.1","ord38s18-in-f14.1e100.net","TCP","590","[TCP Spurious Retransmission] 54758  >  443 [ACK] Seq=1 Ack=1 Win=65535 Len=536"
"190","2022-01-19 21:48:05.352748","ord38s18-in-f14.1e100.net","10.8.0.1","TCP","54","443  >  54758 [ACK] Seq=1 Ack=537 Win=65535 Len=0"
"191","2022-01-19 21:48:05.352778","10.8.0.1","ec2-52-72-198-199.compute-1.amazonaws.com","TCP","571","[TCP Spurious Retransmission] 48332  >  443 [PSH, ACK] Seq=1 Ack=1 Win=65535 Len=517"
"192","2022-01-19 21:48:05.352801","ec2-52-72-198-199.compute-1.amazonaws.com","10.8.0.1","TCP","54","[TCP Dup ACK 180#1] 443  >  48332 [ACK] Seq=1 Ack=518 Win=65535 Len=0"
"193","2022-01-19 21:48:05.352811","10.8.0.1","ec2-52-17-143-157.eu-west-1.compute.amazonaws.com","TCP","180","[TCP Spurious Retransmission] 50770  >  443 [PSH, ACK] Seq=518 Ack=6309 Win=65535 Len=126"
"194","2022-01-19 21:48:05.352836","ec2-52-17-143-157.eu-west-1.compute.amazonaws.com","10.8.0.1","TCP","54","[TCP Dup ACK 162#2] 443  >  50770 [ACK] Seq=6309 Ack=644 Win=65535 Len=0"
"195","2022-01-19 21:48:05.352855","10.8.0.1","ord38s30-in-f10.1e100.net","QUIC","1292","Initial, DCID=1ce9e32b80ac91f5, PKN: 8, PADDING, PING, PADDING"
"196","2022-01-19 21:48:06.381943","10.8.0.1","ord37s33-in-f10.1e100.net","QUIC","1292","Initial, DCID=10e9fedf6d567c13, PKN: 1, CRYPTO, PING, PING, CRYPTO, CRYPTO, PADDING, CRYPTO, PADDING, CRYPTO, PING, CRYPTO, PING, PADDING, PING, CRYPTO, PING, CRYPTO, CRYPTO, PING, CRYPTO"
"197","2022-01-19 21:48:06.529136","ord37s33-in-f10.1e100.net","10.8.0.1","QUIC","1292","Initial, SCID=10e9fedf6d567c13, PKN: 1, ACK, CRYPTO, PADDING"
"198","2022-01-19 21:48:06.529371","ord38s30-in-f10.1e100.net","10.8.0.1","TLSv1.3","4762","Server Hello, Change Cipher Spec, Application Data, Application Data"
"199","2022-01-19 21:48:06.529522","ord38s18-in-f14.1e100.net","10.8.0.1","TLSv1.3","257","Server Hello, Change Cipher Spec, Application Data"
"200","2022-01-19 21:48:06.529744","ec2-52-72-198-199.compute-1.amazonaws.com","10.8.0.1","TLSv1.2","5840","Server Hello, Certificate, Server Key Exchange, Server Hello Done, Alert (Level: Fatal, Description: Protocol Version)"
"201","2022-01-19 21:48:06.529800","10.8.0.1","ord37s33-in-f10.1e100.net","TCP","74","58202  >  443 [SYN] Seq=0 Win=65535 Len=0 MSS=1460 SACK_PERM=1 TSval=3638136736 TSecr=0 WS=1024"
"202","2022-01-19 21:48:06.535645","ord37s33-in-f10.1e100.net","10.8.0.1","TCP","54","443  >  58202 [SYN, ACK] Seq=0 Ack=1 Win=65535 Len=0"
"203","2022-01-19 21:48:06.535768","ec2-52-17-143-157.eu-west-1.compute.amazonaws.com","10.8.0.1","TLSv1.2","359","New Session Ticket, Change Cipher Spec, Encrypted Handshake Message, Encrypted Alert"
"204","2022-01-19 21:48:06.535804","ec2-52-17-143-157.eu-west-1.compute.amazonaws.com","10.8.0.1","TCP","54","443  >  50770 [FIN, ACK] Seq=6614 Ack=644 Win=65535 Len=0"
"205","2022-01-19 21:48:06.535865","10.8.0.1","ord37s33-in-f10.1e100.net","QUIC","1292","Initial, DCID=10e9fedf6d567c13, PKN: 3, PADDING, CRYPTO, PADDING, CRYPTO, CRYPTO, PADDING, CRYPTO, CRYPTO, CRYPTO, PADDING, CRYPTO, CRYPTO, CRYPTO"
"206","2022-01-19 21:48:07.562077","10.8.0.1","ord38s18-in-f14.1e100.net","TCP","590","[TCP Spurious Retransmission] 54758  >  443 [ACK] Seq=1 Ack=1 Win=65535 Len=536"
"207","2022-01-19 21:48:07.562295","ord38s18-in-f14.1e100.net","10.8.0.1","TCP","54","443  >  54758 [ACK] Seq=1 Ack=537 Win=65535 Len=0"
"208","2022-01-19 21:48:07.562374","10.8.0.1","ord37s33-in-f10.1e100.net","QUIC","1292","Initial, DCID=10e9fedf6d567c13, PKN: 5, PADDING, CRYPTO, CRYPTO, PADDING, CRYPTO"
"209","2022-01-19 21:48:07.671279","ord37s33-in-f10.1e100.net","10.8.0.1","QUIC","136","Initial, SCID=10e9fedf6d567c13, PKN: 10, CC"
"210","2022-01-19 21:48:07.671367","10.8.0.1","ord38s30-in-f10.1e100.net","TCP","571","[TCP Spurious Retransmission] 38912  >  443 [PSH, ACK] Seq=1 Ack=1 Win=65535 Len=517"
"211","2022-01-19 21:48:07.671530","ord38s30-in-f10.1e100.net","10.8.0.1","TCP","54","443  >  38912 [ACK] Seq=1 Ack=518 Win=65535 Len=0"
"212","2022-01-19 21:48:07.671601","ord38s30-in-f10.1e100.net","10.8.0.1","TCP","54","[TCP Retransmission] 443  >  38912 [FIN, ACK] Seq=1 Ack=518 Win=65535 Len=0"
"213","2022-01-19 21:48:07.671730","10.8.0.1","ord37s33-in-f10.1e100.net","TCP","74","58204  >  443 [SYN] Seq=0 Win=65535 Len=0 MSS=1460 SACK_PERM=1 TSval=3638136990 TSecr=0 WS=1024"
"214","2022-01-19 21:48:07.675355","ord37s33-in-f10.1e100.net","10.8.0.1","TCP","54","443  >  58204 [SYN, ACK] Seq=0 Ack=1 Win=65535 Len=0"
"215","2022-01-19 21:48:07.675414","10.8.0.1","ord38s32-in-f2.1e100.net","TCP","54","42636  >  443 [ACK] Seq=575 Ack=219 Win=65535 Len=0"
"216","2022-01-19 21:48:07.675442","10.8.0.1","ord38s32-in-f2.1e100.net","TLSv1.3","118","Change Cipher Spec, Application Data"
"217","2022-01-19 21:48:07.675523","ord38s32-in-f2.1e100.net","10.8.0.1","TCP","54","443  >  42636 [ACK] Seq=219 Ack=639 Win=65535 Len=0"
"218","2022-01-19 21:48:07.675549","10.8.0.1","ec2-52-72-198-199.compute-1.amazonaws.com","TCP","571","[TCP Spurious Retransmission] 48332  >  443 [PSH, ACK] Seq=1 Ack=1 Win=65535 Len=517"
"219","2022-01-19 21:48:07.675690","ec2-52-72-198-199.compute-1.amazonaws.com","10.8.0.1","TCP","54","443  >  48332 [ACK] Seq=1 Ack=518 Win=65535 Len=0"
"220","2022-01-19 21:48:07.675754","ec2-52-72-198-199.compute-1.amazonaws.com","10.8.0.1","TCP","54","[TCP Retransmission] 443  >  48332 [FIN, ACK] Seq=1 Ack=518 Win=65535 Len=0"
"221","2022-01-19 21:48:07.675910","10.8.0.1","whatsapp-chatd-msgr-mini-edge-shv-01-ort2.facebook.com","TCP","54","38476  >  5222 [ACK] Seq=1291 Ack=244 Win=65535 Len=0"
"222","2022-01-19 21:48:07.675940","10.8.0.1","ord38s18-in-f14.1e100.net","TCP","63","[TCP Retransmission] 54758  >  443 [PSH, ACK] Seq=537 Ack=1 Win=65535 Len=9"
"223","2022-01-19 21:48:07.675996","ord38s18-in-f14.1e100.net","10.8.0.1","TCP","54","443  >  54758 [ACK] Seq=1 Ack=546 Win=65535 Len=0"
"224","2022-01-19 21:48:07.676016","10.8.0.1","ord37s33-in-f10.1e100.net","QUIC","1292","Initial, DCID=10e9fedf6d567c13, PKN: 7, PING, PING, PING, PADDING, PING, PADDING, PING, PADDING, PING, PING, PADDING, CRYPTO, PING, PING"
"225","2022-01-19 21:48:07.767360","ord37s33-in-f10.1e100.net","10.8.0.1","QUIC","136","Initial, SCID=10e9fedf6d567c13, PKN: 10, CC"
"226","2022-01-19 21:48:07.767582","10.8.0.1","ec2-52-72-198-199.compute-1.amazonaws.com","TCP","54","48348  >  443 [ACK] Seq=1 Ack=1 Win=65535 Len=0"
"227","2022-01-19 21:48:07.767619","10.8.0.1","ec2-52-72-198-199.compute-1.amazonaws.com","TLSv1.2","571","Client Hello"
"228","2022-01-19 21:48:07.767740","ec2-52-72-198-199.compute-1.amazonaws.com","10.8.0.1","TCP","54","443  >  48348 [ACK] Seq=1 Ack=518 Win=65535 Len=0"
"229","2022-01-19 21:48:07.767768","10.8.0.1","ord38s32-in-f2.1e100.net","TCP","118","[TCP Spurious Retransmission] 42636  >  443 [PSH, ACK] Seq=575 Ack=219 Win=65535 Len=64"
"230","2022-01-19 21:48:07.767825","ord38s32-in-f2.1e100.net","10.8.0.1","TCP","54","[TCP Dup ACK 217#1] 443  >  42636 [ACK] Seq=219 Ack=639 Win=65535 Len=0"
"231","2022-01-19 21:48:07.767911","10.8.0.1","ord37s33-in-f10.1e100.net","TCP","74","[TCP Retransmission] [TCP Port numbers reused] 58202  >  443 [SYN] Seq=0 Win=65535 Len=0 MSS=1460 SACK_PERM=1 TSval=3638137762 TSecr=0 WS=1024"
"232","2022-01-19 21:48:07.772815","ord37s33-in-f10.1e100.net","10.8.0.1","TCP","54","[TCP Retransmission] 443  >  58202 [SYN, ACK] Seq=0 Ack=1 Win=65535 Len=0"
"233","2022-01-19 21:48:07.772904","10.8.0.1","ord37s33-in-f10.1e100.net","QUIC","1292","Initial, DCID=10e9fedf6d567c13, PKN: 9, PADDING, CRYPTO, PING, PING, PADDING, PING, CRYPTO, PADDING, CRYPTO, PADDING, CRYPTO, PING, PING"
"234","2022-01-19 21:48:08.777829","10.8.0.1","ord38s32-in-f2.1e100.net","TCP","118","[TCP Spurious Retransmission] 42636  >  443 [PSH, ACK] Seq=575 Ack=219 Win=65535 Len=64"
"235","2022-01-19 21:48:08.777971","ord38s32-in-f2.1e100.net","10.8.0.1","TCP","54","[TCP Dup ACK 217#2] 443  >  42636 [ACK] Seq=219 Ack=639 Win=65535 Len=0"
"236","2022-01-19 21:48:08.778114","ord38s18-in-f14.1e100.net","10.8.0.1","TCP","78","[TCP Retransmission] 443  >  54758 [PSH, ACK] Seq=1 Ack=546 Win=65535 Len=24"
"237","2022-01-19 21:48:08.778239","ec2-52-72-198-199.compute-1.amazonaws.com","10.8.0.1","TLSv1.2","5833","Server Hello, Certificate, Server Key Exchange, Server Hello Done"
"238","2022-01-19 21:48:08.778349","ord38s32-in-f2.1e100.net","10.8.0.1","TLSv1.3","636","Application Data, Application Data"
"239","2022-01-19 21:48:08.778379","10.8.0.1","ord37s33-in-f10.1e100.net","TCP","74","[TCP Retransmission] [TCP Port numbers reused] 58204  >  443 [SYN] Seq=0 Win=65535 Len=0 MSS=1460 SACK_PERM=1 TSval=3638138018 TSecr=0 WS=1024"
"240","2022-01-19 21:48:08.781710","ord37s33-in-f10.1e100.net","10.8.0.1","TCP","54","[TCP Retransmission] 443  >  58204 [SYN, ACK] Seq=0 Ack=1 Win=65535 Len=0"
"241","2022-01-19 21:48:08.781807","10.8.0.1","ord38s30-in-f10.1e100.net","TCP","54","38912  >  443 [ACK] Seq=518 Ack=4709 Win=65535 Len=0"
"242","2022-01-19 21:48:08.781826","10.8.0.1","ord38s18-in-f14.1e100.net","TCP","54","54758  >  443 [ACK] Seq=546 Ack=204 Win=65535 Len=0"
"243","2022-01-19 21:48:08.781904","ord38s18-in-f14.1e100.net","10.8.0.1","TCP","54","443  >  54758 [FIN, ACK] Seq=204 Ack=546 Win=65535 Len=0"
"244","2022-01-19 21:48:08.781960","10.8.0.1","ec2-52-72-198-199.compute-1.amazonaws.com","TCP","54","48332  >  443 [ACK] Seq=518 Ack=5787 Win=65535 Len=0"
"245","2022-01-19 21:48:08.781969","10.8.0.1","ord38s18-in-f14.1e100.net","TLSv1.3","118","Change Cipher Spec, Application Data"
"246","2022-01-19 21:48:08.781976","10.8.0.1","ord37s33-in-f10.1e100.net","TCP","54","58202  >  443 [ACK] Seq=1 Ack=1 Win=67107840 Len=0"
"247","2022-01-19 21:48:08.781983","10.8.0.1","ec2-52-17-143-157.eu-west-1.compute.amazonaws.com","TCP","54","50770  >  443 [ACK] Seq=644 Ack=6614 Win=65535 Len=0"
"248","2022-01-19 21:48:08.781990","10.8.0.1","ec2-52-72-198-199.compute-1.amazonaws.com","TLSv1.2","180","Client Key Exchange, Change Cipher Spec, Encrypted Handshake Message"
"249","2022-01-19 21:48:08.781996","10.8.0.1","ord38s18-in-f14.1e100.net","TCP","590","54758  >  443 [ACK] Seq=610 Ack=204 Win=65535 Len=536 [TCP segment of a reassembled PDU]"
"250","2022-01-19 21:48:08.782002","10.8.0.1","ec2-52-72-198-199.compute-1.amazonaws.com","TCP","54","48332  >  443 [FIN, ACK] Seq=644 Ack=5787 Win=65535 Len=0"
"251","2022-01-19 21:48:08.782048","ec2-52-72-198-199.compute-1.amazonaws.com","10.8.0.1","TCP","54","443  >  48332 [ACK] Seq=5787 Ack=645 Win=65535 Len=0"
"252","2022-01-19 21:48:08.782087","ec2-52-72-198-199.compute-1.amazonaws.com","10.8.0.1","TCP","54","443  >  48332 [FIN, ACK] Seq=5787 Ack=645 Win=65535 Len=0"
"253","2022-01-19 21:48:08.782095","10.8.0.1","ec2-52-200-91-14.compute-1.amazonaws.com","TCP","74","39320  >  443 [SYN] Seq=0 Win=65535 Len=0 MSS=1460 SACK_PERM=1 TSval=2435017336 TSecr=0 WS=1024"
"254","2022-01-19 21:48:08.784334","ec2-52-200-91-14.compute-1.amazonaws.com","10.8.0.1","TCP","54","443  >  39320 [SYN, ACK] Seq=0 Ack=1 Win=65535 Len=0"
"255","2022-01-19 21:48:08.784367","10.8.0.1","ord38s30-in-f10.1e100.net","TLSv1.3","118","Change Cipher Spec, Application Data"
"256","2022-01-19 21:48:08.784379","10.8.0.1","ord38s30-in-f10.1e100.net","TLSv1.3","146","Application Data"
"257","2022-01-19 21:48:08.784388","10.8.0.1","ord38s30-in-f10.1e100.net","TLSv1.3","123","Application Data"
"258","2022-01-19 21:48:08.784433","ord38s30-in-f10.1e100.net","10.8.0.1","TCP","54","443  >  38912 [ACK] Seq=4709 Ack=675 Win=65535 Len=0"
