"No.","Time","Source","Destination","Protocol","Length","Info"
"1","2022-01-19 21:59:36.572378","10.8.0.1","edge-mqtt-shv-01-ort2.facebook.com","TCP","74","42094  >  443 [SYN] Seq=0 Win=65535 Len=0 MSS=1460 SACK_PERM=1 TSval=1906044979 TSecr=0 WS=1024"
"2","2022-01-19 21:59:36.574290","edge-mqtt-shv-01-ort2.facebook.com","10.8.0.1","TCP","54","443  >  42094 [SYN, ACK] Seq=0 Ack=1 Win=65535 Len=0"
"3","2022-01-19 21:59:36.574328","10.8.0.1","edge-mqtt-shv-01-ort2.facebook.com","TCP","54","42094  >  443 [ACK] Seq=1 Ack=1 Win=65535 Len=0"
"4","2022-01-19 21:59:36.576936","10.8.0.1","edge-mqtt-shv-01-ort2.facebook.com","TLSv1.3","453","Client Hello"
"5","2022-01-19 21:59:36.577026","edge-mqtt-shv-01-ort2.facebook.com","10.8.0.1","TCP","54","443  >  42094 [ACK] Seq=1 Ack=400 Win=65535 Len=0"
"6","2022-01-19 21:59:36.577764","10.8.0.1","edge-mqtt-shv-01-ort2.facebook.com","TLSv1.3","462","Change Cipher Spec, Application Data"
"7","2022-01-19 21:59:36.577837","edge-mqtt-shv-01-ort2.facebook.com","10.8.0.1","TCP","54","443  >  42094 [ACK] Seq=1 Ack=808 Win=65535 Len=0"
"8","2022-01-19 21:59:36.606341","10.8.0.1","edge-mqtt-shv-01-ort2.facebook.com","TLSv1.3","350","Application Data"
"9","2022-01-19 21:59:36.606453","edge-mqtt-shv-01-ort2.facebook.com","10.8.0.1","TCP","54","443  >  42094 [ACK] Seq=1 Ack=1104 Win=65535 Len=0"
"10","2022-01-19 21:59:36.608904","10.8.0.1","edge-mqtt-shv-01-ort2.facebook.com","TLSv1.3","315","Application Data"
"11","2022-01-19 21:59:36.609003","edge-mqtt-shv-01-ort2.facebook.com","10.8.0.1","TCP","54","443  >  42094 [ACK] Seq=1 Ack=1365 Win=65535 Len=0"
"12","2022-01-19 21:59:36.616114","10.8.0.1","edge-mqtt-shv-01-ort2.facebook.com","TLSv1.3","106","Application Data"
"13","2022-01-19 21:59:36.616225","edge-mqtt-shv-01-ort2.facebook.com","10.8.0.1","TCP","54","443  >  42094 [ACK] Seq=1 Ack=1417 Win=65535 Len=0"
"14","2022-01-19 21:59:36.616678","10.8.0.1","edge-mqtt-shv-01-ort2.facebook.com","TLSv1.3","102","Application Data"
"15","2022-01-19 21:59:36.616710","edge-mqtt-shv-01-ort2.facebook.com","10.8.0.1","TCP","54","443  >  42094 [ACK] Seq=1 Ack=1465 Win=65535 Len=0"
"16","2022-01-19 21:59:36.624501","10.8.0.1","edge-mqtt-shv-01-ort2.facebook.com","TLSv1.3","293","Application Data"
"17","2022-01-19 21:59:36.624613","edge-mqtt-shv-01-ort2.facebook.com","10.8.0.1","TCP","54","443  >  42094 [ACK] Seq=1 Ack=1704 Win=65535 Len=0"
"18","2022-01-19 21:59:36.631697","10.8.0.1","edge-mqtt-shv-01-ort2.facebook.com","TLSv1.3","422","Application Data"
"19","2022-01-19 21:59:36.631801","edge-mqtt-shv-01-ort2.facebook.com","10.8.0.1","TCP","54","443  >  42094 [ACK] Seq=1 Ack=2072 Win=65535 Len=0"
"20","2022-01-19 21:59:36.638338","10.8.0.1","edge-mqtt-shv-01-ort2.facebook.com","TLSv1.3","353","Application Data"
"21","2022-01-19 21:59:36.638450","edge-mqtt-shv-01-ort2.facebook.com","10.8.0.1","TCP","54","443  >  42094 [ACK] Seq=1 Ack=2371 Win=65535 Len=0"
"22","2022-01-19 21:59:36.705086","10.8.0.1","whatsapp-chatd-msgr-mini-edge-shv-02-ort2.facebook.com","TCP","74","58188  >  5222 [SYN] Seq=0 Win=65535 Len=0 MSS=1460 SACK_PERM=1 TSval=542498621 TSecr=0 WS=1024"
"23","2022-01-19 21:59:36.708433","whatsapp-chatd-msgr-mini-edge-shv-02-ort2.facebook.com","10.8.0.1","TCP","54","5222  >  58188 [SYN, ACK] Seq=0 Ack=1 Win=65535 Len=0"
"24","2022-01-19 21:59:36.708483","10.8.0.1","whatsapp-chatd-msgr-mini-edge-shv-02-ort2.facebook.com","TCP","54","58188  >  5222 [ACK] Seq=1 Ack=1 Win=65535 Len=0"
"25","2022-01-19 21:59:36.709378","10.8.0.1","whatsapp-chatd-msgr-mini-edge-shv-02-ort2.facebook.com","TCP","58","58188  >  5222 [PSH, ACK] Seq=1 Ack=1 Win=65535 Len=4 [TCP segment of a reassembled PDU]"
"26","2022-01-19 21:59:36.709445","whatsapp-chatd-msgr-mini-edge-shv-02-ort2.facebook.com","10.8.0.1","TCP","54","5222  >  58188 [ACK] Seq=1 Ack=5 Win=65535 Len=0"
"27","2022-01-19 21:59:36.709957","10.8.0.1","whatsapp-chatd-msgr-mini-edge-shv-02-ort2.facebook.com","TCP","61","58188  >  5222 [PSH, ACK] Seq=5 Ack=1 Win=65535 Len=7 [TCP segment of a reassembled PDU]"
"28","2022-01-19 21:59:36.710018","whatsapp-chatd-msgr-mini-edge-shv-02-ort2.facebook.com","10.8.0.1","TCP","54","5222  >  58188 [ACK] Seq=1 Ack=12 Win=65535 Len=0"
"29","2022-01-19 21:59:36.710140","10.8.0.1","whatsapp-chatd-msgr-mini-edge-shv-02-ort2.facebook.com","TCP","58","58188  >  5222 [PSH, ACK] Seq=12 Ack=1 Win=65535 Len=4 [TCP segment of a reassembled PDU]"
"30","2022-01-19 21:59:36.710171","whatsapp-chatd-msgr-mini-edge-shv-02-ort2.facebook.com","10.8.0.1","TCP","54","5222  >  58188 [ACK] Seq=1 Ack=16 Win=65535 Len=0"
"31","2022-01-19 21:59:36.715202","10.8.0.1","whatsapp-chatd-msgr-mini-edge-shv-02-ort2.facebook.com","TCP","590","58188  >  5222 [ACK] Seq=16 Ack=1 Win=65535 Len=536 [TCP segment of a reassembled PDU]"
"32","2022-01-19 21:59:36.715227","whatsapp-chatd-msgr-mini-edge-shv-02-ort2.facebook.com","10.8.0.1","TCP","54","5222  >  58188 [ACK] Seq=1 Ack=552 Win=65535 Len=0"
"33","2022-01-19 21:59:36.715236","10.8.0.1","whatsapp-chatd-msgr-mini-edge-shv-02-ort2.facebook.com","TCP","590","58188  >  5222 [PSH, ACK] Seq=552 Ack=1 Win=65535 Len=536 [TCP segment of a reassembled PDU]"
"34","2022-01-19 21:59:36.715257","whatsapp-chatd-msgr-mini-edge-shv-02-ort2.facebook.com","10.8.0.1","TCP","54","5222  >  58188 [ACK] Seq=1 Ack=1088 Win=65535 Len=0"
"35","2022-01-19 21:59:36.715265","10.8.0.1","whatsapp-chatd-msgr-mini-edge-shv-02-ort2.facebook.com","TCP","213","58188  >  5222 [PSH, ACK] Seq=1088 Ack=1 Win=65535 Len=159 [TCP segment of a reassembled PDU]"
"36","2022-01-19 21:59:36.715282","whatsapp-chatd-msgr-mini-edge-shv-02-ort2.facebook.com","10.8.0.1","TCP","54","5222  >  58188 [ACK] Seq=1 Ack=1247 Win=65535 Len=0"
"37","2022-01-19 21:59:36.740489","edge-mqtt-shv-01-ort2.facebook.com","10.8.0.1","TLSv1.3","270","Server Hello, Change Cipher Spec, Application Data"
"38","2022-01-19 21:59:36.790668","10.8.0.1","edge-mqtt-shv-01-ort2.facebook.com","TCP","54","42094  >  443 [ACK] Seq=2371 Ack=217 Win=65535 Len=0"
"39","2022-01-19 21:59:36.790820","10.8.0.1","edge-mqtt-shv-01-ort2.facebook.com","TLSv1.3","138","Application Data, Application Data"
"40","2022-01-19 21:59:36.790892","edge-mqtt-shv-01-ort2.facebook.com","10.8.0.1","TCP","54","443  >  42094 [ACK] Seq=217 Ack=2455 Win=65535 Len=0"
"41","2022-01-19 21:59:36.841258","edge-mqtt-shv-01-ort2.facebook.com","10.8.0.1","TLSv1.3","964","Application Data, Application Data, Application Data, Application Data, Application Data, Application Data, Application Data, Application Data, Application Data, Application Data, Application Data, Application Data"
"42","2022-01-19 21:59:36.891438","10.8.0.1","edge-mqtt-shv-01-ort2.facebook.com","TCP","54","42094  >  443 [ACK] Seq=2455 Ack=1127 Win=65535 Len=0"
"43","2022-01-19 21:59:36.891630","edge-mqtt-shv-01-ort2.facebook.com","10.8.0.1","TLSv1.3","341","Application Data"
"44","2022-01-19 21:59:36.891644","10.8.0.1","edge-mqtt-shv-01-ort2.facebook.com","TLSv1.3","85","Application Data"
"45","2022-01-19 21:59:36.891696","edge-mqtt-shv-01-ort2.facebook.com","10.8.0.1","TCP","54","443  >  42094 [ACK] Seq=1127 Ack=2486 Win=65535 Len=0"
"46","2022-01-19 21:59:36.891732","10.8.0.1","edge-mqtt-shv-01-ort2.facebook.com","TCP","54","42094  >  443 [ACK] Seq=2486 Ack=1414 Win=65535 Len=0"
"47","2022-01-19 21:59:36.891740","10.8.0.1","edge-mqtt-shv-01-ort2.facebook.com","TCP","54","[TCP Dup ACK 46#1] 42094  >  443 [ACK] Seq=2486 Ack=1414 Win=65535 Len=0"
"48","2022-01-19 21:59:36.893176","whatsapp-chatd-msgr-mini-edge-shv-02-ort2.facebook.com","10.8.0.1","TCP","111","5222  >  58188 [PSH, ACK] Seq=1 Ack=1247 Win=65535 Len=57 [TCP segment of a reassembled PDU]"
"49","2022-01-19 21:59:36.943279","10.8.0.1","whatsapp-chatd-msgr-mini-edge-shv-02-ort2.facebook.com","TCP","54","58188  >  5222 [ACK] Seq=1247 Ack=58 Win=65535 Len=0"
"50","2022-01-19 21:59:36.943391","edge-mqtt-shv-01-ort2.facebook.com","10.8.0.1","TLSv1.3","436","Application Data, Application Data"
"51","2022-01-19 21:59:36.943466","whatsapp-chatd-msgr-mini-edge-shv-02-ort2.facebook.com","10.8.0.1","TCP","107","5222  >  58188 [PSH, ACK] Seq=58 Ack=1247 Win=65535 Len=53 [TCP segment of a reassembled PDU]"
"52","2022-01-19 21:59:36.943485","10.8.0.1","edge-mqtt-shv-01-ort2.facebook.com","TCP","54","42094  >  443 [ACK] Seq=2486 Ack=1796 Win=65535 Len=0"
"53","2022-01-19 21:59:36.943495","10.8.0.1","whatsapp-chatd-msgr-mini-edge-shv-02-ort2.facebook.com","TCP","54","58188  >  5222 [ACK] Seq=1247 Ack=111 Win=65535 Len=0"
"54","2022-01-19 21:59:36.946113","10.8.0.1","whatsapp-chatd-msgr-mini-edge-shv-02-ort2.facebook.com","TCP","98","58188  >  5222 [PSH, ACK] Seq=1247 Ack=111 Win=65535 Len=44 [TCP segment of a reassembled PDU]"
"55","2022-01-19 21:59:36.946180","whatsapp-chatd-msgr-mini-edge-shv-02-ort2.facebook.com","10.8.0.1","TCP","54","5222  >  58188 [ACK] Seq=111 Ack=1291 Win=65535 Len=0"
"56","2022-01-19 21:59:37.026470","whatsapp-chatd-msgr-mini-edge-shv-02-ort2.facebook.com","10.8.0.1","TCP","100","5222  >  58188 [PSH, ACK] Seq=111 Ack=1291 Win=65535 Len=46 [TCP segment of a reassembled PDU]"
"57","2022-01-19 21:59:37.076647","10.8.0.1","whatsapp-chatd-msgr-mini-edge-shv-02-ort2.facebook.com","TCP","54","58188  >  5222 [ACK] Seq=1291 Ack=157 Win=65535 Len=0"
"58","2022-01-19 21:59:37.076907","whatsapp-chatd-msgr-mini-edge-shv-02-ort2.facebook.com","10.8.0.1","TCP","141","5222  >  58188 [PSH, ACK] Seq=157 Ack=1291 Win=65535 Len=87 [TCP segment of a reassembled PDU]"
"59","2022-01-19 21:59:37.127059","10.8.0.1","whatsapp-chatd-msgr-mini-edge-shv-02-ort2.facebook.com","TCP","54","58188  >  5222 [ACK] Seq=1291 Ack=244 Win=65535 Len=0"
"60","2022-01-19 21:59:37.655969","10.8.0.1","40.70.161.102","TCP","74","43338  >  443 [SYN] Seq=0 Win=65535 Len=0 MSS=1460 SACK_PERM=1 TSval=1435801795 TSecr=0 WS=1024"
"61","2022-01-19 21:59:37.661529","40.70.161.102","10.8.0.1","TCP","54","443  >  43338 [SYN, ACK] Seq=0 Ack=1 Win=65535 Len=0"
"62","2022-01-19 21:59:37.661629","10.8.0.1","40.70.161.102","TCP","54","43338  >  443 [ACK] Seq=1 Ack=1 Win=65535 Len=0"
"63","2022-01-19 21:59:37.668739","10.8.0.1","40.70.161.102","TLSv1.2","571","Client Hello"
"64","2022-01-19 21:59:37.668841","40.70.161.102","10.8.0.1","TCP","54","443  >  43338 [ACK] Seq=1 Ack=518 Win=65535 Len=0"
"65","2022-01-19 21:59:37.943034","40.70.161.102","10.8.0.1","TLSv1.2","4258","Server Hello"
"66","2022-01-19 21:59:37.994623","10.8.0.1","40.70.161.102","TCP","54","43338  >  443 [ACK] Seq=518 Ack=4205 Win=65535 Len=0"
"67","2022-01-19 21:59:38.015105","40.70.161.102","10.8.0.1","TLSv1.2","907","Certificate, Server Key Exchange, Server Hello Done"
"68","2022-01-19 21:59:38.065387","10.8.0.1","40.70.161.102","TCP","54","43338  >  443 [ACK] Seq=518 Ack=5058 Win=65535 Len=0"
"69","2022-01-19 21:59:38.065473","10.8.0.1","40.70.161.102","TLSv1.2","180","Client Key Exchange, Change Cipher Spec, Encrypted Handshake Message"
"70","2022-01-19 21:59:38.065678","40.70.161.102","10.8.0.1","TCP","54","443  >  43338 [ACK] Seq=5058 Ack=644 Win=65535 Len=0"
"71","2022-01-19 21:59:38.174288","40.70.161.102","10.8.0.1","TLSv1.2","312","New Session Ticket, Change Cipher Spec, Encrypted Handshake Message"
"72","2022-01-19 21:59:38.225668","10.8.0.1","40.70.161.102","TCP","54","43338  >  443 [ACK] Seq=644 Ack=5316 Win=65535 Len=0"
"73","2022-01-19 21:59:38.225788","10.8.0.1","40.70.161.102","TCP","590","43338  >  443 [ACK] Seq=644 Ack=5316 Win=65535 Len=536 [TCP segment of a reassembled PDU]"
"74","2022-01-19 21:59:38.225944","40.70.161.102","10.8.0.1","TCP","54","443  >  43338 [ACK] Seq=5316 Ack=1180 Win=65535 Len=0"
"75","2022-01-19 21:59:38.225968","10.8.0.1","40.70.161.102","TLSv1.2","377","Application Data"
"76","2022-01-19 21:59:38.226017","40.70.161.102","10.8.0.1","TCP","54","443  >  43338 [ACK] Seq=5316 Ack=1503 Win=65535 Len=0"
"77","2022-01-19 21:59:38.372497","40.70.161.102","10.8.0.1","TLSv1.2","371","Application Data"
"78","2022-01-19 21:59:38.423719","10.8.0.1","40.70.161.102","TCP","54","43338  >  443 [ACK] Seq=1503 Ack=5633 Win=65535 Len=0"
"79","2022-01-19 21:59:40.060458","10.8.0.1","159.203.158.197","NTP","90","NTP Version 3, client"
"80","2022-01-19 21:59:40.172830","159.203.158.197","10.8.0.1","NTP","90","NTP Version 3, server"
"81","2022-01-19 21:59:41.529606","10.8.0.1","gh-in-f188.1e100.net","TCP","74","54896  >  5228 [SYN] Seq=0 Win=65535 Len=0 MSS=1460 SACK_PERM=1 TSval=1666752653 TSecr=0 WS=1024"
"82","2022-01-19 21:59:41.534062","gh-in-f188.1e100.net","10.8.0.1","TCP","54","5228  >  54896 [SYN, ACK] Seq=0 Ack=1 Win=65535 Len=0"
"83","2022-01-19 21:59:41.534123","10.8.0.1","gh-in-f188.1e100.net","TCP","54","54896  >  5228 [ACK] Seq=1 Ack=1 Win=65535 Len=0"
"84","2022-01-19 21:59:41.535642","10.8.0.1","gh-in-f188.1e100.net","TLSv1.3","587","Client Hello"
"85","2022-01-19 21:59:41.535710","gh-in-f188.1e100.net","10.8.0.1","TCP","54","5228  >  54896 [ACK] Seq=1 Ack=534 Win=65535 Len=0"
"86","2022-01-19 21:59:41.776590","gh-in-f188.1e100.net","10.8.0.1","TLSv1.3","257","Server Hello, Change Cipher Spec, Application Data"
"87","2022-01-19 21:59:41.827855","10.8.0.1","gh-in-f188.1e100.net","TCP","54","54896  >  5228 [ACK] Seq=534 Ack=204 Win=65535 Len=0"
"88","2022-01-19 21:59:41.827956","10.8.0.1","gh-in-f188.1e100.net","TLSv1.3","118","Change Cipher Spec, Application Data"
"89","2022-01-19 21:59:41.828219","gh-in-f188.1e100.net","10.8.0.1","TCP","54","5228  >  54896 [ACK] Seq=204 Ack=598 Win=65535 Len=0"
"90","2022-01-19 21:59:41.828253","10.8.0.1","gh-in-f188.1e100.net","TLSv1.3","385","Application Data"
"91","2022-01-19 21:59:41.828380","gh-in-f188.1e100.net","10.8.0.1","TCP","54","5228  >  54896 [ACK] Seq=204 Ack=929 Win=65535 Len=0"
"92","2022-01-19 21:59:41.975432","gh-in-f188.1e100.net","10.8.0.1","TLSv1.3","667","Application Data, Application Data, Application Data"
"93","2022-01-19 21:59:42.026596","10.8.0.1","gh-in-f188.1e100.net","TCP","54","54896  >  5228 [ACK] Seq=929 Ack=817 Win=65535 Len=0"
"94","2022-01-19 21:59:42.026843","gh-in-f188.1e100.net","10.8.0.1","TLSv1.3","88","Application Data"
"95","2022-01-19 21:59:42.026872","10.8.0.1","ord38s18-in-f14.1e100.net","TCP","74","54976  >  443 [SYN] Seq=0 Win=65535 Len=0 MSS=1460 SACK_PERM=1 TSval=3598990777 TSecr=0 WS=1024"
"96","2022-01-19 21:59:42.032548","ord38s18-in-f14.1e100.net","10.8.0.1","TCP","54","443  >  54976 [SYN, ACK] Seq=0 Ack=1 Win=65535 Len=0"
"97","2022-01-19 21:59:42.032618","10.8.0.1","gh-in-f188.1e100.net","TCP","54","54896  >  5228 [ACK] Seq=929 Ack=851 Win=65535 Len=0"
"98","2022-01-19 21:59:42.032642","10.8.0.1","ord38s18-in-f14.1e100.net","TCP","54","54976  >  443 [ACK] Seq=1 Ack=1 Win=65535 Len=0"
"99","2022-01-19 21:59:42.036673","10.8.0.1","ord38s18-in-f14.1e100.net","TCP","590","54976  >  443 [ACK] Seq=1 Ack=1 Win=65535 Len=536 [TCP segment of a reassembled PDU]"
"100","2022-01-19 21:59:42.036838","ord38s18-in-f14.1e100.net","10.8.0.1","TCP","54","443  >  54976 [ACK] Seq=1 Ack=537 Win=65535 Len=0"
"101","2022-01-19 21:59:42.036869","10.8.0.1","ord38s18-in-f14.1e100.net","TLSv1.3","63","Client Hello"
"102","2022-01-19 21:59:42.036919","ord38s18-in-f14.1e100.net","10.8.0.1","TCP","54","443  >  54976 [ACK] Seq=1 Ack=546 Win=65535 Len=0"
"103","2022-01-19 21:59:42.187365","ord38s18-in-f14.1e100.net","10.8.0.1","TLSv1.3","257","Server Hello, Change Cipher Spec, Application Data"
"104","2022-01-19 21:59:42.238792","10.8.0.1","ord38s18-in-f14.1e100.net","TCP","54","54976  >  443 [ACK] Seq=546 Ack=204 Win=65535 Len=0"
"105","2022-01-19 21:59:42.238885","10.8.0.1","ord38s18-in-f14.1e100.net","TLSv1.3","118","Change Cipher Spec, Application Data"
"106","2022-01-19 21:59:42.239074","ord38s18-in-f14.1e100.net","10.8.0.1","TCP","54","443  >  54976 [ACK] Seq=204 Ack=610 Win=65535 Len=0"
"107","2022-01-19 21:59:42.239107","10.8.0.1","ord38s18-in-f14.1e100.net","TCP","590","54976  >  443 [ACK] Seq=610 Ack=204 Win=65535 Len=536 [TCP segment of a reassembled PDU]"
"108","2022-01-19 21:59:42.239167","ord38s18-in-f14.1e100.net","10.8.0.1","TCP","54","443  >  54976 [ACK] Seq=204 Ack=1146 Win=65535 Len=0"
"109","2022-01-19 21:59:42.239201","10.8.0.1","ord38s18-in-f14.1e100.net","TLSv1.3","70","Application Data"
"110","2022-01-19 21:59:42.239240","ord38s18-in-f14.1e100.net","10.8.0.1","TCP","54","443  >  54976 [ACK] Seq=204 Ack=1162 Win=65535 Len=0"
"111","2022-01-19 21:59:42.373856","ord38s18-in-f14.1e100.net","10.8.0.1","TLSv1.3","1164","Application Data, Application Data"
"112","2022-01-19 21:59:42.426085","10.8.0.1","ord38s18-in-f14.1e100.net","TCP","54","54976  >  443 [ACK] Seq=1162 Ack=1314 Win=65535 Len=0"
"113","2022-01-19 21:59:42.454463","ord38s18-in-f14.1e100.net","10.8.0.1","TLSv1.3","167","Application Data, Application Data"
"114","2022-01-19 21:59:42.505827","10.8.0.1","ord38s18-in-f14.1e100.net","TCP","54","54976  >  443 [ACK] Seq=1162 Ack=1427 Win=65535 Len=0"
"115","2022-01-19 21:59:42.505931","10.8.0.1","ord38s18-in-f14.1e100.net","TCP","590","54976  >  443 [ACK] Seq=1162 Ack=1427 Win=65535 Len=536 [TCP segment of a reassembled PDU]"
"116","2022-01-19 21:59:42.506099","ord38s18-in-f14.1e100.net","10.8.0.1","TCP","54","443  >  54976 [ACK] Seq=1427 Ack=1698 Win=65535 Len=0"
"117","2022-01-19 21:59:42.506128","10.8.0.1","ord38s18-in-f14.1e100.net","TLSv1.3","56","Application Data"
"118","2022-01-19 21:59:42.506177","ord38s18-in-f14.1e100.net","10.8.0.1","TCP","54","443  >  54976 [ACK] Seq=1427 Ack=1700 Win=65535 Len=0"
"119","2022-01-19 21:59:42.612737","ord38s18-in-f14.1e100.net","10.8.0.1","TLSv1.3","630","Application Data"
"120","2022-01-19 21:59:42.663993","10.8.0.1","ord38s18-in-f14.1e100.net","TCP","54","54976  >  443 [ACK] Seq=1700 Ack=2003 Win=65535 Len=0"
"121","2022-01-19 21:59:42.694280","ord38s18-in-f14.1e100.net","10.8.0.1","TLSv1.3","160","Application Data, Application Data"
"122","2022-01-19 21:59:42.745625","10.8.0.1","ord38s18-in-f14.1e100.net","TCP","54","54976  >  443 [ACK] Seq=1700 Ack=2109 Win=65535 Len=0"
"123","2022-01-19 21:59:42.745696","10.8.0.1","20.189.173.3","TCP","74","51406  >  443 [SYN] Seq=0 Win=65535 Len=0 MSS=1460 SACK_PERM=1 TSval=1830924853 TSecr=0 WS=1024"
"124","2022-01-19 21:59:42.754271","20.189.173.3","10.8.0.1","TCP","54","443  >  51406 [SYN, ACK] Seq=0 Ack=1 Win=65535 Len=0"
"125","2022-01-19 21:59:42.754335","10.8.0.1","ord38s18-in-f14.1e100.net","TLSv1.3","585","Application Data"
"126","2022-01-19 21:59:42.754405","ord38s18-in-f14.1e100.net","10.8.0.1","TCP","54","443  >  54976 [ACK] Seq=2109 Ack=2231 Win=65535 Len=0"
"127","2022-01-19 21:59:42.754428","10.8.0.1","20.189.173.3","TCP","54","51406  >  443 [ACK] Seq=1 Ack=1 Win=65535 Len=0"
"128","2022-01-19 21:59:42.758863","10.8.0.1","20.189.173.3","TLSv1.2","571","Client Hello"
"129","2022-01-19 21:59:42.759030","20.189.173.3","10.8.0.1","TCP","54","443  >  51406 [ACK] Seq=1 Ack=518 Win=65535 Len=0"
"130","2022-01-19 21:59:42.777467","10.8.0.1","ord37s19-in-f3.1e100.net","TCP","74","60168  >  443 [SYN] Seq=0 Win=65535 Len=0 MSS=1460 SACK_PERM=1 TSval=3301258531 TSecr=0 WS=1024"
"131","2022-01-19 21:59:42.784929","ord37s19-in-f3.1e100.net","10.8.0.1","TCP","54","443  >  60168 [SYN, ACK] Seq=0 Ack=1 Win=65535 Len=0"
"132","2022-01-19 21:59:42.784993","10.8.0.1","ord37s19-in-f3.1e100.net","TCP","54","60168  >  443 [ACK] Seq=1 Ack=1 Win=65535 Len=0"
"133","2022-01-19 21:59:42.788015","10.8.0.1","ord37s19-in-f3.1e100.net","TLSv1.3","571","Client Hello"
"134","2022-01-19 21:59:42.788186","ord37s19-in-f3.1e100.net","10.8.0.1","TCP","54","443  >  60168 [ACK] Seq=1 Ack=518 Win=65535 Len=0"
"135","2022-01-19 21:59:42.854106","ord38s18-in-f14.1e100.net","10.8.0.1","TLSv1.3","630","Application Data"
"136","2022-01-19 21:59:42.943471","10.8.0.1","ord38s18-in-f14.1e100.net","TCP","54","54976  >  443 [ACK] Seq=2231 Ack=2685 Win=65535 Len=0"
"137","2022-01-19 21:59:42.943835","ord37s19-in-f3.1e100.net","10.8.0.1","TLSv1.3","1472","Server Hello, Change Cipher Spec"
"138","2022-01-19 21:59:42.944025","ord38s18-in-f14.1e100.net","10.8.0.1","TLSv1.3","352","Application Data, Application Data"
"139","2022-01-19 21:59:42.944050","10.8.0.1","ord37s19-in-f3.1e100.net","TCP","54","60168  >  443 [ACK] Seq=518 Ack=1419 Win=65535 Len=0"
"140","2022-01-19 21:59:42.944075","10.8.0.1","ord38s18-in-f14.1e100.net","TCP","54","54976  >  443 [ACK] Seq=2231 Ack=2983 Win=65535 Len=0"
"141","2022-01-19 21:59:42.953366","10.8.0.1","ord38s18-in-f14.1e100.net","TLSv1.3","582","Application Data"
"142","2022-01-19 21:59:42.953581","ord38s18-in-f14.1e100.net","10.8.0.1","TCP","54","443  >  54976 [ACK] Seq=2983 Ack=2759 Win=65535 Len=0"
"143","2022-01-19 21:59:42.953616","10.8.0.1","ord37s19-in-f3.1e100.net","TCP","74","60172  >  443 [SYN] Seq=0 Win=65535 Len=0 MSS=1460 SACK_PERM=1 TSval=3301258707 TSecr=0 WS=1024"
"144","2022-01-19 21:59:42.959386","ord37s19-in-f3.1e100.net","10.8.0.1","TCP","54","443  >  60172 [SYN, ACK] Seq=0 Ack=1 Win=65535 Len=0"
"145","2022-01-19 21:59:42.959522","10.8.0.1","ord37s19-in-f3.1e100.net","TCP","54","60172  >  443 [ACK] Seq=1 Ack=1 Win=65535 Len=0"
"146","2022-01-19 21:59:42.960425","ord37s19-in-f3.1e100.net","10.8.0.1","TCP","1432","443  >  60168 [PSH, ACK] Seq=1419 Ack=518 Win=65535 Len=1378 [TCP segment of a reassembled PDU]"
"147","2022-01-19 21:59:43.012195","10.8.0.1","ord37s19-in-f3.1e100.net","TCP","54","60168  >  443 [ACK] Seq=518 Ack=2797 Win=65535 Len=0"
"148","2022-01-19 21:59:43.012600","20.189.173.3","10.8.0.1","TCP","5648","443  >  51406 [PSH, ACK] Seq=1 Ack=518 Win=65535 Len=5594 [TCP segment of a reassembled PDU]"
"149","2022-01-19 21:59:43.012784","ord37s19-in-f3.1e100.net","10.8.0.1","TLSv1.3","1582","Application Data"
"150","2022-01-19 21:59:43.012839","10.8.0.1","ord37s19-in-f3.1e100.net","TCP","590","60172  >  443 [ACK] Seq=1 Ack=1 Win=65535 Len=536 [TCP segment of a reassembled PDU]"
"151","2022-01-19 21:59:43.012902","ord37s19-in-f3.1e100.net","10.8.0.1","TCP","54","443  >  60172 [ACK] Seq=1 Ack=537 Win=65535 Len=0"
"152","2022-01-19 21:59:43.012926","10.8.0.1","ord37s19-in-f3.1e100.net","TLSv1.3","97","Client Hello"
"153","2022-01-19 21:59:43.012970","ord37s19-in-f3.1e100.net","10.8.0.1","TCP","54","443  >  60172 [ACK] Seq=1 Ack=580 Win=65535 Len=0"
"154","2022-01-19 21:59:43.012988","10.8.0.1","20.189.173.3","TCP","54","51406  >  443 [ACK] Seq=518 Ack=5595 Win=65535 Len=0"
"155","2022-01-19 21:59:43.013100","10.8.0.1","ord37s19-in-f3.1e100.net","TCP","54","60168  >  443 [ACK] Seq=518 Ack=4325 Win=65535 Len=0"
"156","2022-01-19 21:59:43.025875","10.8.0.1","ord37s19-in-f3.1e100.net","TLSv1.3","118","Change Cipher Spec, Application Data"
"157","2022-01-19 21:59:43.026009","ord37s19-in-f3.1e100.net","10.8.0.1","TCP","54","443  >  60168 [ACK] Seq=4325 Ack=582 Win=65535 Len=0"
"158","2022-01-19 21:59:43.026037","10.8.0.1","ord37s19-in-f3.1e100.net","TLSv1.3","146","Application Data"
"159","2022-01-19 21:59:43.026085","ord37s19-in-f3.1e100.net","10.8.0.1","TCP","54","443  >  60168 [ACK] Seq=4325 Ack=674 Win=65535 Len=0"
"160","2022-01-19 21:59:43.026204","10.8.0.1","ord37s19-in-f3.1e100.net","TLSv1.3","327","Application Data"
"161","2022-01-19 21:59:43.026255","ord37s19-in-f3.1e100.net","10.8.0.1","TCP","54","443  >  60168 [ACK] Seq=4325 Ack=947 Win=65535 Len=0"
"162","2022-01-19 21:59:43.077790","ord38s18-in-f14.1e100.net","10.8.0.1","TLSv1.3","630","Application Data"
"163","2022-01-19 21:59:43.128975","10.8.0.1","ord38s18-in-f14.1e100.net","TCP","54","54976  >  443 [ACK] Seq=2759 Ack=3559 Win=65535 Len=0"
"164","2022-01-19 21:59:43.129222","20.189.173.3","10.8.0.1","TLSv1.2","668","Server Hello, Certificate, Certificate Status, Server Key Exchange, Server Hello Done"
"165","2022-01-19 21:59:43.129378","ord37s19-in-f3.1e100.net","10.8.0.1","TLSv1.3","662","Application Data, Application Data"
"166","2022-01-19 21:59:43.129470","ord37s19-in-f3.1e100.net","10.8.0.1","TLSv1.3","272","Server Hello, Change Cipher Spec, Application Data"
"167","2022-01-19 21:59:43.129601","ord38s18-in-f14.1e100.net","10.8.0.1","TLSv1.3","312","Application Data, Application Data"
"168","2022-01-19 21:59:43.129626","10.8.0.1","20.189.173.3","TCP","54","51406  >  443 [ACK] Seq=518 Ack=6209 Win=65535 Len=0"
"169","2022-01-19 21:59:43.129648","10.8.0.1","ord37s19-in-f3.1e100.net","TCP","54","60168  >  443 [ACK] Seq=947 Ack=4933 Win=65535 Len=0"
"170","2022-01-19 21:59:43.129666","10.8.0.1","ord37s19-in-f3.1e100.net","TCP","54","60172  >  443 [ACK] Seq=580 Ack=219 Win=65535 Len=0"
"171","2022-01-19 21:59:43.129683","10.8.0.1","ord38s18-in-f14.1e100.net","TCP","54","54976  >  443 [ACK] Seq=2759 Ack=3817 Win=65535 Len=0"
"172","2022-01-19 21:59:43.130513","10.8.0.1","ord37s19-in-f3.1e100.net","TLSv1.3","85","Application Data"
"173","2022-01-19 21:59:43.130638","ord37s19-in-f3.1e100.net","10.8.0.1","TCP","54","443  >  60168 [ACK] Seq=4933 Ack=978 Win=65535 Len=0"
"174","2022-01-19 21:59:43.182046","ord37s19-in-f3.1e100.net","10.8.0.1","TLSv1.3","85","Application Data"
"175","2022-01-19 21:59:43.182124","10.8.0.1","ord37s19-in-f3.1e100.net","TLSv1.3","118","Change Cipher Spec, Application Data"
"176","2022-01-19 21:59:43.182231","ord37s19-in-f3.1e100.net","10.8.0.1","TCP","54","443  >  60172 [ACK] Seq=219 Ack=644 Win=65535 Len=0"
"177","2022-01-19 21:59:43.182261","10.8.0.1","ord38s18-in-f14.1e100.net","TCP","590","54976  >  443 [ACK] Seq=2759 Ack=3817 Win=65535 Len=536 [TCP segment of a reassembled PDU]"
"178","2022-01-19 21:59:43.182329","ord38s18-in-f14.1e100.net","10.8.0.1","TCP","54","443  >  54976 [ACK] Seq=3817 Ack=3295 Win=65535 Len=0"
"179","2022-01-19 21:59:43.182475","10.8.0.1","ord38s18-in-f14.1e100.net","TLSv1.3","60","Application Data"
"180","2022-01-19 21:59:43.182525","ord38s18-in-f14.1e100.net","10.8.0.1","TCP","54","443  >  54976 [ACK] Seq=3817 Ack=3301 Win=65535 Len=0"
"181","2022-01-19 21:59:43.182549","10.8.0.1","20.189.173.3","TLSv1.2","212","Client Key Exchange, Change Cipher Spec, Encrypted Handshake Message"
"182","2022-01-19 21:59:43.182600","20.189.173.3","10.8.0.1","TCP","54","443  >  51406 [ACK] Seq=6209 Ack=676 Win=65535 Len=0"
"183","2022-01-19 21:59:43.182674","10.8.0.1","ord37s19-in-f3.1e100.net","TCP","54","60168  >  443 [ACK] Seq=978 Ack=4964 Win=65535 Len=0"
"184","2022-01-19 21:59:43.182733","10.8.0.1","ord37s19-in-f3.1e100.net","TLSv1.3","308","Application Data"
"185","2022-01-19 21:59:43.182776","ord37s19-in-f3.1e100.net","10.8.0.1","TCP","54","443  >  60172 [ACK] Seq=219 Ack=898 Win=65535 Len=0"
"186","2022-01-19 21:59:43.251400","ord37s19-in-f3.1e100.net","10.8.0.1","TLSv1.3","454","Application Data, Application Data, Application Data"
"187","2022-01-19 21:59:43.302980","10.8.0.1","ord37s19-in-f3.1e100.net","TCP","54","60168  >  443 [ACK] Seq=978 Ack=5364 Win=65535 Len=0"
"188","2022-01-19 21:59:43.303229","ord38s18-in-f14.1e100.net","10.8.0.1","TLSv1.3","630","Application Data"
"189","2022-01-19 21:59:43.303372","20.189.173.3","10.8.0.1","TLSv1.2","105","Change Cipher Spec, Encrypted Handshake Message"
"190","2022-01-19 21:59:43.303404","10.8.0.1","ord37s19-in-f3.1e100.net","QUIC","1292","Initial, DCID=6a51d6a14fbd8da0, PKN: 1, PADDING, PING, PADDING, CRYPTO, PING, PADDING, CRYPTO, PING, CRYPTO, PADDING, PING, CRYPTO, CRYPTO"
"191","2022-01-19 21:59:43.369428","ord37s19-in-f3.1e100.net","10.8.0.1","QUIC","1292","Initial, SCID=6a51d6a14fbd8da0, PKN: 1, ACK, CRYPTO, PADDING"
"192","2022-01-19 21:59:43.369495","10.8.0.1","ord37s19-in-f3.1e100.net","TLSv1.3","93","Application Data"
"193","2022-01-19 21:59:43.369595","ord37s19-in-f3.1e100.net","10.8.0.1","TCP","54","443  >  60168 [ACK] Seq=5364 Ack=1017 Win=65535 Len=0"
"194","2022-01-19 21:59:43.369623","10.8.0.1","ord37s19-in-f3.1e100.net","TLSv1.3","89","Application Data"
"195","2022-01-19 21:59:43.369668","ord37s19-in-f3.1e100.net","10.8.0.1","TCP","54","443  >  60168 [ACK] Seq=5364 Ack=1052 Win=65535 Len=0"
"196","2022-01-19 21:59:43.369815","10.8.0.1","20.189.173.3","TCP","54","51406  >  443 [ACK] Seq=676 Ack=6260 Win=65535 Len=0"
"197","2022-01-19 21:59:43.369842","10.8.0.1","ord38s18-in-f14.1e100.net","TCP","54","54976  >  443 [ACK] Seq=3301 Ack=4393 Win=65535 Len=0"
"198","2022-01-19 21:59:43.369925","ord38s18-in-f14.1e100.net","10.8.0.1","TLSv1.3","357","Application Data, Application Data"
"199","2022-01-19 21:59:43.369951","10.8.0.1","20.189.173.3","TCP","590","51406  >  443 [ACK] Seq=676 Ack=6260 Win=65535 Len=536 [TCP segment of a reassembled PDU]"
"200","2022-01-19 21:59:43.370000","20.189.173.3","10.8.0.1","TCP","54","443  >  51406 [ACK] Seq=6260 Ack=1212 Win=65535 Len=0"
"201","2022-01-19 21:59:43.370020","10.8.0.1","20.189.173.3","TCP","590","51406  >  443 [PSH, ACK] Seq=1212 Ack=6260 Win=65535 Len=536 [TCP segment of a reassembled PDU]"
"202","2022-01-19 21:59:43.370059","20.189.173.3","10.8.0.1","TCP","54","443  >  51406 [ACK] Seq=6260 Ack=1748 Win=65535 Len=0"
"203","2022-01-19 21:59:43.370077","10.8.0.1","20.189.173.3","TCP","590","51406  >  443 [ACK] Seq=1748 Ack=6260 Win=65535 Len=536 [TCP segment of a reassembled PDU]"
"204","2022-01-19 21:59:43.370112","20.189.173.3","10.8.0.1","TCP","54","443  >  51406 [ACK] Seq=6260 Ack=2284 Win=65535 Len=0"
"205","2022-01-19 21:59:43.370135","10.8.0.1","20.189.173.3","TLSv1.2","120","Application Data"
"206","2022-01-19 21:59:43.370169","20.189.173.3","10.8.0.1","TCP","54","443  >  51406 [ACK] Seq=6260 Ack=2350 Win=65535 Len=0"
"207","2022-01-19 21:59:43.421526","10.8.0.1","ord38s18-in-f14.1e100.net","TCP","54","54976  >  443 [ACK] Seq=3301 Ack=4696 Win=65535 Len=0"
"208","2022-01-19 21:59:43.421889","ord37s19-in-f3.1e100.net","10.8.0.1","TLSv1.3","890","Application Data, Application Data"
"209","2022-01-19 21:59:43.421927","10.8.0.1","ord37s19-in-f3.1e100.net","QUIC","1292","Initial, DCID=6a51d6a14fbd8da0, PKN: 2, ACK, PADDING"
"210","2022-01-19 21:59:44.459622","10.8.0.1","ord38s18-in-f14.1e100.net","TCP","590","54976  >  443 [ACK] Seq=3301 Ack=4696 Win=65535 Len=536 [TCP segment of a reassembled PDU]"
"211","2022-01-19 21:59:44.460006","ord38s18-in-f14.1e100.net","10.8.0.1","TCP","54","443  >  54976 [ACK] Seq=4696 Ack=3837 Win=65535 Len=0"
"212","2022-01-19 21:59:44.460201","20.189.173.3","10.8.0.1","TLSv1.2","506","Application Data"
"213","2022-01-19 21:59:44.460239","10.8.0.1","ord38s18-in-f14.1e100.net","TLSv1.3","61","Application Data"
"214","2022-01-19 21:59:44.460294","ord38s18-in-f14.1e100.net","10.8.0.1","TCP","54","443  >  54976 [ACK] Seq=4696 Ack=3844 Win=65535 Len=0"
"215","2022-01-19 21:59:44.460318","10.8.0.1","ord37s19-in-f3.1e100.net","TCP","54","60172  >  443 [ACK] Seq=898 Ack=1055 Win=65535 Len=0"
"216","2022-01-19 21:59:44.460520","10.8.0.1","ord37s19-in-f3.1e100.net","TLSv1.3","143","Application Data"
"217","2022-01-19 21:59:44.460641","ord37s19-in-f3.1e100.net","10.8.0.1","TCP","54","443  >  60168 [ACK] Seq=5364 Ack=1141 Win=65535 Len=0"
"218","2022-01-19 21:59:44.460670","10.8.0.1","ord37s19-in-f3.1e100.net","TCP","590","60168  >  443 [ACK] Seq=1141 Ack=5364 Win=65535 Len=536 [TCP segment of a reassembled PDU]"
"219","2022-01-19 21:59:44.460740","ord37s19-in-f3.1e100.net","10.8.0.1","TCP","54","443  >  60168 [ACK] Seq=5364 Ack=1677 Win=65535 Len=0"
"220","2022-01-19 21:59:44.460771","10.8.0.1","ord37s19-in-f3.1e100.net","TCP","590","60168  >  443 [PSH, ACK] Seq=1677 Ack=5364 Win=65535 Len=536 [TCP segment of a reassembled PDU]"
"221","2022-01-19 21:59:44.460814","ord37s19-in-f3.1e100.net","10.8.0.1","TCP","54","443  >  60168 [ACK] Seq=5364 Ack=2213 Win=65535 Len=0"
"222","2022-01-19 21:59:44.460834","10.8.0.1","ord37s19-in-f3.1e100.net","TCP","590","60168  >  443 [ACK] Seq=2213 Ack=5364 Win=65535 Len=536 [TCP segment of a reassembled PDU]"
"223","2022-01-19 21:59:44.460922","ord37s19-in-f3.1e100.net","10.8.0.1","TCP","54","443  >  60168 [ACK] Seq=5364 Ack=2749 Win=65535 Len=0"
"224","2022-01-19 21:59:44.460949","10.8.0.1","ord37s19-in-f3.1e100.net","TLSv1.3","318","Application Data"
"225","2022-01-19 21:59:44.460988","ord37s19-in-f3.1e100.net","10.8.0.1","TCP","54","443  >  60168 [ACK] Seq=5364 Ack=3013 Win=65535 Len=0"
"226","2022-01-19 21:59:44.461007","10.8.0.1","ord37s19-in-f3.1e100.net","QUIC","83","Handshake, DCID=6a51d6a14fbd8da0"
"227","2022-01-19 21:59:44.537781","ord37s19-in-f3.1e100.net","10.8.0.1","QUIC","136","Initial, SCID=6a51d6a14fbd8da0, PKN: 6, CC"
"228","2022-01-19 21:59:44.538066","10.8.0.1","ord38s18-in-f14.1e100.net","TCP","590","[TCP Spurious Retransmission] 54976  >  443 [ACK] Seq=3301 Ack=4696 Win=65535 Len=536"
"229","2022-01-19 21:59:44.538160","ord38s18-in-f14.1e100.net","10.8.0.1","TCP","54","443  >  54976 [ACK] Seq=4696 Ack=3837 Win=65535 Len=0"
"230","2022-01-19 21:59:44.538189","10.8.0.1","ord37s19-in-f3.1e100.net","TCP","143","[TCP Spurious Retransmission] 60168  >  443 [PSH, ACK] Seq=1052 Ack=5364 Win=65535 Len=89"
"231","2022-01-19 21:59:44.538235","ord37s19-in-f3.1e100.net","10.8.0.1","TCP","54","443  >  60168 [ACK] Seq=5364 Ack=1141 Win=65535 Len=0"
"232","2022-01-19 21:59:44.538257","10.8.0.1","ord37s19-in-f3.1e100.net","QUIC","83","Handshake, DCID=6a51d6a14fbd8da0"
"233","2022-01-19 21:59:44.616228","ord37s19-in-f3.1e100.net","10.8.0.1","QUIC","136","Initial, SCID=6a51d6a14fbd8da0, PKN: 6, CC"
"234","2022-01-19 21:59:44.616468","10.8.0.1","ord38s18-in-f14.1e100.net","TCP","590","[TCP Spurious Retransmission] 54976  >  443 [ACK] Seq=3301 Ack=4696 Win=65535 Len=536"
"235","2022-01-19 21:59:44.616562","ord38s18-in-f14.1e100.net","10.8.0.1","TCP","54","[TCP Dup ACK 229#1] 443  >  54976 [ACK] Seq=4696 Ack=3837 Win=65535 Len=0"
"236","2022-01-19 21:59:44.616693","ord38s18-in-f14.1e100.net","10.8.0.1","TLSv1.3","630","Application Data"
"237","2022-01-19 21:59:44.616727","10.8.0.1","ord37s19-in-f3.1e100.net","TCP","143","[TCP Spurious Retransmission] 60168  >  443 [PSH, ACK] Seq=1052 Ack=5364 Win=65535 Len=89"
"238","2022-01-19 21:59:44.616782","ord37s19-in-f3.1e100.net","10.8.0.1","TCP","54","[TCP Dup ACK 231#1] 443  >  60168 [ACK] Seq=5364 Ack=1141 Win=65535 Len=0"
"239","2022-01-19 21:59:44.616804","10.8.0.1","ord37s19-in-f3.1e100.net","QUIC","83","Handshake, DCID=6a51d6a14fbd8da0"
"240","2022-01-19 21:59:45.644480","10.8.0.1","ord38s18-in-f14.1e100.net","TCP","61","[TCP Retransmission] 54976  >  443 [PSH, ACK] Seq=3837 Ack=4696 Win=65535 Len=7"
"241","2022-01-19 21:59:45.644756","ord38s18-in-f14.1e100.net","10.8.0.1","TCP","54","443  >  54976 [ACK] Seq=4696 Ack=3844 Win=65535 Len=0"
"242","2022-01-19 21:59:45.644967","ord37s19-in-f3.1e100.net","10.8.0.1","TLSv1.3","946","Application Data, Application Data, Application Data, Application Data"
"243","2022-01-19 21:59:45.645056","ord38s18-in-f14.1e100.net","10.8.0.1","TCP","202","[TCP Retransmission] 443  >  54976 [PSH, ACK] Seq=4696 Ack=3844 Win=65535 Len=148"
"244","2022-01-19 21:59:45.645088","10.8.0.1","20.189.173.3","TCP","54","51406  >  443 [ACK] Seq=2350 Ack=6712 Win=65535 Len=0"
"245","2022-01-19 21:59:45.645191","10.8.0.1","ord37s19-in-f3.1e100.net","TCP","590","[TCP Retransmission] 60168  >  443 [ACK] Seq=1141 Ack=5364 Win=65535 Len=536"
"246","2022-01-19 21:59:45.645246","ord37s19-in-f3.1e100.net","10.8.0.1","TCP","54","443  >  60168 [ACK] Seq=5364 Ack=1677 Win=65535 Len=0"
"247","2022-01-19 21:59:45.645313","ord37s19-in-f3.1e100.net","10.8.0.1","TCP","54","[TCP Out-Of-Order] 443  >  60168 [FIN, ACK] Seq=5364 Ack=1677 Win=65535 Len=0"
"248","2022-01-19 21:59:45.645410","10.8.0.1","ord37s19-in-f3.1e100.net","TCP","590","[TCP Retransmission] 60168  >  443 [PSH, ACK] Seq=1677 Ack=5364 Win=65535 Len=536"
"249","2022-01-19 21:59:45.645433","10.8.0.1","ord37s19-in-f3.1e100.net","TCP","590","[TCP Retransmission] 60168  >  443 [ACK] Seq=2213 Ack=5364 Win=65535 Len=536"
"250","2022-01-19 21:59:45.645449","10.8.0.1","ord37s19-in-f3.1e100.net","TCP","318","[TCP Retransmission] 60168  >  443 [PSH, ACK] Seq=2749 Ack=5364 Win=65535 Len=264"
"251","2022-01-19 21:59:45.645465","10.8.0.1","ord38s18-in-f14.1e100.net","TCP","54","54976  >  443 [ACK] Seq=3844 Ack=5272 Win=65535 Len=0"
"252","2022-01-19 21:59:45.645485","10.8.0.1","ord37s19-in-f3.1e100.net","QUIC","83","Handshake, DCID=6a51d6a14fbd8da0"
"253","2022-01-19 21:59:45.737195","ord37s19-in-f3.1e100.net","10.8.0.1","QUIC","136","Initial, SCID=6a51d6a14fbd8da0, PKN: 6, CC"
"254","2022-01-19 21:59:45.737299","10.8.0.1","ord38s18-in-f14.1e100.net","TCP","54","[TCP Dup ACK 251#1] 54976  >  443 [ACK] Seq=3844 Ack=5272 Win=65535 Len=0"
"255","2022-01-19 21:59:45.737471","ord38s18-in-f14.1e100.net","10.8.0.1","TLSv1.3","78","Application Data"
"256","2022-01-19 21:59:45.737500","10.8.0.1","ord38s18-in-f14.1e100.net","TCP","54","[TCP Dup ACK 251#2] 54976  >  443 [ACK] Seq=3844 Ack=5272 Win=65535 Len=0"
"257","2022-01-19 21:59:45.737705","ord38s18-in-f14.1e100.net","10.8.0.1","TCP","54","[TCP Fast Retransmission] 443  >  54976 [FIN, ACK] Seq=5272 Ack=3844 Win=65535 Len=0"
"258","2022-01-19 21:59:45.737844","10.8.0.1","ord37s19-in-f3.1e100.net","TCP","54","60168  >  443 [ACK] Seq=3013 Ack=6256 Win=65535 Len=0"
"259","2022-01-19 21:59:45.737871","10.8.0.1","ord37s19-in-f3.1e100.net","TLSv1.3","93","Application Data"
"260","2022-01-19 21:59:45.737888","10.8.0.1","ord37s19-in-f3.1e100.net","TLSv1.3","123","Application Data"
"261","2022-01-19 21:59:45.737904","10.8.0.1","ord37s19-in-f3.1e100.net","TLSv1.3","89","Application Data"
"262","2022-01-19 21:59:45.737919","10.8.0.1","ord37s19-in-f3.1e100.net","TCP","54","60168  >  443 [FIN, ACK] Seq=3156 Ack=6256 Win=65535 Len=0"
"263","2022-01-19 21:59:45.738891","ord37s19-in-f3.1e100.net","10.8.0.1","TCP","54","443  >  60168 [ACK] Seq=6256 Ack=3157 Win=65535 Len=0"
"264","2022-01-19 21:59:45.739044","ord37s19-in-f3.1e100.net","10.8.0.1","TCP","54","443  >  60168 [FIN, ACK] Seq=6256 Ack=3157 Win=65535 Len=0"
"265","2022-01-19 21:59:45.739076","10.8.0.1","ord38s18-in-f14.1e100.net","TCP","54","54976  >  443 [ACK] Seq=3844 Ack=5296 Win=65535 Len=0"
"266","2022-01-19 21:59:45.739093","10.8.0.1","ord38s18-in-f14.1e100.net","TCP","54","[TCP Dup ACK 265#1] 54976  >  443 [ACK] Seq=3844 Ack=5296 Win=65535 Len=0"
"267","2022-01-19 21:59:45.739110","10.8.0.1","ord38s18-in-f14.1e100.net","TLSv1.3","78","Application Data"
"268","2022-01-19 21:59:45.739124","10.8.0.1","ord37s19-in-f3.1e100.net","TCP","54","60168  >  443 [ACK] Seq=3157 Ack=6257 Win=65535 Len=0"
"269","2022-01-19 21:59:45.743281","10.8.0.1","ord38s18-in-f14.1e100.net","TCP","54","54976  >  443 [FIN, ACK] Seq=3868 Ack=5296 Win=65535 Len=0"
"270","2022-01-19 21:59:45.743418","ord38s18-in-f14.1e100.net","10.8.0.1","TCP","54","443  >  54976 [ACK] Seq=5296 Ack=3869 Win=65535 Len=0"
"271","2022-01-19 21:59:45.743506","ord38s18-in-f14.1e100.net","10.8.0.1","TCP","54","443  >  54976 [FIN, ACK] Seq=5296 Ack=3869 Win=65535 Len=0"
"272","2022-01-19 21:59:45.743532","10.8.0.1","ord38s18-in-f14.1e100.net","TCP","54","54976  >  443 [ACK] Seq=3869 Ack=5297 Win=65535 Len=0"
"273","2022-01-19 21:59:47.048666","10.8.0.1","ord37s19-in-f3.1e100.net","QUIC","83","Handshake, DCID=6a51d6a14fbd8da0"
"274","2022-01-19 21:59:48.077053","10.8.0.1","ord37s19-in-f3.1e100.net","QUIC","169","Handshake, DCID=6a51d6a14fbd8da0"
"275","2022-01-19 21:59:50.494666","10.8.0.1","40.70.161.102","TCP","54","43338  >  443 [RST, ACK] Seq=1503 Ack=5633 Win=65535 Len=0"
"276","2022-01-19 21:59:50.495110","10.8.0.1","20.189.173.3","TCP","54","51406  >  443 [RST, ACK] Seq=2350 Ack=6712 Win=65535 Len=0"
"277","2022-01-19 21:59:51.567346","10.8.0.1","whatsapp-chatd-msgr-mini-edge-shv-02-ort2.facebook.com","TCP","54","58188  >  5222 [RST, ACK] Seq=1291 Ack=244 Win=65535 Len=0"
"278","2022-01-19 21:59:51.567641","10.8.0.1","edge-mqtt-shv-01-ort2.facebook.com","TCP","54","42094  >  443 [RST, ACK] Seq=2486 Ack=1796 Win=65535 Len=0"
