"No.","Time","Source","Destination","Protocol","Length","Info"
"1","0.000000","10.8.0.1","10.133.134.154","TCP","74","36968  >  http-alt(8008) [SYN] Seq=0 Win=65535 Len=0 MSS=1460 SACK_PERM=1 TSval=1672004880 TSecr=0 WS=1024"
"2","0.001662","10.133.134.154","10.8.0.1","TCP","54","http-alt(8008)  >  36968 [SYN, ACK] Seq=0 Ack=1 Win=65535 Len=0"
"3","0.001688","10.8.0.1","10.133.134.154","TCP","54","36968  >  http-alt(8008) [ACK] Seq=1 Ack=1 Win=65535 Len=0"
"4","0.001859","10.8.0.1","10.133.134.154","HTTP","334","GET /ssdp/device-desc.xml HTTP/1.1 "
"5","0.001884","10.133.134.154","10.8.0.1","TCP","54","http-alt(8008)  >  36968 [ACK] Seq=1 Ack=281 Win=65535 Len=0"
"6","0.031115","10.133.27.50","ord38s17-in-f6.1e100.net","UDP","86","59971  >  https(443) Len=44"
"7","1.036804","10.133.27.50","ord37s22-in-f8.1e100.net","UDP","87","50603  >  https(443) Len=45"
"8","2.060112","10.133.27.50","ord37s28-in-f10.1e100.net","UDP","87","49027  >  https(443) Len=45"
"9","3.082362","10.133.27.50","mf-in-f102.1e100.net","UDP","90","36604  >  https(443) Len=48"
"10","4.107117","10.133.27.50","ord38s33-in-f10.1e100.net","UDP","90","43562  >  https(443) Len=48"
"11","5.131157","10.133.27.50","ord36s03-in-f12.1e100.net","UDP","88","60293  >  https(443) Len=46"
"12","6.157394","10.133.27.50","ord37s34-in-f14.1e100.net","UDP","86","47438  >  https(443) Len=44"
"13","7.180381","10.8.0.1","edge-mqtt-shv-01-msp1.facebook.com","TCP","74","48472  >  https(443) [SYN] Seq=0 Win=65535 Len=0 MSS=1460 SACK_PERM=1 TSval=541843908 TSecr=0 WS=1024"
"14","7.184681","edge-mqtt-shv-01-msp1.facebook.com","10.8.0.1","TCP","54","https(443)  >  48472 [SYN, ACK] Seq=0 Ack=1 Win=65535 Len=0"
"15","7.184737","10.8.0.1","edge-star-shv-01-msp1.facebook.com","TCP","74","38206  >  http(80) [SYN] Seq=0 Win=65535 Len=0 MSS=1460 SACK_PERM=1 TSval=1146352652 TSecr=0 WS=1024"
"16","7.187264","edge-star-shv-01-msp1.facebook.com","10.8.0.1","TCP","54","http(80)  >  38206 [SYN, ACK] Seq=0 Ack=1 Win=65535 Len=0"
"17","7.187329","10.8.0.1","edge-mqtt-shv-01-msp1.facebook.com","TCP","74","[TCP Retransmission] 48472  >  https(443) [SYN] Seq=0 Win=65535 Len=0 MSS=1460 SACK_PERM=1 TSval=541844911 TSecr=0 WS=1024"
"18","7.189677","edge-mqtt-shv-01-msp1.facebook.com","10.8.0.1","TCP","54","[TCP Retransmission] https(443)  >  48472 [SYN, ACK] Seq=0 Ack=1 Win=65535 Len=0"
"19","7.189726","10.8.0.1","edge-star-shv-01-msp1.facebook.com","TCP","74","[TCP Retransmission] 38206  >  http(80) [SYN] Seq=0 Win=65535 Len=0 MSS=1460 SACK_PERM=1 TSval=1146353654 TSecr=0 WS=1024"
"20","7.191918","edge-star-shv-01-msp1.facebook.com","10.8.0.1","TCP","54","[TCP Retransmission] http(80)  >  38206 [SYN, ACK] Seq=0 Ack=1 Win=65535 Len=0"
"21","7.191961","10.8.0.1","edge-mqtt-shv-01-msp1.facebook.com","TCP","74","[TCP Retransmission] 48472  >  https(443) [SYN] Seq=0 Win=65535 Len=0 MSS=1460 SACK_PERM=1 TSval=541846927 TSecr=0 WS=1024"
"22","7.194189","edge-mqtt-shv-01-msp1.facebook.com","10.8.0.1","TCP","54","[TCP Retransmission] https(443)  >  48472 [SYN, ACK] Seq=0 Ack=1 Win=65535 Len=0"
"23","7.194237","10.8.0.1","edge-star-shv-01-msp1.facebook.com","TCP","74","[TCP Retransmission] 38206  >  http(80) [SYN] Seq=0 Win=65535 Len=0 MSS=1460 SACK_PERM=1 TSval=1146355670 TSecr=0 WS=1024"
"24","7.196558","edge-star-shv-01-msp1.facebook.com","10.8.0.1","TCP","54","[TCP Retransmission] http(80)  >  38206 [SYN, ACK] Seq=0 Ack=1 Win=65535 Len=0"
"25","7.196604","10.8.0.1","edge-mqtt-shv-01-msp1.facebook.com","TCP","54","48472  >  https(443) [ACK] Seq=1 Ack=1 Win=67107840 Len=0"
"26","7.196624","10.8.0.1","edge-star-shv-01-msp1.facebook.com","TCP","54","38206  >  http(80) [ACK] Seq=1 Ack=1 Win=67107840 Len=0"
"27","7.196644","10.8.0.1","edge-star-shv-01-msp1.facebook.com","HTTP","320","GET /mobile/status.php HTTP/1.1 "
"28","7.196699","edge-star-shv-01-msp1.facebook.com","10.8.0.1","TCP","54","http(80)  >  38206 [ACK] Seq=1 Ack=267 Win=65535 Len=0"
"29","7.196716","10.8.0.1","edge-mqtt-shv-01-msp1.facebook.com","TCP","54","[TCP Dup ACK 25#1] 48472  >  https(443) [ACK] Seq=1 Ack=1 Win=67107840 Len=0"
"30","7.196733","10.8.0.1","edge-star-shv-01-msp1.facebook.com","TCP","54","[TCP Dup ACK 26#1] 38206  >  http(80) [ACK] Seq=267 Ack=1 Win=67107840 Len=0"
"31","7.198205","10.8.0.1","edge-mqtt-shv-01-msp1.facebook.com","TLSv1.3","453","Client Hello"
"32","7.198270","edge-mqtt-shv-01-msp1.facebook.com","10.8.0.1","TCP","54","https(443)  >  48472 [ACK] Seq=1 Ack=400 Win=65535 Len=0"
"33","7.200359","10.8.0.1","edge-mqtt-shv-01-msp1.facebook.com","TLSv1.3","461","Change Cipher Spec, Application Data"
"34","7.200411","edge-mqtt-shv-01-msp1.facebook.com","10.8.0.1","TCP","54","https(443)  >  48472 [ACK] Seq=1 Ack=807 Win=65535 Len=0"
"35","7.281700","edge-mqtt-shv-01-msp1.facebook.com","10.8.0.1","TLSv1.3","470","Server Hello, Change Cipher Spec, Application Data, Application Data, Application Data, Application Data"
"36","7.281767","10.8.0.1","edge-mqtt-shv-01-msp1.facebook.com","TLSv1.3","340","Application Data"
"37","7.281826","edge-mqtt-shv-01-msp1.facebook.com","10.8.0.1","TCP","54","https(443)  >  48472 [ACK] Seq=1 Ack=1093 Win=65535 Len=0"
"38","7.281954","10.8.0.1","edge-mqtt-shv-01-msp1.facebook.com","TLSv1.3","106","Application Data"
"39","7.282006","edge-mqtt-shv-01-msp1.facebook.com","10.8.0.1","TCP","54","https(443)  >  48472 [ACK] Seq=1 Ack=1145 Win=65535 Len=0"
"40","7.282046","10.8.0.1","whatsapp-chatd-msgr-mini-edge-shv-01-msp1.facebook.com","TCP","74","60870  >  xmpp-client(5222) [SYN] Seq=0 Win=65535 Len=0 MSS=1460 SACK_PERM=1 TSval=182924129 TSecr=0 WS=1024"
"41","7.284543","whatsapp-chatd-msgr-mini-edge-shv-01-msp1.facebook.com","10.8.0.1","TCP","54","xmpp-client(5222)  >  60870 [SYN, ACK] Seq=0 Ack=1 Win=65535 Len=0"
"42","7.284589","10.8.0.1","edge-mqtt-shv-01-msp1.facebook.com","TCP","54","48472  >  https(443) [ACK] Seq=1145 Ack=417 Win=67107840 Len=0"
"43","7.284610","10.8.0.1","whatsapp-chatd-msgr-mini-edge-shv-01-msp1.facebook.com","TCP","54","60870  >  xmpp-client(5222) [ACK] Seq=1 Ack=1 Win=65535 Len=0"
"44","7.284995","10.8.0.1","whatsapp-chatd-msgr-mini-edge-shv-01-msp1.facebook.com","TCP","58","60870  >  xmpp-client(5222) [PSH, ACK] Seq=1 Ack=1 Win=65535 Len=4 [TCP segment of a reassembled PDU]"
"45","7.285050","whatsapp-chatd-msgr-mini-edge-shv-01-msp1.facebook.com","10.8.0.1","TCP","54","xmpp-client(5222)  >  60870 [ACK] Seq=1 Ack=5 Win=65535 Len=0"
"46","7.285111","10.8.0.1","whatsapp-chatd-msgr-mini-edge-shv-01-msp1.facebook.com","TCP","61","60870  >  xmpp-client(5222) [PSH, ACK] Seq=5 Ack=1 Win=65535 Len=7 [TCP segment of a reassembled PDU]"
"47","7.285153","whatsapp-chatd-msgr-mini-edge-shv-01-msp1.facebook.com","10.8.0.1","TCP","54","xmpp-client(5222)  >  60870 [ACK] Seq=1 Ack=12 Win=65535 Len=0"
"48","7.285208","10.8.0.1","whatsapp-chatd-msgr-mini-edge-shv-01-msp1.facebook.com","TCP","58","60870  >  xmpp-client(5222) [PSH, ACK] Seq=12 Ack=1 Win=65535 Len=4 [TCP segment of a reassembled PDU]"
"49","7.285253","whatsapp-chatd-msgr-mini-edge-shv-01-msp1.facebook.com","10.8.0.1","TCP","54","xmpp-client(5222)  >  60870 [ACK] Seq=1 Ack=16 Win=65535 Len=0"
"50","7.294875","10.8.0.1","whatsapp-chatd-msgr-mini-edge-shv-01-msp1.facebook.com","TCP","590","60870  >  xmpp-client(5222) [ACK] Seq=16 Ack=1 Win=65535 Len=536 [TCP segment of a reassembled PDU]"
"51","7.294921","whatsapp-chatd-msgr-mini-edge-shv-01-msp1.facebook.com","10.8.0.1","TCP","54","xmpp-client(5222)  >  60870 [ACK] Seq=1 Ack=552 Win=65535 Len=0"
"52","7.294940","10.8.0.1","whatsapp-chatd-msgr-mini-edge-shv-01-msp1.facebook.com","TCP","590","60870  >  xmpp-client(5222) [PSH, ACK] Seq=552 Ack=1 Win=65535 Len=536 [TCP segment of a reassembled PDU]"
"53","7.294978","whatsapp-chatd-msgr-mini-edge-shv-01-msp1.facebook.com","10.8.0.1","TCP","54","xmpp-client(5222)  >  60870 [ACK] Seq=1 Ack=1088 Win=65535 Len=0"
"54","7.294994","10.8.0.1","whatsapp-chatd-msgr-mini-edge-shv-01-msp1.facebook.com","TCP","216","60870  >  xmpp-client(5222) [PSH, ACK] Seq=1088 Ack=1 Win=65535 Len=162 [TCP segment of a reassembled PDU]"
"55","7.295029","whatsapp-chatd-msgr-mini-edge-shv-01-msp1.facebook.com","10.8.0.1","TCP","54","xmpp-client(5222)  >  60870 [ACK] Seq=1 Ack=1250 Win=65535 Len=0"
"56","7.332160","edge-mqtt-shv-01-msp1.facebook.com","10.8.0.1","TLSv1.3","89","Application Data"
"57","7.332236","10.8.0.1","edge-mqtt-shv-01-msp1.facebook.com","TLSv1.3","590","Application Data, Application Data"
"58","7.332344","edge-mqtt-shv-01-msp1.facebook.com","10.8.0.1","TCP","54","https(443)  >  48472 [ACK] Seq=452 Ack=1681 Win=65535 Len=0"
"59","7.332369","10.8.0.1","edge-mqtt-shv-01-msp1.facebook.com","TLSv1.3","590","Application Data, Application Data, Application Data, Application Data"
"60","7.332412","edge-mqtt-shv-01-msp1.facebook.com","10.8.0.1","TCP","54","https(443)  >  48472 [ACK] Seq=452 Ack=2217 Win=65535 Len=0"
"61","7.332430","10.8.0.1","edge-mqtt-shv-01-msp1.facebook.com","TLSv1.3","69","Application Data"
"62","7.332465","edge-mqtt-shv-01-msp1.facebook.com","10.8.0.1","TCP","54","https(443)  >  48472 [ACK] Seq=452 Ack=2232 Win=65535 Len=0"
"63","7.347560","edge-mqtt-shv-01-msp1.facebook.com","10.8.0.1","TLSv1.3","233","Application Data"
"64","7.399583","10.8.0.1","edge-mqtt-shv-01-msp1.facebook.com","TCP","54","48472  >  https(443) [ACK] Seq=2232 Ack=631 Win=67107840 Len=0"
"65","7.399847","edge-mqtt-shv-01-msp1.facebook.com","10.8.0.1","TLSv1.3","490","Application Data, Application Data, Application Data, Application Data, Application Data, Application Data"
"66","7.450036","10.8.0.1","edge-mqtt-shv-01-msp1.facebook.com","TCP","54","48472  >  https(443) [ACK] Seq=2232 Ack=1067 Win=67107840 Len=0"
"67","7.450409","whatsapp-chatd-msgr-mini-edge-shv-01-msp1.facebook.com","10.8.0.1","TCP","164","xmpp-client(5222)  >  60870 [PSH, ACK] Seq=1 Ack=1250 Win=65535 Len=110 [TCP segment of a reassembled PDU]"
"68","7.450526","edge-mqtt-shv-01-msp1.facebook.com","10.8.0.1","TLSv1.3","243","Application Data"
"69","7.450549","10.8.0.1","edge-mqtt-shv-01-msp1.facebook.com","TLSv1.3","302","Application Data"
"70","7.450592","edge-mqtt-shv-01-msp1.facebook.com","10.8.0.1","TCP","54","https(443)  >  48472 [ACK] Seq=1067 Ack=2480 Win=65535 Len=0"
"71","7.450727","10.8.0.1","whatsapp-chatd-msgr-mini-edge-shv-01-msp1.facebook.com","TCP","54","60870  >  xmpp-client(5222) [ACK] Seq=1250 Ack=111 Win=65535 Len=0"
"72","7.450753","10.8.0.1","edge-mqtt-shv-01-msp1.facebook.com","TCP","54","48472  >  https(443) [ACK] Seq=2480 Ack=1256 Win=67107840 Len=0"
"73","7.455378","10.8.0.1","whatsapp-chatd-msgr-mini-edge-shv-01-msp1.facebook.com","TCP","98","60870  >  xmpp-client(5222) [PSH, ACK] Seq=1250 Ack=111 Win=65535 Len=44 [TCP segment of a reassembled PDU]"
"74","7.455441","whatsapp-chatd-msgr-mini-edge-shv-01-msp1.facebook.com","10.8.0.1","TCP","54","xmpp-client(5222)  >  60870 [ACK] Seq=111 Ack=1294 Win=65535 Len=0"
"75","7.507025","edge-mqtt-shv-01-msp1.facebook.com","10.8.0.1","TLSv1.3","89","Application Data"
"76","7.558409","10.8.0.1","edge-mqtt-shv-01-msp1.facebook.com","TCP","54","48472  >  https(443) [ACK] Seq=2480 Ack=1291 Win=67107840 Len=0"
"77","7.712646","whatsapp-chatd-msgr-mini-edge-shv-01-msp1.facebook.com","10.8.0.1","TCP","187","xmpp-client(5222)  >  60870 [PSH, ACK] Seq=111 Ack=1294 Win=65535 Len=133 [TCP segment of a reassembled PDU]"
"78","7.712832","edge-mqtt-shv-01-msp1.facebook.com","10.8.0.1","TLSv1.3","576","Application Data, Application Data"
"79","7.712870","10.8.0.1","whatsapp-chatd-msgr-mini-edge-shv-01-msp1.facebook.com","TCP","54","60870  >  xmpp-client(5222) [ACK] Seq=1294 Ack=244 Win=65535 Len=0"
"80","7.712946","10.8.0.1","edge-mqtt-shv-01-msp1.facebook.com","TCP","54","48472  >  https(443) [ACK] Seq=2480 Ack=1813 Win=67107840 Len=0"
"81","7.744413","10.8.0.1","edge-mqtt-shv-01-msp1.facebook.com","TLSv1.3","305","Application Data"
"82","7.744572","edge-mqtt-shv-01-msp1.facebook.com","10.8.0.1","TCP","54","https(443)  >  48472 [ACK] Seq=1813 Ack=2731 Win=65535 Len=0"
"83","7.796094","edge-mqtt-shv-01-msp1.facebook.com","10.8.0.1","TLSv1.3","89","Application Data"
"84","7.848905","10.8.0.1","edge-mqtt-shv-01-msp1.facebook.com","TCP","54","48472  >  https(443) [ACK] Seq=2731 Ack=1848 Win=67107840 Len=0"
"85","8.531465","edge-mqtt-shv-01-msp1.facebook.com","10.8.0.1","TLSv1.3","2826","Application Data"
"86","8.584190","10.8.0.1","edge-mqtt-shv-01-msp1.facebook.com","TCP","54","48472  >  https(443) [ACK] Seq=2731 Ack=4620 Win=67107840 Len=0"
"87","8.584733","edge-mqtt-shv-01-msp1.facebook.com","10.8.0.1","TLSv1.3","21692","Application Data, Application Data, Application Data, Application Data, Application Data, Application Data, Application Data, Application Data"
"88","8.635924","10.8.0.1","edge-mqtt-shv-01-msp1.facebook.com","TCP","54","48472  >  https(443) [ACK] Seq=2731 Ack=26258 Win=67107840 Len=0"
"89","8.809392","10.8.0.1","gm-in-f188.1e100.net","TCP","74","34650  >  hpvroom(5228) [SYN] Seq=0 Win=65535 Len=0 MSS=1460 SACK_PERM=1 TSval=3309527808 TSecr=0 WS=1024"
"90","8.811641","gm-in-f188.1e100.net","10.8.0.1","TCP","54","hpvroom(5228)  >  34650 [SYN, ACK] Seq=0 Ack=1 Win=65535 Len=0"
"91","8.811672","10.8.0.1","gm-in-f188.1e100.net","TCP","54","34650  >  hpvroom(5228) [ACK] Seq=1 Ack=1 Win=65535 Len=0"
"92","8.812847","10.8.0.1","gm-in-f188.1e100.net","TLSv1.3","587","Client Hello"
"93","8.812893","gm-in-f188.1e100.net","10.8.0.1","TCP","54","hpvroom(5228)  >  34650 [ACK] Seq=1 Ack=534 Win=65535 Len=0"
"94","8.889823","gm-in-f188.1e100.net","10.8.0.1","TLSv1.3","257","Server Hello, Change Cipher Spec, Application Data"
"95","8.941036","10.8.0.1","gm-in-f188.1e100.net","TCP","54","34650  >  hpvroom(5228) [ACK] Seq=534 Ack=204 Win=65535 Len=0"
"96","8.941136","10.8.0.1","edge-mqtt-shv-01-msp1.facebook.com","TLSv1.3","423","Application Data"
"97","8.941316","edge-mqtt-shv-01-msp1.facebook.com","10.8.0.1","TCP","54","https(443)  >  48472 [ACK] Seq=26258 Ack=3100 Win=65535 Len=0"
"98","8.941344","10.8.0.1","gm-in-f188.1e100.net","TLSv1.3","118","Change Cipher Spec, Application Data"
"99","8.941471","gm-in-f188.1e100.net","10.8.0.1","TCP","54","hpvroom(5228)  >  34650 [ACK] Seq=204 Ack=598 Win=65535 Len=0"
"100","8.941731","10.8.0.1","gm-in-f188.1e100.net","TLSv1.3","486","Application Data"
"101","8.941808","gm-in-f188.1e100.net","10.8.0.1","TCP","54","hpvroom(5228)  >  34650 [ACK] Seq=204 Ack=1030 Win=65535 Len=0"
"102","8.971613","edge-mqtt-shv-01-msp1.facebook.com","10.8.0.1","TLSv1.3","89","Application Data"
"103","9.023333","10.8.0.1","edge-mqtt-shv-01-msp1.facebook.com","TCP","54","48472  >  https(443) [ACK] Seq=3100 Ack=26293 Win=67107840 Len=0"
"104","9.030860","gm-in-f188.1e100.net","10.8.0.1","TLSv1.3","1403","Application Data, Application Data, Application Data, Application Data, Application Data"
"105","9.031040","10.8.0.1","gm-in-f188.1e100.net","TCP","54","34650  >  hpvroom(5228) [ACK] Seq=1030 Ack=1553 Win=65535 Len=0"
"106","9.080406","10.8.0.1","gm-in-f188.1e100.net","TLSv1.3","92","Application Data"
"107","9.080564","gm-in-f188.1e100.net","10.8.0.1","TCP","54","hpvroom(5228)  >  34650 [ACK] Seq=1553 Ack=1068 Win=65535 Len=0"
"108","9.080752","gm-in-f188.1e100.net","10.8.0.1","TCP","54","[TCP Dup ACK 107#1] hpvroom(5228)  >  34650 [PSH, ACK] Seq=1553 Ack=1068 Win=65535 Len=0"
"109","9.199914","10.8.0.1","ord37s34-in-f5.1e100.net","TCP","74","39760  >  https(443) [SYN] Seq=0 Win=65535 Len=0 MSS=1460 SACK_PERM=1 TSval=443979892 TSecr=0 WS=1024"
"110","9.202653","ord37s34-in-f5.1e100.net","10.8.0.1","TCP","54","https(443)  >  39760 [SYN, ACK] Seq=0 Ack=1 Win=65535 Len=0"
"111","9.202698","10.8.0.1","ord37s34-in-f5.1e100.net","TCP","54","39760  >  https(443) [ACK] Seq=1 Ack=1 Win=65535 Len=0"
"112","9.204318","10.8.0.1","ord37s34-in-f5.1e100.net","TCP","590","39760  >  https(443) [ACK] Seq=1 Ack=1 Win=65535 Len=536 [TCP segment of a reassembled PDU]"
"113","9.204381","ord37s34-in-f5.1e100.net","10.8.0.1","TCP","54","https(443)  >  39760 [ACK] Seq=1 Ack=537 Win=65535 Len=0"
"114","9.204402","10.8.0.1","ord37s34-in-f5.1e100.net","TLSv1.3","115","Client Hello"
"115","9.204443","ord37s34-in-f5.1e100.net","10.8.0.1","TCP","54","https(443)  >  39760 [ACK] Seq=1 Ack=598 Win=65535 Len=0"
"116","9.278765","ord37s34-in-f5.1e100.net","10.8.0.1","TLSv1.3","266","Server Hello, Change Cipher Spec, Application Data"
"117","9.331541","10.8.0.1","ord37s34-in-f5.1e100.net","TCP","54","39760  >  https(443) [ACK] Seq=598 Ack=213 Win=65535 Len=0"
"118","9.331703","10.8.0.1","ord37s34-in-f5.1e100.net","TLSv1.3","118","Change Cipher Spec, Application Data"
"119","9.331888","ord37s34-in-f5.1e100.net","10.8.0.1","TCP","54","https(443)  >  39760 [ACK] Seq=213 Ack=662 Win=65535 Len=0"
"120","9.331917","10.8.0.1","ord37s34-in-f5.1e100.net","TLSv1.3","146","Application Data"
"121","9.331979","ord37s34-in-f5.1e100.net","10.8.0.1","TCP","54","https(443)  >  39760 [ACK] Seq=213 Ack=754 Win=65535 Len=0"
"122","9.332182","10.8.0.1","ord37s34-in-f5.1e100.net","TCP","590","39760  >  https(443) [ACK] Seq=754 Ack=213 Win=65535 Len=536 [TCP segment of a reassembled PDU]"
"123","9.332257","ord37s34-in-f5.1e100.net","10.8.0.1","TCP","54","https(443)  >  39760 [ACK] Seq=213 Ack=1290 Win=65535 Len=0"
"124","9.332280","10.8.0.1","ord37s34-in-f5.1e100.net","TCP","590","39760  >  https(443) [ACK] Seq=1290 Ack=213 Win=65535 Len=536 [TCP segment of a reassembled PDU]"
"125","9.332412","ord37s34-in-f5.1e100.net","10.8.0.1","TCP","54","https(443)  >  39760 [ACK] Seq=213 Ack=1826 Win=65535 Len=0"
"126","9.332435","10.8.0.1","ord37s34-in-f5.1e100.net","TLSv1.3","320","Application Data"
"127","9.332477","ord37s34-in-f5.1e100.net","10.8.0.1","TCP","54","https(443)  >  39760 [ACK] Seq=213 Ack=2092 Win=65535 Len=0"
"128","9.332495","10.8.0.1","ord37s34-in-f5.1e100.net","TLSv1.3","333","Application Data"
"129","9.332533","ord37s34-in-f5.1e100.net","10.8.0.1","TCP","54","https(443)  >  39760 [ACK] Seq=213 Ack=2371 Win=65535 Len=0"
"130","9.377755","ord37s34-in-f5.1e100.net","10.8.0.1","TLSv1.3","693","Application Data, Application Data, Application Data"
"131","9.430526","10.8.0.1","ord37s34-in-f5.1e100.net","TCP","54","39760  >  https(443) [ACK] Seq=2371 Ack=852 Win=65535 Len=0"
"132","9.430675","10.8.0.1","ord37s34-in-f5.1e100.net","TLSv1.3","85","Application Data"
"133","9.430804","ord37s34-in-f5.1e100.net","10.8.0.1","TCP","54","https(443)  >  39760 [ACK] Seq=852 Ack=2402 Win=65535 Len=0"
"134","9.657645","ord37s34-in-f5.1e100.net","10.8.0.1","TLSv1.3","1411","Application Data, Application Data, Application Data, Application Data, Application Data"
"135","9.658060","edge-mqtt-shv-01-msp1.facebook.com","10.8.0.1","TLSv1.3","25383","Application Data, Application Data, Application Data, Application Data, Application Data, Application Data, Application Data, Application Data, Application Data"
"136","9.658412","10.8.0.1","ord37s34-in-f5.1e100.net","TCP","54","39760  >  https(443) [ACK] Seq=2402 Ack=2209 Win=65535 Len=0"
"137","9.658438","10.8.0.1","edge-mqtt-shv-01-msp1.facebook.com","TCP","54","48472  >  https(443) [ACK] Seq=3100 Ack=51622 Win=67107840 Len=0"
"138","9.663454","10.8.0.1","ord37s34-in-f5.1e100.net","TLSv1.3","93","Application Data"
"139","9.663623","ord37s34-in-f5.1e100.net","10.8.0.1","TCP","54","https(443)  >  39760 [ACK] Seq=2209 Ack=2441 Win=65535 Len=0"
"140","9.714990","10.8.0.1","edge-mqtt-shv-01-msp1.facebook.com","TLSv1.3","102","Application Data"
"141","9.715178","edge-mqtt-shv-01-msp1.facebook.com","10.8.0.1","TCP","54","https(443)  >  48472 [ACK] Seq=51622 Ack=3148 Win=65535 Len=0"
"142","9.940145","10.8.0.1","edge-mqtt-shv-01-msp1.facebook.com","TLSv1.3","422","Application Data"
"143","9.940304","edge-mqtt-shv-01-msp1.facebook.com","10.8.0.1","TCP","54","https(443)  >  48472 [ACK] Seq=51622 Ack=3516 Win=65535 Len=0"
"144","9.990886","edge-mqtt-shv-01-msp1.facebook.com","10.8.0.1","TLSv1.3","89","Application Data"
"145","10.043349","10.8.0.1","edge-mqtt-shv-01-msp1.facebook.com","TCP","54","48472  >  https(443) [ACK] Seq=3516 Ack=51657 Win=67107840 Len=0"
"146","10.680838","edge-mqtt-shv-01-msp1.facebook.com","10.8.0.1","TLSv1.3","24614","Application Data, Application Data, Application Data, Application Data, Application Data, Application Data, Application Data, Application Data, Application Data"
"147","10.732179","10.8.0.1","edge-mqtt-shv-01-msp1.facebook.com","TCP","54","48472  >  https(443) [ACK] Seq=3516 Ack=76217 Win=67107840 Len=0"
"148","10.732257","10.8.0.1","edge-mqtt-shv-01-msp1.facebook.com","TLSv1.3","102","Application Data"
"149","10.732421","edge-mqtt-shv-01-msp1.facebook.com","10.8.0.1","TCP","54","https(443)  >  48472 [ACK] Seq=76217 Ack=3564 Win=65535 Len=0"
"150","10.969380","10.8.0.1","edge-mqtt-shv-01-msp1.facebook.com","TLSv1.3","418","Application Data"
"151","10.969541","edge-mqtt-shv-01-msp1.facebook.com","10.8.0.1","TCP","54","https(443)  >  48472 [ACK] Seq=76217 Ack=3928 Win=65535 Len=0"
"152","11.021049","edge-mqtt-shv-01-msp1.facebook.com","10.8.0.1","TLSv1.3","89","Application Data"
"153","11.074242","10.8.0.1","edge-mqtt-shv-01-msp1.facebook.com","TCP","54","48472  >  https(443) [ACK] Seq=3928 Ack=76252 Win=67107840 Len=0"
"154","11.306332","edge-mqtt-shv-01-msp1.facebook.com","10.8.0.1","TLSv1.3","4279","Application Data, Application Data, Application Data"
"155","11.361296","10.8.0.1","edge-mqtt-shv-01-msp1.facebook.com","TCP","54","48472  >  https(443) [ACK] Seq=3928 Ack=80477 Win=67107840 Len=0"
"156","11.381845","10.8.0.1","edge-mqtt-shv-01-msp1.facebook.com","TLSv1.3","305","Application Data"
"157","11.382006","edge-mqtt-shv-01-msp1.facebook.com","10.8.0.1","TCP","54","https(443)  >  48472 [ACK] Seq=80477 Ack=4179 Win=65535 Len=0"
"158","11.433452","edge-mqtt-shv-01-msp1.facebook.com","10.8.0.1","TLSv1.3","89","Application Data"
"159","11.485616","10.8.0.1","edge-mqtt-shv-01-msp1.facebook.com","TCP","54","48472  >  https(443) [ACK] Seq=4179 Ack=80512 Win=67107840 Len=0"
"160","11.581382","edge-mqtt-shv-01-msp1.facebook.com","10.8.0.1","TLSv1.3","315","Application Data"
"161","11.632655","10.8.0.1","edge-mqtt-shv-01-msp1.facebook.com","TCP","54","48472  >  https(443) [ACK] Seq=4179 Ack=80773 Win=67107840 Len=0"
"162","17.234172","10.8.0.1","edge-star-shv-01-msp1.facebook.com","TCP","54","38206  >  http(80) [RST, ACK] Seq=267 Ack=1 Win=67107840 Len=0"
"163","17.239088","10.8.0.1","whatsapp-chatd-msgr-mini-edge-shv-01-msp1.facebook.com","TCP","54","60870  >  xmpp-client(5222) [RST, ACK] Seq=1294 Ack=244 Win=65535 Len=0"
"164","17.239269","10.8.0.1","edge-mqtt-shv-01-msp1.facebook.com","TCP","54","48472  >  https(443) [RST, ACK] Seq=4179 Ack=80773 Win=67107840 Len=0"
"165","18.619841","10.8.0.1","srcf-ntp.stanford.edu","NTP","90","NTP Version 3, client"
"166","18.769210","srcf-ntp.stanford.edu","10.8.0.1","NTP","90","NTP Version 3, server"
"167","19.631870","10.8.0.1","ord36s03-in-f12.1e100.net","GQUIC","1392","Client Hello, PKN: 1, CID: 6099468274396608503"
"168","19.653934","ord36s03-in-f12.1e100.net","10.8.0.1","GQUIC","1392","Rejection, PKN: 1, CID: 6099468274396608503"
"169","19.654044","10.8.0.1","ord36s03-in-f12.1e100.net","TCP","74","45796  >  https(443) [SYN] Seq=0 Win=65535 Len=0 MSS=1460 SACK_PERM=1 TSval=1387186567 TSecr=0 WS=1024"
"170","19.657261","ord36s03-in-f12.1e100.net","10.8.0.1","TCP","54","https(443)  >  45796 [SYN, ACK] Seq=0 Ack=1 Win=65535 Len=0"
"171","19.657315","10.8.0.1","ord36s03-in-f12.1e100.net","TCP","54","45796  >  https(443) [ACK] Seq=1 Ack=1 Win=65535 Len=0"
"172","19.661319","10.8.0.1","ord36s03-in-f12.1e100.net","GQUIC","1392","Client Hello, PKN: 2, CID: 6099468274396608503"
"173","19.685276","ord36s03-in-f12.1e100.net","10.8.0.1","GQUIC","1392","Payload (Encrypted), PKN: 2"
"174","19.685441","10.8.0.1","ord36s03-in-f12.1e100.net","GQUIC","939","Payload (Encrypted), PKN: 3, CID: 6099468274396608503"
"175","19.733478","ord36s03-in-f12.1e100.net","10.8.0.1","GQUIC","62","Payload (Encrypted), PKN: 3"
"176","19.733549","10.8.0.1","ord36s03-in-f12.1e100.net","TLSv1.3","571","Client Hello"
"177","19.733655","ord36s03-in-f12.1e100.net","10.8.0.1","TCP","54","https(443)  >  45796 [ACK] Seq=1 Ack=518 Win=65535 Len=0"
"178","19.733679","10.8.0.1","ord36s03-in-f12.1e100.net","GQUIC","959","Payload (Encrypted), PKN: 4, CID: 6099468274396608503"
"179","19.754149","ord36s03-in-f12.1e100.net","10.8.0.1","GQUIC","427","Payload (Encrypted), PKN: 5"
"180","19.754470","10.8.0.1","ord36s03-in-f12.1e100.net","GQUIC","70","Payload (Encrypted), PKN: 5, CID: 6099468274396608503"
"181","19.775495","ord36s03-in-f12.1e100.net","10.8.0.1","GQUIC","1392","Payload (Encrypted), PKN: 60"
"182","19.775550","10.8.0.1","ord36s03-in-f12.1e100.net","GQUIC","939","Payload (Encrypted), PKN: 6, CID: 6099468274396608503"
"183","19.803614","ord36s03-in-f12.1e100.net","10.8.0.1","GQUIC","1392","Payload (Encrypted), PKN: 82"
"184","19.803826","ord36s03-in-f12.1e100.net","10.8.0.1","TLSv1.3","5233","Server Hello, Change Cipher Spec, Application Data"
"185","19.803886","10.8.0.1","ord36s03-in-f12.1e100.net","GQUIC","959","Payload (Encrypted), PKN: 7, CID: 6099468274396608503"
"186","19.849427","ord36s03-in-f12.1e100.net","10.8.0.1","GQUIC","63","Payload (Encrypted), PKN: 83"
"187","19.849488","10.8.0.1","ord36s03-in-f12.1e100.net","GQUIC","73","Payload (Encrypted), PKN: 8, CID: 6099468274396608503"
"188","19.873518","ord36s03-in-f12.1e100.net","10.8.0.1","GQUIC","1392","Payload (Encrypted), PKN: 84"
"189","19.873600","10.8.0.1","ord36s03-in-f12.1e100.net","GQUIC","75","Payload (Encrypted), PKN: 9, CID: 6099468274396608503"
"190","19.893240","ord36s03-in-f12.1e100.net","10.8.0.1","GQUIC","1392","Payload (Encrypted), PKN: 85"
"191","19.893304","10.8.0.1","ord36s03-in-f12.1e100.net","TCP","54","45796  >  https(443) [ACK] Seq=518 Ack=5180 Win=65535 Len=0"
"192","19.893338","10.8.0.1","ord36s03-in-f12.1e100.net","GQUIC","77","Payload (Encrypted), PKN: 10, CID: 6099468274396608503"
"193","19.917327","ord36s03-in-f12.1e100.net","10.8.0.1","GQUIC","1392","Payload (Encrypted), PKN: 107"
"194","19.917396","10.8.0.1","ord36s03-in-f12.1e100.net","TLSv1.3","118","Change Cipher Spec, Application Data"
"195","19.917488","ord36s03-in-f12.1e100.net","10.8.0.1","TCP","54","https(443)  >  45796 [ACK] Seq=5180 Ack=582 Win=65535 Len=0"
"196","19.917514","10.8.0.1","ord36s03-in-f12.1e100.net","GQUIC","77","Payload (Encrypted), PKN: 11, CID: 6099468274396608503"
"197","19.937460","ord36s03-in-f12.1e100.net","10.8.0.1","GQUIC","1392","Payload (Encrypted), PKN: 134"
"198","19.937765","10.8.0.1","ord36s03-in-f12.1e100.net","GQUIC","77","Payload (Encrypted), PKN: 12, CID: 6099468274396608503"
"199","19.961477","ord36s03-in-f12.1e100.net","10.8.0.1","GQUIC","1392","Payload (Encrypted), PKN: 157"
"200","19.961533","10.8.0.1","ord36s03-in-f12.1e100.net","GQUIC","79","Payload (Encrypted), PKN: 13, CID: 6099468274396608503"
"201","19.985017","ord36s03-in-f12.1e100.net","10.8.0.1","GQUIC","1392","Payload (Encrypted), PKN: 166"
"202","19.985079","10.8.0.1","ord36s03-in-f12.1e100.net","GQUIC","81","Payload (Encrypted), PKN: 14, CID: 6099468274396608503"
"203","20.012011","ord36s03-in-f12.1e100.net","10.8.0.1","GQUIC","1392","Payload (Encrypted), PKN: 189"
"204","20.012094","10.8.0.1","ord36s03-in-f12.1e100.net","GQUIC","83","Payload (Encrypted), PKN: 15, CID: 6099468274396608503"
"205","20.037367","ord36s03-in-f12.1e100.net","10.8.0.1","GQUIC","1392","Payload (Encrypted), PKN: 215"
"206","20.037427","10.8.0.1","ord36s03-in-f12.1e100.net","GQUIC","85","Payload (Encrypted), PKN: 16, CID: 6099468274396608503"
"207","20.061327","ord36s03-in-f12.1e100.net","10.8.0.1","GQUIC","1392","Payload (Encrypted), PKN: 241"
"208","20.061414","10.8.0.1","ord36s03-in-f12.1e100.net","GQUIC","87","Payload (Encrypted), PKN: 17, CID: 6099468274396608503"
"209","20.085362","ord36s03-in-f12.1e100.net","10.8.0.1","GQUIC","1392","Payload (Encrypted), PKN: 251"
"210","20.085418","10.8.0.1","ord36s03-in-f12.1e100.net","GQUIC","89","Payload (Encrypted), PKN: 18, CID: 6099468274396608503"
"211","20.107935","ord36s03-in-f12.1e100.net","10.8.0.1","GQUIC","1392","Payload (Encrypted), PKN: 275"
"212","20.107990","10.8.0.1","ord36s03-in-f12.1e100.net","GQUIC","91","Payload (Encrypted), PKN: 19, CID: 6099468274396608503"
"213","20.132504","ord36s03-in-f12.1e100.net","10.8.0.1","GQUIC","1392","Payload (Encrypted), PKN: 301"
"214","20.132578","10.8.0.1","ord36s03-in-f12.1e100.net","GQUIC","93","Payload (Encrypted), PKN: 20, CID: 6099468274396608503"
"215","20.152662","ord36s03-in-f12.1e100.net","10.8.0.1","GQUIC","1392","Payload (Encrypted), PKN: 329"
"216","20.152715","10.8.0.1","ord36s03-in-f12.1e100.net","GQUIC","96","Payload (Encrypted), PKN: 21, CID: 6099468274396608503"
"217","20.201230","ord36s03-in-f12.1e100.net","10.8.0.1","GQUIC","1392","Payload (Encrypted), PKN: 340"
"218","20.201310","10.8.0.1","ord36s03-in-f12.1e100.net","GQUIC","98","Payload (Encrypted), PKN: 22, CID: 6099468274396608503"
"219","20.249296","ord36s03-in-f12.1e100.net","10.8.0.1","GQUIC","1392","Payload (Encrypted), PKN: 341"
"220","20.249419","10.8.0.1","ord36s03-in-f12.1e100.net","GQUIC","100","Payload (Encrypted), PKN: 23, CID: 6099468274396608503"
"221","20.441684","ord36s03-in-f12.1e100.net","10.8.0.1","GQUIC","1392","Payload (Encrypted), PKN: 342"
"222","20.441803","10.8.0.1","ord36s03-in-f12.1e100.net","GQUIC","102","Payload (Encrypted), PKN: 24, CID: 6099468274396608503"
"223","20.607809","ord36s03-in-f12.1e100.net","10.8.0.1","GQUIC","1392","Payload (Encrypted), PKN: 344"
"224","20.607885","10.8.0.1","ord36s03-in-f12.1e100.net","GQUIC","102","Payload (Encrypted), PKN: 25, CID: 6099468274396608503"
"225","20.628407","ord36s03-in-f12.1e100.net","10.8.0.1","GQUIC","1392","Payload (Encrypted), PKN: 346"
"226","20.628467","10.8.0.1","ord36s03-in-f12.1e100.net","GQUIC","102","Payload (Encrypted), PKN: 26, CID: 6099468274396608503"
"227","20.657455","ord36s03-in-f12.1e100.net","10.8.0.1","GQUIC","1392","Payload (Encrypted), PKN: 91"
"228","20.657512","10.8.0.1","ord36s03-in-f12.1e100.net","GQUIC","117","Payload (Encrypted), PKN: 27, CID: 6099468274396608503"
"229","20.696514","ord36s03-in-f12.1e100.net","10.8.0.1","GQUIC","1392","Payload (Encrypted), PKN: 93"
"230","20.696595","10.8.0.1","ord36s03-in-f12.1e100.net","GQUIC","106","Payload (Encrypted), PKN: 28, CID: 6099468274396608503"
"231","20.737296","ord36s03-in-f12.1e100.net","10.8.0.1","GQUIC","1392","Payload (Encrypted), PKN: 95"
"232","20.737354","10.8.0.1","ord36s03-in-f12.1e100.net","GQUIC","106","Payload (Encrypted), PKN: 29, CID: 6099468274396608503"
"233","20.777424","ord36s03-in-f12.1e100.net","10.8.0.1","GQUIC","1392","Payload (Encrypted), PKN: 97"
"234","20.777481","10.8.0.1","ord36s03-in-f12.1e100.net","GQUIC","76","Payload (Encrypted), PKN: 30, CID: 6099468274396608503"
"235","20.805463","ord36s03-in-f12.1e100.net","10.8.0.1","GQUIC","1392","Payload (Encrypted), PKN: 98"
"236","20.805625","10.8.0.1","ord36s03-in-f12.1e100.net","GQUIC","78","Payload (Encrypted), PKN: 31, CID: 6099468274396608503"
"237","20.830953","ord36s03-in-f12.1e100.net","10.8.0.1","GQUIC","1392","Payload (Encrypted), PKN: 99"
"238","20.831019","10.8.0.1","ord36s03-in-f12.1e100.net","GQUIC","80","Payload (Encrypted), PKN: 32, CID: 6099468274396608503"
"239","20.857406","ord36s03-in-f12.1e100.net","10.8.0.1","GQUIC","1392","Payload (Encrypted), PKN: 100"
"240","20.857463","10.8.0.1","ord36s03-in-f12.1e100.net","GQUIC","80","Payload (Encrypted), PKN: 33, CID: 6099468274396608503"
"241","20.901331","ord36s03-in-f12.1e100.net","10.8.0.1","GQUIC","1392","Payload (Encrypted), PKN: 102"
"242","20.901418","10.8.0.1","ord36s03-in-f12.1e100.net","GQUIC","80","Payload (Encrypted), PKN: 34, CID: 6099468274396608503"
"243","20.944405","ord36s03-in-f12.1e100.net","10.8.0.1","GQUIC","1392","Payload (Encrypted), PKN: 104"
"244","20.944526","10.8.0.1","ord36s03-in-f12.1e100.net","GQUIC","80","Payload (Encrypted), PKN: 35, CID: 6099468274396608503"
"245","20.985250","ord36s03-in-f12.1e100.net","10.8.0.1","GQUIC","1392","Payload (Encrypted), PKN: 106"
"246","20.985377","10.8.0.1","ord36s03-in-f12.1e100.net","GQUIC","82","Payload (Encrypted), PKN: 36, CID: 6099468274396608503"
"247","21.009395","ord36s03-in-f12.1e100.net","10.8.0.1","GQUIC","1391","Payload (Encrypted), PKN: 107"
"248","21.009452","10.8.0.1","ord36s03-in-f12.1e100.net","GQUIC","84","Payload (Encrypted), PKN: 37, CID: 6099468274396608503"
"249","21.057287","ord36s03-in-f12.1e100.net","10.8.0.1","GQUIC","1392","Payload (Encrypted), PKN: 109"
"250","21.057346","10.8.0.1","ord36s03-in-f12.1e100.net","GQUIC","86","Payload (Encrypted), PKN: 38, CID: 6099468274396608503"
"251","21.101336","ord36s03-in-f12.1e100.net","10.8.0.1","GQUIC","1392","Payload (Encrypted), PKN: 111"
"252","21.101502","10.8.0.1","ord36s03-in-f12.1e100.net","GQUIC","86","Payload (Encrypted), PKN: 39, CID: 6099468274396608503"
"253","21.136355","ord36s03-in-f12.1e100.net","10.8.0.1","GQUIC","1392","Payload (Encrypted), PKN: 113"
"254","21.136422","10.8.0.1","ord36s03-in-f12.1e100.net","GQUIC","88","Payload (Encrypted), PKN: 40, CID: 6099468274396608503"
"255","21.165523","ord36s03-in-f12.1e100.net","10.8.0.1","GQUIC","1392","Payload (Encrypted), PKN: 114"
"256","21.165583","10.8.0.1","ord36s03-in-f12.1e100.net","GQUIC","90","Payload (Encrypted), PKN: 41, CID: 6099468274396608503"
"257","21.214747","ord36s03-in-f12.1e100.net","10.8.0.1","GQUIC","1391","Payload (Encrypted), PKN: 116"
"258","21.214829","10.8.0.1","ord36s03-in-f12.1e100.net","GQUIC","92","Payload (Encrypted), PKN: 42, CID: 6099468274396608503"
"259","21.245475","ord36s03-in-f12.1e100.net","10.8.0.1","GQUIC","1392","Payload (Encrypted), PKN: 117"
"260","21.245533","10.8.0.1","ord36s03-in-f12.1e100.net","GQUIC","92","Payload (Encrypted), PKN: 43, CID: 6099468274396608503"
"261","21.284651","ord36s03-in-f12.1e100.net","10.8.0.1","GQUIC","1392","Payload (Encrypted), PKN: 119"
"262","21.284745","10.8.0.1","ord36s03-in-f12.1e100.net","GQUIC","94","Payload (Encrypted), PKN: 44, CID: 6099468274396608503"
"263","21.346062","ord36s03-in-f12.1e100.net","10.8.0.1","GQUIC","1392","Payload (Encrypted), PKN: 121"
"264","21.346227","10.8.0.1","ord36s03-in-f12.1e100.net","GQUIC","94","Payload (Encrypted), PKN: 45, CID: 6099468274396608503"
"265","21.373366","ord36s03-in-f12.1e100.net","10.8.0.1","GQUIC","1392","Payload (Encrypted), PKN: 123"
"266","21.373426","10.8.0.1","ord36s03-in-f12.1e100.net","GQUIC","96","Payload (Encrypted), PKN: 46, CID: 6099468274396608503"
"267","21.395477","ord36s03-in-f12.1e100.net","10.8.0.1","GQUIC","1392","Payload (Encrypted), PKN: 124"
"268","21.395575","10.8.0.1","ord36s03-in-f12.1e100.net","GQUIC","111","Payload (Encrypted), PKN: 47, CID: 6099468274396608503"
"269","21.417433","ord36s03-in-f12.1e100.net","10.8.0.1","GQUIC","1392","Payload (Encrypted), PKN: 125"
"270","21.417495","10.8.0.1","ord36s03-in-f12.1e100.net","GQUIC","100","Payload (Encrypted), PKN: 48, CID: 6099468274396608503"
"271","21.457484","ord36s03-in-f12.1e100.net","10.8.0.1","GQUIC","1392","Payload (Encrypted), PKN: 126"
"272","21.457548","10.8.0.1","ord36s03-in-f12.1e100.net","GQUIC","100","Payload (Encrypted), PKN: 49, CID: 6099468274396608503"
"273","21.482475","ord36s03-in-f12.1e100.net","10.8.0.1","GQUIC","1392","Payload (Encrypted), PKN: 128"
"274","21.482585","10.8.0.1","ord36s03-in-f12.1e100.net","GQUIC","74","Payload (Encrypted), PKN: 50, CID: 6099468274396608503"
"275","21.511585","ord36s03-in-f12.1e100.net","10.8.0.1","GQUIC","1392","Payload (Encrypted), PKN: 129"
"276","21.511645","10.8.0.1","ord36s03-in-f12.1e100.net","GQUIC","74","Payload (Encrypted), PKN: 51, CID: 6099468274396608503"
"277","21.561682","ord36s03-in-f12.1e100.net","10.8.0.1","GQUIC","1392","Payload (Encrypted), PKN: 131"
"278","21.561801","10.8.0.1","ord36s03-in-f12.1e100.net","GQUIC","76","Payload (Encrypted), PKN: 52, CID: 6099468274396608503"
"279","21.599917","ord36s03-in-f12.1e100.net","10.8.0.1","GQUIC","1392","Payload (Encrypted), PKN: 133"
"280","21.599974","10.8.0.1","ord36s03-in-f12.1e100.net","GQUIC","76","Payload (Encrypted), PKN: 53, CID: 6099468274396608503"
"281","21.625344","ord36s03-in-f12.1e100.net","10.8.0.1","GQUIC","1392","Payload (Encrypted), PKN: 134"
"282","21.625404","10.8.0.1","ord36s03-in-f12.1e100.net","GQUIC","78","Payload (Encrypted), PKN: 54, CID: 6099468274396608503"
"283","21.668579","ord36s03-in-f12.1e100.net","10.8.0.1","GQUIC","1392","Payload (Encrypted), PKN: 136"
"284","21.668662","10.8.0.1","ord36s03-in-f12.1e100.net","GQUIC","80","Payload (Encrypted), PKN: 55, CID: 6099468274396608503"
"285","21.693832","ord36s03-in-f12.1e100.net","10.8.0.1","GQUIC","1392","Payload (Encrypted), PKN: 137"
"286","21.693894","10.8.0.1","ord36s03-in-f12.1e100.net","GQUIC","80","Payload (Encrypted), PKN: 56, CID: 6099468274396608503"
"287","21.737232","ord36s03-in-f12.1e100.net","10.8.0.1","GQUIC","1392","Payload (Encrypted), PKN: 139"
"288","21.737289","10.8.0.1","ord36s03-in-f12.1e100.net","GQUIC","82","Payload (Encrypted), PKN: 57, CID: 6099468274396608503"
"289","21.780611","ord36s03-in-f12.1e100.net","10.8.0.1","GQUIC","1392","Payload (Encrypted), PKN: 141"
"290","21.780827","10.8.0.1","ord36s03-in-f12.1e100.net","GQUIC","82","Payload (Encrypted), PKN: 58, CID: 6099468274396608503"
"291","21.805358","ord36s03-in-f12.1e100.net","10.8.0.1","GQUIC","1392","Payload (Encrypted), PKN: 142"
"292","21.805418","10.8.0.1","ord36s03-in-f12.1e100.net","GQUIC","84","Payload (Encrypted), PKN: 59, CID: 6099468274396608503"
"293","21.844316","ord36s03-in-f12.1e100.net","10.8.0.1","GQUIC","1392","Payload (Encrypted), PKN: 144"
"294","21.844423","10.8.0.1","ord36s03-in-f12.1e100.net","GQUIC","86","Payload (Encrypted), PKN: 60, CID: 6099468274396608503"
"295","21.873415","ord36s03-in-f12.1e100.net","10.8.0.1","GQUIC","1392","Payload (Encrypted), PKN: 145"
"296","21.873652","10.8.0.1","ord36s03-in-f12.1e100.net","GQUIC","86","Payload (Encrypted), PKN: 61, CID: 6099468274396608503"
"297","21.897431","ord36s03-in-f12.1e100.net","10.8.0.1","GQUIC","1392","Payload (Encrypted), PKN: 146"
"298","21.897497","10.8.0.1","ord36s03-in-f12.1e100.net","GQUIC","88","Payload (Encrypted), PKN: 62, CID: 6099468274396608503"
"299","21.921347","ord36s03-in-f12.1e100.net","10.8.0.1","GQUIC","1386","Payload (Encrypted), PKN: 147"
"300","21.921432","10.8.0.1","ord36s03-in-f12.1e100.net","GQUIC","88","Payload (Encrypted), PKN: 63, CID: 6099468274396608503"
"301","21.944608","ord36s03-in-f12.1e100.net","10.8.0.1","GQUIC","1392","Payload (Encrypted), PKN: 148"
"302","21.944661","10.8.0.1","ord36s03-in-f12.1e100.net","GQUIC","88","Payload (Encrypted), PKN: 64, CID: 6099468274396608503"
"303","21.969313","ord36s03-in-f12.1e100.net","10.8.0.1","GQUIC","1392","Payload (Encrypted), PKN: 149"
"304","21.969378","10.8.0.1","ord36s03-in-f12.1e100.net","GQUIC","88","Payload (Encrypted), PKN: 65, CID: 6099468274396608503"
"305","21.988599","ord36s03-in-f12.1e100.net","10.8.0.1","GQUIC","1390","Payload (Encrypted), PKN: 150"
"306","21.988681","10.8.0.1","ord36s03-in-f12.1e100.net","GQUIC","88","Payload (Encrypted), PKN: 66, CID: 6099468274396608503"
"307","22.013396","ord36s03-in-f12.1e100.net","10.8.0.1","GQUIC","1392","Payload (Encrypted), PKN: 151"
"308","22.013453","10.8.0.1","ord36s03-in-f12.1e100.net","GQUIC","101","Payload (Encrypted), PKN: 67, CID: 6099468274396608503"
"309","22.037430","ord36s03-in-f12.1e100.net","10.8.0.1","GQUIC","1392","Payload (Encrypted), PKN: 152"
"310","22.037490","10.8.0.1","ord36s03-in-f12.1e100.net","GQUIC","88","Payload (Encrypted), PKN: 68, CID: 6099468274396608503"
"311","22.065325","ord36s03-in-f12.1e100.net","10.8.0.1","GQUIC","1392","Payload (Encrypted), PKN: 153"
"312","22.065416","10.8.0.1","ord36s03-in-f12.1e100.net","GQUIC","88","Payload (Encrypted), PKN: 69, CID: 6099468274396608503"
"313","22.117486","ord36s03-in-f12.1e100.net","10.8.0.1","GQUIC","1392","Payload (Encrypted), PKN: 155"
"314","22.117601","10.8.0.1","ord36s03-in-f12.1e100.net","GQUIC","71","Payload (Encrypted), PKN: 70, CID: 6099468274396608503"
