"No.","Time","Source","Destination","Protocol","Length","Info"
"1","0.000000","10.133.24.19","142.250.190.74","TCP","54","48360  >  443 [RST, ACK] Seq=1 Ack=1 Win=133 Len=0"
"2","0.000989","10.133.24.19","3.90.122.13","TCP","54","48432  >  443 [FIN, ACK] Seq=1 Ack=1 Win=150 Len=0"
"3","0.001058","3.90.122.13","10.133.24.19","TCP","54","443  >  48432 [ACK] Seq=1 Ack=2 Win=65535 Len=0"
"4","0.001088","3.90.122.13","10.133.24.19","TCP","54","443  >  48432 [FIN, ACK] Seq=1 Ack=2 Win=65535 Len=0"
"5","0.001094","10.133.24.19","3.90.122.13","TCP","54","48432  >  443 [RST] Seq=2 Win=0 Len=0"
"6","0.002108","10.133.24.19","54.192.58.91","TCP","54","40790  >  443 [RST, ACK] Seq=1 Ack=1 Win=1206 Len=0"
"7","0.002123","10.133.24.19","54.192.58.91","TCP","54","40792  >  443 [RST, ACK] Seq=1 Ack=1 Win=258 Len=0"
"8","0.003528","10.133.24.19","172.217.4.196","TCP","54","43074  >  443 [FIN, ACK] Seq=1 Ack=1 Win=150 Len=0"
"9","0.003595","172.217.4.196","10.133.24.19","TCP","54","443  >  43074 [ACK] Seq=1 Ack=2 Win=65535 Len=0"
"10","0.003624","172.217.4.196","10.133.24.19","TCP","54","443  >  43074 [FIN, ACK] Seq=1 Ack=2 Win=65535 Len=0"
"11","0.003630","10.133.24.19","172.217.4.196","TCP","54","43074  >  443 [RST] Seq=2 Win=0 Len=0"
"12","0.003936","10.8.0.1","34.98.74.57","TCP","74","40390  >  443 [SYN] Seq=0 Win=65535 Len=0 MSS=1460 SACK_PERM=1 TSval=2240169199 TSecr=0 WS=512"
"13","0.004683","34.98.74.57","10.8.0.1","TCP","54","443  >  40390 [SYN, ACK] Seq=0 Ack=1 Win=65535 Len=0"
"14","0.004697","10.133.24.19","104.70.164.33","TCP","54","41686  >  443 [RST, ACK] Seq=1 Ack=1 Win=156 Len=0"
"15","0.004700","10.8.0.1","34.98.74.57","TCP","54","40390  >  443 [ACK] Seq=1 Ack=1 Win=65535 Len=0"
"16","0.009440","10.8.0.1","34.98.74.57","TCP","590","40390  >  443 [ACK] Seq=1 Ack=1 Win=65535 Len=536 [TCP segment of a reassembled PDU]"
"17","0.009831","34.98.74.57","10.8.0.1","TCP","54","443  >  40390 [ACK] Seq=1 Ack=537 Win=65535 Len=0"
"18","0.009846","10.8.0.1","34.98.74.57","TLSv1.3","72","Client Hello"
"19","0.009872","34.98.74.57","10.8.0.1","TCP","54","443  >  40390 [ACK] Seq=1 Ack=555 Win=65535 Len=0"
"20","0.013785","10.8.0.1","157.240.26.55","TCP","74","47642  >  5222 [SYN] Seq=0 Win=65535 Len=0 MSS=1460 SACK_PERM=1 TSval=1303496607 TSecr=0 WS=512"
"21","0.014280","157.240.26.55","10.8.0.1","TCP","54","5222  >  47642 [SYN, ACK] Seq=0 Ack=1 Win=65535 Len=0"
"22","0.014327","10.8.0.1","157.240.26.55","TCP","54","47642  >  5222 [ACK] Seq=1 Ack=1 Win=65535 Len=0"
"23","0.067691","34.98.74.57","10.8.0.1","TLSv1.3","266","Server Hello, Change Cipher Spec, Application Data"
"24","0.067712","10.133.24.19","172.217.4.196","UDP","93","39615  >  443 Len=51"
"25","1.080262","10.8.0.1","104.70.164.33","TCP","74","38384  >  443 [SYN] Seq=0 Win=65535 Len=0 MSS=1460 SACK_PERM=1 TSval=2784651052 TSecr=0 WS=512"
"26","1.081595","104.70.164.33","10.8.0.1","TCP","54","443  >  38384 [SYN, ACK] Seq=0 Ack=1 Win=65535 Len=0"
"27","1.081625","10.8.0.1","157.240.26.55","TCP","58","47642  >  5222 [PSH, ACK] Seq=1 Ack=1 Win=65535 Len=4 [TCP segment of a reassembled PDU]"
"28","1.081689","157.240.26.55","10.8.0.1","TCP","54","5222  >  47642 [ACK] Seq=1 Ack=5 Win=65535 Len=0"
"29","1.081701","10.8.0.1","34.98.74.57","TCP","54","40390  >  443 [ACK] Seq=555 Ack=213 Win=65535 Len=0"
"30","1.081782","10.8.0.1","44.225.120.180","TCP","74","43266  >  443 [SYN] Seq=0 Win=65535 Len=0 MSS=1460 SACK_PERM=1 TSval=1702518046 TSecr=0 WS=512"
"31","1.082476","44.225.120.180","10.8.0.1","TCP","54","443  >  43266 [SYN, ACK] Seq=0 Ack=1 Win=65535 Len=0"
"32","1.082493","10.8.0.1","35.165.233.216","TCP","74","43498  >  443 [SYN] Seq=0 Win=65535 Len=0 MSS=1460 SACK_PERM=1 TSval=1205061027 TSecr=0 WS=512"
"33","1.083545","35.165.233.216","10.8.0.1","TCP","54","443  >  43498 [SYN, ACK] Seq=0 Ack=1 Win=65535 Len=0"
"34","1.083570","10.8.0.1","34.98.74.57","TLSv1.3","118","Change Cipher Spec, Application Data"
"35","1.083623","34.98.74.57","10.8.0.1","TCP","54","443  >  40390 [ACK] Seq=213 Ack=619 Win=65535 Len=0"
"36","1.083636","10.8.0.1","44.225.120.180","TCP","74","43270  >  443 [SYN] Seq=0 Win=65535 Len=0 MSS=1460 SACK_PERM=1 TSval=1702518049 TSecr=0 WS=512"
"37","1.084588","44.225.120.180","10.8.0.1","TCP","54","443  >  43270 [SYN, ACK] Seq=0 Ack=1 Win=65535 Len=0"
"38","1.084689","10.8.0.1","104.70.164.33","TCP","74","38392  >  443 [SYN] Seq=0 Win=65535 Len=0 MSS=1460 SACK_PERM=1 TSval=2784651078 TSecr=0 WS=512"
"39","1.085611","104.70.164.33","10.8.0.1","TCP","54","443  >  38392 [SYN, ACK] Seq=0 Ack=1 Win=65535 Len=0"
"40","1.085639","10.8.0.1","151.101.150.73","TCP","74","38638  >  443 [SYN] Seq=0 Win=65535 Len=0 MSS=1460 SACK_PERM=1 TSval=4150479928 TSecr=0 WS=512"
"41","1.086584","151.101.150.73","10.8.0.1","TCP","54","443  >  38638 [SYN, ACK] Seq=0 Ack=1 Win=65535 Len=0"
"42","1.086614","10.8.0.1","151.101.150.73","TCP","74","38640  >  443 [SYN] Seq=0 Win=65535 Len=0 MSS=1460 SACK_PERM=1 TSval=4150479929 TSecr=0 WS=512"
"43","1.087629","151.101.150.73","10.8.0.1","TCP","54","443  >  38640 [SYN, ACK] Seq=0 Ack=1 Win=65535 Len=0"
"44","1.087659","10.8.0.1","104.70.164.18","TCP","74","46056  >  443 [SYN] Seq=0 Win=65535 Len=0 MSS=1460 SACK_PERM=1 TSval=2760485825 TSecr=0 WS=512"
"45","1.089016","104.70.164.18","10.8.0.1","TCP","54","443  >  46056 [SYN, ACK] Seq=0 Ack=1 Win=65535 Len=0"
"46","1.089041","10.8.0.1","104.70.164.18","TCP","74","46058  >  443 [SYN] Seq=0 Win=65535 Len=0 MSS=1460 SACK_PERM=1 TSval=2760485825 TSecr=0 WS=512"
"47","1.091805","104.70.164.18","10.8.0.1","TCP","54","443  >  46058 [SYN, ACK] Seq=0 Ack=1 Win=65535 Len=0"
"48","1.091825","10.8.0.1","151.101.150.73","TCP","74","38646  >  443 [SYN] Seq=0 Win=65535 Len=0 MSS=1460 SACK_PERM=1 TSval=4150479931 TSecr=0 WS=512"
"49","1.092585","151.101.150.73","10.8.0.1","TCP","54","443  >  38646 [SYN, ACK] Seq=0 Ack=1 Win=65535 Len=0"
"50","1.092614","10.8.0.1","104.70.164.18","TCP","74","46062  >  443 [SYN] Seq=0 Win=65535 Len=0 MSS=1460 SACK_PERM=1 TSval=2760485826 TSecr=0 WS=512"
"51","1.093284","104.70.164.18","10.8.0.1","TCP","54","443  >  46062 [SYN, ACK] Seq=0 Ack=1 Win=65535 Len=0"
"52","1.093303","10.8.0.1","35.186.224.25","TCP","74","49102  >  443 [SYN] Seq=0 Win=65535 Len=0 MSS=1460 SACK_PERM=1 TSval=1328222701 TSecr=0 WS=512"
"53","1.094325","35.186.224.25","10.8.0.1","TCP","54","443  >  49102 [SYN, ACK] Seq=0 Ack=1 Win=65535 Len=0"
"54","1.094350","10.8.0.1","157.240.26.55","TCP","58","[TCP Spurious Retransmission] 47642  >  5222 [PSH, ACK] Seq=1 Ack=1 Win=65535 Len=4"
"55","1.094388","157.240.26.55","10.8.0.1","TCP","54","[TCP Dup ACK 28#1] 5222  >  47642 [ACK] Seq=1 Ack=5 Win=65535 Len=0"
"56","1.094405","10.8.0.1","34.98.74.57","TLSv1.3","118","[TCP Spurious Retransmission] , Change Cipher Spec, Application Data"
"57","1.094430","34.98.74.57","10.8.0.1","TCP","54","[TCP Dup ACK 35#1] 443  >  40390 [ACK] Seq=213 Ack=619 Win=65535 Len=0"
"58","1.094506","10.8.0.1","104.70.164.18","TCP","74","46066  >  443 [SYN] Seq=0 Win=65535 Len=0 MSS=1460 SACK_PERM=1 TSval=2760486089 TSecr=0 WS=512"
"59","1.095497","104.70.164.18","10.8.0.1","TCP","54","443  >  46066 [SYN, ACK] Seq=0 Ack=1 Win=65535 Len=0"
"60","1.095537","10.8.0.1","142.251.4.188","TCP","74","39610  >  5228 [SYN] Seq=0 Win=65535 Len=0 MSS=1460 SACK_PERM=1 TSval=2090190141 TSecr=0 WS=512"
"61","1.096633","142.251.4.188","10.8.0.1","TCP","54","5228  >  39610 [SYN, ACK] Seq=0 Ack=1 Win=65535 Len=0"
"62","1.096661","10.8.0.1","104.70.164.18","TCP","74","46070  >  443 [SYN] Seq=0 Win=65535 Len=0 MSS=1460 SACK_PERM=1 TSval=2760486146 TSecr=0 WS=512"
"63","1.097663","104.70.164.18","10.8.0.1","TCP","54","443  >  46070 [SYN, ACK] Seq=0 Ack=1 Win=65535 Len=0"
"64","1.097696","10.8.0.1","104.70.164.33","TCP","74","38414  >  443 [SYN] Seq=0 Win=65535 Len=0 MSS=1460 SACK_PERM=1 TSval=2784651428 TSecr=0 WS=512"
"65","1.098677","104.70.164.33","10.8.0.1","TCP","54","443  >  38414 [SYN, ACK] Seq=0 Ack=1 Win=65535 Len=0"
"66","1.098750","34.98.74.57","10.8.0.1","TLSv1.3","634","Application Data, Application Data"
"67","1.098768","10.8.0.1","104.70.164.33","TCP","74","38416  >  443 [SYN] Seq=0 Win=65535 Len=0 MSS=1460 SACK_PERM=1 TSval=2784651428 TSecr=0 WS=512"
"68","1.099756","104.70.164.33","10.8.0.1","TCP","54","443  >  38416 [SYN, ACK] Seq=0 Ack=1 Win=65535 Len=0"
"69","1.099783","10.8.0.1","104.70.164.33","TCP","74","38418  >  443 [SYN] Seq=0 Win=65535 Len=0 MSS=1460 SACK_PERM=1 TSval=2784651429 TSecr=0 WS=512"
"70","1.100603","104.70.164.33","10.8.0.1","TCP","54","443  >  38418 [SYN, ACK] Seq=0 Ack=1 Win=65535 Len=0"
"71","1.100621","10.8.0.1","157.240.26.55","TCP","58","[TCP Spurious Retransmission] 47642  >  5222 [PSH, ACK] Seq=1 Ack=1 Win=65535 Len=4"
"72","1.100642","157.240.26.55","10.8.0.1","TCP","54","[TCP Dup ACK 28#2] 5222  >  47642 [ACK] Seq=1 Ack=5 Win=65535 Len=0"
"73","1.100671","157.240.26.55","10.8.0.1","TCP","54","5222  >  47642 [FIN, ACK] Seq=1 Ack=5 Win=65535 Len=0"
"74","1.100868","10.8.0.1","34.98.74.57","TLSv1.3","118","[TCP Spurious Retransmission] , Change Cipher Spec, Application Data"
"75","1.100976","34.98.74.57","10.8.0.1","TCP","54","443  >  40390 [ACK] Seq=213 Ack=619 Win=65535 Len=0"
"76","1.100995","10.8.0.1","104.70.164.33","TCP","74","38420  >  443 [SYN] Seq=0 Win=65535 Len=0 MSS=1460 SACK_PERM=1 TSval=2784651722 TSecr=0 WS=512"
"77","1.101762","104.70.164.33","10.8.0.1","TCP","54","443  >  38420 [SYN, ACK] Seq=0 Ack=1 Win=65535 Len=0"
"78","1.101791","10.8.0.1","35.186.224.47","TCP","74","39946  >  443 [SYN] Seq=0 Win=65535 Len=0 MSS=1460 SACK_PERM=1 TSval=2593429185 TSecr=0 WS=512"
"79","1.102494","35.186.224.47","10.8.0.1","TCP","54","443  >  39946 [SYN, ACK] Seq=0 Ack=1 Win=65535 Len=0"
"80","1.102508","10.8.0.1","104.70.164.33","TCP","74","38424  >  443 [SYN] Seq=0 Win=65535 Len=0 MSS=1460 SACK_PERM=1 TSval=2784651788 TSecr=0 WS=512"
"81","1.103079","104.70.164.33","10.8.0.1","TCP","54","443  >  38424 [SYN, ACK] Seq=0 Ack=1 Win=65535 Len=0"
"82","1.103096","10.8.0.1","104.70.164.18","TCP","74","46084  >  443 [SYN] Seq=0 Win=65535 Len=0 MSS=1460 SACK_PERM=1 TSval=2760486508 TSecr=0 WS=512"
"83","1.103642","104.70.164.18","10.8.0.1","TCP","54","443  >  46084 [SYN, ACK] Seq=0 Ack=1 Win=65535 Len=0"
"84","1.103655","10.8.0.1","104.70.164.18","TCP","74","46086  >  443 [SYN] Seq=0 Win=65535 Len=0 MSS=1460 SACK_PERM=1 TSval=2760486509 TSecr=0 WS=512"
"85","1.104236","104.70.164.18","10.8.0.1","TCP","54","443  >  46086 [SYN, ACK] Seq=0 Ack=1 Win=65535 Len=0"
"86","1.104251","10.8.0.1","104.70.164.18","TCP","74","46088  >  443 [SYN] Seq=0 Win=65535 Len=0 MSS=1460 SACK_PERM=1 TSval=2760486510 TSecr=0 WS=512"
"87","1.104821","104.70.164.18","10.8.0.1","TCP","54","443  >  46088 [SYN, ACK] Seq=0 Ack=1 Win=65535 Len=0"
"88","1.104852","10.8.0.1","104.70.164.18","TCP","74","46090  >  443 [SYN] Seq=0 Win=65535 Len=0 MSS=1460 SACK_PERM=1 TSval=2760486770 TSecr=0 WS=512"
"89","1.105408","104.70.164.18","10.8.0.1","TCP","54","443  >  46090 [SYN, ACK] Seq=0 Ack=1 Win=65535 Len=0"
"90","1.105422","10.8.0.1","104.70.164.33","TCP","74","[TCP Retransmission] 38392  >  443 [SYN] Seq=0 Win=65535 Len=0 MSS=1460 SACK_PERM=1 TSval=2784652083 TSecr=0 WS=512"
"91","1.106200","104.70.164.33","10.8.0.1","TCP","54","[TCP Retransmission] 443  >  38392 [SYN, ACK] Seq=0 Ack=1 Win=65535 Len=0"
"92","1.106217","10.8.0.1","44.225.120.180","TCP","74","[TCP Retransmission] 43270  >  443 [SYN] Seq=0 Win=65535 Len=0 MSS=1460 SACK_PERM=1 TSval=1702519057 TSecr=0 WS=512"
"93","1.106819","44.225.120.180","10.8.0.1","TCP","54","[TCP Retransmission] 443  >  43270 [SYN, ACK] Seq=0 Ack=1 Win=65535 Len=0"
"94","1.106835","10.8.0.1","44.225.120.180","TCP","74","[TCP Retransmission] 43266  >  443 [SYN] Seq=0 Win=65535 Len=0 MSS=1460 SACK_PERM=1 TSval=1702519057 TSecr=0 WS=512"
"95","1.107676","44.225.120.180","10.8.0.1","TCP","54","[TCP Retransmission] 443  >  43266 [SYN, ACK] Seq=0 Ack=1 Win=65535 Len=0"
"96","1.107698","10.8.0.1","35.165.233.216","TCP","74","[TCP Retransmission] 43498  >  443 [SYN] Seq=0 Win=65535 Len=0 MSS=1460 SACK_PERM=1 TSval=1205062038 TSecr=0 WS=512"
"97","1.108329","35.165.233.216","10.8.0.1","TCP","54","[TCP Retransmission] 443  >  43498 [SYN, ACK] Seq=0 Ack=1 Win=65535 Len=0"
"98","1.108345","10.8.0.1","104.70.164.33","TCP","54","38384  >  443 [RST] Seq=1 Win=0 Len=0"
"99","1.108398","10.8.0.1","157.240.26.55","TCP","325","47642  >  5222 [PSH, ACK] Seq=5 Ack=1 Win=65535 Len=271 [TCP segment of a reassembled PDU]"
"100","1.108407","10.8.0.1","44.225.120.180","TCP","54","43266  >  443 [ACK] Seq=1 Ack=1 Win=33553920 Len=0"
"101","1.108413","10.8.0.1","35.165.233.216","TCP","54","43498  >  443 [ACK] Seq=1 Ack=1 Win=33553920 Len=0"
"102","1.108421","10.8.0.1","34.98.74.57","TLSv1.3","277","Application Data, Application Data, Application Data, Application Data"
"103","1.108518","34.98.74.57","10.8.0.1","TCP","54","443  >  40390 [ACK] Seq=213 Ack=842 Win=65535 Len=0"
"104","1.108548","10.8.0.1","44.225.120.180","TCP","54","43270  >  443 [ACK] Seq=1 Ack=1 Win=33553920 Len=0"
"105","1.108594","10.8.0.1","44.225.120.180","TLSv1","571","Client Hello"
"106","1.108660","44.225.120.180","10.8.0.1","TCP","54","443  >  43266 [ACK] Seq=1 Ack=518 Win=65535 Len=0"
"107","1.108683","10.8.0.1","35.165.233.216","TLSv1","571","Client Hello"
"108","1.108731","35.165.233.216","10.8.0.1","TCP","54","443  >  43498 [ACK] Seq=1 Ack=518 Win=65535 Len=0"
"109","1.108748","10.8.0.1","104.70.164.33","TCP","54","38392  >  443 [ACK] Seq=1 Ack=1 Win=33553920 Len=0"
"110","1.108757","10.8.0.1","44.225.120.180","TLSv1","571","Client Hello"
"111","1.108774","44.225.120.180","10.8.0.1","TCP","54","443  >  43270 [ACK] Seq=1 Ack=518 Win=65535 Len=0"
"112","1.108783","10.8.0.1","104.70.164.33","TCP","590","38392  >  443 [ACK] Seq=1 Ack=1 Win=33553920 Len=536 [TCP segment of a reassembled PDU]"
"113","1.108818","104.70.164.33","10.8.0.1","TCP","54","443  >  38392 [ACK] Seq=1 Ack=537 Win=65535 Len=0"
"114","1.108827","10.8.0.1","104.70.164.33","TLSv1","123","Client Hello"
"115","1.108848","104.70.164.33","10.8.0.1","TCP","54","443  >  38392 [ACK] Seq=1 Ack=606 Win=65535 Len=0"
"116","1.108857","10.8.0.1","151.101.150.73","TCP","54","38638  >  443 [ACK] Seq=1 Ack=1 Win=65535 Len=0"
"117","1.108869","10.8.0.1","151.101.150.73","TLSv1.3","571","Client Hello"
"118","1.108888","151.101.150.73","10.8.0.1","TCP","54","443  >  38638 [ACK] Seq=1 Ack=518 Win=65535 Len=0"
"119","1.108896","10.8.0.1","151.101.150.73","TCP","54","38640  >  443 [ACK] Seq=1 Ack=1 Win=65535 Len=0"
"120","1.108961","10.8.0.1","104.70.164.18","TCP","54","46056  >  443 [RST] Seq=1 Win=0 Len=0"
"121","1.109020","10.8.0.1","151.101.150.73","TLSv1.3","571","Client Hello"
"122","1.109049","151.101.150.73","10.8.0.1","TCP","54","443  >  38640 [ACK] Seq=1 Ack=518 Win=65535 Len=0"
"123","1.109062","10.8.0.1","104.70.164.18","TCP","54","46058  >  443 [RST] Seq=1 Win=0 Len=0"
"124","1.109211","10.8.0.1","151.101.150.73","TCP","54","38646  >  443 [ACK] Seq=1 Ack=1 Win=65535 Len=0"
"125","1.109227","10.8.0.1","151.101.150.73","TLSv1.3","571","Client Hello"
"126","1.109251","151.101.150.73","10.8.0.1","TCP","54","443  >  38646 [ACK] Seq=1 Ack=518 Win=65535 Len=0"
"127","1.109260","10.8.0.1","104.70.164.18","TCP","54","46062  >  443 [RST] Seq=1 Win=0 Len=0"
"128","1.109358","10.8.0.1","35.186.224.25","TCP","54","49102  >  443 [ACK] Seq=1 Ack=1 Win=65535 Len=0"
"129","1.109372","10.8.0.1","104.70.164.18","TCP","54","46066  >  443 [RST] Seq=1 Win=0 Len=0"
"130","1.109431","10.8.0.1","35.186.224.25","TCP","590","49102  >  443 [ACK] Seq=1 Ack=1 Win=65535 Len=536 [TCP segment of a reassembled PDU]"
"131","1.109458","35.186.224.25","10.8.0.1","TCP","54","443  >  49102 [ACK] Seq=1 Ack=537 Win=65535 Len=0"
"132","1.109467","10.8.0.1","35.186.224.25","TLSv1.3","74","Client Hello"
"133","1.109486","35.186.224.25","10.8.0.1","TCP","54","443  >  49102 [ACK] Seq=1 Ack=557 Win=65535 Len=0"
"134","1.109496","10.8.0.1","142.251.4.188","TCP","54","39610  >  5228 [ACK] Seq=1 Ack=1 Win=65535 Len=0"
"135","1.109531","10.8.0.1","104.70.164.18","TCP","54","46070  >  443 [RST] Seq=1 Win=0 Len=0"
"136","1.109595","10.8.0.1","142.251.4.188","TLSv1.3","587","Client Hello"
"137","1.109630","142.251.4.188","10.8.0.1","TCP","54","5228  >  39610 [ACK] Seq=1 Ack=534 Win=65535 Len=0"
"138","1.109642","10.8.0.1","104.70.164.33","TCP","54","38414  >  443 [RST] Seq=1 Win=0 Len=0"
"139","1.109690","10.8.0.1","104.70.164.33","TCP","54","38416  >  443 [RST] Seq=1 Win=0 Len=0"
"140","1.109736","10.8.0.1","104.70.164.33","TCP","54","38418  >  443 [RST] Seq=1 Win=0 Len=0"
"141","1.109780","10.8.0.1","157.240.26.55","TCP","54","47642  >  5222 [FIN, ACK] Seq=276 Ack=2 Win=65535 Len=0"
"142","1.109922","157.240.26.55","10.8.0.1","TCP","54","5222  >  47642 [ACK] Seq=2 Ack=277 Win=65535 Len=0"
"143","1.109981","157.240.26.55","10.8.0.1","TCP","54","5222  >  47642 [FIN, ACK] Seq=2 Ack=277 Win=65535 Len=0"
"144","1.109995","10.8.0.1","104.70.164.33","TCP","54","38420  >  443 [RST] Seq=1 Win=0 Len=0"
"145","1.110061","10.8.0.1","35.186.224.47","TCP","54","39946  >  443 [ACK] Seq=1 Ack=1 Win=65535 Len=0"
"146","1.110072","10.8.0.1","104.70.164.33","TCP","54","38424  >  443 [ACK] Seq=1 Ack=1 Win=65535 Len=0"
"147","1.110080","10.8.0.1","104.70.164.18","TCP","54","46084  >  443 [ACK] Seq=1 Ack=1 Win=65535 Len=0"
"148","1.110089","10.8.0.1","104.70.164.33","TLSv1.3","571","Client Hello"
"149","1.110114","104.70.164.33","10.8.0.1","TCP","54","443  >  38424 [ACK] Seq=1 Ack=518 Win=65535 Len=0"
"150","1.110123","10.8.0.1","104.70.164.18","TCP","54","46086  >  443 [ACK] Seq=1 Ack=1 Win=65535 Len=0"
"151","1.110170","10.8.0.1","104.70.164.18","TLSv1.3","571","Client Hello"
"152","1.110193","104.70.164.18","10.8.0.1","TCP","54","443  >  46084 [ACK] Seq=1 Ack=518 Win=65535 Len=0"
"153","1.110201","10.8.0.1","104.70.164.18","TLSv1.3","571","Client Hello"
"154","1.110218","104.70.164.18","10.8.0.1","TCP","54","443  >  46086 [ACK] Seq=1 Ack=518 Win=65535 Len=0"
"155","1.110266","10.8.0.1","104.70.164.18","TCP","54","46088  >  443 [ACK] Seq=1 Ack=1 Win=65535 Len=0"
"156","1.110275","10.8.0.1","104.70.164.18","TLSv1.3","571","Client Hello"
"157","1.110304","104.70.164.18","10.8.0.1","TCP","54","443  >  46088 [ACK] Seq=1 Ack=518 Win=65535 Len=0"
"158","1.110312","10.8.0.1","104.70.164.18","TCP","54","46090  >  443 [ACK] Seq=1 Ack=1 Win=65535 Len=0"
"159","1.110318","10.8.0.1","104.70.164.33","TCP","54","[TCP Dup ACK 109#1] 38392  >  443 [ACK] Seq=606 Ack=1 Win=33553920 Len=0"
"160","1.110325","10.8.0.1","44.225.120.180","TCP","54","[TCP Dup ACK 104#1] 43270  >  443 [ACK] Seq=518 Ack=1 Win=33553920 Len=0"
"161","1.110331","10.8.0.1","104.70.164.18","TLSv1.3","571","Client Hello"
"162","1.110347","104.70.164.18","10.8.0.1","TCP","54","443  >  46090 [ACK] Seq=1 Ack=518 Win=65535 Len=0"
"163","1.110353","10.8.0.1","44.225.120.180","TCP","54","[TCP Dup ACK 100#1] 43266  >  443 [ACK] Seq=518 Ack=1 Win=33553920 Len=0"
"164","1.110359","10.8.0.1","35.165.233.216","TCP","54","[TCP Dup ACK 101#1] 43498  >  443 [ACK] Seq=518 Ack=1 Win=33553920 Len=0"
"165","1.110365","10.8.0.1","34.98.74.57","TLSv1.3","85","Application Data"
"166","1.110380","34.98.74.57","10.8.0.1","TCP","54","443  >  40390 [ACK] Seq=793 Ack=873 Win=65535 Len=0"
"167","1.110386","10.8.0.1","157.240.26.55","TCP","74","47074  >  80 [SYN] Seq=0 Win=65535 Len=0 MSS=1460 SACK_PERM=1 TSval=1303497704 TSecr=0 WS=512"
"168","1.111089","157.240.26.55","10.8.0.1","TCP","54","80  >  47074 [SYN, ACK] Seq=0 Ack=1 Win=65535 Len=0"
"169","1.111108","10.8.0.1","157.240.26.55","TCP","54","47642  >  5222 [RST] Seq=277 Win=0 Len=0"
"170","1.111148","10.8.0.1","35.186.224.47","TLSv1.2","480","Client Hello"
"171","1.111168","35.186.224.47","10.8.0.1","TCP","54","443  >  39946 [ACK] Seq=1 Ack=427 Win=65535 Len=0"
"172","1.111175","10.8.0.1","157.240.26.55","TCP","54","47074  >  80 [ACK] Seq=1 Ack=1 Win=65535 Len=0"
"173","1.161575","104.70.164.18","10.8.0.1","TLSv1.3","4170","Server Hello, Change Cipher Spec, Application Data, Application Data, Application Data, Application Data"
"174","1.161688","34.98.74.57","10.8.0.1","TCP","54","443  >  40390 [FIN, ACK] Seq=793 Ack=873 Win=65535 Len=0"
"175","1.161764","151.101.150.73","10.8.0.1","TLSv1.3","4360","Server Hello, Change Cipher Spec, Application Data, Application Data, Application Data, Application Data, Application Data"
"176","1.161813","151.101.150.73","10.8.0.1","TLSv1.3","4360","Server Hello, Change Cipher Spec, Application Data, Application Data, Application Data, Application Data, Application Data"
"177","1.161827","10.8.0.1","157.240.26.55","TCP","211","47074  >  80 [PSH, ACK] Seq=1 Ack=1 Win=65535 Len=157 [TCP segment of a reassembled PDU]"
"178","1.161857","157.240.26.55","10.8.0.1","TCP","54","80  >  47074 [ACK] Seq=1 Ack=158 Win=65535 Len=0"
"179","1.161925","151.101.150.73","10.8.0.1","TLSv1.3","4360","Server Hello, Change Cipher Spec, Application Data, Application Data, Application Data, Application Data, Application Data"
"180","1.161968","104.70.164.18","10.8.0.1","TLSv1.3","4170","Server Hello, Change Cipher Spec, Application Data, Application Data, Application Data, Application Data"
"181","1.162040","104.70.164.18","10.8.0.1","TLSv1.3","4170","Server Hello, Change Cipher Spec, Application Data, Application Data, Application Data, Application Data"
"182","1.162080","104.70.164.33","10.8.0.1","TLSv1.3","4170","Server Hello, Change Cipher Spec, Application Data, Application Data, Application Data, Application Data"
"183","1.162118","35.186.224.25","10.8.0.1","TLSv1.3","266","Server Hello, Change Cipher Spec, Application Data"
"184","1.162129","10.8.0.1","104.70.164.18","TCP","54","46090  >  443 [ACK] Seq=518 Ack=4117 Win=65535 Len=0"
"185","1.162170","10.8.0.1","151.101.150.73","TCP","54","38646  >  443 [ACK] Seq=518 Ack=4307 Win=65535 Len=0"
"186","1.162190","10.8.0.1","151.101.150.73","TCP","54","38638  >  443 [ACK] Seq=518 Ack=4307 Win=65535 Len=0"
"187","1.162197","10.8.0.1","157.240.26.55","TCP","336","47074  >  80 [PSH, ACK] Seq=158 Ack=1 Win=65535 Len=282 [TCP segment of a reassembled PDU]"
"188","1.162221","157.240.26.55","10.8.0.1","TCP","54","80  >  47074 [ACK] Seq=1 Ack=440 Win=65535 Len=0"
"189","1.162228","10.8.0.1","151.101.150.73","TCP","54","38640  >  443 [ACK] Seq=518 Ack=4307 Win=65535 Len=0"
"190","1.162239","10.8.0.1","104.70.164.18","TCP","54","46084  >  443 [ACK] Seq=518 Ack=4117 Win=65535 Len=0"
"191","1.162244","10.8.0.1","104.70.164.18","TCP","54","46086  >  443 [ACK] Seq=518 Ack=4117 Win=65535 Len=0"
"192","1.162248","10.8.0.1","104.70.164.33","TCP","54","38424  >  443 [ACK] Seq=518 Ack=4117 Win=65535 Len=0"
"193","1.162252","10.8.0.1","35.186.224.25","TCP","54","49102  >  443 [ACK] Seq=557 Ack=213 Win=65535 Len=0"
"194","1.162257","10.8.0.1","34.98.74.57","TLSv1.3","93","Application Data"
"195","1.163716","10.8.0.1","104.70.164.18","TLSv1.3","134","Change Cipher Spec, Application Data"
"196","1.163771","104.70.164.18","10.8.0.1","TCP","54","443  >  46090 [ACK] Seq=4117 Ack=598 Win=65535 Len=0"
"197","1.214755","104.70.164.18","10.8.0.1","TLSv1.3","660","Application Data, Application Data"
"198","1.214791","10.8.0.1","34.98.74.57","TLSv1.3","113","Application Data, Application Data"
"199","1.214833","34.98.74.57","10.8.0.1","TCP","54","443  >  40390 [ACK] Seq=794 Ack=913 Win=65535 Len=0"
"200","1.214857","34.98.74.57","10.8.0.1","TCP","54","443  >  40390 [FIN, ACK] Seq=794 Ack=913 Win=65535 Len=0"
"201","1.214936","104.70.164.18","10.8.0.1","TLSv1.3","4170","Server Hello, Change Cipher Spec, Application Data, Application Data, Application Data, Application Data"
"202","1.215051","35.186.224.47","10.8.0.1","TLSv1.2","3449","Server Hello, Certificate, Server Key Exchange, Server Hello Done"
"203","1.215141","142.251.4.188","10.8.0.1","TLSv1.3","257","Server Hello, Change Cipher Spec, Application Data"
"204","1.215206","157.240.26.55","10.8.0.1","TCP","183","80  >  47074 [PSH, ACK] Seq=1 Ack=440 Win=65535 Len=129 [TCP segment of a reassembled PDU]"
"205","1.215224","10.8.0.1","10.133.131.19","TCP","74","38660  >  8009 [SYN] Seq=0 Win=65535 Len=0 MSS=1460 SACK_PERM=1 TSval=1888649026 TSecr=0 WS=512"
"206","1.218920","10.133.131.19","10.8.0.1","TCP","54","8009  >  38660 [SYN, ACK] Seq=0 Ack=1 Win=65535 Len=0"
"207","1.218940","10.8.0.1","151.101.150.73","TLSv1.3","118","Change Cipher Spec, Application Data"
"208","1.218966","151.101.150.73","10.8.0.1","TCP","54","443  >  38646 [ACK] Seq=4307 Ack=582 Win=65535 Len=0"
"209","1.218979","10.8.0.1","35.186.224.25","TLSv1.3","118","Change Cipher Spec, Application Data"
"210","1.219011","35.186.224.25","10.8.0.1","TCP","54","443  >  49102 [ACK] Seq=213 Ack=621 Win=65535 Len=0"
"211","1.219076","10.8.0.1","151.101.150.73","TLSv1.3","118","Change Cipher Spec, Application Data"
"212","1.219108","151.101.150.73","10.8.0.1","TCP","54","443  >  38638 [ACK] Seq=4307 Ack=582 Win=65535 Len=0"
"213","1.219161","10.8.0.1","35.186.224.25","TLSv1.3","590","Application Data, Application Data, Application Data"
"214","1.219185","35.186.224.25","10.8.0.1","TCP","54","443  >  49102 [ACK] Seq=213 Ack=1157 Win=65535 Len=0"
"215","1.219227","10.8.0.1","35.186.224.25","TCP","590","49102  >  443 [ACK] Seq=1157 Ack=213 Win=65535 Len=536 [TCP segment of a reassembled PDU]"
"216","1.219258","35.186.224.25","10.8.0.1","TCP","54","443  >  49102 [ACK] Seq=213 Ack=1693 Win=65535 Len=0"
"217","1.219266","10.8.0.1","151.101.150.73","TLSv1.3","118","Change Cipher Spec, Application Data"
"218","1.219281","151.101.150.73","10.8.0.1","TCP","54","443  >  38640 [ACK] Seq=4307 Ack=582 Win=65535 Len=0"
"219","1.219288","10.8.0.1","104.70.164.18","TLSv1.3","134","Change Cipher Spec, Application Data"
"220","1.219306","104.70.164.18","10.8.0.1","TCP","54","443  >  46084 [ACK] Seq=4117 Ack=598 Win=65535 Len=0"
"221","1.219344","10.8.0.1","104.70.164.18","TLSv1.3","134","Change Cipher Spec, Application Data"
"222","1.219365","104.70.164.18","10.8.0.1","TCP","54","443  >  46086 [ACK] Seq=4117 Ack=598 Win=65535 Len=0"
"223","1.219400","10.8.0.1","104.70.164.33","TLSv1.3","134","Change Cipher Spec, Application Data"
"224","1.219418","104.70.164.33","10.8.0.1","TCP","54","443  >  38424 [ACK] Seq=4117 Ack=598 Win=65535 Len=0"
"225","1.219453","10.8.0.1","104.70.164.18","TCP","54","46084  >  443 [FIN, ACK] Seq=598 Ack=4117 Win=65535 Len=0"
"226","1.219484","104.70.164.18","10.8.0.1","TCP","54","443  >  46084 [ACK] Seq=4117 Ack=599 Win=65535 Len=0"
"227","1.219515","104.70.164.18","10.8.0.1","TCP","54","443  >  46084 [FIN, ACK] Seq=4117 Ack=599 Win=65535 Len=0"
"228","1.219595","10.8.0.1","104.70.164.18","TLSv1.3","140","Application Data"
"229","1.219627","104.70.164.18","10.8.0.1","TCP","54","443  >  46090 [ACK] Seq=4117 Ack=684 Win=65535 Len=0"
"230","1.219637","10.8.0.1","104.70.164.18","TCP","590","46090  >  443 [ACK] Seq=684 Ack=4117 Win=65535 Len=536 [TCP segment of a reassembled PDU]"
"231","1.219658","104.70.164.18","10.8.0.1","TCP","54","443  >  46090 [ACK] Seq=4117 Ack=1220 Win=65535 Len=0"
"232","1.219667","10.8.0.1","104.70.164.18","TCP","590","46090  >  443 [ACK] Seq=1220 Ack=4117 Win=65535 Len=536 [TCP segment of a reassembled PDU]"
"233","1.219680","104.70.164.18","10.8.0.1","TCP","54","443  >  46090 [ACK] Seq=4117 Ack=1756 Win=65535 Len=0"
"234","1.219685","10.8.0.1","104.70.164.18","TCP","590","46090  >  443 [ACK] Seq=1756 Ack=4117 Win=65535 Len=536 [TCP segment of a reassembled PDU]"
"235","1.219697","104.70.164.18","10.8.0.1","TCP","54","443  >  46090 [ACK] Seq=4117 Ack=2292 Win=65535 Len=0"
"236","1.219702","10.8.0.1","104.70.164.18","TCP","590","46090  >  443 [ACK] Seq=2292 Ack=4117 Win=65535 Len=536 [TCP segment of a reassembled PDU]"
"237","1.219714","104.70.164.18","10.8.0.1","TCP","54","443  >  46090 [ACK] Seq=4117 Ack=2828 Win=65535 Len=0"
"238","1.219726","10.8.0.1","104.70.164.18","TLSv1.3","189","Application Data"
"239","1.219738","104.70.164.18","10.8.0.1","TCP","54","443  >  46090 [ACK] Seq=4117 Ack=2963 Win=65535 Len=0"
"240","1.219744","10.8.0.1","104.154.127.106","TCP","74","46126  >  443 [SYN] Seq=0 Win=65535 Len=0 MSS=1460 SACK_PERM=1 TSval=2316782231 TSecr=0 WS=512"
"241","1.221063","104.154.127.106","10.8.0.1","TCP","54","443  >  46126 [SYN, ACK] Seq=0 Ack=1 Win=65535 Len=0"
"242","1.221171","10.8.0.1","104.70.164.18","TCP","590","46090  >  443 [ACK] Seq=2963 Ack=4117 Win=65535 Len=536 [TCP segment of a reassembled PDU]"
"243","1.221210","104.70.164.18","10.8.0.1","TCP","54","443  >  46090 [ACK] Seq=4117 Ack=3499 Win=65535 Len=0"
"244","1.221224","10.8.0.1","104.70.164.18","TCP","590","46090  >  443 [ACK] Seq=3499 Ack=4117 Win=65535 Len=536 [TCP segment of a reassembled PDU]"
"245","1.221249","104.70.164.18","10.8.0.1","TCP","54","443  >  46090 [ACK] Seq=4117 Ack=4035 Win=65535 Len=0"
"246","1.221260","10.8.0.1","104.70.164.18","TLSv1.3","104","Application Data"
"247","1.221279","104.70.164.18","10.8.0.1","TCP","54","443  >  46090 [ACK] Seq=4117 Ack=4085 Win=65535 Len=0"
"248","1.221290","10.8.0.1","104.70.164.18","TLSv1.3","491","Application Data"
"249","1.221310","104.70.164.18","10.8.0.1","TCP","54","443  >  46090 [ACK] Seq=4117 Ack=4522 Win=65535 Len=0"
"250","1.221366","10.8.0.1","104.70.164.18","TCP","54","46088  >  443 [ACK] Seq=518 Ack=4117 Win=65535 Len=0"
"251","1.221380","10.8.0.1","35.186.224.47","TCP","54","39946  >  443 [ACK] Seq=427 Ack=3396 Win=65535 Len=0"
"252","1.221390","10.8.0.1","142.251.4.188","TCP","54","39610  >  5228 [ACK] Seq=534 Ack=204 Win=65535 Len=0"
"253","1.221400","10.8.0.1","157.240.26.55","TCP","54","47074  >  80 [ACK] Seq=440 Ack=130 Win=65535 Len=0"
"254","1.221410","10.8.0.1","142.251.4.188","TLSv1.3","118","Change Cipher Spec, Application Data"
"255","1.221441","142.251.4.188","10.8.0.1","TCP","54","5228  >  39610 [ACK] Seq=204 Ack=598 Win=65535 Len=0"
"256","1.221452","10.8.0.1","104.70.164.18","TLSv1.3","134","Change Cipher Spec, Application Data"
"257","1.221476","104.70.164.18","10.8.0.1","TCP","54","443  >  46088 [ACK] Seq=4117 Ack=598 Win=65535 Len=0"
"258","1.221524","10.8.0.1","10.133.131.19","TCP","54","38660  >  8009 [ACK] Seq=1 Ack=1 Win=65535 Len=0"
"259","1.221571","10.8.0.1","35.186.224.25","TLSv1.3","244","Application Data"
"260","1.221603","35.186.224.25","10.8.0.1","TCP","54","443  >  49102 [ACK] Seq=213 Ack=1883 Win=65535 Len=0"
"261","1.221615","10.8.0.1","104.70.164.18","TCP","54","46084  >  443 [ACK] Seq=599 Ack=4118 Win=65535 Len=0"
"262","1.221632","10.8.0.1","104.70.164.18","TLSv1.3","494","Application Data"
"263","1.221678","104.70.164.18","10.8.0.1","TCP","54","443  >  46090 [ACK] Seq=4723 Ack=4962 Win=65535 Len=0"
"264","1.221689","10.8.0.1","104.70.164.18","TCP","54","[TCP Dup ACK 262#1] 46090  >  443 [ACK] Seq=4962 Ack=4723 Win=65535 Len=0"
"265","1.221701","10.8.0.1","104.154.127.106","TCP","54","46126  >  443 [ACK] Seq=1 Ack=1 Win=65535 Len=0"
"266","1.223155","10.8.0.1","142.251.4.188","TLSv1.3","485","Application Data"
"267","1.223203","142.251.4.188","10.8.0.1","TCP","54","5228  >  39610 [ACK] Seq=204 Ack=1029 Win=65535 Len=0"
"268","1.273465","104.70.164.33","10.8.0.1","TLSv1.3","660","Application Data, Application Data"
"269","1.273573","104.70.164.18","10.8.0.1","TLSv1.3","660","Application Data, Application Data"
"270","1.274746","35.186.224.25","10.8.0.1","TLSv1.3","665","Application Data, Application Data, Application Data"
"271","1.274781","10.8.0.1","104.154.127.106","SSL","392","Continuation Data"
"272","1.274860","104.154.127.106","10.8.0.1","TCP","54","443  >  46126 [ACK] Seq=1 Ack=339 Win=65535 Len=0"
"273","1.275002","157.240.26.55","10.8.0.1","TCP","180","80  >  47074 [PSH, ACK] Seq=130 Ack=440 Win=65535 Len=126 [TCP segment of a reassembled PDU]"
"274","1.275088","104.70.164.18","10.8.0.1","TLSv1.3","660","Application Data, Application Data"
"275","1.275216","104.70.164.18","10.8.0.1","TLSv1.3","159","Application Data, Application Data"
"276","1.275251","10.8.0.1","10.133.131.19","TCP","192","38660  >  8009 [PSH, ACK] Seq=1 Ack=1 Win=65535 Len=138 [TCP segment of a reassembled PDU]"
"277","1.275323","10.133.131.19","10.8.0.1","TCP","54","8009  >  38660 [ACK] Seq=1 Ack=139 Win=65535 Len=0"
"278","1.275468","10.8.0.1","35.186.224.47","TLSv1.2","129","Client Key Exchange"
"279","1.275549","35.186.224.47","10.8.0.1","TCP","54","443  >  39946 [ACK] Seq=3396 Ack=502 Win=65535 Len=0"
"280","1.275580","10.8.0.1","35.186.224.47","TLSv1.2","60","Change Cipher Spec"
"281","1.275642","35.186.224.47","10.8.0.1","TCP","54","443  >  39946 [ACK] Seq=3396 Ack=508 Win=65535 Len=0"
"282","1.275777","10.8.0.1","35.186.224.47","TLSv1.2","99","Encrypted Handshake Message"
"283","1.275846","35.186.224.47","10.8.0.1","TCP","54","443  >  39946 [ACK] Seq=3396 Ack=553 Win=65535 Len=0"
"284","1.275874","10.8.0.1","104.70.164.18","TCP","590","46090  >  443 [ACK] Seq=4962 Ack=4723 Win=65535 Len=536 [TCP segment of a reassembled PDU]"
"285","1.275935","104.70.164.18","10.8.0.1","TCP","54","443  >  46090 [ACK] Seq=4723 Ack=5498 Win=65535 Len=0"
"286","1.275980","10.8.0.1","104.70.164.18","TCP","590","46090  >  443 [ACK] Seq=5498 Ack=4723 Win=65535 Len=536 [TCP segment of a reassembled PDU]"
"287","1.276040","104.70.164.18","10.8.0.1","TCP","54","443  >  46090 [ACK] Seq=4723 Ack=6034 Win=65535 Len=0"
"288","1.276065","10.8.0.1","104.70.164.18","TLSv1.3","408","Application Data"
"289","1.276120","104.70.164.18","10.8.0.1","TCP","54","443  >  46090 [ACK] Seq=4723 Ack=6388 Win=65535 Len=0"
"290","1.276190","10.8.0.1","104.70.164.18","TCP","590","46090  >  443 [ACK] Seq=6388 Ack=4723 Win=65535 Len=536 [TCP segment of a reassembled PDU]"
"291","1.276252","104.70.164.18","10.8.0.1","TCP","54","443  >  46090 [ACK] Seq=4723 Ack=6924 Win=65535 Len=0"
"292","1.276285","10.8.0.1","104.70.164.18","TCP","590","46090  >  443 [ACK] Seq=6924 Ack=4723 Win=65535 Len=536 [TCP segment of a reassembled PDU]"
"293","1.276462","104.70.164.18","10.8.0.1","TCP","54","443  >  46090 [ACK] Seq=4723 Ack=7460 Win=65535 Len=0"
"294","1.276506","10.8.0.1","104.70.164.18","TCP","590","46090  >  443 [ACK] Seq=7460 Ack=4723 Win=65535 Len=536 [TCP segment of a reassembled PDU]"
"295","1.276587","104.70.164.18","10.8.0.1","TCP","54","443  >  46090 [ACK] Seq=4723 Ack=7996 Win=65535 Len=0"
"296","1.276617","10.8.0.1","104.70.164.18","TCP","590","46090  >  443 [ACK] Seq=7996 Ack=4723 Win=65535 Len=536 [TCP segment of a reassembled PDU]"
"297","1.276680","104.70.164.18","10.8.0.1","TCP","54","443  >  46090 [ACK] Seq=4723 Ack=8532 Win=65535 Len=0"
"298","1.276710","10.8.0.1","104.70.164.18","TCP","590","46090  >  443 [ACK] Seq=8532 Ack=4723 Win=65535 Len=536 [TCP segment of a reassembled PDU]"
"299","1.276778","104.70.164.18","10.8.0.1","TCP","54","443  >  46090 [ACK] Seq=4723 Ack=9068 Win=65535 Len=0"
"300","1.276809","10.8.0.1","104.70.164.18","TLSv1.3","257","Application Data"
"301","1.276930","104.70.164.18","10.8.0.1","TCP","54","443  >  46090 [ACK] Seq=4723 Ack=9271 Win=65535 Len=0"
"302","1.276966","10.8.0.1","104.70.164.18","TCP","590","46090  >  443 [ACK] Seq=9271 Ack=4723 Win=65535 Len=536 [TCP segment of a reassembled PDU]"
"303","1.277062","104.70.164.18","10.8.0.1","TCP","54","443  >  46090 [ACK] Seq=4723 Ack=9807 Win=65535 Len=0"
"304","1.277102","10.8.0.1","104.70.164.18","TCP","590","46090  >  443 [ACK] Seq=9807 Ack=4723 Win=65535 Len=536 [TCP segment of a reassembled PDU]"
"305","1.277270","104.70.164.18","10.8.0.1","TCP","54","443  >  46090 [ACK] Seq=4723 Ack=10343 Win=65535 Len=0"
"306","1.277305","10.8.0.1","104.70.164.18","TLSv1.3","391","Application Data"
"307","1.277387","104.70.164.18","10.8.0.1","TCP","54","443  >  46090 [ACK] Seq=4723 Ack=10680 Win=65535 Len=0"
"308","1.277677","10.8.0.1","157.240.26.55","TCP","54","47074  >  80 [ACK] Seq=440 Ack=256 Win=65535 Len=0"
"309","1.277714","10.8.0.1","35.186.224.25","TLSv1.3","85","Application Data"
"310","1.277790","35.186.224.25","10.8.0.1","TCP","54","443  >  49102 [ACK] Seq=824 Ack=1914 Win=65535 Len=0"
"311","1.277820","10.8.0.1","104.70.164.18","TLSv1.3","85","Application Data"
"312","1.277898","104.70.164.18","10.8.0.1","TCP","54","443  >  46090 [ACK] Seq=4828 Ack=10711 Win=65535 Len=0"
"313","1.328501","104.70.164.18","10.8.0.1","TLSv1.3","3419","Application Data, Application Data, Application Data, Application Data, Application Data"
"314","1.328713","142.251.4.188","10.8.0.1","TLSv1.3","701","Application Data, Application Data, Application Data, Application Data"
"315","1.328749","10.8.0.1","157.240.26.55","TCP","56","47074  >  80 [PSH, ACK] Seq=440 Ack=256 Win=65535 Len=2 [TCP segment of a reassembled PDU]"
"316","1.328889","157.240.26.55","10.8.0.1","TCP","54","80  >  47074 [ACK] Seq=256 Ack=442 Win=65535 Len=0"
"317","1.330278","104.154.127.106","10.8.0.1","SSL","673","Continuation Data"
"318","1.330643","35.186.224.47","10.8.0.1","TLSv1.2","346","New Session Ticket, Change Cipher Spec, Encrypted Handshake Message"
"319","1.330683","10.8.0.1","104.70.164.18","TCP","54","46088  >  443 [ACK] Seq=598 Ack=4723 Win=65535 Len=0"
"320","1.330883","10.8.0.1","104.70.164.18","TCP","54","46086  >  443 [ACK] Seq=598 Ack=4723 Win=65535 Len=0"
"321","1.330915","10.8.0.1","104.70.164.33","TCP","54","38424  >  443 [ACK] Seq=598 Ack=4723 Win=65535 Len=0"
"322","1.330937","10.8.0.1","104.70.164.18","TCP","54","46090  >  443 [ACK] Seq=10711 Ack=8193 Win=65535 Len=0"
"323","1.330955","10.8.0.1","157.240.26.55","TCP","98","POST /chat HTTP/1.1  [TCP segment of a reassembled PDU]"
"324","1.331012","157.240.26.55","10.8.0.1","TCP","54","80  >  47074 [ACK] Seq=256 Ack=486 Win=65535 Len=0"
"325","1.331035","10.8.0.1","104.154.127.106","TCP","54","46126  >  443 [ACK] Seq=339 Ack=620 Win=65535 Len=0"
"326","1.331071","10.8.0.1","35.186.224.47","TCP","590","39946  >  443 [ACK] Seq=553 Ack=3688 Win=65535 Len=536 [TCP segment of a reassembled PDU]"
"327","1.331125","35.186.224.47","10.8.0.1","TCP","54","443  >  39946 [ACK] Seq=3688 Ack=1089 Win=65535 Len=0"
"328","1.331147","10.8.0.1","35.186.224.47","TLSv1.2","180","Application Data"
"329","1.331197","35.186.224.47","10.8.0.1","TCP","54","443  >  39946 [ACK] Seq=3688 Ack=1215 Win=65535 Len=0"
"330","1.382223","35.186.224.47","10.8.0.1","TLSv1.2","771","Application Data, Application Data"
"331","1.382331","10.8.0.1","104.154.127.106","SSL","458","Continuation Data"
"332","1.382403","104.154.127.106","10.8.0.1","TCP","54","443  >  46126 [ACK] Seq=620 Ack=743 Win=65535 Len=0"
"333","1.383002","35.186.224.25","10.8.0.1","TLSv1.3","508","Application Data"
"334","1.383026","10.8.0.1","142.251.4.188","TCP","54","39610  >  5228 [ACK] Seq=1029 Ack=851 Win=65535 Len=0"
"335","1.383223","10.8.0.1","35.186.224.25","TLSv1.3","93","Application Data"
"336","1.383276","35.186.224.25","10.8.0.1","TCP","54","443  >  49102 [ACK] Seq=1278 Ack=1953 Win=65535 Len=0"
"337","1.433682","157.240.26.55","10.8.0.1","TCP","350","HTTP/1.1 200 OK  [TCP segment of a reassembled PDU]"
"338","1.433730","10.8.0.1","35.186.224.47","TCP","54","39946  >  443 [ACK] Seq=1215 Ack=4405 Win=65535 Len=0"
"339","1.433752","10.8.0.1","34.98.74.57","TCP","112","[TCP Retransmission] 40390  >  443 [FIN, PSH, ACK] Seq=913 Ack=794 Win=65535 Len=58"
"340","1.433800","34.98.74.57","10.8.0.1","TCP","54","[TCP Keep-Alive] 443  >  40390 [ACK] Seq=794 Ack=914 Win=65535 Len=0"
"341","1.433831","34.98.74.57","10.8.0.1","TCP","54","[TCP Retransmission] 443  >  40390 [FIN, ACK] Seq=794 Ack=914 Win=65535 Len=0"
"342","1.438033","104.154.127.106","10.8.0.1","SSL","1294","Continuation Data"
"343","1.488224","10.8.0.1","104.154.127.106","SSL","81","Continuation Data"
"344","1.488376","104.154.127.106","10.8.0.1","TCP","54","443  >  46126 [ACK] Seq=1860 Ack=770 Win=65535 Len=0"
"345","1.489039","104.154.127.106","10.8.0.1","SSL","7308","Continuation Data"
"346","1.489100","10.8.0.1","157.240.26.55","TCP","54","47074  >  80 [ACK] Seq=486 Ack=552 Win=65535 Len=0"
"347","1.489120","10.8.0.1","35.186.224.47","TLSv1.2","144","Application Data"
"348","1.489167","35.186.224.47","10.8.0.1","TCP","54","443  >  39946 [ACK] Seq=4405 Ack=1305 Win=65535 Len=0"
