"No.","Time","Source","Destination","Protocol","Length","Info"
"1","0.000000","10.133.1.154","guzzoni-apple-com.v.aaplimg.com","TLSv1.2","71","Encrypted Alert"
"2","1.001317","10.133.1.154","guzzoni-apple-com.v.aaplimg.com","TCP","40","57958  >  https(443) [FIN, ACK] Seq=32 Ack=1 Win=4096 Len=0"
"3","1.001814","guzzoni-apple-com.v.aaplimg.com","10.133.1.154","TCP","46","https(443)  >  57958 [ACK] Seq=1 Ack=32 Win=506 Len=0"
"4","1.002256","guzzoni-apple-com.v.aaplimg.com","10.133.1.154","TLSv1.2","77","Application Data"
"5","1.002448","guzzoni-apple-com.v.aaplimg.com","10.133.1.154","TCP","46","https(443)  >  57958 [FIN, ACK] Seq=38 Ack=33 Win=506 Len=0"
"6","1.002618","10.133.1.154","guzzoni-apple-com.v.aaplimg.com","TCP","40","57958  >  https(443) [RST] Seq=33 Win=0 Len=0"
"7","7.183956","10.133.19.21","10.133.1.154","NBNS","78","Name query NBSTAT *<00><00><00><00><00><00><00><00><00><00><00><00><00><00><00>"
"8","7.184284","10.133.1.154","10.133.19.21","ICMP","56","Destination unreachable (Port unreachable)"
"9","8.719649","10.133.19.21","10.133.1.154","NBNS","78","Name query NBSTAT *<00><00><00><00><00><00><00><00><00><00><00><00><00><00><00>"
"10","8.720103","10.133.1.154","10.133.19.21","ICMP","56","Destination unreachable (Port unreachable)"
"11","10.357486","10.133.19.21","10.133.1.154","NBNS","78","Name query NBSTAT *<00><00><00><00><00><00><00><00><00><00><00><00><00><00><00>"
"12","10.357721","10.133.1.154","10.133.19.21","ICMP","56","Destination unreachable (Port unreachable)"
"13","12.714620","N/A","N/A","N/A","28","Raw packet data"
"14","14.021823","169.254.242.102","224.0.0.251","MDNS","69","Standard query 0x0000 SRV ncm._remoted._tcp.local, ""QM"" question"
"15","14.022169","fe80::b3:9867:bfa0:51be","ff02::fb","MDNS","89","Standard query 0x0000 SRV ncm._remoted._tcp.local, ""QM"" question"
"16","15.022380","qrttxzy.local","224.0.0.251","MDNS","176","Standard query response 0x0000 SRV, cache flush 0 0 57144 qrttxzy.local AAAA, cache flush fe80::1833:75f9:cb29:169c A, cache flush 169.254.204.60 NSEC, cache flush qrttxzy.local NSEC, cache flush ncm._remoted._tcp.local"
"17","15.022900","qrttxzy.local","ff02::fb","MDNS","196","Standard query response 0x0000 SRV, cache flush 0 0 57144 qrttxzy.local AAAA, cache flush fe80::1833:75f9:cb29:169c A, cache flush 169.254.204.60 NSEC, cache flush qrttxzy.local NSEC, cache flush ncm._remoted._tcp.local"
"18","16.023392","10.133.1.154","ns1.its.carleton.edu","DNS","80","Standard query 0xc257 HTTPS configuration.apple.com.akadns.net"
"19","16.023638","10.133.1.154","ns1.its.carleton.edu","DNS","80","Standard query 0x066b A configuration.apple.com.akadns.net"
"20","16.023808","ns1.its.carleton.edu","10.133.1.154","DNS","227","Standard query response 0xc257 HTTPS configuration.apple.com.akadns.net CNAME configuration.apple.com.edgekey.net CNAME e673.dsce9.akamaiedge.net SOA n0dsce9.akamaiedge.net"
"21","16.023930","ns1.its.carleton.edu","10.133.1.154","DNS","510","Standard query response 0x066b A configuration.apple.com.akadns.net CNAME configuration.apple.com.edgekey.net CNAME e673.dsce9.akamaiedge.net A 23.35.200.54 NS n3dsce9.akamaiedge.net NS n5dsce9.akamaiedge.net NS n4dsce9.akamaiedge.net NS n2dsce9.akamaiedge.net NS n6dsce9.akamaiedge.net NS n1dsce9.akamaiedge.net NS n0dsce9.akamaiedge.net NS n7dsce9.akamaiedge.net A 184.30.41.7 A 23.42.159.36 A 23.42.159.15 A 23.42.158.134 A 88.221.81.192 A 23.42.159.22 A 23.220.96.101 A 23.42.159.44 AAAA 2600:1480:e800::c0"
"22","16.024026","10.133.1.154","e673.dsce9.akamaiedge.net","TCP","64","55314  >  https(443) [SYN] Seq=0 Win=65535 Len=0 MSS=1460 WS=64 TSval=175807318 TSecr=0 SACK_PERM=1"
"23","16.024121","e673.dsce9.akamaiedge.net","10.133.1.154","TCP","52","https(443)  >  55314 [SYN, ACK] Seq=0 Ack=1 Win=64240 Len=0 MSS=1386 SACK_PERM=1 WS=128"
"24","16.024205","10.133.1.154","e673.dsce9.akamaiedge.net","TCP","40","55314  >  https(443) [ACK] Seq=1 Ack=1 Win=262144 Len=0"
"25","16.024292","10.133.1.154","e673.dsce9.akamaiedge.net","TLSv1.3","557","Client Hello"
"26","16.024383","e673.dsce9.akamaiedge.net","10.133.1.154","TCP","46","https(443)  >  55314 [ACK] Seq=1 Ack=518 Win=64128 Len=0"
"27","16.024564","e673.dsce9.akamaiedge.net","10.133.1.154","TLSv1.3","1426","Server Hello, Change Cipher Spec, Application Data"
"28","16.024710","10.133.1.154","e673.dsce9.akamaiedge.net","TCP","40","55314  >  https(443) [ACK] Seq=518 Ack=1387 Win=260736 Len=0"
"29","16.024839","e673.dsce9.akamaiedge.net","10.133.1.154","TCP","1426","https(443)  >  55314 [PSH, ACK] Seq=1387 Ack=518 Win=64128 Len=1386 [TCP segment of a reassembled PDU]"
"30","16.025010","e673.dsce9.akamaiedge.net","10.133.1.154","TCP","1364","https(443)  >  55314 [PSH, ACK] Seq=2773 Ack=518 Win=64128 Len=1324 [TCP segment of a reassembled PDU]"
"31","16.025141","e673.dsce9.akamaiedge.net","10.133.1.154","TCP","1426","https(443)  >  55314 [ACK] Seq=4097 Ack=518 Win=64128 Len=1386 [TCP segment of a reassembled PDU]"
"32","16.025244","10.133.1.154","e673.dsce9.akamaiedge.net","TCP","40","55314  >  https(443) [ACK] Seq=518 Ack=5483 Win=258048 Len=0"
"33","16.025378","10.133.1.154","e673.dsce9.akamaiedge.net","TCP","40","[TCP Window Update] 55314  >  https(443) [ACK] Seq=518 Ack=5483 Win=262144 Len=0"
"34","16.025488","e673.dsce9.akamaiedge.net","10.133.1.154","TCP","1426","https(443)  >  55314 [ACK] Seq=5483 Ack=518 Win=64128 Len=1386 [TCP segment of a reassembled PDU]"
"35","16.025640","e673.dsce9.akamaiedge.net","10.133.1.154","TCP","1426","https(443)  >  55314 [PSH, ACK] Seq=6869 Ack=518 Win=64128 Len=1386 [TCP segment of a reassembled PDU]"
"36","16.025766","10.133.1.154","e673.dsce9.akamaiedge.net","TCP","40","55314  >  https(443) [ACK] Seq=518 Ack=8255 Win=259328 Len=0"
"37","16.025871","10.133.1.154","e673.dsce9.akamaiedge.net","TCP","40","[TCP Window Update] 55314  >  https(443) [ACK] Seq=518 Ack=8255 Win=262144 Len=0"
"38","16.025943","e673.dsce9.akamaiedge.net","10.133.1.154","TLSv1.3","550","Application Data, Application Data, Application Data"
"39","16.026091","10.133.1.154","e673.dsce9.akamaiedge.net","TCP","40","55314  >  https(443) [ACK] Seq=518 Ack=8765 Win=261632 Len=0"
"40","16.026177","10.133.1.154","e673.dsce9.akamaiedge.net","TLSv1.3","120","Change Cipher Spec, Application Data"
"41","16.026347","10.133.1.154","e673.dsce9.akamaiedge.net","TLSv1.3","371","Application Data"
"42","16.026432","e673.dsce9.akamaiedge.net","10.133.1.154","TCP","46","https(443)  >  55314 [ACK] Seq=8765 Ack=598 Win=64128 Len=0"
"43","16.026533","e673.dsce9.akamaiedge.net","10.133.1.154","TCP","46","https(443)  >  55314 [ACK] Seq=8765 Ack=929 Win=64128 Len=0"
"44","17.025479","e673.dsce9.akamaiedge.net","10.133.1.154","TLSv1.3","327","Application Data"
"45","17.025588","10.133.1.154","e673.dsce9.akamaiedge.net","TCP","40","55314  >  https(443) [ACK] Seq=929 Ack=9052 Win=261824 Len=0"
"46","17.025700","e673.dsce9.akamaiedge.net","10.133.1.154","TLSv1.3","327","Application Data"
"47","17.025810","10.133.1.154","e673.dsce9.akamaiedge.net","TCP","40","55314  >  https(443) [ACK] Seq=929 Ack=9339 Win=261824 Len=0"
"48","17.025943","e673.dsce9.akamaiedge.net","10.133.1.154","TLSv1.3","725","Application Data"
"49","17.026065","10.133.1.154","e673.dsce9.akamaiedge.net","TCP","40","55314  >  https(443) [ACK] Seq=929 Ack=10024 Win=261440 Len=0"
"50","17.026208","10.133.1.154","e673.dsce9.akamaiedge.net","TLSv1.3","64","Application Data"
"51","17.026299","10.133.1.154","e673.dsce9.akamaiedge.net","TCP","40","55314  >  https(443) [FIN, ACK] Seq=953 Ack=10024 Win=262144 Len=0"
"52","17.026452","e673.dsce9.akamaiedge.net","10.133.1.154","TCP","46","https(443)  >  55314 [ACK] Seq=10024 Ack=953 Win=64128 Len=0"
"53","17.026576","e673.dsce9.akamaiedge.net","10.133.1.154","TLSv1.3","64","Application Data"
"54","17.026659","10.133.1.154","e673.dsce9.akamaiedge.net","TCP","40","55314  >  https(443) [RST] Seq=954 Win=0 Len=0"
"55","17.026780","e673.dsce9.akamaiedge.net","10.133.1.154","TCP","46","https(443)  >  55314 [FIN, ACK] Seq=10048 Ack=954 Win=64128 Len=0"
"56","17.026909","e673.dsce9.akamaiedge.net","10.133.1.154","TCP","46","[TCP Out-Of-Order] https(443)  >  55314 [FIN, ACK] Seq=10048 Ack=954 Win=64128 Len=0"
"57","17.027033","10.133.1.154","e673.dsce9.akamaiedge.net","TCP","40","55314  >  https(443) [RST] Seq=954 Win=0 Len=0"
"58","17.027199","e673.dsce9.akamaiedge.net","10.133.1.154","TCP","46","[TCP Retransmission] https(443)  >  55314 [FIN, ACK] Seq=10048 Ack=954 Win=64128 Len=0"
"59","17.027293","10.133.1.154","e673.dsce9.akamaiedge.net","TCP","40","55314  >  https(443) [RST] Seq=954 Win=0 Len=0"
"60","17.027399","10.133.5.254","10.133.1.154","TCP","52","57511  >  http(80) [SYN] Seq=0 Win=64240 Len=0 MSS=1386 WS=4 SACK_PERM=1"
"61","17.027542","10.133.1.154","10.133.5.254","TCP","40","http(80)  >  57511 [RST, ACK] Seq=1 Ack=1 Win=0 Len=0"
"62","17.027646","e673.dsce9.akamaiedge.net","10.133.1.154","TCP","64","[TCP Retransmission] https(443)  >  55314 [FIN, PSH, ACK] Seq=10024 Ack=954 Win=64128 Len=24"
"63","17.027770","10.133.1.154","e673.dsce9.akamaiedge.net","TCP","40","55314  >  https(443) [RST] Seq=954 Win=0 Len=0"
"64","17.027882","10.133.5.254","10.133.1.154","TCP","52","[TCP Retransmission] 57511  >  http(80) [SYN] Seq=0 Win=64240 Len=0 MSS=1386 WS=4 SACK_PERM=1"
"65","17.027948","10.133.1.154","10.133.5.254","TCP","40","http(80)  >  57511 [RST, ACK] Seq=1 Ack=1 Win=0 Len=0"
"66","18.028140","10.133.5.254","10.133.1.154","TCP","52","[TCP Retransmission] 57511  >  http(80) [SYN] Seq=0 Win=64240 Len=0 MSS=1386 WS=4 SACK_PERM=1"
"67","18.028368","10.133.1.154","10.133.5.254","TCP","40","http(80)  >  57511 [RST, ACK] Seq=1 Ack=1 Win=0 Len=0"
"68","19.028525","10.133.5.254","10.133.1.154","TCP","52","[TCP Retransmission] 57511  >  http(80) [SYN] Seq=0 Win=64240 Len=0 MSS=1386 WS=4 SACK_PERM=1"
"69","19.028753","10.133.1.154","10.133.5.254","TCP","40","http(80)  >  57511 [RST, ACK] Seq=1 Ack=1 Win=0 Len=0"
"70","20.029913","10.133.5.254","10.133.1.154","TCP","52","[TCP Retransmission] 57511  >  http(80) [SYN] Seq=0 Win=64240 Len=0 MSS=1386 WS=4 SACK_PERM=1"
"71","20.030371","10.133.1.154","10.133.5.254","TCP","40","http(80)  >  57511 [RST, ACK] Seq=1 Ack=1 Win=0 Len=0"
"72","20.030818","10.133.5.254","10.133.1.154","NBNS","78","Name query NBSTAT *<00><00><00><00><00><00><00><00><00><00><00><00><00><00><00>"
"73","20.031012","10.133.1.154","10.133.5.254","ICMP","56","Destination unreachable (Port unreachable)"
"74","21.030900","N/A","N/A","N/A","28","Raw packet data"
"75","21.031131","N/A","N/A","N/A","42","Raw packet data"
"76","22.662069","10.133.1.154","guzzoni-apple-com.v.aaplimg.com","MPTCP","76","57965  >  https(443) [SYN] Seq=0 Win=65535 Len=0 MSS=1460 WS=64 TSval=1896493015 TSecr=0 SACK_PERM=1"
"77","23.663688","guzzoni-apple-com.v.aaplimg.com","10.133.1.154","TCP","52","https(443)  >  57965 [SYN, ACK] Seq=0 Ack=1 Win=8190 Len=0 MSS=1330 WS=256 SACK_PERM=1"
"78","23.663988","10.133.1.154","guzzoni-apple-com.v.aaplimg.com","TCP","40","57965  >  https(443) [ACK] Seq=1 Ack=1 Win=131072 Len=0"
"79","23.664339","10.133.1.154","guzzoni-apple-com.v.aaplimg.com","TLSv1.2","557","Client Hello"
"80","23.664646","guzzoni-apple-com.v.aaplimg.com","10.133.1.154","TCP","1370","https(443)  >  57965 [PSH, ACK] Seq=1 Ack=518 Win=130048 Len=1330 [TCP segment of a reassembled PDU]"
"81","23.665013","10.133.1.154","guzzoni-apple-com.v.aaplimg.com","TCP","40","57965  >  https(443) [ACK] Seq=518 Ack=1331 Win=260800 Len=0"
"82","23.665204","guzzoni-apple-com.v.aaplimg.com","10.133.1.154","TCP","1370","https(443)  >  57965 [PSH, ACK] Seq=1331 Ack=518 Win=130048 Len=1330 [TCP segment of a reassembled PDU]"
"83","23.665414","10.133.1.154","guzzoni-apple-com.v.aaplimg.com","TCP","40","57965  >  https(443) [ACK] Seq=518 Ack=2661 Win=260800 Len=0"
"84","23.665802","guzzoni-apple-com.v.aaplimg.com","10.133.1.154","TLSv1.2","897","Server Hello, Certificate"
"85","23.666088","guzzoni-apple-com.v.aaplimg.com","10.133.1.154","TLSv1.2","382","Server Key Exchange, Server Hello Done"
"86","23.666268","10.133.1.154","guzzoni-apple-com.v.aaplimg.com","TCP","40","57965  >  https(443) [ACK] Seq=518 Ack=3860 Win=260928 Len=0"
"87","23.666422","10.133.1.154","guzzoni-apple-com.v.aaplimg.com","TLSv1.2","166","Client Key Exchange, Change Cipher Spec, Encrypted Handshake Message"
"88","23.666550","10.133.1.154","guzzoni-apple-com.v.aaplimg.com","TLSv1.2","610","Application Data"
"89","23.666774","10.133.1.154","guzzoni-apple-com.v.aaplimg.com","TLSv1.2","73","Application Data"
"90","23.666854","guzzoni-apple-com.v.aaplimg.com","10.133.1.154","TCP","46","https(443)  >  57965 [ACK] Seq=3860 Ack=644 Win=130048 Len=0"
"91","23.666976","guzzoni-apple-com.v.aaplimg.com","10.133.1.154","TCP","46","https(443)  >  57965 [ACK] Seq=3860 Ack=1214 Win=129536 Len=0"
"92","23.667098","guzzoni-apple-com.v.aaplimg.com","10.133.1.154","TCP","46","https(443)  >  57965 [ACK] Seq=3860 Ack=1247 Win=129536 Len=0"
"93","23.667237","guzzoni-apple-com.v.aaplimg.com","10.133.1.154","TLSv1.2","46","Change Cipher Spec"
"94","23.667378","10.133.1.154","guzzoni-apple-com.v.aaplimg.com","TCP","40","57965  >  https(443) [ACK] Seq=1247 Ack=3866 Win=262080 Len=0"
"95","23.667531","guzzoni-apple-com.v.aaplimg.com","10.133.1.154","TLSv1.2","85","Encrypted Handshake Message"
"96","23.667677","10.133.1.154","guzzoni-apple-com.v.aaplimg.com","TCP","40","57965  >  https(443) [ACK] Seq=1247 Ack=3911 Win=262080 Len=0"
"97","23.667760","guzzoni-apple-com.v.aaplimg.com","10.133.1.154","TLSv1.2","135","Application Data"
"98","23.667841","10.133.1.154","guzzoni-apple-com.v.aaplimg.com","TCP","40","57965  >  https(443) [ACK] Seq=1247 Ack=4006 Win=262016 Len=0"
"99","23.667972","guzzoni-apple-com.v.aaplimg.com","10.133.1.154","TLSv1.2","73","Application Data"
"100","23.668051","10.133.1.154","guzzoni-apple-com.v.aaplimg.com","TCP","40","57965  >  https(443) [ACK] Seq=1247 Ack=4039 Win=262080 Len=0"
"101","23.668119","10.133.1.154","guzzoni-apple-com.v.aaplimg.com","TCP","40","[TCP Keep-Alive] 57965  >  https(443) [ACK] Seq=1246 Ack=4039 Win=262144 Len=0"
"102","23.668270","guzzoni-apple-com.v.aaplimg.com","10.133.1.154","TCP","46","[TCP Keep-Alive ACK] https(443)  >  57965 [ACK] Seq=4039 Ack=1247 Win=129536 Len=0"
"103","26.024508","10.133.0.29","10.133.1.154","ICMP","60","Echo (ping) request  id=0x0002, seq=55757/52697, ttl=128 (reply in 104)"
"104","26.024632","10.133.1.154","10.133.0.29","ICMP","60","Echo (ping) reply    id=0x0002, seq=55757/52697, ttl=64 (request in 103)"
"105","29.111841","10.133.5.254","10.133.1.154","TCP","52","57522  >  microsoft-ds(445) [SYN] Seq=0 Win=64240 Len=0 MSS=1386 WS=4 SACK_PERM=1"
"106","29.112068","10.133.1.154","10.133.5.254","TCP","40","microsoft-ds(445)  >  57522 [RST, ACK] Seq=1 Ack=1 Win=0 Len=0"
"107","30.113162","10.133.5.254","10.133.1.154","TCP","52","[TCP Retransmission] 57522  >  microsoft-ds(445) [SYN] Seq=0 Win=64240 Len=0 MSS=1386 WS=4 SACK_PERM=1"
"108","30.113395","10.133.9.198","10.133.1.154","ICMP","60","Echo (ping) request  id=0x0004, seq=55785/59865, ttl=128 (reply in 110)"
"109","30.113578","10.133.1.154","10.133.5.254","TCP","40","microsoft-ds(445)  >  57522 [RST, ACK] Seq=1 Ack=1 Win=0 Len=0"
"110","30.113930","10.133.1.154","10.133.9.198","ICMP","60","Echo (ping) reply    id=0x0004, seq=55785/59865, ttl=64 (request in 108)"
"111","31.114371","N/A","N/A","N/A","28","Raw packet data"
"112","31.114598","N/A","N/A","N/A","42","Raw packet data"
"113","31.114781","10.133.5.254","10.133.1.154","TCP","52","[TCP Retransmission] 57522  >  microsoft-ds(445) [SYN] Seq=0 Win=64240 Len=0 MSS=1386 WS=4 SACK_PERM=1"
"114","31.115124","10.133.1.154","10.133.5.254","TCP","40","microsoft-ds(445)  >  57522 [RST, ACK] Seq=1 Ack=1 Win=0 Len=0"
"115","32.115728","10.133.5.254","10.133.1.154","TCP","52","[TCP Retransmission] 57522  >  microsoft-ds(445) [SYN] Seq=0 Win=64240 Len=0 MSS=1386 WS=4 SACK_PERM=1"
"116","32.115971","10.133.1.154","10.133.5.254","TCP","40","microsoft-ds(445)  >  57522 [RST, ACK] Seq=1 Ack=1 Win=0 Len=0"
"117","33.116811","10.133.5.254","10.133.1.154","TCP","52","[TCP Retransmission] 57522  >  microsoft-ds(445) [SYN] Seq=0 Win=64240 Len=0 MSS=1386 WS=4 SACK_PERM=1"
"118","33.117015","10.133.1.154","10.133.5.254","TCP","40","microsoft-ds(445)  >  57522 [RST, ACK] Seq=1 Ack=1 Win=0 Len=0"
"119","33.117263","10.133.5.254","10.133.1.154","TCP","52","57523  >  netbios-ssn(139) [SYN] Seq=0 Win=64240 Len=0 MSS=1386 WS=4 SACK_PERM=1"
"120","33.117582","10.133.1.154","10.133.5.254","TCP","40","netbios-ssn(139)  >  57523 [RST, ACK] Seq=1 Ack=1 Win=0 Len=0"
"121","34.118206","10.133.5.254","10.133.1.154","TCP","52","[TCP Retransmission] 57523  >  netbios-ssn(139) [SYN] Seq=0 Win=64240 Len=0 MSS=1386 WS=4 SACK_PERM=1"
"122","34.118437","10.133.1.154","10.133.5.254","TCP","40","netbios-ssn(139)  >  57523 [RST, ACK] Seq=1 Ack=1 Win=0 Len=0"
"123","35.119088","N/A","N/A","N/A","28","Raw packet data"
"124","35.119292","N/A","N/A","N/A","42","Raw packet data"
"125","35.119463","10.133.5.254","10.133.1.154","TCP","52","[TCP Retransmission] 57523  >  netbios-ssn(139) [SYN] Seq=0 Win=64240 Len=0 MSS=1386 WS=4 SACK_PERM=1"
"126","35.119626","10.133.1.154","10.133.5.254","TCP","40","netbios-ssn(139)  >  57523 [RST, ACK] Seq=1 Ack=1 Win=0 Len=0"
"127","36.120674","N/A","N/A","N/A","28","Raw packet data"
"128","36.120976","10.133.5.254","10.133.1.154","TCP","52","[TCP Retransmission] 57523  >  netbios-ssn(139) [SYN] Seq=0 Win=64240 Len=0 MSS=1386 WS=4 SACK_PERM=1"
"129","36.121336","N/A","N/A","N/A","42","Raw packet data"
"130","36.121599","10.133.1.154","10.133.5.254","TCP","40","netbios-ssn(139)  >  57523 [RST, ACK] Seq=1 Ack=1 Win=0 Len=0"
"131","37.122264","10.133.5.254","10.133.1.154","TCP","52","[TCP Retransmission] 57523  >  netbios-ssn(139) [SYN] Seq=0 Win=64240 Len=0 MSS=1386 WS=4 SACK_PERM=1"
"132","37.122495","10.133.1.154","10.133.5.254","TCP","40","netbios-ssn(139)  >  57523 [RST, ACK] Seq=1 Ack=1 Win=0 Len=0"
"133","37.122674","10.133.5.254","10.133.1.154","TCP","52","57524  >  microsoft-ds(445) [SYN] Seq=0 Win=64240 Len=0 MSS=1386 WS=4 SACK_PERM=1"
"134","37.123087","10.133.1.154","10.133.5.254","TCP","40","microsoft-ds(445)  >  57524 [RST, ACK] Seq=1 Ack=1 Win=0 Len=0"
"135","38.123108","10.133.5.254","10.133.1.154","TCP","52","[TCP Retransmission] 57524  >  microsoft-ds(445) [SYN] Seq=0 Win=64240 Len=0 MSS=1386 WS=4 SACK_PERM=1"
"136","38.123336","10.133.1.154","10.133.5.254","TCP","40","microsoft-ds(445)  >  57524 [RST, ACK] Seq=1 Ack=1 Win=0 Len=0"
"137","39.124513","10.133.5.254","10.133.1.154","TCP","52","[TCP Retransmission] 57524  >  microsoft-ds(445) [SYN] Seq=0 Win=64240 Len=0 MSS=1386 WS=4 SACK_PERM=1"
"138","39.124775","10.133.1.154","10.133.5.254","TCP","40","microsoft-ds(445)  >  57524 [RST, ACK] Seq=1 Ack=1 Win=0 Len=0"
"139","40.125444","10.133.5.254","10.133.1.154","TCP","52","[TCP Retransmission] 57524  >  microsoft-ds(445) [SYN] Seq=0 Win=64240 Len=0 MSS=1386 WS=4 SACK_PERM=1"
"140","40.126203","10.133.1.154","10.133.5.254","TCP","40","microsoft-ds(445)  >  57524 [RST, ACK] Seq=1 Ack=1 Win=0 Len=0"
"141","41.126753","N/A","N/A","N/A","42","Raw packet data"
"142","41.127647","10.133.5.254","10.133.1.154","TCP","52","[TCP Retransmission] 57524  >  microsoft-ds(445) [SYN] Seq=0 Win=64240 Len=0 MSS=1386 WS=4 SACK_PERM=1"
"143","41.127873","10.133.1.154","10.133.5.254","TCP","40","microsoft-ds(445)  >  57524 [RST, ACK] Seq=1 Ack=1 Win=0 Len=0"
"144","41.128189","10.133.5.254","10.133.1.154","TCP","52","57525  >  netbios-ssn(139) [SYN] Seq=0 Win=64240 Len=0 MSS=1386 WS=4 SACK_PERM=1"
"145","41.128501","10.133.1.154","10.133.5.254","TCP","40","netbios-ssn(139)  >  57525 [RST, ACK] Seq=1 Ack=1 Win=0 Len=0"
"146","42.127826","10.133.5.254","10.133.1.154","TCP","52","[TCP Retransmission] 57525  >  netbios-ssn(139) [SYN] Seq=0 Win=64240 Len=0 MSS=1386 WS=4 SACK_PERM=1"
"147","42.128341","10.133.1.154","10.133.5.254","TCP","40","netbios-ssn(139)  >  57525 [RST, ACK] Seq=1 Ack=1 Win=0 Len=0"
"148","43.128638","10.133.5.254","10.133.1.154","TCP","52","[TCP Retransmission] 57525  >  netbios-ssn(139) [SYN] Seq=0 Win=64240 Len=0 MSS=1386 WS=4 SACK_PERM=1"
"149","43.128782","10.133.1.154","10.133.5.254","TCP","40","netbios-ssn(139)  >  57525 [RST, ACK] Seq=1 Ack=1 Win=0 Len=0"
"150","43.129015","N/A","N/A","N/A","28","Raw packet data"
"151","43.129298","10.133.5.254","10.133.1.154","ICMP","60","Echo (ping) request  id=0x0001, seq=12708/42033, ttl=128 (reply in 152)"
"152","43.129821","10.133.1.154","10.133.5.254","ICMP","60","Echo (ping) reply    id=0x0001, seq=12708/42033, ttl=64 (request in 151)"
"153","44.130383","N/A","N/A","N/A","28","Raw packet data"
"154","44.130589","N/A","N/A","N/A","42","Raw packet data"
"155","45.585414","10.133.5.254","10.133.1.154","TCP","52","[TCP Retransmission] 57525  >  netbios-ssn(139) [SYN] Seq=0 Win=64240 Len=0 MSS=1386 WS=4 SACK_PERM=1"
"156","45.585706","10.133.1.154","10.133.5.254","TCP","40","netbios-ssn(139)  >  57525 [RST, ACK] Seq=1 Ack=1 Win=0 Len=0"
"157","46.586547","10.133.0.29","10.133.1.154","NBNS","78","Name query NBSTAT *<00><00><00><00><00><00><00><00><00><00><00><00><00><00><00>"
"158","46.586909","10.133.1.154","10.133.0.29","ICMP","56","Destination unreachable (Port unreachable)"
"159","46.587485","N/A","N/A","N/A","28","Raw packet data"
"160","46.587717","N/A","N/A","N/A","42","Raw packet data"
"161","47.588155","10.133.5.254","10.133.1.154","TCP","52","[TCP Retransmission] 57525  >  netbios-ssn(139) [SYN] Seq=0 Win=64240 Len=0 MSS=1386 WS=4 SACK_PERM=1"
"162","47.588505","10.133.1.154","10.133.5.254","TCP","40","netbios-ssn(139)  >  57525 [RST, ACK] Seq=1 Ack=1 Win=0 Len=0"
"163","47.588689","10.133.0.29","10.133.1.154","NBNS","78","Name query NBSTAT *<00><00><00><00><00><00><00><00><00><00><00><00><00><00><00>"
"164","47.588866","10.133.1.154","10.133.0.29","ICMP","56","Destination unreachable (Port unreachable)"
"165","48.589356","0.0.0.0","255.255.255.255","DHCP","328","DHCP Discover - Transaction ID 0xe4d4bb84"
"166","48.589560","10.133.9.198","10.133.1.154","NBNS","78","Name query NBSTAT *<00><00><00><00><00><00><00><00><00><00><00><00><00><00><00>"
"167","48.589730","10.133.1.154","10.133.9.198","ICMP","56","Destination unreachable (Port unreachable)"
"168","48.590137","0.0.0.0","255.255.255.255","DHCP","328","DHCP Discover - Transaction ID 0xab27e0de"
"169","49.589949","0.0.0.0","255.255.255.255","DHCP","328","DHCP Discover - Transaction ID 0xe4d4bb84"
"170","49.590098","10.133.0.29","10.133.1.154","NBNS","78","Name query NBSTAT *<00><00><00><00><00><00><00><00><00><00><00><00><00><00><00>"
"171","49.590233","10.133.9.198","10.133.1.154","NBNS","78","Name query NBSTAT *<00><00><00><00><00><00><00><00><00><00><00><00><00><00><00>"
"172","49.590338","10.133.1.154","10.133.0.29","ICMP","56","Destination unreachable (Port unreachable)"
"173","49.590436","10.133.1.154","10.133.9.198","ICMP","56","Destination unreachable (Port unreachable)"
"174","50.591840","0.0.0.0","255.255.255.255","DHCP","328","DHCP Discover - Transaction ID 0xab27e0de"
"175","51.592870","10.133.9.198","10.133.1.154","NBNS","78","Name query NBSTAT *<00><00><00><00><00><00><00><00><00><00><00><00><00><00><00>"
"176","51.593070","10.133.1.154","10.133.9.198","ICMP","56","Destination unreachable (Port unreachable)"
"177","51.593304","0.0.0.0","255.255.255.255","DHCP","328","DHCP Discover - Transaction ID 0xe4d4bb84"
"178","52.594384","0.0.0.0","255.255.255.255","DHCP","328","DHCP Discover - Transaction ID 0xab27e0de"
"179","52.594663","10.133.20.1","10.133.1.154","ICMP","60","Echo (ping) request  id=0x0001, seq=54756/58581, ttl=128 (reply in 180)"
"180","52.594919","10.133.1.154","10.133.20.1","ICMP","60","Echo (ping) reply    id=0x0001, seq=54756/58581, ttl=64 (request in 179)"
"181","52.595084","N/A","N/A","N/A","28","Raw packet data"
"182","52.595252","N/A","N/A","N/A","42","Raw packet data"
"183","54.693732","10.133.1.154","guzzoni-apple-com.v.aaplimg.com","TLSv1.2","71","Encrypted Alert"
"184","55.695129","10.133.1.154","guzzoni-apple-com.v.aaplimg.com","TCP","40","57965  >  https(443) [FIN, ACK] Seq=1278 Ack=4039 Win=262144 Len=0"
"185","55.695201","guzzoni-apple-com.v.aaplimg.com","10.133.1.154","TCP","46","https(443)  >  57965 [ACK] Seq=4039 Ack=1278 Win=129536 Len=0"
"186","55.695274","guzzoni-apple-com.v.aaplimg.com","10.133.1.154","TLSv1.2","77","Application Data"
"187","55.695387","guzzoni-apple-com.v.aaplimg.com","10.133.1.154","TCP","46","https(443)  >  57965 [FIN, ACK] Seq=4076 Ack=1279 Win=129536 Len=0"
"188","55.695491","10.133.1.154","guzzoni-apple-com.v.aaplimg.com","TCP","40","57965  >  https(443) [RST] Seq=1279 Win=0 Len=0"
"189","56.696607","0.0.0.0","255.255.255.255","DHCP","328","DHCP Discover - Transaction ID 0xe4d4bb84"
"190","56.696801","0.0.0.0","255.255.255.255","DHCP","328","DHCP Discover - Transaction ID 0xab27e0de"
"191","56.697188","N/A","N/A","N/A","28","Raw packet data"
"192","56.697372","N/A","N/A","N/A","42","Raw packet data"
"193","60.367418","10.133.1.154","ns1.its.carleton.edu","DNS","61","Standard query 0x1e5a HTTPS eas.outlook.com"
"194","61.368400","10.133.1.154","ns1.its.carleton.edu","DNS","61","Standard query 0x7344 A eas.outlook.com"
"195","61.368745","10.133.19.21","10.133.1.154","ICMP","60","Echo (ping) request  id=0x0010, seq=24078/3678, ttl=128 (reply in 196)"
"196","61.369063","10.133.1.154","10.133.19.21","ICMP","60","Echo (ping) reply    id=0x0010, seq=24078/3678, ttl=64 (request in 195)"
"197","61.369458","ns1.its.carleton.edu","10.133.1.154","DNS","221","Standard query response 0x1e5a HTTPS eas.outlook.com CNAME outlook.office365.com CNAME outlook.ms-acdc.office.com CNAME DSM-efz.ms-acdc.office.com SOA ns1-ms-acdc.office.com"
"198","61.369690","ns1.its.carleton.edu","10.133.1.154","DNS","320","Standard query response 0x7344 A eas.outlook.com CNAME outlook.office365.com CNAME outlook.ms-acdc.office.com CNAME DSM-efz.ms-acdc.office.com A 52.96.66.194 A 40.97.147.18 A 52.96.180.114 A 40.97.147.210 NS ns2-ms-acdc.office.com NS ns1-ms-acdc.office.com NS ns3-ms-acdc.office.com NS ns4-ms-acdc.office.com"
"199","61.369836","10.133.1.154","ns1.its.carleton.edu","DNS","72","Standard query 0x17cc HTTPS DSM-efz.ms-acdc.office.com"
"200","61.370089","10.133.1.154","ns1.its.carleton.edu","DNS","72","Standard query 0xfe0e A DSM-efz.ms-acdc.office.com"
"201","61.370174","ns1.its.carleton.edu","10.133.1.154","DNS","141","Standard query response 0x17cc HTTPS DSM-efz.ms-acdc.office.com SOA ns1-ms-acdc.office.com"
"202","61.370304","ns1.its.carleton.edu","10.133.1.154","DNS","240","Standard query response 0xfe0e A DSM-efz.ms-acdc.office.com A 40.97.147.18 A 40.97.147.210 A 52.96.180.114 A 52.96.66.194 NS ns1-ms-acdc.office.com NS ns4-ms-acdc.office.com NS ns2-ms-acdc.office.com NS ns3-ms-acdc.office.com"
"203","61.370457","10.133.1.154","DSM-efz.ms-acdc.office.com","TCP","64","55315  >  https(443) [SYN] Seq=0 Win=65535 Len=0 MSS=1460 WS=64 TSval=1271012420 TSecr=0 SACK_PERM=1"
"204","61.370545","DSM-efz.ms-acdc.office.com","10.133.1.154","TCP","52","https(443)  >  55315 [SYN, ACK] Seq=0 Ack=1 Win=65535 Len=0 MSS=1386 WS=256 SACK_PERM=1"
"205","61.370687","10.133.1.154","DSM-efz.ms-acdc.office.com","TCP","40","55315  >  https(443) [ACK] Seq=1 Ack=1 Win=262144 Len=0"
"206","61.370769","10.133.1.154","DSM-efz.ms-acdc.office.com","TLSv1.2","557","Client Hello"
"207","61.370962","DSM-efz.ms-acdc.office.com","10.133.1.154","TCP","1426","https(443)  >  55315 [ACK] Seq=1 Ack=518 Win=4194816 Len=1386 [TCP segment of a reassembled PDU]"
"208","61.371042","10.133.1.154","DSM-efz.ms-acdc.office.com","TCP","40","55315  >  https(443) [ACK] Seq=518 Ack=1387 Win=260736 Len=0"
"209","61.371199","DSM-efz.ms-acdc.office.com","10.133.1.154","TCP","1426","https(443)  >  55315 [ACK] Seq=1387 Ack=518 Win=4194816 Len=1386 [TCP segment of a reassembled PDU]"
"210","61.371317","DSM-efz.ms-acdc.office.com","10.133.1.154","TCP","1426","https(443)  >  55315 [ACK] Seq=2773 Ack=518 Win=4194816 Len=1386 [TCP segment of a reassembled PDU]"
"211","61.371431","10.133.1.154","DSM-efz.ms-acdc.office.com","TCP","40","55315  >  https(443) [ACK] Seq=518 Ack=4159 Win=259328 Len=0"
"212","61.371564","10.133.1.154","DSM-efz.ms-acdc.office.com","TCP","40","[TCP Window Update] 55315  >  https(443) [ACK] Seq=518 Ack=4159 Win=262144 Len=0"
"213","61.371679","DSM-efz.ms-acdc.office.com","10.133.1.154","TLSv1.2","328","Server Hello, Certificate, Certificate Status, Server Key Exchange, Server Hello Done"
"214","61.371839","10.133.1.154","DSM-efz.ms-acdc.office.com","TCP","40","55315  >  https(443) [ACK] Seq=518 Ack=4447 Win=261824 Len=0"
"215","61.371986","10.133.1.154","DSM-efz.ms-acdc.office.com","TLSv1.2","198","Client Key Exchange, Change Cipher Spec, Encrypted Handshake Message"
"216","61.372089","DSM-efz.ms-acdc.office.com","10.133.1.154","TLSv1.2","91","Change Cipher Spec, Encrypted Handshake Message"
"217","61.372193","10.133.1.154","DSM-efz.ms-acdc.office.com","TCP","40","55315  >  https(443) [ACK] Seq=676 Ack=4498 Win=262080 Len=0"
"218","61.372322","10.133.1.154","DSM-efz.ms-acdc.office.com","TCP","1426","55315  >  https(443) [ACK] Seq=676 Ack=4498 Win=262144 Len=1386 [TCP segment of a reassembled PDU]"
"219","61.372437","10.133.1.154","DSM-efz.ms-acdc.office.com","TLSv1.2","241","Application Data"
"220","61.372534","10.133.1.154","DSM-efz.ms-acdc.office.com","TLSv1.2","136","Application Data"
"221","61.372655","DSM-efz.ms-acdc.office.com","10.133.1.154","TCP","46","https(443)  >  55315 [ACK] Seq=4498 Ack=2359 Win=4195328 Len=0"
"222","61.372787","40.97.41.114","10.133.1.154","TLSv1.2","943","Application Data"
"223","61.372898","10.133.1.154","40.97.41.114","TCP","40","55311  >  https(443) [ACK] Seq=1 Ack=904 Win=4081 Len=0"
"224","61.373026","10.133.1.154","40.97.41.114","TLSv1.2","71","Encrypted Alert"
"225","61.373172","10.133.1.154","40.97.41.114","TCP","40","55311  >  https(443) [FIN, ACK] Seq=32 Ack=904 Win=4096 Len=0"
"226","61.373325","40.97.41.114","10.133.1.154","TCP","46","https(443)  >  55311 [ACK] Seq=904 Ack=33 Win=2051 Len=0"
"227","61.373454","40.97.41.114","10.133.1.154","TCP","46","https(443)  >  55311 [FIN, ACK] Seq=904 Ack=33 Win=2051 Len=0"
"228","61.373559","10.133.1.154","40.97.41.114","TCP","40","55311  >  https(443) [ACK] Seq=33 Ack=905 Win=4096 Len=0"
"229","64.465246","10.133.19.19","10.133.1.154","ICMP","60","Echo (ping) request  id=0x0003, seq=2531/58121, ttl=128 (reply in 232)"
"230","64.474677","N/A","N/A","N/A","42","Raw packet data"
"231","65.424798","N/A","N/A","N/A","28","Raw packet data"
"232","65.425041","10.133.1.154","10.133.19.19","ICMP","60","Echo (ping) reply    id=0x0003, seq=2531/58121, ttl=64 (request in 229)"
"233","65.425282","N/A","N/A","N/A","28","Raw packet data"
"234","65.425473","N/A","N/A","N/A","28","Raw packet data"
"235","65.425792","N/A","N/A","N/A","28","Raw packet data"
"236","65.426175","N/A","N/A","N/A","28","Raw packet data"
"237","65.426764","N/A","N/A","N/A","28","Raw packet data"
"238","65.427069","N/A","N/A","N/A","28","Raw packet data"
"239","65.427307","0.0.0.0","255.255.255.255","DHCP","328","DHCP Discover - Transaction ID 0xe4d4bb84"
"240","65.427520","N/A","N/A","N/A","28","Raw packet data"
"241","65.427938","N/A","N/A","N/A","28","Raw packet data"
"242","65.428181","N/A","N/A","N/A","42","Raw packet data"
"243","65.428528","0.0.0.0","255.255.255.255","DHCP","328","DHCP Discover - Transaction ID 0xab27e0de"
"244","66.984496","10.133.20.1","10.133.1.154","NBNS","78","Name query NBSTAT *<00><00><00><00><00><00><00><00><00><00><00><00><00><00><00>"
"245","66.984798","10.133.5.254","10.133.1.154","TCP","52","57533  >  62078 [SYN] Seq=0 Win=64240 Len=0 MSS=1386 WS=4 SACK_PERM=1"
"246","66.985010","10.133.1.154","10.133.5.254","TCP","52","62078  >  57533 [SYN, ACK] Seq=0 Ack=1 Win=0 Len=0 MSS=1460 WS=64 SACK_PERM=1"
"247","66.985147","10.133.1.154","10.133.20.1","ICMP","56","Destination unreachable (Port unreachable)"
"248","67.985785","10.133.5.254","10.133.1.154","TCP","40","57533  >  62078 [ACK] Seq=1 Ack=1 Win=131668 Len=0"
"249","67.986132","10.133.1.154","10.133.5.254","TCP","40","[TCP Window Update] 62078  >  57533 [ACK] Seq=1 Ack=1 Win=262144 Len=0"
"250","67.986405","10.133.1.154","10.133.5.254","TCP","40","62078  >  57533 [FIN, ACK] Seq=1 Ack=1 Win=262144 Len=0"
"251","67.986515","10.133.5.254","10.133.1.154","TCP","40","57533  >  62078 [FIN, ACK] Seq=1 Ack=2 Win=131668 Len=0"
"252","67.986752","10.133.1.154","10.133.5.254","TCP","40","62078  >  57533 [ACK] Seq=2 Ack=2 Win=262144 Len=0"
"253","68.987541","10.133.20.1","10.133.1.154","NBNS","78","Name query NBSTAT *<00><00><00><00><00><00><00><00><00><00><00><00><00><00><00>"
"254","68.988039","N/A","N/A","N/A","28","Raw packet data"
"255","68.988525","N/A","N/A","N/A","42","Raw packet data"
"256","68.989017","10.133.1.154","10.133.20.1","ICMP","56","Destination unreachable (Port unreachable)"
"257","69.990417","10.133.20.1","10.133.1.154","NBNS","78","Name query NBSTAT *<00><00><00><00><00><00><00><00><00><00><00><00><00><00><00>"
"258","69.990779","10.133.1.154","10.133.20.1","ICMP","56","Destination unreachable (Port unreachable)"
"259","71.212438","qrttxzy.local","224.0.0.251","MDNS","171","Standard query 0x0000 PTR lb._dns-sd._udp.local, ""QM"" question PTR _companion-link._tcp.local, ""QM"" question PTR _homekit._tcp.local, ""QM"" question PTR _airplay._tcp.local, ""QM"" question PTR _raop._tcp.local, ""QM"" question PTR hashâ\200\231s MacBook Pro._companion-link._tcp.local"
"260","71.212697","qrttxzy.local","ff02::fb","MDNS","191","Standard query 0x0000 PTR lb._dns-sd._udp.local, ""QM"" question PTR _companion-link._tcp.local, ""QM"" question PTR _homekit._tcp.local, ""QM"" question PTR _airplay._tcp.local, ""QM"" question PTR _raop._tcp.local, ""QM"" question PTR hashâ\200\231s MacBook Pro._companion-link._tcp.local"
"261","71.212827","10.133.1.154","224.0.0.251","MDNS","155","Standard query 0x0000 PTR lb._dns-sd._udp.local, ""QM"" question PTR _companion-link._tcp.local, ""QM"" question PTR _homekit._tcp.local, ""QM"" question PTR _airplay._tcp.local, ""QM"" question PTR _raop._tcp.local, ""QM"" question PTR _sleep-proxy._udp.local, ""QM"" question"
"262","71.213120","fe80::18fa:e863:173f:2864","ff02::fb","MDNS","175","Standard query 0x0000 PTR lb._dns-sd._udp.local, ""QM"" question PTR _companion-link._tcp.local, ""QM"" question PTR _homekit._tcp.local, ""QM"" question PTR _airplay._tcp.local, ""QM"" question PTR _raop._tcp.local, ""QM"" question PTR _sleep-proxy._udp.local, ""QM"" question"
"263","72.213009","17.57.144.136","10.133.1.154","TLSv1.2","396","Application Data"
"264","72.213516","10.133.1.154","17.57.144.136","TCP","40","55178  >  hpvirtgrp(5223) [ACK] Seq=1 Ack=357 Win=65535 Len=0"
"265","72.213913","17.57.144.136","10.133.1.154","TLSv1.2","66","Application Data"
"266","72.214147","10.133.1.154","17.57.144.136","TCP","40","55178  >  hpvirtgrp(5223) [ACK] Seq=1 Ack=383 Win=65535 Len=0"
"267","72.214323","10.133.1.154","17.57.144.136","TLSv1.2","72","Application Data"
"268","72.214661","17.57.144.136","10.133.1.154","TCP","46","hpvirtgrp(5223)  >  55178 [ACK] Seq=383 Ack=33 Win=63806 Len=0"
"269","73.214466","N/A","N/A","N/A","28","Raw packet data"
"270","73.214789","0.0.0.0","255.255.255.255","DHCP","328","DHCP Discover - Transaction ID 0xe4d4bb84"
"271","74.215190","0.0.0.0","255.255.255.255","DHCP","328","DHCP Discover - Transaction ID 0xab27e0de"
"272","75.216526","10.133.19.21","10.133.1.154","NBNS","78","Name query NBSTAT *<00><00><00><00><00><00><00><00><00><00><00><00><00><00><00>"
"273","75.216678","10.133.1.154","10.133.19.21","ICMP","56","Destination unreachable (Port unreachable)"
"274","76.802872","10.133.1.154","17.57.144.136","TLSv1.2","80","Application Data"
"275","77.805261","10.133.19.21","10.133.1.154","NBNS","78","Name query NBSTAT *<00><00><00><00><00><00><00><00><00><00><00><00><00><00><00>"
"276","77.805353","10.133.1.154","10.133.19.21","ICMP","56","Destination unreachable (Port unreachable)"
"277","77.805545","17.57.144.136","10.133.1.154","TCP","46","hpvirtgrp(5223)  >  55178 [ACK] Seq=383 Ack=73 Win=63806 Len=0"
"278","77.805724","17.57.144.136","10.133.1.154","TLSv1.2","64","Application Data"
"279","77.805930","10.133.1.154","17.57.144.136","TCP","40","55178  >  hpvirtgrp(5223) [ACK] Seq=73 Ack=407 Win=65535 Len=0"
"280","77.806077","10.133.1.154","17.57.144.136","TCP","40","[TCP Keep-Alive] 55178  >  hpvirtgrp(5223) [ACK] Seq=72 Ack=407 Win=65535 Len=0"
"281","77.806264","17.57.144.136","10.133.1.154","TCP","46","[TCP Keep-Alive ACK] hpvirtgrp(5223)  >  55178 [ACK] Seq=407 Ack=73 Win=63806 Len=0"
"282","77.806442","10.133.19.21","10.133.1.154","NBNS","78","Name query NBSTAT *<00><00><00><00><00><00><00><00><00><00><00><00><00><00><00>"
"283","77.806684","10.133.1.154","10.133.19.21","ICMP","56","Destination unreachable (Port unreachable)"
"284","81.885197","0.0.0.0","255.255.255.255","DHCP","328","DHCP Discover - Transaction ID 0xe4d4bb84"
"285","82.885896","0.0.0.0","255.255.255.255","DHCP","328","DHCP Discover - Transaction ID 0xab27e0de"
"286","82.886023","10.133.1.154","ns1.its.carleton.edu","DNS","71","Standard query 0x78a4 A e673.dsce9.akamaiedge.net"
"287","82.886233","ns1.its.carleton.edu","10.133.1.154","DNS","419","Standard query response 0x78a4 A e673.dsce9.akamaiedge.net A 23.35.200.54 NS n0dsce9.akamaiedge.net NS n3dsce9.akamaiedge.net NS n2dsce9.akamaiedge.net NS n4dsce9.akamaiedge.net NS n6dsce9.akamaiedge.net NS n7dsce9.akamaiedge.net NS n1dsce9.akamaiedge.net NS n5dsce9.akamaiedge.net A 184.30.41.7 A 23.42.159.36 A 23.42.159.15 A 23.42.158.134 A 88.221.81.192 A 23.42.159.22 A 23.220.96.101 A 23.42.159.44 AAAA 2600:1480:e800::c0"
"288","82.886375","10.133.1.154","e673.dsce9.akamaiedge.net","TCP","64","55316  >  https(443) [SYN] Seq=0 Win=65535 Len=0 MSS=1460 WS=64 TSval=326778573 TSecr=0 SACK_PERM=1"
"289","82.886529","e673.dsce9.akamaiedge.net","10.133.1.154","TCP","52","https(443)  >  55316 [SYN, ACK] Seq=0 Ack=1 Win=64240 Len=0 MSS=1386 SACK_PERM=1 WS=128"
"290","82.886738","10.133.1.154","e673.dsce9.akamaiedge.net","TCP","40","55316  >  https(443) [ACK] Seq=1 Ack=1 Win=262144 Len=0"
"291","82.887010","10.133.1.154","e673.dsce9.akamaiedge.net","TLSv1.3","557","Client Hello"
"292","82.887116","e673.dsce9.akamaiedge.net","10.133.1.154","TCP","52","[TCP Retransmission] https(443)  >  55316 [SYN, ACK] Seq=0 Ack=1 Win=64240 Len=0 MSS=1386 SACK_PERM=1 WS=128"
"293","82.887206","10.133.1.154","e673.dsce9.akamaiedge.net","TCP","40","[TCP Dup ACK 290#1] 55316  >  https(443) [ACK] Seq=518 Ack=1 Win=262144 Len=0"
"294","82.887393","e673.dsce9.akamaiedge.net","10.133.1.154","TCP","46","https(443)  >  55316 [ACK] Seq=1 Ack=518 Win=64128 Len=0"
"295","82.887530","e673.dsce9.akamaiedge.net","10.133.1.154","TLSv1.3","1426","Server Hello, Change Cipher Spec, Application Data"
"296","82.887704","10.133.1.154","e673.dsce9.akamaiedge.net","TCP","40","55316  >  https(443) [ACK] Seq=518 Ack=1387 Win=260736 Len=0"
"297","82.887847","e673.dsce9.akamaiedge.net","10.133.1.154","TCP","1426","https(443)  >  55316 [PSH, ACK] Seq=1387 Ack=518 Win=64128 Len=1386 [TCP segment of a reassembled PDU]"
"298","82.887924","10.133.1.154","e673.dsce9.akamaiedge.net","TCP","40","55316  >  https(443) [ACK] Seq=518 Ack=2773 Win=260736 Len=0"
"299","82.888045","e673.dsce9.akamaiedge.net","10.133.1.154","TCP","1364","https(443)  >  55316 [PSH, ACK] Seq=2773 Ack=518 Win=64128 Len=1324 [TCP segment of a reassembled PDU]"
"300","82.888188","e673.dsce9.akamaiedge.net","10.133.1.154","TCP","1426","https(443)  >  55316 [ACK] Seq=4097 Ack=518 Win=64128 Len=1386 [TCP segment of a reassembled PDU]"
"301","82.888287","10.133.1.154","e673.dsce9.akamaiedge.net","TCP","40","55316  >  https(443) [ACK] Seq=518 Ack=5483 Win=259392 Len=0"
"302","82.888471","e673.dsce9.akamaiedge.net","10.133.1.154","TCP","1426","https(443)  >  55316 [ACK] Seq=5483 Ack=518 Win=64128 Len=1386 [TCP segment of a reassembled PDU]"
