"No.","Time","Source","Destination","Protocol","Length","Info"
"1","0.000000","10.8.0.1","ord37s36-in-f10.1e100.net","TCP","74","36000  >  443 [SYN] Seq=0 Win=65535 Len=0 MSS=1460 SACK_PERM=1 TSval=809166777 TSecr=0 WS=1024"
"2","0.002553","ord37s36-in-f10.1e100.net","10.8.0.1","TCP","54","443  >  36000 [SYN, ACK] Seq=0 Ack=1 Win=65535 Len=0"
"3","0.002585","10.8.0.1","ord37s36-in-f10.1e100.net","TCP","54","36000  >  443 [ACK] Seq=1 Ack=1 Win=65535 Len=0"
"4","0.009257","10.8.0.1","ord37s36-in-f10.1e100.net","TLSv1.3","571","Client Hello"
"5","0.009336","ord37s36-in-f10.1e100.net","10.8.0.1","TCP","54","443  >  36000 [ACK] Seq=1 Ack=518 Win=65535 Len=0"
"6","0.072503","10.8.0.1","104.244.42.66","TCP","74","33958  >  443 [SYN] Seq=0 Win=65535 Len=0 MSS=1460 SACK_PERM=1 TSval=1247186804 TSecr=0 WS=1024"
"7","0.073395","104.244.42.66","10.8.0.1","TCP","54","443  >  33958 [SYN, ACK] Seq=0 Ack=1 Win=65535 Len=0"
"8","0.073414","10.8.0.1","104.244.42.66","TCP","54","33958  >  443 [ACK] Seq=1 Ack=1 Win=65535 Len=0"
"9","0.075406","10.8.0.1","104.244.42.66","TLSv1.3","571","Client Hello"
"10","0.075467","104.244.42.66","10.8.0.1","TCP","54","443  >  33958 [ACK] Seq=1 Ack=518 Win=65535 Len=0"
"11","1.475746","ord37s36-in-f10.1e100.net","10.8.0.1","TLSv1.3","2850","Server Hello, Change Cipher Spec"
"12","1.527267","10.8.0.1","ord37s36-in-f10.1e100.net","TCP","54","36000  >  443 [ACK] Seq=518 Ack=2797 Win=65535 Len=0"
"13","1.527600","ord37s36-in-f10.1e100.net","10.8.0.1","TCP","1432","443  >  36000 [PSH, ACK] Seq=2797 Ack=518 Win=65535 Len=1378 [TCP segment of a reassembled PDU]"
"14","1.578629","10.8.0.1","ord37s36-in-f10.1e100.net","TCP","54","36000  >  443 [ACK] Seq=518 Ack=4175 Win=65535 Len=0"
"15","1.578861","104.244.42.66","10.8.0.1","TLSv1.3","266","Server Hello, Change Cipher Spec, Application Data"
"16","1.578894","10.8.0.1","104.244.42.66","TCP","54","33958  >  443 [ACK] Seq=518 Ack=213 Win=65535 Len=0"
"17","1.580675","10.8.0.1","104.244.42.66","TLSv1.3","118","Change Cipher Spec, Application Data"
"18","1.580820","104.244.42.66","10.8.0.1","TCP","54","443  >  33958 [ACK] Seq=213 Ack=582 Win=65535 Len=0"
"19","1.631992","10.8.0.1","104.244.42.66","TLSv1.3","100","Application Data"
"20","1.632246","104.244.42.66","10.8.0.1","TCP","54","443  >  33958 [ACK] Seq=213 Ack=628 Win=65535 Len=0"
"21","1.632281","10.8.0.1","104.244.42.66","TLSv1.3","590","Application Data, Application Data"
"22","1.632369","104.244.42.66","10.8.0.1","TCP","54","443  >  33958 [ACK] Seq=213 Ack=1164 Win=65535 Len=0"
"23","1.632423","10.8.0.1","104.244.42.66","TCP","590","33958  >  443 [ACK] Seq=1164 Ack=213 Win=65535 Len=536 [TCP segment of a reassembled PDU]"
"24","1.632512","104.244.42.66","10.8.0.1","TCP","54","443  >  33958 [ACK] Seq=213 Ack=1700 Win=65535 Len=0"
"25","1.632535","10.8.0.1","104.244.42.66","TCP","590","33958  >  443 [ACK] Seq=1700 Ack=213 Win=65535 Len=536 [TCP segment of a reassembled PDU]"
"26","1.632589","104.244.42.66","10.8.0.1","TCP","54","443  >  33958 [ACK] Seq=213 Ack=2236 Win=65535 Len=0"
"27","1.632610","10.8.0.1","104.244.42.66","TCP","590","33958  >  443 [PSH, ACK] Seq=2236 Ack=213 Win=65535 Len=536 [TCP segment of a reassembled PDU]"
"28","1.632659","104.244.42.66","10.8.0.1","TCP","54","443  >  33958 [ACK] Seq=213 Ack=2772 Win=65535 Len=0"
"29","1.632679","10.8.0.1","104.244.42.66","TLSv1.3","428","Application Data"
"30","1.632766","104.244.42.66","10.8.0.1","TCP","54","443  >  33958 [ACK] Seq=213 Ack=3146 Win=65535 Len=0"
"31","1.701186","ord37s36-in-f10.1e100.net","10.8.0.1","TLSv1.3","568","Application Data"
"32","1.752655","10.8.0.1","ord37s36-in-f10.1e100.net","TCP","54","36000  >  443 [ACK] Seq=518 Ack=4689 Win=65535 Len=0"
"33","1.752732","10.8.0.1","ord37s36-in-f10.1e100.net","TLSv1.3","118","Change Cipher Spec, Application Data"
"34","1.752947","ord37s36-in-f10.1e100.net","10.8.0.1","TCP","54","443  >  36000 [ACK] Seq=4689 Ack=582 Win=65535 Len=0"
"35","1.752976","10.8.0.1","ord37s36-in-f10.1e100.net","TCP","590","36000  >  443 [ACK] Seq=582 Ack=4689 Win=65535 Len=536 [TCP segment of a reassembled PDU]"
"36","1.753052","ord37s36-in-f10.1e100.net","10.8.0.1","TCP","54","443  >  36000 [ACK] Seq=4689 Ack=1118 Win=65535 Len=0"
"37","1.753087","10.8.0.1","ord37s36-in-f10.1e100.net","TCP","590","36000  >  443 [ACK] Seq=1118 Ack=4689 Win=65535 Len=536 [TCP segment of a reassembled PDU]"
"38","1.753164","ord37s36-in-f10.1e100.net","10.8.0.1","TCP","54","443  >  36000 [ACK] Seq=4689 Ack=1654 Win=65535 Len=0"
"39","1.753185","10.8.0.1","ord37s36-in-f10.1e100.net","TCP","590","36000  >  443 [ACK] Seq=1654 Ack=4689 Win=65535 Len=536 [TCP segment of a reassembled PDU]"
"40","1.753221","ord37s36-in-f10.1e100.net","10.8.0.1","TCP","54","443  >  36000 [ACK] Seq=4689 Ack=2190 Win=65535 Len=0"
"41","1.753238","10.8.0.1","ord37s36-in-f10.1e100.net","TCP","590","36000  >  443 [ACK] Seq=2190 Ack=4689 Win=65535 Len=536 [TCP segment of a reassembled PDU]"
"42","1.753288","ord37s36-in-f10.1e100.net","10.8.0.1","TCP","54","443  >  36000 [ACK] Seq=4689 Ack=2726 Win=65535 Len=0"
"43","1.753306","10.8.0.1","ord37s36-in-f10.1e100.net","TCP","590","36000  >  443 [PSH, ACK] Seq=2726 Ack=4689 Win=65535 Len=536 [TCP segment of a reassembled PDU]"
"44","1.753358","ord37s36-in-f10.1e100.net","10.8.0.1","TCP","54","443  >  36000 [ACK] Seq=4689 Ack=3262 Win=65535 Len=0"
"45","1.753377","10.8.0.1","ord37s36-in-f10.1e100.net","TCP","590","36000  >  443 [ACK] Seq=3262 Ack=4689 Win=65535 Len=536 [TCP segment of a reassembled PDU]"
"46","1.753412","ord37s36-in-f10.1e100.net","10.8.0.1","TCP","54","443  >  36000 [ACK] Seq=4689 Ack=3798 Win=65535 Len=0"
"47","1.753439","10.8.0.1","ord37s36-in-f10.1e100.net","TCP","590","36000  >  443 [ACK] Seq=3798 Ack=4689 Win=65535 Len=536 [TCP segment of a reassembled PDU]"
"48","1.753483","ord37s36-in-f10.1e100.net","10.8.0.1","TCP","54","443  >  36000 [ACK] Seq=4689 Ack=4334 Win=65535 Len=0"
"49","1.753500","10.8.0.1","ord37s36-in-f10.1e100.net","TCP","590","36000  >  443 [ACK] Seq=4334 Ack=4689 Win=65535 Len=536 [TCP segment of a reassembled PDU]"
"50","1.753559","ord37s36-in-f10.1e100.net","10.8.0.1","TCP","54","443  >  36000 [ACK] Seq=4689 Ack=4870 Win=65535 Len=0"
"51","1.753579","10.8.0.1","ord37s36-in-f10.1e100.net","TCP","590","36000  >  443 [PSH, ACK] Seq=4870 Ack=4689 Win=65535 Len=536 [TCP segment of a reassembled PDU]"
"52","1.753632","ord37s36-in-f10.1e100.net","10.8.0.1","TCP","54","443  >  36000 [ACK] Seq=4689 Ack=5406 Win=65535 Len=0"
"53","1.753650","10.8.0.1","ord37s36-in-f10.1e100.net","TCP","590","36000  >  443 [ACK] Seq=5406 Ack=4689 Win=65535 Len=536 [TCP segment of a reassembled PDU]"
"54","1.753768","ord37s36-in-f10.1e100.net","10.8.0.1","TCP","54","443  >  36000 [ACK] Seq=4689 Ack=5942 Win=65535 Len=0"
"55","1.753796","10.8.0.1","ord37s36-in-f10.1e100.net","TCP","590","36000  >  443 [PSH, ACK] Seq=5942 Ack=4689 Win=65535 Len=536 [TCP segment of a reassembled PDU]"
"56","1.753841","ord37s36-in-f10.1e100.net","10.8.0.1","TCP","54","443  >  36000 [ACK] Seq=4689 Ack=6478 Win=65535 Len=0"
"57","1.753859","10.8.0.1","ord37s36-in-f10.1e100.net","TCP","590","36000  >  443 [ACK] Seq=6478 Ack=4689 Win=65535 Len=536 [TCP segment of a reassembled PDU]"
"58","1.753894","ord37s36-in-f10.1e100.net","10.8.0.1","TCP","54","443  >  36000 [ACK] Seq=4689 Ack=7014 Win=65535 Len=0"
"59","1.753916","10.8.0.1","ord37s36-in-f10.1e100.net","TLSv1.3","402","Application Data"
"60","1.753949","ord37s36-in-f10.1e100.net","10.8.0.1","TCP","54","443  >  36000 [ACK] Seq=4689 Ack=7362 Win=65535 Len=0"
"61","1.851243","104.244.42.66","10.8.0.1","TLSv1.3","581","Application Data, Application Data"
"62","1.902713","10.8.0.1","104.244.42.66","TCP","54","33958  >  443 [ACK] Seq=3146 Ack=740 Win=65535 Len=0"
"63","1.902810","10.8.0.1","104.244.42.66","TLSv1.3","85","Application Data"
"64","1.902918","104.244.42.66","10.8.0.1","TCP","54","443  >  33958 [ACK] Seq=740 Ack=3177 Win=65535 Len=0"
"65","2.064220","104.244.42.66","10.8.0.1","TLSv1.3","504","Application Data"
"66","2.115382","10.8.0.1","104.244.42.66","TCP","54","33958  >  443 [ACK] Seq=3177 Ack=1190 Win=65535 Len=0"
"67","2.115689","ord37s36-in-f10.1e100.net","10.8.0.1","TLSv1.3","1432","Application Data, Application Data"
"68","2.115730","10.8.0.1","ord37s36-in-f10.1e100.net","TCP","54","36000  >  443 [ACK] Seq=7362 Ack=6067 Win=65535 Len=0"
"69","2.144411","ord37s36-in-f10.1e100.net","10.8.0.1","TLSv1.3","187","Application Data, Application Data"
"70","2.195436","10.8.0.1","ord37s36-in-f10.1e100.net","TCP","54","36000  >  443 [ACK] Seq=7362 Ack=6200 Win=65535 Len=0"
"71","5.616807","10.8.0.1","gm-in-f188.1e100.net","TCP","74","55760  >  5228 [SYN] Seq=0 Win=65535 Len=0 MSS=1460 SACK_PERM=1 TSval=4117557573 TSecr=0 WS=1024"
"72","5.619201","gm-in-f188.1e100.net","10.8.0.1","TCP","54","5228  >  55760 [SYN, ACK] Seq=0 Ack=1 Win=65535 Len=0"
"73","5.619250","10.8.0.1","gm-in-f188.1e100.net","TCP","54","55760  >  5228 [ACK] Seq=1 Ack=1 Win=65535 Len=0"
"74","5.620505","10.8.0.1","gm-in-f188.1e100.net","TLSv1.3","587","Client Hello"
"75","5.620577","gm-in-f188.1e100.net","10.8.0.1","TCP","54","5228  >  55760 [ACK] Seq=1 Ack=534 Win=65535 Len=0"
"76","5.991068","gm-in-f188.1e100.net","10.8.0.1","TLSv1.3","257","Server Hello, Change Cipher Spec, Application Data"
"77","6.042264","10.8.0.1","gm-in-f188.1e100.net","TCP","54","55760  >  5228 [ACK] Seq=534 Ack=204 Win=65535 Len=0"
"78","6.042354","10.8.0.1","gm-in-f188.1e100.net","TLSv1.3","118","Change Cipher Spec, Application Data"
"79","6.042528","gm-in-f188.1e100.net","10.8.0.1","TCP","54","5228  >  55760 [ACK] Seq=204 Ack=598 Win=65535 Len=0"
"80","6.042560","10.8.0.1","gm-in-f188.1e100.net","TLSv1.3","445","Application Data"
"81","6.042657","gm-in-f188.1e100.net","10.8.0.1","TCP","54","5228  >  55760 [ACK] Seq=204 Ack=989 Win=65535 Len=0"
"82","6.190330","gm-in-f188.1e100.net","10.8.0.1","TLSv1.3","583","Application Data, Application Data"
"83","6.241505","10.8.0.1","gm-in-f188.1e100.net","TCP","54","55760  >  5228 [ACK] Seq=989 Ack=733 Win=65535 Len=0"
"84","6.241722","gm-in-f188.1e100.net","10.8.0.1","TLSv1.3","172","Application Data, Application Data"
"85","6.291918","10.8.0.1","gm-in-f188.1e100.net","TCP","54","55760  >  5228 [ACK] Seq=989 Ack=851 Win=65535 Len=0"
"86","9.316636","10.8.0.1","ord37s36-in-f10.1e100.net","TCP","54","36000  >  443 [RST, ACK] Seq=7362 Ack=6200 Win=65535 Len=0"
"87","10.046818","10.8.0.1","104.244.42.66","TCP","54","33958  >  443 [RST, ACK] Seq=3177 Ack=1190 Win=65535 Len=0"
"88","13.190707","gm-in-f188.1e100.net","10.8.0.1","TLSv1.3","2221","Application Data, Application Data"
"89","13.240963","10.8.0.1","gm-in-f188.1e100.net","TCP","54","55760  >  5228 [ACK] Seq=989 Ack=3018 Win=65535 Len=0"
"90","13.247706","10.8.0.1","gm-in-f188.1e100.net","TLSv1.3","92","Application Data"
"91","13.247841","gm-in-f188.1e100.net","10.8.0.1","TCP","54","5228  >  55760 [ACK] Seq=3018 Ack=1027 Win=65535 Len=0"
"92","13.247981","gm-in-f188.1e100.net","10.8.0.1","TCP","54","[TCP Dup ACK 91#1] 5228  >  55760 [PSH, ACK] Seq=3018 Ack=1027 Win=65535 Len=0"
"93","13.396808","10.8.0.1","ord38s28-in-f1.1e100.net","QUIC","1292","Initial, DCID=a12e2d38e39fd073, PKN: 1, PING, PADDING, CRYPTO, PADDING, PING, CRYPTO, PADDING, PING, CRYPTO, PADDING"
"94","13.506229","ord38s28-in-f1.1e100.net","10.8.0.1","QUIC","1292","Protected Payload (KP0)"
"95","13.506347","10.8.0.1","ord38s28-in-f1.1e100.net","QUIC","120","0-RTT, DCID=a12e2d38e39fd073"
"96","14.526729","10.8.0.1","ord38s28-in-f1.1e100.net","TCP","74","59636  >  443 [SYN] Seq=0 Win=65535 Len=0 MSS=1460 SACK_PERM=1 TSval=3068053982 TSecr=0 WS=1024"
"97","14.530718","ord38s28-in-f1.1e100.net","10.8.0.1","TCP","54","443  >  59636 [SYN, ACK] Seq=0 Ack=1 Win=65535 Len=0"
"98","14.530776","10.8.0.1","ord38s30-in-f22.1e100.net","QUIC","1292","Initial, DCID=e73e04f84a76f5c0, PKN: 1, PING, CRYPTO, CRYPTO, CRYPTO, PING, PADDING, CRYPTO, CRYPTO, PADDING, PING, PADDING, PING, PING, CRYPTO"
"99","14.665677","ord38s30-in-f22.1e100.net","10.8.0.1","QUIC","1292","Protected Payload (KP0)"
"100","14.665816","10.8.0.1","ord38s30-in-f22.1e100.net","QUIC","122","0-RTT, DCID=e73e04f84a76f5c0"
"101","15.681521","10.8.0.1","ord38s30-in-f22.1e100.net","TCP","74","38744  >  443 [SYN] Seq=0 Win=65535 Len=0 MSS=1460 SACK_PERM=1 TSval=4009702168 TSecr=0 WS=1024"
"102","15.685429","ord38s30-in-f22.1e100.net","10.8.0.1","TCP","54","443  >  38744 [SYN, ACK] Seq=0 Ack=1 Win=65535 Len=0"
"103","15.685485","10.8.0.1","ord38s30-in-f22.1e100.net","QUIC","1292","Initial, DCID=e73e04f84a76f5c0, PKN: 4, PING, PADDING, PING, CRYPTO, PADDING, PING, PING, PADDING, CRYPTO, PADDING"
"104","16.112221","ord38s30-in-f22.1e100.net","10.8.0.1","QUIC","136","Initial, SCID=e73e04f84a76f5c0, PKN: 8, CC"
"105","16.112331","10.8.0.1","ord38s28-in-f1.1e100.net","QUIC","1292","Initial, DCID=a12e2d38e39fd073, PKN: 4, PING, PING, PING, PING, PADDING, CRYPTO, PING, CRYPTO"
"106","16.304632","ord38s28-in-f1.1e100.net","10.8.0.1","QUIC","136","Initial, SCID=a12e2d38e39fd073, PKN: 8, CC"
"107","16.304773","10.8.0.1","ord38s28-in-f1.1e100.net","QUIC","1292","Handshake, DCID=a12e2d38e39fd073"
"108","16.426405","ord38s28-in-f1.1e100.net","10.8.0.1","QUIC","136","Initial, SCID=a12e2d38e39fd073, PKN: 8, CC"
"109","16.426500","10.8.0.1","ord38s28-in-f1.1e100.net","QUIC","115","Handshake, DCID=a12e2d38e39fd073"
"110","17.437931","10.8.0.1","ord38s28-in-f1.1e100.net","QUIC","300","Protected Payload (KP0), DCID=a12e2d38e39fd073"
"111","17.551802","ord38s28-in-f1.1e100.net","10.8.0.1","QUIC","136","Initial, SCID=a12e2d38e39fd073, PKN: 8, CC"
"112","17.551870","10.8.0.1","ord38s30-in-f22.1e100.net","QUIC","1292","Initial, DCID=e73e04f84a76f5c0, PKN: 6, CRYPTO, CRYPTO, PING, PING, PING, PADDING, PING, PADDING, CRYPTO, CRYPTO"
"113","17.665824","ord38s30-in-f22.1e100.net","10.8.0.1","QUIC","136","Initial, SCID=e73e04f84a76f5c0, PKN: 8, CC"
"114","17.665907","10.8.0.1","ord38s30-in-f22.1e100.net","TCP","74","38746  >  443 [SYN] Seq=0 Win=65535 Len=0 MSS=1460 SACK_PERM=1 TSval=4009702422 TSecr=0 WS=1024"
"115","17.668478","ord38s30-in-f22.1e100.net","10.8.0.1","TCP","54","443  >  38746 [SYN, ACK] Seq=0 Ack=1 Win=65535 Len=0"
"116","17.668548","10.8.0.1","ord38s28-in-f1.1e100.net","QUIC","185","Protected Payload (KP0), DCID=a12e2d38e39fd073"
"117","18.685858","10.8.0.1","ord38s30-in-f22.1e100.net","QUIC","1292","Initial, DCID=e73e04f84a76f5c0, PKN: 8, PING, PING, PADDING, PING, CRYPTO, PADDING, PING, PADDING, CRYPTO, PING, CRYPTO"
"118","19.711218","10.8.0.1","ord38s28-in-f1.1e100.net","QUIC","367","Protected Payload (KP0), DCID=a12e2d38e39fd073"
"119","20.735410","10.8.0.1","ord38s30-in-f22.1e100.net","QUIC","1292","Initial, DCID=e73e04f84a76f5c0, PKN: 10, CRYPTO, CRYPTO, PADDING, PING, PADDING"
"120","20.825588","ord38s30-in-f22.1e100.net","10.8.0.1","QUIC","136","Initial, SCID=e73e04f84a76f5c0, PKN: 8, CC"
"121","20.825704","10.8.0.1","ord38s28-in-f1.1e100.net","TCP","74","[TCP Retransmission] 59636  >  443 [SYN] Seq=0 Win=65535 Len=0 MSS=1460 SACK_PERM=1 TSval=3068054980 TSecr=0 WS=1024"
"122","20.829312","ord38s28-in-f1.1e100.net","10.8.0.1","TCP","54","[TCP Retransmission] 443  >  59636 [SYN, ACK] Seq=0 Ack=1 Win=65535 Len=0"
"123","20.829357","10.8.0.1","ord38s30-in-f22.1e100.net","TCP","74","[TCP Retransmission] 38744  >  443 [SYN] Seq=0 Win=65535 Len=0 MSS=1460 SACK_PERM=1 TSval=4009703191 TSecr=0 WS=1024"
"124","20.831697","ord38s30-in-f22.1e100.net","10.8.0.1","TCP","54","[TCP Retransmission] 443  >  38744 [SYN, ACK] Seq=0 Ack=1 Win=65535 Len=0"
"125","20.831743","10.8.0.1","ord38s28-in-f1.1e100.net","TCP","54","59636  >  443 [ACK] Seq=1 Ack=1 Win=67107840 Len=0"
"126","20.831769","10.8.0.1","ord38s28-in-f1.1e100.net","TCP","590","59636  >  443 [ACK] Seq=1 Ack=1 Win=67107840 Len=536 [TCP segment of a reassembled PDU]"
"127","20.831904","ord38s28-in-f1.1e100.net","10.8.0.1","TCP","54","443  >  59636 [ACK] Seq=1 Ack=537 Win=65535 Len=0"
"128","20.831930","10.8.0.1","ord38s28-in-f1.1e100.net","TLSv1.3","112","Client Hello"
"129","20.832061","ord38s28-in-f1.1e100.net","10.8.0.1","TCP","54","443  >  59636 [ACK] Seq=1 Ack=595 Win=65535 Len=0"
"130","20.832089","10.8.0.1","ord38s30-in-f22.1e100.net","QUIC","1292","Handshake, DCID=e73e04f84a76f5c0"
"131","21.855012","10.8.0.1","ord38s30-in-f22.1e100.net","QUIC","115","Handshake, DCID=e73e04f84a76f5c0"
"132","22.879108","10.8.0.1","ord38s30-in-f22.1e100.net","QUIC","323","Protected Payload (KP0), DCID=e73e04f84a76f5c0"
"133","23.904720","10.8.0.1","ord38s30-in-f22.1e100.net","TCP","74","[TCP Retransmission] 38746  >  443 [SYN] Seq=0 Win=65535 Len=0 MSS=1460 SACK_PERM=1 TSval=4009703447 TSecr=0 WS=1024"
"134","23.908379","ord38s30-in-f22.1e100.net","10.8.0.1","TCP","54","[TCP Retransmission] 443  >  38746 [SYN, ACK] Seq=0 Ack=1 Win=65535 Len=0"
"135","23.908550","ord38s28-in-f1.1e100.net","10.8.0.1","TLSv1.3","266","Server Hello, Change Cipher Spec, Application Data"
"136","23.908588","10.8.0.1","ord38s28-in-f1.1e100.net","QUIC","185","Protected Payload (KP0), DCID=a12e2d38e39fd073"
"137","24.927261","10.8.0.1","ord38s30-in-f22.1e100.net","TCP","54","38744  >  443 [ACK] Seq=1 Ack=1 Win=67107840 Len=0"
"138","24.927395","10.8.0.1","ord38s30-in-f22.1e100.net","TCP","590","38744  >  443 [ACK] Seq=1 Ack=1 Win=67107840 Len=536 [TCP segment of a reassembled PDU]"
"139","24.927764","ord38s30-in-f22.1e100.net","10.8.0.1","TCP","54","443  >  38744 [ACK] Seq=1 Ack=537 Win=65535 Len=0"
"140","24.927801","10.8.0.1","ord38s30-in-f22.1e100.net","TLSv1.3","110","Client Hello"
"141","24.927860","ord38s30-in-f22.1e100.net","10.8.0.1","TCP","54","443  >  38744 [ACK] Seq=1 Ack=593 Win=65535 Len=0"
"142","24.927881","10.8.0.1","ord38s30-in-f22.1e100.net","TCP","74","[TCP Retransmission] 38746  >  443 [SYN] Seq=0 Win=65535 Len=0 MSS=1460 SACK_PERM=1 TSval=4009705463 TSecr=0 WS=1024"
"143","24.931280","ord38s30-in-f22.1e100.net","10.8.0.1","TCP","54","[TCP Retransmission] 443  >  38746 [SYN, ACK] Seq=0 Ack=1 Win=65535 Len=0"
"144","24.931401","10.8.0.1","ord38s28-in-f1.1e100.net","QUIC","367","Protected Payload (KP0), DCID=a12e2d38e39fd073"
"145","25.026822","ord38s28-in-f1.1e100.net","10.8.0.1","QUIC","136","Initial, SCID=a12e2d38e39fd073, PKN: 8, CC"
"146","25.026938","10.8.0.1","ord38s30-in-f22.1e100.net","QUIC","187","Protected Payload (KP0), DCID=e73e04f84a76f5c0"
"147","25.106213","ord38s30-in-f22.1e100.net","10.8.0.1","QUIC","136","Initial, SCID=e73e04f84a76f5c0, PKN: 8, CC"
"148","25.106332","10.8.0.1","ord38s28-in-f1.1e100.net","TCP","590","[TCP Spurious Retransmission] 59636  >  443 [ACK] Seq=1 Ack=1 Win=67107840 Len=536"
"149","25.106466","ord38s28-in-f1.1e100.net","10.8.0.1","TCP","54","443  >  59636 [ACK] Seq=1 Ack=537 Win=65535 Len=0"
"150","25.106556","ord38s30-in-f22.1e100.net","10.8.0.1","TLSv1.3","266","Server Hello, Change Cipher Spec, Application Data"
"151","25.106582","10.8.0.1","ord38s30-in-f22.1e100.net","TCP","54","38746  >  443 [ACK] Seq=1 Ack=1 Win=67107840 Len=0"
"152","25.106604","10.8.0.1","ord38s30-in-f22.1e100.net","TCP","590","38746  >  443 [ACK] Seq=1 Ack=1 Win=67107840 Len=536 [TCP segment of a reassembled PDU]"
"153","25.106686","ord38s30-in-f22.1e100.net","10.8.0.1","TCP","54","443  >  38746 [ACK] Seq=1 Ack=537 Win=65535 Len=0"
"154","25.106709","10.8.0.1","ord38s30-in-f22.1e100.net","TCP","590","[TCP Out-Of-Order] 38744  >  443 [ACK] Seq=1 Ack=1 Win=67107840 Len=536"
"155","25.106763","ord38s30-in-f22.1e100.net","10.8.0.1","TCP","54","443  >  38744 [ACK] Seq=1 Ack=537 Win=65535 Len=0"
"156","25.106784","10.8.0.1","ord38s28-in-f1.1e100.net","QUIC","185","Protected Payload (KP0), DCID=a12e2d38e39fd073"
"157","26.111823","10.8.0.1","ord38s28-in-f1.1e100.net","TCP","54","[TCP Dup ACK 125#1] 59636  >  443 [ACK] Seq=595 Ack=1 Win=67107840 Len=0"
"158","26.111938","10.8.0.1","ord38s30-in-f22.1e100.net","TCP","54","[TCP Dup ACK 137#1] 38744  >  443 [ACK] Seq=593 Ack=1 Win=67107840 Len=0"
"159","26.111965","10.8.0.1","ord38s28-in-f1.1e100.net","TCP","112","[TCP Retransmission] 59636  >  443 [PSH, ACK] Seq=537 Ack=1 Win=67107840 Len=58"
"160","26.112269","ord38s28-in-f1.1e100.net","10.8.0.1","TCP","54","443  >  59636 [ACK] Seq=1 Ack=595 Win=65535 Len=0"
"161","26.112312","10.8.0.1","ord38s30-in-f22.1e100.net","TCP","590","[TCP Spurious Retransmission] 38746  >  443 [ACK] Seq=1 Ack=1 Win=67107840 Len=536"
"162","26.112458","ord38s30-in-f22.1e100.net","10.8.0.1","TCP","54","[TCP Dup ACK 153#1] 443  >  38746 [ACK] Seq=1 Ack=537 Win=65535 Len=0"
"163","26.112653","10.8.0.1","ord38s30-in-f22.1e100.net","QUIC","390","Protected Payload (KP0), DCID=e73e04f84a76f5c0"
"164","27.135061","10.8.0.1","ord38s30-in-f22.1e100.net","TCP","54","[TCP Dup ACK 151#1] 38746  >  443 [ACK] Seq=537 Ack=1 Win=67107840 Len=0"
"165","27.135487","ord38s28-in-f1.1e100.net","10.8.0.1","TCP","78","[TCP Retransmission] 443  >  59636 [PSH, ACK] Seq=1 Ack=595 Win=65535 Len=24"
"166","27.135573","ord38s28-in-f1.1e100.net","10.8.0.1","TCP","54","[TCP Retransmission] 443  >  59636 [FIN, ACK] Seq=25 Ack=595 Win=65535 Len=0"
"167","27.135697","10.8.0.1","ord38s28-in-f1.1e100.net","TCP","54","59636  >  443 [ACK] Seq=595 Ack=213 Win=67107840 Len=0"
"168","27.135724","10.8.0.1","ord38s28-in-f1.1e100.net","TLSv1.3","118","Change Cipher Spec, Application Data"
"169","27.135742","10.8.0.1","ord38s28-in-f1.1e100.net","QUIC","184","Protected Payload (KP0), DCID=a12e2d38e39fd073"
"170","28.160783","10.8.0.1","ord38s28-in-f1.1e100.net","TLSv1.3","146","Application Data"
"171","28.160887","10.8.0.1","ord38s28-in-f1.1e100.net","TLSv1.3","294","Application Data"
"172","28.160915","10.8.0.1","ord38s30-in-f22.1e100.net","TCP","110","[TCP Retransmission] 38744  >  443 [PSH, ACK] Seq=537 Ack=1 Win=67107840 Len=56"
"173","28.161215","ord38s30-in-f22.1e100.net","10.8.0.1","TCP","54","443  >  38744 [ACK] Seq=1 Ack=593 Win=65535 Len=0"
"174","28.161250","10.8.0.1","ord38s30-in-f22.1e100.net","TCP","54","[TCP Dup ACK 151#2] 38746  >  443 [ACK] Seq=537 Ack=1 Win=67107840 Len=0"
"175","28.161502","10.8.0.1","ord38s28-in-f1.1e100.net","TCP","54","[TCP Dup ACK 167#1] 59636  >  443 [ACK] Seq=991 Ack=213 Win=67107840 Len=0"
"176","28.161527","10.8.0.1","ord38s30-in-f22.1e100.net","TCP","54","38744  >  443 [ACK] Seq=593 Ack=213 Win=67107840 Len=0"
"177","28.161546","10.8.0.1","ord38s30-in-f22.1e100.net","TLSv1.2","110","Client Hello"
"178","28.161629","ord38s30-in-f22.1e100.net","10.8.0.1","TCP","54","443  >  38746 [ACK] Seq=1 Ack=593 Win=65535 Len=0"
"179","28.161649","10.8.0.1","ord38s30-in-f22.1e100.net","TCP","54","[TCP Dup ACK 176#1] 38744  >  443 [ACK] Seq=593 Ack=213 Win=67107840 Len=0"
"180","28.161740","10.8.0.1","ord38s30-in-f22.1e100.net","TLSv1.3","118","Change Cipher Spec, Application Data"
"181","28.161792","ord38s30-in-f22.1e100.net","10.8.0.1","TCP","54","443  >  38744 [ACK] Seq=213 Ack=657 Win=65535 Len=0"
"182","28.161813","10.8.0.1","ord38s28-in-f1.1e100.net","TCP","54","[TCP Dup ACK 167#2] 59636  >  443 [ACK] Seq=991 Ack=213 Win=67107840 Len=0"
"183","28.161852","10.8.0.1","ord38s28-in-f1.1e100.net","TCP","54","[TCP Dup ACK 167#3] 59636  >  443 [ACK] Seq=991 Ack=213 Win=67107840 Len=0"
"184","28.161868","10.8.0.1","ord38s28-in-f1.1e100.net","TCP","54","[TCP Dup ACK 167#4] 59636  >  443 [ACK] Seq=991 Ack=213 Win=67107840 Len=0"
"185","28.161882","10.8.0.1","ord38s30-in-f22.1e100.net","TCP","54","[TCP Dup ACK 176#2] 38744  >  443 [ACK] Seq=657 Ack=213 Win=67107840 Len=0"
"186","28.266614","ord38s30-in-f22.1e100.net","10.8.0.1","TLSv1.3","78","Application Data"
"187","28.317970","ord38s30-in-f22.1e100.net","10.8.0.1","TCP","54","443  >  38744 [FIN, ACK] Seq=237 Ack=657 Win=65535 Len=0"
"188","28.318129","10.8.0.1","ord38s30-in-f22.1e100.net","TCP","54","38744  >  443 [ACK] Seq=657 Ack=237 Win=67107840 Len=0"
"189","28.318276","ord38s30-in-f22.1e100.net","10.8.0.1","TLSv1.2","61","Alert (Level: Fatal, Description: Decode Error)"
"190","28.318307","10.8.0.1","ord38s30-in-f22.1e100.net","TCP","54","38746  >  443 [ACK] Seq=593 Ack=8 Win=67107840 Len=0"
"191","28.318369","ord38s30-in-f22.1e100.net","10.8.0.1","TCP","54","443  >  38746 [FIN, ACK] Seq=8 Ack=593 Win=65535 Len=0"
"192","28.318596","10.8.0.1","ord38s30-in-f22.1e100.net","TCP","54","38744  >  443 [FIN, ACK] Seq=657 Ack=238 Win=67107840 Len=0"
"193","28.318693","ord38s30-in-f22.1e100.net","10.8.0.1","TCP","54","443  >  38744 [ACK] Seq=238 Ack=658 Win=65535 Len=0"
"194","28.318796","ord38s30-in-f22.1e100.net","10.8.0.1","TCP","54","443  >  38744 [FIN, ACK] Seq=238 Ack=658 Win=65535 Len=0"
"195","28.318822","10.8.0.1","ord38s30-in-f22.1e100.net","TCP","54","38744  >  443 [RST] Seq=658 Win=0 Len=0"
"196","28.319269","10.8.0.1","ord38s30-in-f22.1e100.net","TCP","54","38746  >  443 [FIN, ACK] Seq=593 Ack=9 Win=67107840 Len=0"
"197","28.319571","ord38s30-in-f22.1e100.net","10.8.0.1","TCP","54","443  >  38746 [ACK] Seq=9 Ack=594 Win=65535 Len=0"
"198","28.319701","ord38s30-in-f22.1e100.net","10.8.0.1","TCP","54","443  >  38746 [FIN, ACK] Seq=9 Ack=594 Win=65535 Len=0"
"199","28.319737","10.8.0.1","ord38s30-in-f22.1e100.net","TCP","54","38746  >  443 [RST] Seq=594 Win=0 Len=0"
"200","28.323353","10.8.0.1","ord38s30-in-f22.1e100.net","TCP","74","38762  >  443 [SYN] Seq=0 Win=65535 Len=0 MSS=1460 SACK_PERM=1 TSval=4009717085 TSecr=0 WS=1024"
"201","28.326135","ord38s30-in-f22.1e100.net","10.8.0.1","TCP","54","443  >  38762 [SYN, ACK] Seq=0 Ack=1 Win=65535 Len=0"
"202","28.326243","10.8.0.1","ord38s30-in-f22.1e100.net","TCP","54","38762  >  443 [ACK] Seq=1 Ack=1 Win=65535 Len=0"
"203","28.327678","10.8.0.1","ord38s30-in-f22.1e100.net","TLSv1.3","571","Client Hello"
"204","28.327768","ord38s30-in-f22.1e100.net","10.8.0.1","TCP","54","443  >  38762 [ACK] Seq=1 Ack=518 Win=65535 Len=0"
"205","28.578021","ord38s30-in-f22.1e100.net","10.8.0.1","TLSv1.3","2850","Server Hello, Change Cipher Spec"
"206","28.629570","10.8.0.1","ord38s30-in-f22.1e100.net","TCP","54","38762  >  443 [ACK] Seq=518 Ack=2797 Win=65535 Len=0"
"207","28.630054","ord38s30-in-f22.1e100.net","10.8.0.1","TCP","1432","443  >  38762 [PSH, ACK] Seq=2797 Ack=518 Win=65535 Len=1378 [TCP segment of a reassembled PDU]"
"208","28.681544","10.8.0.1","ord38s30-in-f22.1e100.net","TCP","54","38762  >  443 [ACK] Seq=518 Ack=4175 Win=65535 Len=0"
"209","28.707137","ord38s30-in-f22.1e100.net","10.8.0.1","TLSv1.3","630","Application Data"
"210","28.758375","10.8.0.1","ord38s30-in-f22.1e100.net","TCP","54","38762  >  443 [ACK] Seq=518 Ack=4751 Win=65535 Len=0"
"211","28.758469","10.8.0.1","ord38s30-in-f22.1e100.net","TLSv1.3","118","Change Cipher Spec, Application Data"
"212","28.758655","ord38s30-in-f22.1e100.net","10.8.0.1","TCP","54","443  >  38762 [ACK] Seq=4751 Ack=582 Win=65535 Len=0"
"213","28.864974","ord38s30-in-f22.1e100.net","10.8.0.1","TLSv1.3","662","Application Data, Application Data"
"214","28.916215","10.8.0.1","ord38s30-in-f22.1e100.net","TCP","54","38762  >  443 [ACK] Seq=582 Ack=5359 Win=65535 Len=0"
"215","30.078399","10.8.0.1","ord38s28-in-f1.1e100.net","TCP","450","[TCP Retransmission] 59636  >  443 [PSH, ACK] Seq=595 Ack=213 Win=67107840 Len=396"
"216","32.367168","10.8.0.1","ord38s30-in-f22.1e100.net","QUIC","187","Protected Payload (KP0), DCID=e73e04f84a76f5c0"
"217","42.112082","10.8.0.1","ord38s28-in-f1.1e100.net","TCP","450","[TCP Retransmission] 59636  >  443 [PSH, ACK] Seq=595 Ack=213 Win=67107840 Len=396"
"218","43.700206","10.8.0.1","ord38s30-in-f22.1e100.net","QUIC","244","Protected Payload (KP0), DCID=e73e04f84a76f5c0"
"219","44.734040","10.8.0.1","ord38s30-in-f22.1e100.net","TLSv1.3","146","Application Data"
"220","44.734419","ord38s30-in-f22.1e100.net","10.8.0.1","TCP","54","443  >  38762 [ACK] Seq=5359 Ack=674 Win=65535 Len=0"
"221","44.734450","10.8.0.1","ord38s30-in-f22.1e100.net","TLSv1.3","85","Application Data"
"222","44.734503","ord38s30-in-f22.1e100.net","10.8.0.1","TCP","54","443  >  38762 [ACK] Seq=5359 Ack=705 Win=65535 Len=0"
"223","44.734673","10.8.0.1","ord38s30-in-f22.1e100.net","TLSv1.3","317","Application Data"
"224","44.734732","ord38s30-in-f22.1e100.net","10.8.0.1","TCP","54","443  >  38762 [ACK] Seq=5359 Ack=968 Win=65535 Len=0"
"225","44.734754","10.8.0.1","ord38s30-in-f22.1e100.net","TCP","146","[TCP Out-Of-Order] 38762  >  443 [PSH, ACK] Seq=582 Ack=5359 Win=65535 Len=92"
"226","44.734793","ord38s30-in-f22.1e100.net","10.8.0.1","TCP","54","443  >  38762 [ACK] Seq=5359 Ack=674 Win=65535 Len=0"
"227","44.734831","10.8.0.1","ord38s30-in-f22.1e100.net","TCP","146","[TCP Out-Of-Order] 38762  >  443 [PSH, ACK] Seq=582 Ack=5359 Win=65535 Len=92"
"228","44.734864","ord38s30-in-f22.1e100.net","10.8.0.1","TCP","54","[TCP Dup ACK 226#1] 443  >  38762 [ACK] Seq=5359 Ack=674 Win=65535 Len=0"
"229","44.734880","10.8.0.1","ord38s30-in-f22.1e100.net","TCP","85","[TCP Out-Of-Order] 38762  >  443 [PSH, ACK] Seq=674 Ack=5359 Win=65535 Len=31"
"230","44.734911","ord38s30-in-f22.1e100.net","10.8.0.1","TCP","54","443  >  38762 [ACK] Seq=5359 Ack=705 Win=65535 Len=0"
"231","44.734940","10.8.0.1","ord38s30-in-f22.1e100.net","TCP","317","[TCP Retransmission] 38762  >  443 [PSH, ACK] Seq=705 Ack=5359 Win=65535 Len=263"
"232","44.734973","ord38s30-in-f22.1e100.net","10.8.0.1","TCP","54","443  >  38762 [ACK] Seq=5359 Ack=968 Win=65535 Len=0"
"233","44.834190","ord38s30-in-f22.1e100.net","10.8.0.1","TLSv1.3","85","Application Data"
"234","44.885369","10.8.0.1","ord38s30-in-f22.1e100.net","TCP","54","38762  >  443 [ACK] Seq=968 Ack=5390 Win=65535 Len=0"
"235","44.906660","ord38s30-in-f22.1e100.net","10.8.0.1","TLSv1.3","78","Application Data"
"236","44.957835","ord38s30-in-f22.1e100.net","10.8.0.1","TCP","54","443  >  38762 [FIN, ACK] Seq=5414 Ack=968 Win=65535 Len=0"
"237","44.957984","10.8.0.1","ord38s30-in-f22.1e100.net","TCP","54","38762  >  443 [ACK] Seq=968 Ack=5414 Win=65535 Len=0"
"238","44.958009","10.8.0.1","ord38s30-in-f22.1e100.net","TLSv1.3","123","Application Data"
"239","44.958026","10.8.0.1","ord38s30-in-f22.1e100.net","TCP","54","38762  >  443 [FIN, ACK] Seq=1037 Ack=5414 Win=65535 Len=0"
"240","44.958102","ord38s30-in-f22.1e100.net","10.8.0.1","TCP","54","[TCP Keep-Alive] 443  >  38762 [ACK] Seq=5414 Ack=1038 Win=65535 Len=0"
"241","44.958402","ord38s30-in-f22.1e100.net","10.8.0.1","TCP","54","[TCP Out-Of-Order] 443  >  38762 [FIN, ACK] Seq=5414 Ack=1038 Win=65535 Len=0"
"242","44.958455","10.8.0.1","ord38s30-in-f22.1e100.net","QUIC","1292","Initial, DCID=871f5843d75f78a8, PKN: 1, PADDING, PING, CRYPTO, PADDING, CRYPTO, CRYPTO, PADDING, CRYPTO, PADDING, CRYPTO, CRYPTO, CRYPTO, PADDING"
"243","45.108886","ord38s30-in-f22.1e100.net","10.8.0.1","QUIC","1292","Protected Payload (KP0)"
"244","45.109026","10.8.0.1","ord38s30-in-f22.1e100.net","QUIC","118","0-RTT, DCID=871f5843d75f78a8"
"245","46.112899","10.8.0.1","ord38s30-in-f22.1e100.net","QUIC","321","0-RTT, DCID=871f5843d75f78a8"
"246","46.305499","ord38s30-in-f22.1e100.net","10.8.0.1","QUIC","136","Initial, SCID=871f5843d75f78a8, PKN: 5, CC"
"247","46.305597","10.8.0.1","ord38s30-in-f22.1e100.net","TCP","54","38762  >  443 [ACK] Seq=1038 Ack=5415 Win=65535 Len=0"
"248","46.305618","10.8.0.1","ord38s30-in-f22.1e100.net","TCP","54","[TCP Dup ACK 247#1] 38762  >  443 [ACK] Seq=1038 Ack=5415 Win=65535 Len=0"
"249","46.305640","10.8.0.1","ord38s30-in-f22.1e100.net","QUIC","1292","Handshake, DCID=871f5843d75f78a8"
"250","46.429578","ord38s30-in-f22.1e100.net","10.8.0.1","QUIC","136","Initial, SCID=871f5843d75f78a8, PKN: 5, CC"
"251","46.429692","10.8.0.1","ord38s30-in-f22.1e100.net","QUIC","115","Handshake, DCID=871f5843d75f78a8"
"252","47.455812","10.8.0.1","ord38s30-in-f22.1e100.net","QUIC","75","Protected Payload (KP0), DCID=871f5843d75f78a8"
"253","47.585954","ord38s30-in-f22.1e100.net","10.8.0.1","QUIC","136","Initial, SCID=871f5843d75f78a8, PKN: 5, CC"
"254","47.586038","10.8.0.1","ord38s30-in-f22.1e100.net","QUIC","183","Protected Payload (KP0), DCID=871f5843d75f78a8"
"255","48.605370","10.8.0.1","ord38s30-in-f22.1e100.net","QUIC","386","Protected Payload (KP0), DCID=871f5843d75f78a8"
"256","49.629377","10.8.0.1","ord38s30-in-f22.1e100.net","QUIC","183","Protected Payload (KP0), DCID=871f5843d75f78a8"
"257","50.654567","10.8.0.1","ord38s30-in-f22.1e100.net","QUIC","386","Protected Payload (KP0), DCID=871f5843d75f78a8"
"258","50.750582","ord38s30-in-f22.1e100.net","10.8.0.1","QUIC","136","Initial, SCID=871f5843d75f78a8, PKN: 5, CC"
"259","52.154912","10.8.0.1","lithium.constant.com","NTP","90","NTP Version 3, client"
"260","52.266644","lithium.constant.com","10.8.0.1","NTP","90","NTP Version 3, server"
"261","56.547109","10.8.0.1","ord38s30-in-f22.1e100.net","QUIC","183","Protected Payload (KP0), DCID=871f5843d75f78a8"
"262","62.973023","10.8.0.1","ord38s30-in-f22.1e100.net","QUIC","184","Protected Payload (KP0), DCID=871f5843d75f78a8"
"263","63.998139","10.8.0.1","ord38s30-in-f22.1e100.net","TCP","74","38766  >  443 [SYN] Seq=0 Win=65535 Len=0 MSS=1460 SACK_PERM=1 TSval=4009751740 TSecr=0 WS=1024"
"264","64.001971","ord38s30-in-f22.1e100.net","10.8.0.1","TCP","54","443  >  38766 [SYN, ACK] Seq=0 Ack=1 Win=65535 Len=0"
"265","64.002017","10.8.0.1","ord38s30-in-f22.1e100.net","TCP","74","38768  >  443 [SYN] Seq=0 Win=65535 Len=0 MSS=1460 SACK_PERM=1 TSval=4009751995 TSecr=0 WS=1024"
"266","64.004289","ord38s30-in-f22.1e100.net","10.8.0.1","TCP","54","443  >  38768 [SYN, ACK] Seq=0 Ack=1 Win=65535 Len=0"
"267","64.004335","10.8.0.1","ord38s30-in-f22.1e100.net","TCP","74","[TCP Retransmission] 38766  >  443 [SYN] Seq=0 Win=65535 Len=0 MSS=1460 SACK_PERM=1 TSval=4009752759 TSecr=0 WS=1024"
"268","64.006948","ord38s30-in-f22.1e100.net","10.8.0.1","TCP","54","[TCP Retransmission] 443  >  38766 [SYN, ACK] Seq=0 Ack=1 Win=65535 Len=0"
"269","64.006993","10.8.0.1","ord38s30-in-f22.1e100.net","TCP","54","38766  >  443 [ACK] Seq=1 Ack=1 Win=67107840 Len=0"
"270","64.007017","10.8.0.1","ord38s30-in-f22.1e100.net","TLSv1","571","Client Hello"
"271","64.007083","ord38s30-in-f22.1e100.net","10.8.0.1","TCP","54","443  >  38766 [ACK] Seq=1 Ack=518 Win=65535 Len=0"
"272","64.007101","10.8.0.1","ord38s30-in-f22.1e100.net","TCP","54","38768  >  443 [ACK] Seq=1 Ack=1 Win=65535 Len=0"
"273","64.007119","10.8.0.1","ord38s30-in-f22.1e100.net","TLSv1.3","571","Client Hello"
"274","64.007164","ord38s30-in-f22.1e100.net","10.8.0.1","TCP","54","443  >  38768 [ACK] Seq=1 Ack=518 Win=65535 Len=0"
"275","64.007180","10.8.0.1","ord38s30-in-f22.1e100.net","TCP","54","[TCP Dup ACK 269#1] 38766  >  443 [ACK] Seq=518 Ack=1 Win=67107840 Len=0"
"276","64.192499","ord38s30-in-f22.1e100.net","10.8.0.1","TLSv1.3","1432","Server Hello, Change Cipher Spec"
"277","64.243980","10.8.0.1","ord38s30-in-f22.1e100.net","TCP","54","38768  >  443 [ACK] Seq=518 Ack=1379 Win=65535 Len=0"
"278","64.245071","ord38s30-in-f22.1e100.net","10.8.0.1","TLSv1.3","3426","Application Data"
"279","64.296154","10.8.0.1","ord38s30-in-f22.1e100.net","TCP","54","38768  >  443 [ACK] Seq=518 Ack=4751 Win=65535 Len=0"
"280","64.296229","10.8.0.1","ord38s30-in-f22.1e100.net","TLSv1.3","118","Change Cipher Spec, Application Data"
"281","64.296351","ord38s30-in-f22.1e100.net","10.8.0.1","TCP","54","443  >  38768 [ACK] Seq=4751 Ack=582 Win=65535 Len=0"
"282","64.296378","10.8.0.1","ord38s30-in-f22.1e100.net","TLSv1.3","146","Application Data"
"283","64.296426","ord38s30-in-f22.1e100.net","10.8.0.1","TCP","54","443  >  38768 [ACK] Seq=4751 Ack=674 Win=65535 Len=0"
"284","64.296566","10.8.0.1","ord38s30-in-f22.1e100.net","TLSv1.3","317","Application Data"
"285","64.296625","ord38s30-in-f22.1e100.net","10.8.0.1","TCP","54","443  >  38768 [ACK] Seq=4751 Ack=937 Win=65535 Len=0"
"286","64.393412","ord38s30-in-f22.1e100.net","10.8.0.1","TLSv1.3","662","Application Data, Application Data"
"287","64.444946","10.8.0.1","ord38s30-in-f22.1e100.net","TCP","54","38768  >  443 [ACK] Seq=937 Ack=5359 Win=65535 Len=0"
"288","64.445043","10.8.0.1","ord38s30-in-f22.1e100.net","TLSv1.3","85","Application Data"
"289","64.445232","ord38s30-in-f22.1e100.net","10.8.0.1","TCP","54","443  >  38768 [ACK] Seq=5359 Ack=968 Win=65535 Len=0"
"290","64.496794","ord38s30-in-f22.1e100.net","10.8.0.1","TLSv1.3","9731","Application Data, Application Data, Application Data, Application Data, Application Data, Application Data, Application Data, Application Data"
"291","64.548054","10.8.0.1","ord38s30-in-f22.1e100.net","TCP","54","38768  >  443 [ACK] Seq=968 Ack=15036 Win=65535 Len=0"
"292","64.549023","ord38s30-in-f22.1e100.net","10.8.0.1","TLSv1.3","11078","Application Data, Application Data, Application Data, Application Data, Application Data, Application Data, Application Data, Application Data"
"293","64.600427","10.8.0.1","ord38s30-in-f22.1e100.net","TCP","54","38768  >  443 [ACK] Seq=968 Ack=26060 Win=65535 Len=0"
"294","64.600845","ord38s30-in-f22.1e100.net","10.8.0.1","TLSv1.3","24858","Application Data, Application Data, Application Data, Application Data, Application Data, Application Data, Application Data, Application Data, Application Data, Application Data, Application Data, Application Data, Application Data, Application Data, Application Data, Application Data, Application Data, Application Data"
"295","64.651943","10.8.0.1","ord38s30-in-f22.1e100.net","TCP","54","38768  >  443 [ACK] Seq=968 Ack=50864 Win=65535 Len=0"
"296","64.652327","ord38s30-in-f22.1e100.net","10.8.0.1","TLSv1.3","8322","Application Data, Application Data, Application Data, Application Data, Application Data, Application Data"
"297","64.704607","10.8.0.1","ord38s30-in-f22.1e100.net","TCP","54","38768  >  443 [ACK] Seq=968 Ack=59132 Win=65535 Len=0"
"298","64.704989","ord38s30-in-f22.1e100.net","10.8.0.1","TLSv1.3","858","Application Data, Application Data"
"299","64.756853","10.8.0.1","ord38s30-in-f22.1e100.net","TCP","54","38768  >  443 [ACK] Seq=968 Ack=59936 Win=65535 Len=0"
"300","64.756908","10.8.0.1","ord38s30-in-f22.1e100.net","TLSv1.3","93","Application Data"
"301","64.757020","ord38s30-in-f22.1e100.net","10.8.0.1","TCP","54","443  >  38768 [ACK] Seq=59936 Ack=1007 Win=65535 Len=0"
"302","66.942628","10.8.0.1","ord38s28-in-f1.1e100.net","TCP","450","[TCP Retransmission] 59636  >  443 [PSH, ACK] Seq=595 Ack=213 Win=67107840 Len=396"
"303","73.293132","10.8.0.1","ord37s34-in-f10.1e100.net","QUIC","1292","Initial, DCID=2f2ec9f918280cfc, PKN: 1, CRYPTO, PADDING, PING, PADDING, PING, PADDING, CRYPTO, PING, PING, PADDING, CRYPTO, PADDING, CRYPTO"
"304","73.392554","ord37s34-in-f10.1e100.net","10.8.0.1","QUIC","1292","Protected Payload (KP0)"
"305","73.392630","10.8.0.1","ord37s34-in-f10.1e100.net","QUIC","119","0-RTT, DCID=2f2ec9f918280cfc"
"306","74.396708","10.8.0.1","209.237.195.128","TCP","74","59814  >  443 [SYN] Seq=0 Win=65535 Len=0 MSS=1460 SACK_PERM=1 TSval=1158509413 TSecr=0 WS=1024"
"307","74.400258","209.237.195.128","10.8.0.1","TCP","54","443  >  59814 [SYN, ACK] Seq=0 Ack=1 Win=65535 Len=0"
"308","74.400333","10.8.0.1","ord37s34-in-f10.1e100.net","QUIC","1292","Handshake, DCID=2f2ec9f918280cfc"
"309","74.488407","ord37s34-in-f10.1e100.net","10.8.0.1","QUIC","136","Initial, SCID=2f2ec9f918280cfc, PKN: 5, CC"
"310","74.488496","10.8.0.1","ord37s34-in-f10.1e100.net","QUIC","115","Handshake, DCID=2f2ec9f918280cfc"
"311","74.550203","ord37s34-in-f10.1e100.net","10.8.0.1","QUIC","136","Initial, SCID=2f2ec9f918280cfc, PKN: 5, CC"
"312","74.550294","10.8.0.1","ord37s34-in-f10.1e100.net","QUIC","711","Protected Payload (KP0), DCID=2f2ec9f918280cfc"
"313","75.548456","10.8.0.1","ord37s34-in-f10.1e100.net","QUIC","163","Protected Payload (KP0), DCID=2f2ec9f918280cfc"
"314","75.671857","ord37s34-in-f10.1e100.net","10.8.0.1","QUIC","136","Initial, SCID=2f2ec9f918280cfc, PKN: 5, CC"
