"No.","Time","Source","Destination","Protocol","Length","Info"
"1","0.000000","10.89.90.233","ord38s32-in-f6.1e100.net","UDP","92","46714  >  443 Len=50"
"2","1.005332","10.89.90.233","ord37s34-in-f2.1e100.net","UDP","92","41756  >  443 Len=50"
"3","2.029698","10.8.0.1","147.92.191.123","TCP","74","34134  >  443 [SYN] Seq=0 Win=65535 Len=0 MSS=1460 SACK_PERM=1 TSval=676783532 TSecr=0 WS=1024"
"4","2.033261","147.92.191.123","10.8.0.1","TCP","54","443  >  34134 [SYN, ACK] Seq=0 Ack=1 Win=65535 Len=0"
"5","2.033301","10.8.0.1","147.92.191.123","TCP","74","[TCP Retransmission] 34134  >  443 [SYN] Seq=0 Win=65535 Len=0 MSS=1460 SACK_PERM=1 TSval=676784553 TSecr=0 WS=1024"
"6","2.034541","147.92.191.123","10.8.0.1","TCP","54","[TCP Out-Of-Order] 443  >  34134 [SYN, ACK] Seq=0 Ack=1 Win=65535 Len=0"
"7","2.034563","10.8.0.1","time.cloudflare.com","NTP","90","NTP Version 3, client"
"8","2.146460","time.cloudflare.com","10.8.0.1","NTP","90","NTP Version 3, server"
"9","2.146495","10.8.0.1","52.168.112.67","TCP","74","42944  >  443 [SYN] Seq=0 Win=65535 Len=0 MSS=1460 SACK_PERM=1 TSval=3091872341 TSecr=0 WS=1024"
"10","2.148359","52.168.112.67","10.8.0.1","TCP","54","443  >  42944 [SYN, ACK] Seq=0 Ack=1 Win=65535 Len=0"
"11","2.148393","10.8.0.1","147.92.191.123","TCP","54","34134  >  443 [ACK] Seq=1 Ack=1 Win=67107840 Len=0"
"12","2.148401","10.8.0.1","147.92.191.123","TCP","54","[TCP Dup ACK 11#1] 34134  >  443 [ACK] Seq=1 Ack=1 Win=67107840 Len=0"
"13","2.148409","10.8.0.1","147.92.191.123","TLSv1.2","571","Client Hello"
"14","2.148438","147.92.191.123","10.8.0.1","TCP","54","443  >  34134 [ACK] Seq=1 Ack=518 Win=65535 Len=0"
"15","2.148445","10.8.0.1","52.168.112.67","TCP","54","42944  >  443 [ACK] Seq=1 Ack=1 Win=65535 Len=0"
"16","2.151552","10.8.0.1","52.168.112.67","TLSv1.2","571","Client Hello"
"17","2.151638","52.168.112.67","10.8.0.1","TCP","54","443  >  42944 [ACK] Seq=1 Ack=518 Win=65535 Len=0"
"18","2.360767","52.168.112.67","10.8.0.1","TCP","1432","443  >  42944 [PSH, ACK] Seq=1 Ack=518 Win=65535 Len=1378 [TCP segment of a reassembled PDU]"
"19","2.410946","10.8.0.1","52.168.112.67","TCP","54","42944  >  443 [ACK] Seq=518 Ack=1379 Win=65535 Len=0"
"20","2.411128","52.168.112.67","10.8.0.1","TCP","2810","443  >  42944 [PSH, ACK] Seq=1379 Ack=518 Win=65535 Len=2756 [TCP segment of a reassembled PDU]"
"21","2.461306","10.8.0.1","52.168.112.67","TCP","54","42944  >  443 [ACK] Seq=518 Ack=4135 Win=65535 Len=0"
"22","2.461498","52.168.112.67","10.8.0.1","TCP","1432","443  >  42944 [PSH, ACK] Seq=4135 Ack=518 Win=65535 Len=1378 [TCP segment of a reassembled PDU]"
"23","2.511666","10.8.0.1","52.168.112.67","TCP","54","42944  >  443 [ACK] Seq=518 Ack=5513 Win=65535 Len=0"
"24","2.511878","147.92.191.123","10.8.0.1","TLSv1.2","5448","Server Hello, Certificate, Server Key Exchange, Server Hello Done"
"25","2.511979","52.168.112.67","10.8.0.1","TLSv1.2","716","Server Hello, Certificate, Certificate Status, Server Key Exchange, Server Hello Done"
"26","2.511989","10.8.0.1","147.92.191.123","TCP","54","34134  >  443 [ACK] Seq=518 Ack=5395 Win=67107840 Len=0"
"27","2.511997","10.8.0.1","52.168.112.67","TCP","54","42944  >  443 [ACK] Seq=518 Ack=6175 Win=65535 Len=0"
"28","2.527744","10.8.0.1","147.92.191.123","TLSv1.2","180","Client Key Exchange, Change Cipher Spec, Encrypted Handshake Message"
"29","2.527829","147.92.191.123","10.8.0.1","TCP","54","443  >  34134 [ACK] Seq=5395 Ack=644 Win=65535 Len=0"
"30","2.595435","10.8.0.1","52.168.112.67","TLSv1.2","212","Client Key Exchange, Change Cipher Spec, Encrypted Handshake Message"
"31","2.595539","52.168.112.67","10.8.0.1","TCP","54","443  >  42944 [ACK] Seq=6175 Ack=676 Win=65535 Len=0"
"32","2.683611","52.168.112.67","10.8.0.1","TLSv1.2","105","Change Cipher Spec, Encrypted Handshake Message"
"33","2.733774","10.8.0.1","52.168.112.67","TCP","54","42944  >  443 [ACK] Seq=676 Ack=6226 Win=65535 Len=0"
"34","2.733956","147.92.191.123","10.8.0.1","TLSv1.2","328","New Session Ticket, Change Cipher Spec, Encrypted Handshake Message"
"35","2.733973","10.8.0.1","52.168.112.67","TCP","590","42944  >  443 [ACK] Seq=676 Ack=6226 Win=65535 Len=536 [TCP segment of a reassembled PDU]"
"36","2.734032","52.168.112.67","10.8.0.1","TCP","54","443  >  42944 [ACK] Seq=6226 Ack=1212 Win=65535 Len=0"
"37","2.734040","10.8.0.1","52.168.112.67","TCP","590","42944  >  443 [PSH, ACK] Seq=1212 Ack=6226 Win=65535 Len=536 [TCP segment of a reassembled PDU]"
"38","2.734058","52.168.112.67","10.8.0.1","TCP","54","443  >  42944 [ACK] Seq=6226 Ack=1748 Win=65535 Len=0"
"39","2.734064","10.8.0.1","52.168.112.67","TLSv1.2","409","Application Data"
"40","2.734078","52.168.112.67","10.8.0.1","TCP","54","443  >  42944 [ACK] Seq=6226 Ack=2103 Win=65535 Len=0"
"41","2.734170","10.8.0.1","147.92.191.123","TCP","54","34134  >  443 [ACK] Seq=644 Ack=5669 Win=67107840 Len=0"
"42","2.736568","10.8.0.1","147.92.191.123","TCP","590","34134  >  443 [ACK] Seq=644 Ack=5669 Win=67107840 Len=536 [TCP segment of a reassembled PDU]"
"43","2.736626","147.92.191.123","10.8.0.1","TCP","54","443  >  34134 [ACK] Seq=5669 Ack=1180 Win=65535 Len=0"
"44","2.736637","10.8.0.1","147.92.191.123","TLSv1.2","339","Application Data"
"45","2.736655","147.92.191.123","10.8.0.1","TCP","54","443  >  34134 [ACK] Seq=5669 Ack=1465 Win=65535 Len=0"
"46","2.786844","10.8.0.1","147.92.191.123","TLSv1.2","88","Application Data"
"47","2.786978","147.92.191.123","10.8.0.1","TCP","54","443  >  34134 [ACK] Seq=5669 Ack=1499 Win=65535 Len=0"
"48","2.974016","52.168.112.67","10.8.0.1","TLSv1.2","461","Application Data"
"49","3.024197","10.8.0.1","52.168.112.67","TCP","54","42944  >  443 [ACK] Seq=2103 Ack=6633 Win=65535 Len=0"
"50","3.102501","10.8.0.1","edge-star-shv-02-ort2.facebook.com","TCP","74","55600  >  443 [SYN] Seq=0 Win=65535 Len=0 MSS=1460 SACK_PERM=1 TSval=952338022 TSecr=0 WS=1024"
"51","3.103950","edge-star-shv-02-ort2.facebook.com","10.8.0.1","TCP","54","443  >  55600 [SYN, ACK] Seq=0 Ack=1 Win=65535 Len=0"
"52","3.103974","10.8.0.1","edge-star-shv-02-ort2.facebook.com","TCP","54","55600  >  443 [ACK] Seq=1 Ack=1 Win=65535 Len=0"
"53","3.127594","10.8.0.1","edge-star-mini-shv-01-msp1.facebook.com","TCP","74","48668  >  443 [SYN] Seq=0 Win=65535 Len=0 MSS=1460 SACK_PERM=1 TSval=3495589378 TSecr=0 WS=1024"
"54","3.128924","edge-star-mini-shv-01-msp1.facebook.com","10.8.0.1","TCP","54","443  >  48668 [SYN, ACK] Seq=0 Ack=1 Win=65535 Len=0"
"55","3.128951","10.8.0.1","edge-star-mini-shv-01-msp1.facebook.com","TCP","54","48668  >  443 [ACK] Seq=1 Ack=1 Win=65535 Len=0"
"56","3.160881","147.92.191.123","10.8.0.1","TLSv1.2","552","Application Data"
"57","3.211200","10.8.0.1","147.92.191.123","TCP","54","34134  >  443 [ACK] Seq=1499 Ack=6167 Win=67107840 Len=0"
"58","3.211233","10.8.0.1","147.92.191.123","TCP","74","34158  >  443 [SYN] Seq=0 Win=65535 Len=0 MSS=1460 SACK_PERM=1 TSval=676786710 TSecr=0 WS=1024"
"59","3.213782","147.92.191.123","10.8.0.1","TCP","54","443  >  34158 [SYN, ACK] Seq=0 Ack=1 Win=65535 Len=0"
"60","3.213809","10.8.0.1","147.92.191.123","TCP","54","34158  >  443 [ACK] Seq=1 Ack=1 Win=65535 Len=0"
"61","3.217193","10.8.0.1","147.92.191.123","TLSv1.2","571","Client Hello"
"62","3.217277","147.92.191.123","10.8.0.1","TCP","54","443  >  34158 [ACK] Seq=1 Ack=518 Win=65535 Len=0"
"63","3.251894","10.8.0.1","edge-star-shv-01-ort2.facebook.com","QUIC","1274","Initial, DCID=4df3f257c6bfb8f8, PKN: 4069259, CRYPTO, PADDING"
"64","3.330711","edge-star-shv-01-ort2.facebook.com","10.8.0.1","QUIC","1274","Initial, SCID=67961044cf1197e9, PKN: 13358263, ACK, PADDING"
"65","3.380949","10.8.0.1","edge-star-shv-01-ort2.facebook.com","TCP","74","36364  >  443 [SYN] Seq=0 Win=65535 Len=0 MSS=1460 SACK_PERM=1 TSval=4100379125 TSecr=0 WS=1024"
"66","3.382165","edge-star-shv-01-ort2.facebook.com","10.8.0.1","TCP","54","443  >  36364 [SYN, ACK] Seq=0 Ack=1 Win=65535 Len=0"
"67","3.382331","10.8.0.1","edge-star-mini-shv-01-msp1.facebook.com","TCP","74","48678  >  443 [SYN] Seq=0 Win=65535 Len=0 MSS=1460 SACK_PERM=1 TSval=3495589592 TSecr=0 WS=1024"
"68","3.383115","edge-star-mini-shv-01-msp1.facebook.com","10.8.0.1","TCP","54","443  >  48678 [SYN, ACK] Seq=0 Ack=1 Win=65535 Len=0"
"69","3.383133","10.8.0.1","edge-star-shv-02-ort2.facebook.com","TLSv1.3","459","Client Hello"
"70","3.383176","edge-star-shv-02-ort2.facebook.com","10.8.0.1","TCP","54","443  >  55600 [ACK] Seq=1 Ack=406 Win=65535 Len=0"
"71","3.383184","10.8.0.1","edge-star-mini-shv-01-msp1.facebook.com","TLSv1.3","461","Client Hello"
"72","3.383208","edge-star-mini-shv-01-msp1.facebook.com","10.8.0.1","TCP","54","443  >  48668 [ACK] Seq=1 Ack=408 Win=65535 Len=0"
"73","3.383246","10.8.0.1","edge-star-shv-01-ort2.facebook.com","TCP","54","36364  >  443 [ACK] Seq=1 Ack=1 Win=65535 Len=0"
"74","3.383267","10.8.0.1","edge-star-mini-shv-01-msp1.facebook.com","TCP","54","48678  >  443 [ACK] Seq=1 Ack=1 Win=65535 Len=0"
"75","3.386025","10.8.0.1","edge-star-shv-01-ort2.facebook.com","TLSv1.3","461","Client Hello"
"76","3.386103","edge-star-shv-01-ort2.facebook.com","10.8.0.1","TCP","54","443  >  36364 [ACK] Seq=1 Ack=408 Win=65535 Len=0"
"77","3.397647","10.8.0.1","edge-star-mini-shv-01-msp1.facebook.com","TLSv1.3","463","Client Hello"
"78","3.397741","edge-star-mini-shv-01-msp1.facebook.com","10.8.0.1","TCP","54","443  >  48678 [ACK] Seq=1 Ack=410 Win=65535 Len=0"
"79","3.454839","edge-star-shv-02-ort2.facebook.com","10.8.0.1","TLSv1.3","1432","Server Hello, Change Cipher Spec, Application Data"
"80","3.504994","10.8.0.1","edge-star-shv-02-ort2.facebook.com","TCP","54","55600  >  443 [ACK] Seq=406 Ack=1379 Win=65535 Len=0"
"81","3.505170","edge-star-mini-shv-01-msp1.facebook.com","10.8.0.1","TLSv1.3","266","Server Hello, Change Cipher Spec, Application Data"
"82","3.505217","edge-star-shv-02-ort2.facebook.com","10.8.0.1","TCP","56","443  >  55600 [PSH, ACK] Seq=1379 Ack=406 Win=65535 Len=2 [TCP segment of a reassembled PDU]"
"83","3.505224","10.8.0.1","edge-star-mini-shv-01-msp1.facebook.com","TCP","54","48668  >  443 [ACK] Seq=408 Ack=213 Win=65535 Len=0"
"84","3.505247","10.8.0.1","edge-star-shv-02-ort2.facebook.com","TCP","54","55600  >  443 [ACK] Seq=406 Ack=1381 Win=65535 Len=0"
"85","3.506478","10.8.0.1","edge-star-mini-shv-01-msp1.facebook.com","TLSv1.3","118","Change Cipher Spec, Application Data"
"86","3.506533","edge-star-mini-shv-01-msp1.facebook.com","10.8.0.1","TCP","54","443  >  48668 [ACK] Seq=213 Ack=472 Win=65535 Len=0"
"87","3.556884","edge-star-shv-01-ort2.facebook.com","10.8.0.1","TLSv1.3","2438","Server Hello, Change Cipher Spec, Application Data, Application Data"
"88","3.556969","edge-star-shv-02-ort2.facebook.com","10.8.0.1","TLSv1.3","1057","Application Data"
"89","3.557005","edge-star-mini-shv-01-msp1.facebook.com","10.8.0.1","TLSv1.3","266","Server Hello, Change Cipher Spec, Application Data"
"90","3.557029","10.8.0.1","edge-star-shv-01-ort2.facebook.com","TCP","54","36364  >  443 [ACK] Seq=408 Ack=2385 Win=65535 Len=0"
"91","3.557040","10.8.0.1","edge-star-shv-02-ort2.facebook.com","TCP","54","55600  >  443 [ACK] Seq=406 Ack=2384 Win=65535 Len=0"
"92","3.557047","10.8.0.1","edge-star-mini-shv-01-msp1.facebook.com","TCP","54","48678  >  443 [ACK] Seq=410 Ack=213 Win=65535 Len=0"
"93","3.615752","edge-star-mini-shv-01-msp1.facebook.com","10.8.0.1","TLSv1.3","233","Application Data"
"94","3.665890","10.8.0.1","edge-star-mini-shv-01-msp1.facebook.com","TCP","54","48668  >  443 [ACK] Seq=472 Ack=392 Win=65535 Len=0"
"95","3.665930","10.8.0.1","edge-star-shv-01-ort2.facebook.com","TLSv1.3","118","Change Cipher Spec, Application Data"
"96","3.666021","edge-star-shv-01-ort2.facebook.com","10.8.0.1","TCP","54","443  >  36364 [ACK] Seq=2385 Ack=472 Win=65535 Len=0"
"97","3.716547","147.92.191.123","10.8.0.1","TLSv1.2","5448","Server Hello, Certificate, Server Key Exchange, Server Hello Done"
"98","3.716732","edge-star-mini-shv-01-msp1.facebook.com","10.8.0.1","TLSv1.3","134","Application Data"
"99","3.716756","10.8.0.1","edge-star-shv-02-ort2.facebook.com","TLSv1.3","118","Change Cipher Spec, Application Data"
"100","3.716811","edge-star-shv-02-ort2.facebook.com","10.8.0.1","TCP","54","443  >  55600 [ACK] Seq=2384 Ack=470 Win=65535 Len=0"
"101","3.716833","10.8.0.1","edge-star-mini-shv-01-msp1.facebook.com","TLSv1.3","118","Change Cipher Spec, Application Data"
"102","3.716873","edge-star-mini-shv-01-msp1.facebook.com","10.8.0.1","TCP","54","443  >  48678 [ACK] Seq=213 Ack=474 Win=65535 Len=0"
"103","3.717004","10.8.0.1","147.92.191.123","TCP","54","34158  >  443 [ACK] Seq=518 Ack=5395 Win=65535 Len=0"
"104","3.717074","10.8.0.1","edge-star-mini-shv-01-msp1.facebook.com","TCP","54","48668  >  443 [ACK] Seq=472 Ack=472 Win=65535 Len=0"
"105","3.731897","10.8.0.1","147.92.191.123","TLSv1.2","180","Client Key Exchange, Change Cipher Spec, Encrypted Handshake Message"
"106","3.732010","147.92.191.123","10.8.0.1","TCP","54","443  >  34158 [ACK] Seq=5395 Ack=644 Win=65535 Len=0"
"107","3.782412","edge-star-shv-01-ort2.facebook.com","10.8.0.1","TLSv1.3","233","Application Data"
"108","3.782517","edge-star-shv-02-ort2.facebook.com","10.8.0.1","TLSv1.3","233","Application Data"
"109","3.782544","10.8.0.1","edge-star-shv-01-ort2.facebook.com","TCP","54","36364  >  443 [ACK] Seq=472 Ack=2564 Win=65535 Len=0"
"110","3.782565","10.8.0.1","edge-star-shv-02-ort2.facebook.com","TCP","54","55600  >  443 [ACK] Seq=470 Ack=2563 Win=65535 Len=0"
"111","3.807624","edge-star-mini-shv-01-msp1.facebook.com","10.8.0.1","TLSv1.3","233","Application Data"
"112","3.807705","edge-star-shv-01-ort2.facebook.com","10.8.0.1","TLSv1.3","134","Application Data"
"113","3.807758","10.8.0.1","edge-star-mini-shv-01-msp1.facebook.com","TCP","54","48678  >  443 [ACK] Seq=474 Ack=392 Win=65535 Len=0"
"114","3.807779","10.8.0.1","edge-star-shv-01-ort2.facebook.com","TCP","54","36364  >  443 [ACK] Seq=472 Ack=2644 Win=65535 Len=0"
"115","3.857736","edge-star-shv-02-ort2.facebook.com","10.8.0.1","TLSv1.3","134","Application Data"
"116","3.907935","10.8.0.1","edge-star-shv-02-ort2.facebook.com","TCP","54","55600  >  443 [ACK] Seq=470 Ack=2643 Win=65535 Len=0"
"117","3.910646","edge-star-mini-shv-01-msp1.facebook.com","10.8.0.1","TLSv1.3","134","Application Data"
"118","3.960840","10.8.0.1","edge-star-mini-shv-01-msp1.facebook.com","TCP","54","48678  >  443 [ACK] Seq=474 Ack=472 Win=65535 Len=0"
"119","3.961086","147.92.191.123","10.8.0.1","TLSv1.2","328","New Session Ticket, Change Cipher Spec, Encrypted Handshake Message"
"120","3.961150","10.8.0.1","147.92.191.123","TCP","54","34158  >  443 [ACK] Seq=644 Ack=5669 Win=65535 Len=0"
"121","3.963597","10.8.0.1","147.92.191.123","TCP","590","34158  >  443 [ACK] Seq=644 Ack=5669 Win=65535 Len=536 [TCP segment of a reassembled PDU]"
"122","3.963670","147.92.191.123","10.8.0.1","TCP","54","443  >  34158 [ACK] Seq=5669 Ack=1180 Win=65535 Len=0"
"123","3.963691","10.8.0.1","147.92.191.123","TLSv1.2","339","Application Data"
"124","3.963735","147.92.191.123","10.8.0.1","TCP","54","443  >  34158 [ACK] Seq=5669 Ack=1465 Win=65535 Len=0"
"125","4.013979","10.8.0.1","147.92.191.123","TLSv1.2","88","Application Data"
"126","4.014140","147.92.191.123","10.8.0.1","TCP","54","443  >  34158 [ACK] Seq=5669 Ack=1499 Win=65535 Len=0"
"127","4.335437","147.92.191.123","10.8.0.1","TLSv1.2","552","Application Data"
"128","4.385683","10.8.0.1","147.92.191.123","TCP","54","34158  >  443 [ACK] Seq=1499 Ack=6167 Win=65535 Len=0"
"129","4.385734","10.8.0.1","147.92.191.123","TCP","54","34158  >  443 [FIN, ACK] Seq=1499 Ack=6167 Win=65535 Len=0"
"130","4.385901","147.92.191.123","10.8.0.1","TCP","54","443  >  34158 [ACK] Seq=6167 Ack=1500 Win=65535 Len=0"
"131","4.385992","147.92.191.123","10.8.0.1","TCP","54","443  >  34158 [FIN, ACK] Seq=6167 Ack=1500 Win=65535 Len=0"
"132","4.386212","10.8.0.1","147.92.191.123","TCP","74","34170  >  443 [SYN] Seq=0 Win=65535 Len=0 MSS=1460 SACK_PERM=1 TSval=676787859 TSecr=0 WS=1024"
"133","4.388198","147.92.191.123","10.8.0.1","TCP","54","443  >  34170 [SYN, ACK] Seq=0 Ack=1 Win=65535 Len=0"
"134","4.388222","10.8.0.1","147.92.191.123","TCP","54","34158  >  443 [ACK] Seq=1500 Ack=6168 Win=65535 Len=0"
"135","4.388233","10.8.0.1","147.92.191.123","TCP","54","34170  >  443 [ACK] Seq=1 Ack=1 Win=65535 Len=0"
"136","4.391230","10.8.0.1","147.92.191.123","TLSv1.2","571","Client Hello"
"137","4.391339","147.92.191.123","10.8.0.1","TCP","54","443  >  34170 [ACK] Seq=1 Ack=518 Win=65535 Len=0"
"138","4.813979","147.92.191.123","10.8.0.1","TLSv1.2","1432","Server Hello"
"139","4.864196","10.8.0.1","147.92.191.123","TCP","54","34170  >  443 [ACK] Seq=518 Ack=1379 Win=65535 Len=0"
"140","4.864535","147.92.191.123","10.8.0.1","TLSv1.2","4070","Certificate, Server Key Exchange, Server Hello Done"
"141","4.914741","10.8.0.1","147.92.191.123","TCP","54","34170  >  443 [ACK] Seq=518 Ack=5395 Win=65535 Len=0"
"142","4.914806","10.8.0.1","147.92.191.123","TLSv1.2","180","Client Key Exchange, Change Cipher Spec, Encrypted Handshake Message"
"143","4.914945","147.92.191.123","10.8.0.1","TCP","54","443  >  34170 [ACK] Seq=5395 Ack=644 Win=65535 Len=0"
"144","5.133824","147.92.191.123","10.8.0.1","TLSv1.2","328","New Session Ticket, Change Cipher Spec, Encrypted Handshake Message"
"145","5.184019","10.8.0.1","147.92.191.123","TCP","54","34170  >  443 [ACK] Seq=644 Ack=5669 Win=65535 Len=0"
"146","5.184082","10.8.0.1","147.92.191.123","TCP","590","34170  >  443 [ACK] Seq=644 Ack=5669 Win=65535 Len=536 [TCP segment of a reassembled PDU]"
"147","5.184219","147.92.191.123","10.8.0.1","TCP","54","443  >  34170 [ACK] Seq=5669 Ack=1180 Win=65535 Len=0"
"148","5.184243","10.8.0.1","147.92.191.123","TLSv1.2","339","Application Data"
"149","5.184340","147.92.191.123","10.8.0.1","TCP","54","443  >  34170 [ACK] Seq=5669 Ack=1465 Win=65535 Len=0"
"150","5.184364","10.8.0.1","203.104.160.12","TCP","74","35788  >  443 [SYN] Seq=0 Win=65535 Len=0 MSS=1460 SACK_PERM=1 TSval=1602333569 TSecr=0 WS=1024"
"151","5.186766","203.104.160.12","10.8.0.1","TCP","54","443  >  35788 [SYN, ACK] Seq=0 Ack=1 Win=65535 Len=0"
"152","5.186874","10.8.0.1","147.92.191.123","TLSv1.2","88","Application Data"
"153","5.186921","147.92.191.123","10.8.0.1","TCP","54","443  >  34170 [ACK] Seq=5669 Ack=1499 Win=65535 Len=0"
"154","5.186937","10.8.0.1","203.104.160.12","TCP","54","35788  >  443 [ACK] Seq=1 Ack=1 Win=65535 Len=0"
"155","5.189523","10.8.0.1","203.104.160.12","TLSv1.3","571","Client Hello"
"156","5.189613","203.104.160.12","10.8.0.1","TCP","54","443  >  35788 [ACK] Seq=1 Ack=518 Win=65535 Len=0"
"157","5.381091","203.104.160.12","10.8.0.1","TLSv1.3","193","Server Hello, Change Cipher Spec"
"158","5.431332","10.8.0.1","203.104.160.12","TCP","54","35788  >  443 [ACK] Seq=518 Ack=140 Win=65535 Len=0"
"159","5.441739","203.104.160.12","10.8.0.1","TLSv1.3","149","Application Data, Application Data"
"160","5.491950","10.8.0.1","203.104.160.12","TCP","54","35788  >  443 [ACK] Seq=518 Ack=235 Win=65535 Len=0"
"161","5.492006","10.8.0.1","203.104.160.12","TLSv1.3","118","Change Cipher Spec, Application Data"
"162","5.492192","203.104.160.12","10.8.0.1","TCP","54","443  >  35788 [ACK] Seq=235 Ack=582 Win=65535 Len=0"
"163","5.492220","10.8.0.1","203.104.160.12","TLSv1.3","590","Application Data, Application Data, Application Data"
"164","5.492290","203.104.160.12","10.8.0.1","TCP","54","443  >  35788 [ACK] Seq=235 Ack=1118 Win=65535 Len=0"
"165","5.492321","10.8.0.1","203.104.160.12","TLSv1.3","326","Application Data"
"166","5.492362","203.104.160.12","10.8.0.1","TCP","54","443  >  35788 [ACK] Seq=235 Ack=1390 Win=65535 Len=0"
"167","5.555295","147.92.191.123","10.8.0.1","TLSv1.2","552","Application Data"
"168","5.605496","10.8.0.1","147.92.191.123","TCP","54","34170  >  443 [ACK] Seq=1499 Ack=6167 Win=65535 Len=0"
"169","5.605726","203.104.160.12","10.8.0.1","TLSv1.3","214","Application Data"
"170","5.605747","10.8.0.1","147.92.191.123","TCP","54","34170  >  443 [FIN, ACK] Seq=1499 Ack=6167 Win=65535 Len=0"
"171","5.605812","147.92.191.123","10.8.0.1","TCP","54","443  >  34170 [ACK] Seq=6167 Ack=1500 Win=65535 Len=0"
"172","5.605868","147.92.191.123","10.8.0.1","TCP","54","443  >  34170 [FIN, ACK] Seq=6167 Ack=1500 Win=65535 Len=0"
"173","5.606041","10.8.0.1","203.104.160.12","TCP","54","35788  >  443 [ACK] Seq=1390 Ack=395 Win=65535 Len=0"
"174","5.606057","10.8.0.1","147.92.191.123","TCP","54","34170  >  443 [ACK] Seq=1500 Ack=6168 Win=65535 Len=0"
"175","5.651017","203.104.160.12","10.8.0.1","TLSv1.3","442","Application Data, Application Data, Application Data, Application Data"
"176","5.701520","10.8.0.1","203.104.160.12","TCP","54","35788  >  443 [ACK] Seq=1390 Ack=783 Win=65535 Len=0"
"177","5.701573","10.8.0.1","203.104.160.12","TLSv1.3","85","Application Data"
"178","5.701672","203.104.160.12","10.8.0.1","TCP","54","443  >  35788 [ACK] Seq=783 Ack=1421 Win=65535 Len=0"
"179","5.751901","10.8.0.1","147.92.191.123","TCP","54","34134  >  443 [FIN, ACK] Seq=1499 Ack=6167 Win=67107840 Len=0"
"180","5.752070","147.92.191.123","10.8.0.1","TCP","54","443  >  34134 [ACK] Seq=6167 Ack=1500 Win=65535 Len=0"
"181","5.752133","147.92.191.123","10.8.0.1","TCP","54","443  >  34134 [FIN, ACK] Seq=6167 Ack=1500 Win=65535 Len=0"
"182","5.752324","10.8.0.1","147.92.191.123","TCP","54","34134  >  443 [ACK] Seq=1500 Ack=6168 Win=67107840 Len=0"
"183","5.764642","203.104.160.12","10.8.0.1","TLSv1.3","177","Application Data"
"184","5.814845","10.8.0.1","203.104.160.12","TCP","54","35788  >  443 [ACK] Seq=1421 Ack=906 Win=65535 Len=0"
"185","5.994068","10.8.0.1","203.104.160.12","TLSv1.3","179","Application Data"
"186","5.994217","203.104.160.12","10.8.0.1","TCP","54","443  >  35788 [ACK] Seq=906 Ack=1546 Win=65535 Len=0"
"187","6.262463","203.104.160.12","10.8.0.1","TCP","1502","443  >  35788 [PSH, ACK] Seq=906 Ack=1546 Win=65535 Len=1448 [TCP segment of a reassembled PDU]"
"188","6.312764","10.8.0.1","203.104.160.12","TCP","54","35788  >  443 [ACK] Seq=1546 Ack=2354 Win=65535 Len=0"
"189","6.312881","203.104.160.12","10.8.0.1","TLSv1.3","477","Application Data"
"190","6.363042","10.8.0.1","203.104.160.12","TCP","54","35788  >  443 [ACK] Seq=1546 Ack=2777 Win=65535 Len=0"
"191","10.349429","10.8.0.1","104.244.42.66","TCP","74","42562  >  443 [SYN] Seq=0 Win=65535 Len=0 MSS=1460 SACK_PERM=1 TSval=3886772313 TSecr=0 WS=1024"
"192","10.352195","104.244.42.66","10.8.0.1","TCP","54","443  >  42562 [SYN, ACK] Seq=0 Ack=1 Win=65535 Len=0"
"193","10.352243","10.8.0.1","104.244.42.66","TCP","54","42562  >  443 [ACK] Seq=1 Ack=1 Win=65535 Len=0"
"194","10.359877","10.8.0.1","104.244.42.66","TCP","74","42566  >  443 [SYN] Seq=0 Win=65535 Len=0 MSS=1460 SACK_PERM=1 TSval=3886772324 TSecr=0 WS=1024"
"195","10.362345","104.244.42.66","10.8.0.1","TCP","54","443  >  42566 [SYN, ACK] Seq=0 Ack=1 Win=65535 Len=0"
"196","10.362391","10.8.0.1","104.244.42.66","TCP","54","42566  >  443 [ACK] Seq=1 Ack=1 Win=65535 Len=0"
"197","10.365646","10.8.0.1","104.244.42.66","TLSv1.3","571","Client Hello"
"198","10.365721","104.244.42.66","10.8.0.1","TCP","54","443  >  42562 [ACK] Seq=1 Ack=518 Win=65535 Len=0"
"199","10.368102","10.8.0.1","104.244.42.66","TLSv1.3","571","Client Hello"
"200","10.368198","104.244.42.66","10.8.0.1","TCP","54","443  >  42566 [ACK] Seq=1 Ack=518 Win=65535 Len=0"
"201","10.369729","10.8.0.1","104.244.42.131","TCP","74","49242  >  443 [SYN] Seq=0 Win=65535 Len=0 MSS=1460 SACK_PERM=1 TSval=1399276328 TSecr=0 WS=1024"
"202","10.371825","104.244.42.131","10.8.0.1","TCP","54","443  >  49242 [SYN, ACK] Seq=0 Ack=1 Win=65535 Len=0"
"203","10.371863","10.8.0.1","104.244.42.131","TCP","54","49242  >  443 [ACK] Seq=1 Ack=1 Win=65535 Len=0"
"204","10.372946","10.8.0.1","104.244.42.131","TLSv1.3","571","Client Hello"
"205","10.373012","104.244.42.131","10.8.0.1","TCP","54","443  >  49242 [ACK] Seq=1 Ack=518 Win=65535 Len=0"
"206","10.537916","104.244.42.66","10.8.0.1","TLSv1.3","1402","Server Hello, Change Cipher Spec"
"207","10.588141","10.8.0.1","104.244.42.66","TCP","54","42562  >  443 [ACK] Seq=518 Ack=1349 Win=65535 Len=0"
"208","10.588392","104.244.42.131","10.8.0.1","TLSv1.3","2780","Server Hello, Change Cipher Spec"
"209","10.588546","104.244.42.66","10.8.0.1","TCP","1432","443  >  42562 [PSH, ACK] Seq=1349 Ack=518 Win=65535 Len=1378 [TCP segment of a reassembled PDU]"
"210","10.588569","10.8.0.1","104.244.42.131","TCP","54","49242  >  443 [ACK] Seq=518 Ack=2727 Win=65535 Len=0"
"211","10.588591","10.8.0.1","104.244.42.66","TCP","54","42562  >  443 [ACK] Seq=518 Ack=2727 Win=65535 Len=0"
"212","10.592647","104.244.42.66","10.8.0.1","TLSv1.3","673","Application Data"
"213","10.642854","10.8.0.1","104.244.42.66","TCP","54","42562  >  443 [ACK] Seq=518 Ack=3346 Win=65535 Len=0"
"214","10.643106","104.244.42.66","10.8.0.1","TLSv1.3","1402","Server Hello, Change Cipher Spec"
"215","10.643243","104.244.42.131","10.8.0.1","TLSv1.3","689","Application Data"
"216","10.643270","10.8.0.1","104.244.42.66","TCP","54","42566  >  443 [ACK] Seq=518 Ack=1349 Win=65535 Len=0"
"217","10.643289","10.8.0.1","104.244.42.131","TCP","54","49242  >  443 [ACK] Seq=518 Ack=3362 Win=65535 Len=0"
"218","10.663772","104.244.42.66","10.8.0.1","TCP","1432","443  >  42566 [PSH, ACK] Seq=1349 Ack=518 Win=65535 Len=1378 [TCP segment of a reassembled PDU]"
"219","10.713983","10.8.0.1","104.244.42.66","TCP","54","42566  >  443 [ACK] Seq=518 Ack=2727 Win=65535 Len=0"
"220","10.714260","104.244.42.66","10.8.0.1","TLSv1.3","673","Application Data"
"221","10.764456","10.8.0.1","104.244.42.66","TCP","54","42566  >  443 [ACK] Seq=518 Ack=3346 Win=65535 Len=0"
"222","11.256449","10.8.0.1","104.244.42.66","TLSv1.3","118","Change Cipher Spec, Application Data"
"223","11.256599","104.244.42.66","10.8.0.1","TCP","54","443  >  42562 [ACK] Seq=3346 Ack=582 Win=65535 Len=0"
"224","11.306917","10.8.0.1","104.244.42.66","TLSv1.3","118","Change Cipher Spec, Application Data"
"225","11.307102","104.244.42.66","10.8.0.1","TCP","54","443  >  42566 [ACK] Seq=3346 Ack=582 Win=65535 Len=0"
"226","11.307133","10.8.0.1","104.244.42.131","TLSv1.3","118","Change Cipher Spec, Application Data"
"227","11.307190","104.244.42.131","10.8.0.1","TCP","54","443  >  49242 [ACK] Seq=3362 Ack=582 Win=65535 Len=0"
"228","11.357516","10.8.0.1","104.244.42.131","TLSv1.3","320","Application Data"
"229","11.357642","104.244.42.131","10.8.0.1","TCP","54","443  >  49242 [ACK] Seq=3362 Ack=848 Win=65535 Len=0"
"230","11.407833","10.8.0.1","104.244.42.66","TLSv1.3","100","Application Data"
"231","11.408002","104.244.42.66","10.8.0.1","TCP","54","443  >  42566 [ACK] Seq=3346 Ack=628 Win=65535 Len=0"
"232","11.408031","10.8.0.1","104.244.42.66","TLSv1.3","100","Application Data"
"233","11.408142","104.244.42.66","10.8.0.1","TCP","54","443  >  42562 [ACK] Seq=3346 Ack=628 Win=65535 Len=0"
"234","11.408206","10.8.0.1","104.244.42.66","TLSv1.3","126","Application Data, Application Data"
"235","11.408255","104.244.42.66","10.8.0.1","TCP","54","443  >  42562 [ACK] Seq=3346 Ack=700 Win=65535 Len=0"
"236","11.410596","10.8.0.1","104.244.42.66","TLSv1.3","78","Application Data"
"237","11.410717","104.244.42.66","10.8.0.1","TCP","54","443  >  42562 [ACK] Seq=3346 Ack=724 Win=65535 Len=0"
"238","11.461143","10.8.0.1","ec2-52-39-55-118.us-west-2.compute.amazonaws.com","TCP","74","34660  >  443 [SYN] Seq=0 Win=65535 Len=0 MSS=1460 SACK_PERM=1 TSval=2079374038 TSecr=0 WS=1024"
"239","11.463712","ec2-52-39-55-118.us-west-2.compute.amazonaws.com","10.8.0.1","TCP","54","443  >  34660 [SYN, ACK] Seq=0 Ack=1 Win=65535 Len=0"
"240","11.463758","10.8.0.1","104.244.42.66","TLSv1.3","590","Application Data, Application Data"
"241","11.463816","104.244.42.66","10.8.0.1","TCP","54","443  >  42566 [ACK] Seq=3346 Ack=1164 Win=65535 Len=0"
"242","11.463835","10.8.0.1","104.244.42.66","TLSv1.3","466","Application Data"
"243","11.463873","104.244.42.66","10.8.0.1","TCP","54","443  >  42566 [ACK] Seq=3346 Ack=1576 Win=65535 Len=0"
"244","11.463889","10.8.0.1","ec2-52-39-55-118.us-west-2.compute.amazonaws.com","TCP","54","34660  >  443 [ACK] Seq=1 Ack=1 Win=65535 Len=0"
"245","11.465654","10.8.0.1","104.244.42.66","TLSv1.3","417","Application Data"
"246","11.465710","104.244.42.66","10.8.0.1","TCP","54","443  >  42566 [ACK] Seq=3346 Ack=1939 Win=65535 Len=0"
"247","11.515915","10.8.0.1","ec2-52-39-55-118.us-west-2.compute.amazonaws.com","TLSv1.2","571","Client Hello"
"248","11.516086","ec2-52-39-55-118.us-west-2.compute.amazonaws.com","10.8.0.1","TCP","54","443  >  34660 [ACK] Seq=1 Ack=518 Win=65535 Len=0"
"249","11.823281","104.244.42.66","10.8.0.1","TLSv1.3","528","Application Data, Application Data"
"250","11.823426","104.244.42.66","10.8.0.1","TLSv1.3","581","Application Data, Application Data"
"251","11.823527","104.244.42.131","10.8.0.1","TLSv1.3","1266","Application Data, Application Data"
"252","11.823556","10.8.0.1","104.244.42.66","TCP","54","42562  >  443 [ACK] Seq=724 Ack=3820 Win=65535 Len=0"
"253","11.823625","104.244.42.66","10.8.0.1","TCP","54","443  >  42562 [FIN, ACK] Seq=3820 Ack=724 Win=65535 Len=0"
"254","11.823839","10.8.0.1","104.244.42.66","TCP","54","42566  >  443 [ACK] Seq=1939 Ack=3873 Win=65535 Len=0"
"255","11.823868","10.8.0.1","104.244.42.131","TCP","54","49242  >  443 [ACK] Seq=848 Ack=4574 Win=65535 Len=0"
"256","11.824295","10.8.0.1","104.244.42.66","TCP","54","42562  >  443 [RST, ACK] Seq=724 Ack=3821 Win=65535 Len=0"
"257","11.825990","10.8.0.1","104.244.42.66","TLSv1.3","85","Application Data"
"258","11.826087","104.244.42.66","10.8.0.1","TCP","54","443  >  42566 [ACK] Seq=3873 Ack=1970 Win=65535 Len=0"
"259","11.876460","104.244.42.66","10.8.0.1","TLSv1.3","1226","Application Data, Application Data"
"260","11.926691","10.8.0.1","104.244.42.66","TCP","54","42566  >  443 [ACK] Seq=1970 Ack=5045 Win=65535 Len=0"
"261","11.939668","ec2-52-39-55-118.us-west-2.compute.amazonaws.com","10.8.0.1","TLSv1.2","2810","Server Hello"
"262","11.989872","10.8.0.1","ec2-52-39-55-118.us-west-2.compute.amazonaws.com","TCP","54","34660  >  443 [ACK] Seq=518 Ack=2757 Win=65535 Len=0"
"263","11.990043","ec2-52-39-55-118.us-west-2.compute.amazonaws.com","10.8.0.1","TCP","1432","443  >  34660 [PSH, ACK] Seq=2757 Ack=518 Win=65535 Len=1378 [TCP segment of a reassembled PDU]"
"264","12.040250","10.8.0.1","ec2-52-39-55-118.us-west-2.compute.amazonaws.com","TCP","54","34660  >  443 [ACK] Seq=518 Ack=4135 Win=65535 Len=0"
"265","12.040522","ec2-52-39-55-118.us-west-2.compute.amazonaws.com","10.8.0.1","TLSv1.2","1435","Certificate, Server Key Exchange, Server Hello Done"
"266","12.090899","10.8.0.1","ec2-52-39-55-118.us-west-2.compute.amazonaws.com","TCP","54","34660  >  443 [ACK] Seq=518 Ack=5516 Win=65535 Len=0"
"267","12.134475","10.8.0.1","ec2-52-39-55-118.us-west-2.compute.amazonaws.com","TLSv1.2","180","Client Key Exchange, Change Cipher Spec, Encrypted Handshake Message"
"268","12.134616","ec2-52-39-55-118.us-west-2.compute.amazonaws.com","10.8.0.1","TCP","54","443  >  34660 [ACK] Seq=5516 Ack=644 Win=65535 Len=0"
"269","12.258243","ec2-52-39-55-118.us-west-2.compute.amazonaws.com","10.8.0.1","TLSv1.2","344","New Session Ticket, Change Cipher Spec, Encrypted Handshake Message"
"270","12.308427","10.8.0.1","ec2-52-39-55-118.us-west-2.compute.amazonaws.com","TCP","54","34660  >  443 [ACK] Seq=644 Ack=5806 Win=65535 Len=0"
"271","12.308486","10.8.0.1","ec2-52-39-55-118.us-west-2.compute.amazonaws.com","TLSv1.2","107","Application Data"
"272","12.308638","ec2-52-39-55-118.us-west-2.compute.amazonaws.com","10.8.0.1","TCP","54","443  >  34660 [ACK] Seq=5806 Ack=697 Win=65535 Len=0"
"273","12.308659","10.8.0.1","ec2-52-39-55-118.us-west-2.compute.amazonaws.com","TLSv1.2","590","Application Data, Application Data"
"274","12.308722","ec2-52-39-55-118.us-west-2.compute.amazonaws.com","10.8.0.1","TCP","54","443  >  34660 [ACK] Seq=5806 Ack=1233 Win=65535 Len=0"
"275","12.308746","10.8.0.1","ec2-52-39-55-118.us-west-2.compute.amazonaws.com","TCP","590","34660  >  443 [PSH, ACK] Seq=1233 Ack=5806 Win=65535 Len=536 [TCP segment of a reassembled PDU]"
"276","12.308775","ec2-52-39-55-118.us-west-2.compute.amazonaws.com","10.8.0.1","TCP","54","443  >  34660 [ACK] Seq=5806 Ack=1769 Win=65535 Len=0"
"277","12.308789","10.8.0.1","ec2-52-39-55-118.us-west-2.compute.amazonaws.com","TCP","590","34660  >  443 [ACK] Seq=1769 Ack=5806 Win=65535 Len=536 [TCP segment of a reassembled PDU]"
"278","12.308828","ec2-52-39-55-118.us-west-2.compute.amazonaws.com","10.8.0.1","TCP","54","443  >  34660 [ACK] Seq=5806 Ack=2305 Win=65535 Len=0"
"279","12.308845","10.8.0.1","ec2-52-39-55-118.us-west-2.compute.amazonaws.com","TCP","590","34660  >  443 [PSH, ACK] Seq=2305 Ack=5806 Win=65535 Len=536 [TCP segment of a reassembled PDU]"
"280","12.308876","ec2-52-39-55-118.us-west-2.compute.amazonaws.com","10.8.0.1","TCP","54","443  >  34660 [ACK] Seq=5806 Ack=2841 Win=65535 Len=0"
"281","12.308889","10.8.0.1","ec2-52-39-55-118.us-west-2.compute.amazonaws.com","TCP","590","34660  >  443 [ACK] Seq=2841 Ack=5806 Win=65535 Len=536 [TCP segment of a reassembled PDU]"
"282","12.308913","ec2-52-39-55-118.us-west-2.compute.amazonaws.com","10.8.0.1","TCP","54","443  >  34660 [ACK] Seq=5806 Ack=3377 Win=65535 Len=0"
"283","12.308928","10.8.0.1","ec2-52-39-55-118.us-west-2.compute.amazonaws.com","TCP","590","34660  >  443 [PSH, ACK] Seq=3377 Ack=5806 Win=65535 Len=536 [TCP segment of a reassembled PDU]"
"284","12.308960","ec2-52-39-55-118.us-west-2.compute.amazonaws.com","10.8.0.1","TCP","54","443  >  34660 [ACK] Seq=5806 Ack=3913 Win=65535 Len=0"
"285","12.308971","10.8.0.1","ec2-52-39-55-118.us-west-2.compute.amazonaws.com","TLSv1.2","188","Application Data"
"286","12.308994","ec2-52-39-55-118.us-west-2.compute.amazonaws.com","10.8.0.1","TCP","54","443  >  34660 [ACK] Seq=5806 Ack=4047 Win=65535 Len=0"
"287","12.319700","ec2-52-39-55-118.us-west-2.compute.amazonaws.com","10.8.0.1","TLSv1.2","123","Application Data"
"288","12.369885","10.8.0.1","ec2-52-39-55-118.us-west-2.compute.amazonaws.com","TCP","54","34660  >  443 [ACK] Seq=4047 Ack=5875 Win=65535 Len=0"
"289","12.369948","10.8.0.1","ec2-52-39-55-118.us-west-2.compute.amazonaws.com","TLSv1.2","92","Application Data"
"290","12.370116","ec2-52-39-55-118.us-west-2.compute.amazonaws.com","10.8.0.1","TCP","54","443  >  34660 [ACK] Seq=5875 Ack=4085 Win=65535 Len=0"
"291","12.426940","ec2-52-39-55-118.us-west-2.compute.amazonaws.com","10.8.0.1","TLSv1.2","92","Application Data"
"292","12.477146","10.8.0.1","ec2-52-39-55-118.us-west-2.compute.amazonaws.com","TCP","54","34660  >  443 [ACK] Seq=4085 Ack=5913 Win=65535 Len=0"
"293","12.574700","ec2-52-39-55-118.us-west-2.compute.amazonaws.com","10.8.0.1","TLSv1.2","191","Application Data"
"294","12.624947","10.8.0.1","ec2-52-39-55-118.us-west-2.compute.amazonaws.com","TCP","54","34660  >  443 [ACK] Seq=4085 Ack=6050 Win=65535 Len=0"
"295","12.625010","10.8.0.1","104.244.42.131","TLSv1.3","78","Application Data"
"296","12.625170","104.244.42.131","10.8.0.1","TCP","54","443  >  49242 [ACK] Seq=4574 Ack=872 Win=65535 Len=0"
"297","12.625195","10.8.0.1","104.244.42.131","TCP","54","49242  >  443 [FIN, ACK] Seq=872 Ack=4574 Win=65535 Len=0"
"298","12.625281","104.244.42.131","10.8.0.1","TCP","54","443  >  49242 [ACK] Seq=4574 Ack=873 Win=65535 Len=0"
"299","12.625377","104.244.42.131","10.8.0.1","TCP","54","443  >  49242 [FIN, ACK] Seq=4574 Ack=873 Win=65535 Len=0"
"300","12.625600","10.8.0.1","104.244.42.131","TCP","54","49242  >  443 [ACK] Seq=873 Ack=4575 Win=65535 Len=0"
"301","12.675756","10.8.0.1","server-54-230-210-247.ord53.r.cloudfront.net","TCP","74","42066  >  443 [SYN] Seq=0 Win=65535 Len=0 MSS=1460 SACK_PERM=1 TSval=3562663429 TSecr=0 WS=1024"
"302","12.678279","server-54-230-210-247.ord53.r.cloudfront.net","10.8.0.1","TCP","54","443  >  42066 [SYN, ACK] Seq=0 Ack=1 Win=65535 Len=0"
"303","12.678326","10.8.0.1","server-54-230-210-247.ord53.r.cloudfront.net","TCP","54","42066  >  443 [ACK] Seq=1 Ack=1 Win=65535 Len=0"
"304","12.680030","10.8.0.1","server-54-230-210-247.ord53.r.cloudfront.net","TLSv1.3","571","Client Hello"
"305","12.680105","server-54-230-210-247.ord53.r.cloudfront.net","10.8.0.1","TCP","54","443  >  42066 [ACK] Seq=1 Ack=518 Win=65535 Len=0"
"306","12.813930","server-54-230-210-247.ord53.r.cloudfront.net","10.8.0.1","TLSv1.3","1432","Server Hello, Change Cipher Spec, Application Data"
"307","12.864207","10.8.0.1","server-54-230-210-247.ord53.r.cloudfront.net","TCP","54","42066  >  443 [ACK] Seq=518 Ack=1379 Win=65535 Len=0"
"308","12.864391","server-54-230-210-247.ord53.r.cloudfront.net","10.8.0.1","TLSv1.3","2669","Application Data, Application Data, Application Data"
"309","12.914578","10.8.0.1","server-54-230-210-247.ord53.r.cloudfront.net","TCP","54","42066  >  443 [ACK] Seq=518 Ack=3994 Win=65535 Len=0"
"310","12.914642","10.8.0.1","server-54-230-210-247.ord53.r.cloudfront.net","TLSv1.3","118","Change Cipher Spec, Application Data"
"311","12.914834","server-54-230-210-247.ord53.r.cloudfront.net","10.8.0.1","TCP","54","443  >  42066 [ACK] Seq=3994 Ack=582 Win=65535 Len=0"
"312","12.914855","10.8.0.1","server-54-230-210-247.ord53.r.cloudfront.net","TLSv1.3","321","Application Data"
"313","12.914892","server-54-230-210-247.ord53.r.cloudfront.net","10.8.0.1","TCP","54","443  >  42066 [ACK] Seq=3994 Ack=849 Win=65535 Len=0"
"314","13.052977","server-54-230-210-247.ord53.r.cloudfront.net","10.8.0.1","TLSv1.3","679","Application Data"
"315","13.103198","10.8.0.1","server-54-230-210-247.ord53.r.cloudfront.net","TCP","54","42066  >  443 [ACK] Seq=849 Ack=4619 Win=65535 Len=0"
"316","13.103229","10.8.0.1","server-54-230-210-247.ord53.r.cloudfront.net","TLSv1.3","78","Application Data"
"317","13.103316","server-54-230-210-247.ord53.r.cloudfront.net","10.8.0.1","TCP","54","443  >  42066 [ACK] Seq=4619 Ack=873 Win=65535 Len=0"
"318","13.153539","10.8.0.1","server-65-8-47-252.ord52.r.cloudfront.net","TCP","74","44438  >  443 [SYN] Seq=0 Win=65535 Len=0 MSS=1460 SACK_PERM=1 TSval=218724604 TSecr=0 WS=1024"
"319","13.154908","server-65-8-47-252.ord52.r.cloudfront.net","10.8.0.1","TCP","54","443  >  44438 [SYN, ACK] Seq=0 Ack=1 Win=65535 Len=0"
"320","13.154929","10.8.0.1","server-65-8-47-252.ord52.r.cloudfront.net","TCP","54","44438  >  443 [ACK] Seq=1 Ack=1 Win=65535 Len=0"
"321","13.156572","10.8.0.1","server-65-8-47-252.ord52.r.cloudfront.net","TLSv1","313","Client Hello"
"322","13.156626","server-65-8-47-252.ord52.r.cloudfront.net","10.8.0.1","TCP","54","443  >  44438 [ACK] Seq=1 Ack=260 Win=65535 Len=0"
"323","13.186431","server-54-230-210-247.ord53.r.cloudfront.net","10.8.0.1","TCP","54","443  >  42066 [FIN, ACK] Seq=4619 Ack=873 Win=65535 Len=0"
"324","13.236753","10.8.0.1","ord38s31-in-f3.1e100.net","TCP","74","43500  >  443 [SYN] Seq=0 Win=65535 Len=0 MSS=1460 SACK_PERM=1 TSval=4269991821 TSecr=0 WS=1024"
"325","13.238608","ord38s31-in-f3.1e100.net","10.8.0.1","TCP","54","443  >  43500 [SYN, ACK] Seq=0 Ack=1 Win=65535 Len=0"
"326","13.238645","10.8.0.1","server-54-230-210-247.ord53.r.cloudfront.net","TCP","54","42066  >  443 [ACK] Seq=873 Ack=4620 Win=65535 Len=0"
"327","13.238659","10.8.0.1","ord38s31-in-f3.1e100.net","TCP","54","43500  >  443 [ACK] Seq=1 Ack=1 Win=65535 Len=0"
"328","13.289010","10.8.0.1","ord38s31-in-f3.1e100.net","TCP","590","43500  >  443 [ACK] Seq=1 Ack=1 Win=65535 Len=536 [TCP segment of a reassembled PDU]"
"329","13.289230","ord38s31-in-f3.1e100.net","10.8.0.1","TCP","54","443  >  43500 [ACK] Seq=1 Ack=537 Win=65535 Len=0"
"330","13.289264","10.8.0.1","ord38s31-in-f3.1e100.net","TLSv1.3","97","Client Hello"
"331","13.289325","ord38s31-in-f3.1e100.net","10.8.0.1","TCP","54","443  >  43500 [ACK] Seq=1 Ack=580 Win=65535 Len=0"
