"No.","Time","Source","Destination","Protocol","Length","Info"
"1","0.000000","10.8.0.1","ec2-44-236-35-201.us-west-2.compute.amazonaws.com","TCP","74","41990  >  443 [SYN] Seq=0 Win=65535 Len=0 MSS=1460 SACK_PERM=1 TSval=2466295140 TSecr=0 WS=1024"
"2","0.011164","ec2-44-236-35-201.us-west-2.compute.amazonaws.com","10.8.0.1","TCP","54","443  >  41990 [SYN, ACK] Seq=0 Ack=1 Win=65535 Len=0"
"3","0.011203","10.8.0.1","ec2-44-236-35-201.us-west-2.compute.amazonaws.com","TCP","54","41990  >  443 [ACK] Seq=1 Ack=1 Win=65535 Len=0"
"4","0.064712","10.8.0.1","ec2-44-236-35-201.us-west-2.compute.amazonaws.com","TLSv1.2","571","Client Hello"
"5","0.064808","ec2-44-236-35-201.us-west-2.compute.amazonaws.com","10.8.0.1","TCP","54","443  >  41990 [ACK] Seq=1 Ack=518 Win=65535 Len=0"
"6","0.248915","ec2-44-236-35-201.us-west-2.compute.amazonaws.com","10.8.0.1","TLSv1.2","2810","Server Hello"
"7","0.299437","10.8.0.1","ec2-44-236-35-201.us-west-2.compute.amazonaws.com","TCP","54","41990  >  443 [ACK] Seq=518 Ack=2757 Win=65535 Len=0"
"8","0.299630","ec2-44-236-35-201.us-west-2.compute.amazonaws.com","10.8.0.1","TCP","2810","443  >  41990 [PSH, ACK] Seq=2757 Ack=518 Win=65535 Len=2756 [TCP segment of a reassembled PDU]"
"9","0.350006","10.8.0.1","ec2-44-236-35-201.us-west-2.compute.amazonaws.com","TCP","54","41990  >  443 [ACK] Seq=518 Ack=5513 Win=65535 Len=0"
"10","0.350228","ec2-44-236-35-201.us-west-2.compute.amazonaws.com","10.8.0.1","TLSv1.2","780","Certificate, Server Key Exchange, Server Hello Done"
"11","0.400545","10.8.0.1","ec2-44-236-35-201.us-west-2.compute.amazonaws.com","TCP","54","41990  >  443 [ACK] Seq=518 Ack=6239 Win=65535 Len=0"
"12","0.701891","10.8.0.1","ec2-44-236-35-201.us-west-2.compute.amazonaws.com","TLSv1.2","180","Client Key Exchange, Change Cipher Spec, Encrypted Handshake Message"
"13","0.702042","ec2-44-236-35-201.us-west-2.compute.amazonaws.com","10.8.0.1","TCP","54","443  >  41990 [ACK] Seq=6239 Ack=644 Win=65535 Len=0"
"14","0.816983","ec2-44-236-35-201.us-west-2.compute.amazonaws.com","10.8.0.1","TLSv1.2","312","New Session Ticket, Change Cipher Spec, Encrypted Handshake Message"
"15","0.867141","10.8.0.1","ec2-44-236-35-201.us-west-2.compute.amazonaws.com","TCP","54","41990  >  443 [ACK] Seq=644 Ack=6497 Win=65535 Len=0"
"16","0.867205","10.8.0.1","ec2-44-236-35-201.us-west-2.compute.amazonaws.com","TCP","590","41990  >  443 [ACK] Seq=644 Ack=6497 Win=65535 Len=536 [TCP segment of a reassembled PDU]"
"17","0.867338","ec2-44-236-35-201.us-west-2.compute.amazonaws.com","10.8.0.1","TCP","54","443  >  41990 [ACK] Seq=6497 Ack=1180 Win=65535 Len=0"
"18","0.867350","10.8.0.1","ec2-44-236-35-201.us-west-2.compute.amazonaws.com","TCP","590","41990  >  443 [PSH, ACK] Seq=1180 Ack=6497 Win=65535 Len=536 [TCP segment of a reassembled PDU]"
"19","0.867369","ec2-44-236-35-201.us-west-2.compute.amazonaws.com","10.8.0.1","TCP","54","443  >  41990 [ACK] Seq=6497 Ack=1716 Win=65535 Len=0"
"20","0.867377","10.8.0.1","ec2-44-236-35-201.us-west-2.compute.amazonaws.com","TCP","590","41990  >  443 [ACK] Seq=1716 Ack=6497 Win=65535 Len=536 [TCP segment of a reassembled PDU]"
"21","0.867390","ec2-44-236-35-201.us-west-2.compute.amazonaws.com","10.8.0.1","TCP","54","443  >  41990 [ACK] Seq=6497 Ack=2252 Win=65535 Len=0"
"22","0.867444","10.8.0.1","ec2-44-236-35-201.us-west-2.compute.amazonaws.com","TCP","590","41990  >  443 [PSH, ACK] Seq=2252 Ack=6497 Win=65535 Len=536 [TCP segment of a reassembled PDU]"
"23","0.867460","ec2-44-236-35-201.us-west-2.compute.amazonaws.com","10.8.0.1","TCP","54","443  >  41990 [ACK] Seq=6497 Ack=2788 Win=65535 Len=0"
"24","0.867466","10.8.0.1","ec2-44-236-35-201.us-west-2.compute.amazonaws.com","TCP","590","41990  >  443 [ACK] Seq=2788 Ack=6497 Win=65535 Len=536 [TCP segment of a reassembled PDU]"
"25","0.867479","ec2-44-236-35-201.us-west-2.compute.amazonaws.com","10.8.0.1","TCP","54","443  >  41990 [ACK] Seq=6497 Ack=3324 Win=65535 Len=0"
"26","0.867488","10.8.0.1","ec2-44-236-35-201.us-west-2.compute.amazonaws.com","TCP","590","41990  >  443 [PSH, ACK] Seq=3324 Ack=6497 Win=65535 Len=536 [TCP segment of a reassembled PDU]"
"27","0.867514","ec2-44-236-35-201.us-west-2.compute.amazonaws.com","10.8.0.1","TCP","54","443  >  41990 [ACK] Seq=6497 Ack=3860 Win=65535 Len=0"
"28","0.867528","10.8.0.1","ec2-44-236-35-201.us-west-2.compute.amazonaws.com","TCP","590","41990  >  443 [ACK] Seq=3860 Ack=6497 Win=65535 Len=536 [TCP segment of a reassembled PDU]"
"29","0.867545","ec2-44-236-35-201.us-west-2.compute.amazonaws.com","10.8.0.1","TCP","54","443  >  41990 [ACK] Seq=6497 Ack=4396 Win=65535 Len=0"
"30","0.867553","10.8.0.1","ec2-44-236-35-201.us-west-2.compute.amazonaws.com","TCP","590","41990  >  443 [PSH, ACK] Seq=4396 Ack=6497 Win=65535 Len=536 [TCP segment of a reassembled PDU]"
"31","0.867573","ec2-44-236-35-201.us-west-2.compute.amazonaws.com","10.8.0.1","TCP","54","443  >  41990 [ACK] Seq=6497 Ack=4932 Win=65535 Len=0"
"32","0.867580","10.8.0.1","ec2-44-236-35-201.us-west-2.compute.amazonaws.com","TCP","590","41990  >  443 [ACK] Seq=4932 Ack=6497 Win=65535 Len=536 [TCP segment of a reassembled PDU]"
"33","0.867598","ec2-44-236-35-201.us-west-2.compute.amazonaws.com","10.8.0.1","TCP","54","443  >  41990 [ACK] Seq=6497 Ack=5468 Win=65535 Len=0"
"34","0.867605","10.8.0.1","ec2-44-236-35-201.us-west-2.compute.amazonaws.com","TCP","590","41990  >  443 [PSH, ACK] Seq=5468 Ack=6497 Win=65535 Len=536 [TCP segment of a reassembled PDU]"
"35","0.867633","ec2-44-236-35-201.us-west-2.compute.amazonaws.com","10.8.0.1","TCP","54","443  >  41990 [ACK] Seq=6497 Ack=6004 Win=65535 Len=0"
"36","0.867639","10.8.0.1","ec2-44-236-35-201.us-west-2.compute.amazonaws.com","TLSv1.2","439","Application Data"
"37","0.867657","ec2-44-236-35-201.us-west-2.compute.amazonaws.com","10.8.0.1","TCP","54","443  >  41990 [ACK] Seq=6497 Ack=6389 Win=65535 Len=0"
"38","0.899626","10.8.0.1","40.70.161.7","TCP","74","56522  >  443 [SYN] Seq=0 Win=65535 Len=0 MSS=1460 SACK_PERM=1 TSval=523994451 TSecr=0 WS=1024"
"39","0.901285","40.70.161.7","10.8.0.1","TCP","54","443  >  56522 [SYN, ACK] Seq=0 Ack=1 Win=65535 Len=0"
"40","0.901316","10.8.0.1","40.70.161.7","TCP","54","56522  >  443 [ACK] Seq=1 Ack=1 Win=65535 Len=0"
"41","0.940854","10.8.0.1","40.70.161.7","TLSv1.2","571","Client Hello"
"42","0.940941","40.70.161.7","10.8.0.1","TCP","54","443  >  56522 [ACK] Seq=1 Ack=518 Win=65535 Len=0"
"43","1.155943","40.70.161.7","10.8.0.1","TLSv1.2","4188","Server Hello"
"44","1.206196","10.8.0.1","40.70.161.7","TCP","54","56522  >  443 [ACK] Seq=518 Ack=4135 Win=65535 Len=0"
"45","1.206448","ec2-44-236-35-201.us-west-2.compute.amazonaws.com","10.8.0.1","TCP","1502","443  >  41990 [PSH, ACK] Seq=6497 Ack=6389 Win=65535 Len=1448 [TCP segment of a reassembled PDU]"
"46","1.206550","40.70.161.7","10.8.0.1","TLSv1.2","977","Certificate, Server Key Exchange, Server Hello Done"
"47","1.206567","10.8.0.1","ec2-44-236-35-201.us-west-2.compute.amazonaws.com","TCP","54","41990  >  443 [ACK] Seq=6389 Ack=7945 Win=65535 Len=0"
"48","1.206586","10.8.0.1","40.70.161.7","TCP","54","56522  >  443 [ACK] Seq=518 Ack=5058 Win=65535 Len=0"
"49","1.225727","ec2-44-236-35-201.us-west-2.compute.amazonaws.com","10.8.0.1","TLSv1.2","968","Application Data"
"50","1.276088","10.8.0.1","ec2-44-236-35-201.us-west-2.compute.amazonaws.com","TCP","54","41990  >  443 [ACK] Seq=6389 Ack=8859 Win=65535 Len=0"
"51","1.276145","10.8.0.1","40.70.161.7","TLSv1.2","180","Client Key Exchange, Change Cipher Spec, Encrypted Handshake Message"
"52","1.276295","40.70.161.7","10.8.0.1","TCP","54","443  >  56522 [ACK] Seq=5058 Ack=644 Win=65535 Len=0"
"53","1.326553","10.8.0.1","ns1.backplanedns.org","NTP","90","NTP Version 3, client"
"54","2.334117","10.8.0.1","13.69.109.130","TCP","74","60460  >  443 [SYN] Seq=0 Win=65535 Len=0 MSS=1460 SACK_PERM=1 TSval=1107771188 TSecr=0 WS=1024"
"55","2.337149","13.69.109.130","10.8.0.1","TCP","54","443  >  60460 [SYN, ACK] Seq=0 Ack=1 Win=65535 Len=0"
"56","2.337218","40.70.161.7","10.8.0.1","TLSv1.2","312","New Session Ticket, Change Cipher Spec, Encrypted Handshake Message"
"57","2.337231","10.8.0.1","13.69.109.130","TCP","54","60460  >  443 [ACK] Seq=1 Ack=1 Win=65535 Len=0"
"58","2.337237","10.8.0.1","40.70.161.7","TCP","54","56522  >  443 [ACK] Seq=644 Ack=5316 Win=65535 Len=0"
"59","2.340405","10.8.0.1","13.69.109.130","TLSv1.2","571","Client Hello"
"60","2.340456","13.69.109.130","10.8.0.1","TCP","54","443  >  60460 [ACK] Seq=1 Ack=518 Win=65535 Len=0"
"61","2.343013","10.8.0.1","40.70.161.7","TCP","590","56522  >  443 [ACK] Seq=644 Ack=5316 Win=65535 Len=536 [TCP segment of a reassembled PDU]"
"62","2.343070","40.70.161.7","10.8.0.1","TCP","54","443  >  56522 [ACK] Seq=5316 Ack=1180 Win=65535 Len=0"
"63","2.343080","10.8.0.1","40.70.161.7","TCP","590","56522  >  443 [ACK] Seq=1180 Ack=5316 Win=65535 Len=536 [TCP segment of a reassembled PDU]"
"64","2.343099","40.70.161.7","10.8.0.1","TCP","54","443  >  56522 [ACK] Seq=5316 Ack=1716 Win=65535 Len=0"
"65","2.343106","10.8.0.1","40.70.161.7","TLSv1.2","316","Application Data"
"66","2.343121","40.70.161.7","10.8.0.1","TCP","54","443  >  56522 [ACK] Seq=5316 Ack=1978 Win=65535 Len=0"
"67","2.704120","13.69.109.130","10.8.0.1","TCP","4188","443  >  60460 [PSH, ACK] Seq=1 Ack=518 Win=65535 Len=4134 [TCP segment of a reassembled PDU]"
"68","2.754337","10.8.0.1","13.69.109.130","TCP","54","60460  >  443 [ACK] Seq=518 Ack=4135 Win=65535 Len=0"
"69","2.755677","13.69.109.130","10.8.0.1","TCP","1432","443  >  60460 [PSH, ACK] Seq=4135 Ack=518 Win=65535 Len=1378 [TCP segment of a reassembled PDU]"
"70","2.805913","10.8.0.1","13.69.109.130","TCP","54","60460  >  443 [ACK] Seq=518 Ack=5513 Win=65535 Len=0"
"71","2.806183","40.70.161.7","10.8.0.1","TLSv1.2","371","Application Data"
"72","2.806319","13.69.109.130","10.8.0.1","TLSv1.2","717","Server Hello, Certificate, Certificate Status, Server Key Exchange, Server Hello Done"
"73","2.806350","10.8.0.1","40.70.161.7","TCP","54","56522  >  443 [ACK] Seq=1978 Ack=5633 Win=65535 Len=0"
"74","2.806376","10.8.0.1","13.69.109.130","TCP","54","60460  >  443 [ACK] Seq=518 Ack=6176 Win=65535 Len=0"
"75","2.846257","10.8.0.1","13.69.109.130","TLSv1.2","212","Client Key Exchange, Change Cipher Spec, Encrypted Handshake Message"
"76","2.846370","13.69.109.130","10.8.0.1","TCP","54","443  >  60460 [ACK] Seq=6176 Ack=676 Win=65535 Len=0"
"77","3.018523","13.69.109.130","10.8.0.1","TLSv1.2","105","Change Cipher Spec, Encrypted Handshake Message"
"78","3.068741","10.8.0.1","13.69.109.130","TCP","54","60460  >  443 [ACK] Seq=676 Ack=6227 Win=65535 Len=0"
"79","3.068808","10.8.0.1","13.69.109.130","TCP","590","60460  >  443 [ACK] Seq=676 Ack=6227 Win=65535 Len=536 [TCP segment of a reassembled PDU]"
"80","3.068946","13.69.109.130","10.8.0.1","TCP","54","443  >  60460 [ACK] Seq=6227 Ack=1212 Win=65535 Len=0"
"81","3.068969","10.8.0.1","13.69.109.130","TCP","590","60460  >  443 [PSH, ACK] Seq=1212 Ack=6227 Win=65535 Len=536 [TCP segment of a reassembled PDU]"
"82","3.069023","13.69.109.130","10.8.0.1","TCP","54","443  >  60460 [ACK] Seq=6227 Ack=1748 Win=65535 Len=0"
"83","3.069040","10.8.0.1","13.69.109.130","TLSv1.2","412","Application Data"
"84","3.069120","13.69.109.130","10.8.0.1","TCP","54","443  >  60460 [ACK] Seq=6227 Ack=2106 Win=65535 Len=0"
"85","3.420886","13.69.109.130","10.8.0.1","TLSv1.2","462","Application Data"
"86","3.471123","10.8.0.1","13.69.109.130","TCP","54","60460  >  443 [ACK] Seq=2106 Ack=6635 Win=65535 Len=0"
"87","4.279455","10.8.0.1","edge-star-shv-01-ort2.facebook.com","TCP","74","42074  >  443 [SYN] Seq=0 Win=65535 Len=0 MSS=1460 SACK_PERM=1 TSval=1358972976 TSecr=0 WS=1024"
"88","4.282518","edge-star-shv-01-ort2.facebook.com","10.8.0.1","TCP","54","443  >  42074 [SYN, ACK] Seq=0 Ack=1 Win=65535 Len=0"
"89","4.282573","10.8.0.1","edge-star-shv-01-ort2.facebook.com","TCP","54","42074  >  443 [ACK] Seq=1 Ack=1 Win=65535 Len=0"
"90","4.285205","10.8.0.1","edge-star-mini-shv-01-msp1.facebook.com","TCP","74","34938  >  443 [SYN] Seq=0 Win=65535 Len=0 MSS=1460 SACK_PERM=1 TSval=2703923538 TSecr=0 WS=1024"
"91","4.286866","edge-star-mini-shv-01-msp1.facebook.com","10.8.0.1","TCP","54","443  >  34938 [SYN, ACK] Seq=0 Ack=1 Win=65535 Len=0"
"92","4.286895","10.8.0.1","edge-star-mini-shv-01-msp1.facebook.com","TCP","54","34938  >  443 [ACK] Seq=1 Ack=1 Win=65535 Len=0"
"93","4.318186","10.8.0.1","edge-star-shv-01-ort2.facebook.com","QUIC","1274","Initial, DCID=04b76753e83293c3, PKN: 4985576, CRYPTO, PADDING"
"94","4.392776","edge-star-shv-01-ort2.facebook.com","10.8.0.1","QUIC","1274","Initial, SCID=540a81c311869cfc, PKN: 15822254, ACK, PADDING"
"95","4.392842","10.8.0.1","edge-star-shv-01-ort2.facebook.com","TCP","74","42082  >  443 [SYN] Seq=0 Win=65535 Len=0 MSS=1460 SACK_PERM=1 TSval=1358973021 TSecr=0 WS=1024"
"96","4.395407","edge-star-shv-01-ort2.facebook.com","10.8.0.1","TCP","54","443  >  42082 [SYN, ACK] Seq=0 Ack=1 Win=65535 Len=0"
"97","4.395453","10.8.0.1","edge-star-mini-shv-01-msp1.facebook.com","TCP","74","34944  >  443 [SYN] Seq=0 Win=65535 Len=0 MSS=1460 SACK_PERM=1 TSval=2703923592 TSecr=0 WS=1024"
"98","4.397406","edge-star-mini-shv-01-msp1.facebook.com","10.8.0.1","TCP","54","443  >  34944 [SYN, ACK] Seq=0 Ack=1 Win=65535 Len=0"
"99","4.397448","10.8.0.1","edge-star-shv-01-ort2.facebook.com","TLSv1.3","459","Client Hello"
"100","4.397509","edge-star-shv-01-ort2.facebook.com","10.8.0.1","TCP","54","443  >  42074 [ACK] Seq=1 Ack=406 Win=65535 Len=0"
"101","4.397529","10.8.0.1","edge-star-mini-shv-01-msp1.facebook.com","TLSv1.3","461","Client Hello"
"102","4.397576","edge-star-mini-shv-01-msp1.facebook.com","10.8.0.1","TCP","54","443  >  34938 [ACK] Seq=1 Ack=408 Win=65535 Len=0"
"103","4.397659","10.8.0.1","edge-star-shv-01-ort2.facebook.com","TCP","54","42082  >  443 [ACK] Seq=1 Ack=1 Win=65535 Len=0"
"104","4.397720","10.8.0.1","edge-star-mini-shv-01-msp1.facebook.com","TCP","54","34944  >  443 [ACK] Seq=1 Ack=1 Win=65535 Len=0"
"105","4.399773","10.8.0.1","edge-star-shv-01-ort2.facebook.com","TLSv1.3","461","Client Hello"
"106","4.399843","edge-star-shv-01-ort2.facebook.com","10.8.0.1","TCP","54","443  >  42082 [ACK] Seq=1 Ack=408 Win=65535 Len=0"
"107","4.412188","10.8.0.1","edge-star-mini-shv-01-msp1.facebook.com","TLSv1.3","463","Client Hello"
"108","4.412307","edge-star-mini-shv-01-msp1.facebook.com","10.8.0.1","TCP","54","443  >  34944 [ACK] Seq=1 Ack=410 Win=65535 Len=0"
"109","4.496142","edge-star-shv-01-ort2.facebook.com","10.8.0.1","TLSv1.3","1434","Server Hello, Change Cipher Spec, Application Data"
"110","4.496208","10.8.0.1","edge-star-shv-01-ort2.facebook.com","TCP","54","42074  >  443 [ACK] Seq=406 Ack=1381 Win=65535 Len=0"
"111","4.506093","edge-star-mini-shv-01-msp1.facebook.com","10.8.0.1","TLSv1.3","266","Server Hello, Change Cipher Spec, Application Data"
"112","4.556318","10.8.0.1","edge-star-mini-shv-01-msp1.facebook.com","TCP","54","34938  >  443 [ACK] Seq=408 Ack=213 Win=65535 Len=0"
"113","4.556594","edge-star-shv-01-ort2.facebook.com","10.8.0.1","TLSv1.3","1057","Application Data"
"114","4.556689","edge-star-shv-01-ort2.facebook.com","10.8.0.1","TLSv1.3","1434","Server Hello, Change Cipher Spec, Application Data"
"115","4.556718","10.8.0.1","edge-star-mini-shv-01-msp1.facebook.com","TLSv1.3","118","Change Cipher Spec, Application Data"
"116","4.556773","edge-star-mini-shv-01-msp1.facebook.com","10.8.0.1","TCP","54","443  >  34938 [ACK] Seq=213 Ack=472 Win=65535 Len=0"
"117","4.556795","10.8.0.1","edge-star-shv-01-ort2.facebook.com","TCP","54","42074  >  443 [ACK] Seq=406 Ack=2384 Win=65535 Len=0"
"118","4.556919","10.8.0.1","edge-star-shv-01-ort2.facebook.com","TCP","54","42082  >  443 [ACK] Seq=408 Ack=1381 Win=65535 Len=0"
"119","4.618901","edge-star-shv-01-ort2.facebook.com","10.8.0.1","TLSv1.3","1059","Application Data"
"120","4.669140","10.8.0.1","edge-star-shv-01-ort2.facebook.com","TCP","54","42082  >  443 [ACK] Seq=408 Ack=2386 Win=65535 Len=0"
"121","4.669353","edge-star-mini-shv-01-msp1.facebook.com","10.8.0.1","TLSv1.3","266","Server Hello, Change Cipher Spec, Application Data"
"122","4.669384","10.8.0.1","edge-star-shv-01-ort2.facebook.com","TLSv1.3","118","Change Cipher Spec, Application Data"
"123","4.669446","edge-star-shv-01-ort2.facebook.com","10.8.0.1","TCP","54","443  >  42074 [ACK] Seq=2384 Ack=470 Win=65535 Len=0"
"124","4.669465","10.8.0.1","edge-star-shv-01-ort2.facebook.com","TLSv1.3","118","Change Cipher Spec, Application Data"
"125","4.669509","edge-star-shv-01-ort2.facebook.com","10.8.0.1","TCP","54","443  >  42082 [ACK] Seq=2386 Ack=472 Win=65535 Len=0"
"126","4.669612","10.8.0.1","edge-star-mini-shv-01-msp1.facebook.com","TCP","54","34944  >  443 [ACK] Seq=410 Ack=213 Win=65535 Len=0"
"127","4.670671","10.8.0.1","edge-star-mini-shv-01-msp1.facebook.com","TLSv1.3","118","Change Cipher Spec, Application Data"
"128","4.670792","edge-star-mini-shv-01-msp1.facebook.com","10.8.0.1","TCP","54","443  >  34944 [ACK] Seq=213 Ack=474 Win=65535 Len=0"
"129","4.721146","edge-star-mini-shv-01-msp1.facebook.com","10.8.0.1","TLSv1.3","233","Application Data"
"130","4.771357","10.8.0.1","edge-star-mini-shv-01-msp1.facebook.com","TCP","54","34938  >  443 [ACK] Seq=472 Ack=392 Win=65535 Len=0"
"131","4.771610","edge-star-shv-01-ort2.facebook.com","10.8.0.1","TLSv1.3","233","Application Data"
"132","4.771702","edge-star-shv-01-ort2.facebook.com","10.8.0.1","TLSv1.3","313","Application Data, Application Data"
"133","4.771784","edge-star-mini-shv-01-msp1.facebook.com","10.8.0.1","TLSv1.3","134","Application Data"
"134","4.771802","10.8.0.1","edge-star-shv-01-ort2.facebook.com","TCP","54","42074  >  443 [ACK] Seq=470 Ack=2563 Win=65535 Len=0"
"135","4.771823","10.8.0.1","edge-star-shv-01-ort2.facebook.com","TCP","54","42082  >  443 [ACK] Seq=472 Ack=2645 Win=65535 Len=0"
"136","4.771840","10.8.0.1","edge-star-mini-shv-01-msp1.facebook.com","TCP","54","34938  >  443 [ACK] Seq=472 Ack=472 Win=65535 Len=0"
"137","4.778490","edge-star-mini-shv-01-msp1.facebook.com","10.8.0.1","TLSv1.3","233","Application Data"
"138","4.828689","10.8.0.1","edge-star-mini-shv-01-msp1.facebook.com","TCP","54","34944  >  443 [ACK] Seq=474 Ack=392 Win=65535 Len=0"
"139","4.828940","edge-star-shv-01-ort2.facebook.com","10.8.0.1","TLSv1.3","134","Application Data"
"140","4.828972","10.8.0.1","edge-star-shv-01-ort2.facebook.com","TCP","54","42074  >  443 [ACK] Seq=470 Ack=2643 Win=65535 Len=0"
"141","4.834807","edge-star-mini-shv-01-msp1.facebook.com","10.8.0.1","TLSv1.3","134","Application Data"
"142","4.885008","10.8.0.1","edge-star-mini-shv-01-msp1.facebook.com","TCP","54","34944  >  443 [ACK] Seq=474 Ack=472 Win=65535 Len=0"
"143","7.556202","10.8.0.1","x.ns.gin.ntt.net","NTP","90","NTP Version 3, client"
"144","7.617349","x.ns.gin.ntt.net","10.8.0.1","NTP","90","NTP Version 3, server"
"145","8.469987","10.8.0.1","ec2-44-236-35-201.us-west-2.compute.amazonaws.com","TCP","54","41990  >  443 [FIN, ACK] Seq=6389 Ack=8859 Win=65535 Len=0"
"146","8.470204","ec2-44-236-35-201.us-west-2.compute.amazonaws.com","10.8.0.1","TCP","54","443  >  41990 [ACK] Seq=8859 Ack=6390 Win=65535 Len=0"
"147","8.470321","ec2-44-236-35-201.us-west-2.compute.amazonaws.com","10.8.0.1","TCP","54","443  >  41990 [FIN, ACK] Seq=8859 Ack=6390 Win=65535 Len=0"
"148","8.470521","10.8.0.1","ec2-44-236-35-201.us-west-2.compute.amazonaws.com","TCP","54","41990  >  443 [ACK] Seq=6390 Ack=8860 Win=65535 Len=0"
"149","9.994448","10.8.0.1","104.244.42.66","TCP","74","54992  >  443 [SYN] Seq=0 Win=65535 Len=0 MSS=1460 SACK_PERM=1 TSval=3777337204 TSecr=0 WS=1024"
"150","9.995679","104.244.42.66","10.8.0.1","TCP","54","443  >  54992 [SYN, ACK] Seq=0 Ack=1 Win=65535 Len=0"
"151","9.995697","10.8.0.1","104.244.42.66","TCP","54","54992  >  443 [ACK] Seq=1 Ack=1 Win=65535 Len=0"
"152","9.995747","10.8.0.1","104.244.42.66","TCP","74","54996  >  443 [SYN] Seq=0 Win=65535 Len=0 MSS=1460 SACK_PERM=1 TSval=3777337205 TSecr=0 WS=1024"
"153","9.996645","104.244.42.66","10.8.0.1","TCP","54","443  >  54996 [SYN, ACK] Seq=0 Ack=1 Win=65535 Len=0"
"154","9.996658","10.8.0.1","104.244.42.66","TCP","54","54996  >  443 [ACK] Seq=1 Ack=1 Win=65535 Len=0"
"155","10.002825","10.8.0.1","104.244.42.66","TCP","74","55000  >  443 [SYN] Seq=0 Win=65535 Len=0 MSS=1460 SACK_PERM=1 TSval=3777337212 TSecr=0 WS=1024"
"156","10.003944","104.244.42.66","10.8.0.1","TCP","54","443  >  55000 [SYN, ACK] Seq=0 Ack=1 Win=65535 Len=0"
"157","10.003960","10.8.0.1","104.244.42.66","TCP","54","55000  >  443 [ACK] Seq=1 Ack=1 Win=65535 Len=0"
"158","10.005750","10.8.0.1","104.244.42.66","TLSv1.3","571","Client Hello"
"159","10.005850","104.244.42.66","10.8.0.1","TCP","54","443  >  54996 [ACK] Seq=1 Ack=518 Win=65535 Len=0"
"160","10.008073","10.8.0.1","104.244.42.66","TLSv1.3","571","Client Hello"
"161","10.008120","104.244.42.66","10.8.0.1","TCP","54","443  >  54992 [ACK] Seq=1 Ack=518 Win=65535 Len=0"
"162","10.011525","10.8.0.1","104.244.42.66","TLSv1.3","571","Client Hello"
"163","10.011612","104.244.42.66","10.8.0.1","TCP","54","443  >  55000 [ACK] Seq=1 Ack=518 Win=65535 Len=0"
"164","10.164798","10.8.0.1","ec2-34-213-215-106.us-west-2.compute.amazonaws.com","TCP","74","56878  >  443 [SYN] Seq=0 Win=65535 Len=0 MSS=1460 SACK_PERM=1 TSval=4189981499 TSecr=0 WS=1024"
"165","10.165873","ec2-34-213-215-106.us-west-2.compute.amazonaws.com","10.8.0.1","TCP","54","443  >  56878 [SYN, ACK] Seq=0 Ack=1 Win=65535 Len=0"
"166","10.165904","10.8.0.1","ec2-34-213-215-106.us-west-2.compute.amazonaws.com","TCP","54","56878  >  443 [ACK] Seq=1 Ack=1 Win=65535 Len=0"
"167","10.179872","10.8.0.1","ec2-34-213-215-106.us-west-2.compute.amazonaws.com","TLSv1.2","571","Client Hello"
"168","10.179960","ec2-34-213-215-106.us-west-2.compute.amazonaws.com","10.8.0.1","TCP","54","443  >  56878 [ACK] Seq=1 Ack=518 Win=65535 Len=0"
"169","10.200718","104.244.42.66","10.8.0.1","TLSv1.3","1402","Server Hello, Change Cipher Spec"
"170","10.250889","10.8.0.1","104.244.42.66","TCP","54","54992  >  443 [ACK] Seq=518 Ack=1349 Win=65535 Len=0"
"171","10.251027","104.244.42.66","10.8.0.1","TLSv1.3","2780","Server Hello, Change Cipher Spec"
"172","10.251130","104.244.42.66","10.8.0.1","TLSv1.3","2780","Server Hello, Change Cipher Spec"
"173","10.251188","104.244.42.66","10.8.0.1","TCP","1432","443  >  54992 [PSH, ACK] Seq=1349 Ack=518 Win=65535 Len=1378 [TCP segment of a reassembled PDU]"
"174","10.251197","10.8.0.1","104.244.42.66","TCP","54","54996  >  443 [ACK] Seq=518 Ack=2727 Win=65535 Len=0"
"175","10.251203","10.8.0.1","104.244.42.66","TCP","54","55000  >  443 [ACK] Seq=518 Ack=2727 Win=65535 Len=0"
"176","10.251208","10.8.0.1","104.244.42.66","TCP","54","54992  >  443 [ACK] Seq=518 Ack=2727 Win=65535 Len=0"
"177","10.254407","104.244.42.66","10.8.0.1","TLSv1.3","673","Application Data"
"178","10.304603","10.8.0.1","104.244.42.66","TCP","54","54992  >  443 [ACK] Seq=518 Ack=3346 Win=65535 Len=0"
"179","10.304850","104.244.42.66","10.8.0.1","TLSv1.3","673","Application Data"
"180","10.304906","104.244.42.66","10.8.0.1","TLSv1.3","673","Application Data"
"181","10.304919","10.8.0.1","104.244.42.66","TLSv1.3","118","Change Cipher Spec, Application Data"
"182","10.304950","104.244.42.66","10.8.0.1","TCP","54","443  >  54992 [ACK] Seq=3346 Ack=582 Win=65535 Len=0"
"183","10.304955","10.8.0.1","104.244.42.66","TCP","54","54996  >  443 [ACK] Seq=518 Ack=3346 Win=65535 Len=0"
"184","10.305060","10.8.0.1","104.244.42.66","TCP","54","55000  >  443 [ACK] Seq=518 Ack=3346 Win=65535 Len=0"
"185","10.309076","10.8.0.1","104.244.42.66","TLSv1.3","118","Change Cipher Spec, Application Data"
"186","10.309175","104.244.42.66","10.8.0.1","TCP","54","443  >  54996 [ACK] Seq=3346 Ack=582 Win=65535 Len=0"
"187","10.359367","10.8.0.1","104.244.42.66","TLSv1.3","118","Change Cipher Spec, Application Data"
"188","10.359501","104.244.42.66","10.8.0.1","TCP","54","443  >  55000 [ACK] Seq=3346 Ack=582 Win=65535 Len=0"
"189","10.359513","10.8.0.1","104.244.42.66","TLSv1.3","590","Application Data, Application Data, Application Data"
"190","10.359544","104.244.42.66","10.8.0.1","TCP","54","443  >  55000 [ACK] Seq=3346 Ack=1118 Win=65535 Len=0"
"191","10.359556","10.8.0.1","104.244.42.66","TLSv1.3","100","Application Data"
"192","10.359584","104.244.42.66","10.8.0.1","TCP","54","443  >  54992 [ACK] Seq=3346 Ack=628 Win=65535 Len=0"
"193","10.359592","10.8.0.1","104.244.42.66","TLSv1.3","100","Application Data"
"194","10.359610","104.244.42.66","10.8.0.1","TCP","54","443  >  54996 [ACK] Seq=3346 Ack=628 Win=65535 Len=0"
"195","10.359634","10.8.0.1","104.244.42.66","TLSv1.3","590","Application Data [TCP segment of a reassembled PDU]"
"196","10.359650","104.244.42.66","10.8.0.1","TCP","54","443  >  55000 [ACK] Seq=3346 Ack=1654 Win=65535 Len=0"
"197","10.359680","10.8.0.1","104.244.42.66","TLSv1.3","150","Application Data, Application Data, Application Data"
"198","10.359692","104.244.42.66","10.8.0.1","TCP","54","443  >  54996 [ACK] Seq=3346 Ack=724 Win=65535 Len=0"
"199","10.359697","10.8.0.1","104.244.42.66","TLSv1.3","590","Application Data [TCP segment of a reassembled PDU]"
"200","10.359709","104.244.42.66","10.8.0.1","TCP","54","443  >  55000 [ACK] Seq=3346 Ack=2190 Win=65535 Len=0"
"201","10.359718","10.8.0.1","104.244.42.66","TLSv1.3","196","Application Data"
"202","10.359729","104.244.42.66","10.8.0.1","TCP","54","443  >  55000 [ACK] Seq=3346 Ack=2332 Win=65535 Len=0"
"203","10.359733","10.8.0.1","104.244.42.66","TLSv1.3","150","Application Data, Application Data, Application Data"
"204","10.359744","104.244.42.66","10.8.0.1","TCP","54","443  >  54992 [ACK] Seq=3346 Ack=724 Win=65535 Len=0"
"205","10.435234","ec2-34-213-215-106.us-west-2.compute.amazonaws.com","10.8.0.1","TLSv1.2","1432","Server Hello"
"206","10.486020","10.8.0.1","ec2-34-213-215-106.us-west-2.compute.amazonaws.com","TCP","54","56878  >  443 [ACK] Seq=518 Ack=1379 Win=65535 Len=0"
"207","10.486151","104.244.42.66","10.8.0.1","TLSv1.3","581","Application Data, Application Data"
"208","10.486213","ec2-34-213-215-106.us-west-2.compute.amazonaws.com","10.8.0.1","TLSv1.2","4191","Certificate, Server Key Exchange, Server Hello Done"
"209","10.486243","10.8.0.1","104.244.42.66","TCP","54","55000  >  443 [ACK] Seq=2332 Ack=3873 Win=65535 Len=0"
"210","10.486250","10.8.0.1","ec2-34-213-215-106.us-west-2.compute.amazonaws.com","TCP","54","56878  >  443 [ACK] Seq=518 Ack=5516 Win=65535 Len=0"
"211","10.495361","10.8.0.1","104.244.42.66","TLSv1.3","85","Application Data"
"212","10.495444","104.244.42.66","10.8.0.1","TCP","54","443  >  55000 [ACK] Seq=3873 Ack=2363 Win=65535 Len=0"
"213","10.546015","104.244.42.66","10.8.0.1","TLSv1.3","845","Application Data"
"214","10.546095","10.8.0.1","ec2-34-213-215-106.us-west-2.compute.amazonaws.com","TLSv1.2","180","Client Key Exchange, Change Cipher Spec, Encrypted Handshake Message"
"215","10.546168","ec2-34-213-215-106.us-west-2.compute.amazonaws.com","10.8.0.1","TCP","54","443  >  56878 [ACK] Seq=5516 Ack=644 Win=65535 Len=0"
"216","10.546252","104.244.42.66","10.8.0.1","TLSv1.3","528","Application Data, Application Data"
"217","10.546276","10.8.0.1","104.244.42.66","TCP","54","55000  >  443 [ACK] Seq=2363 Ack=4664 Win=65535 Len=0"
"218","10.546385","10.8.0.1","104.244.42.66","TCP","54","54992  >  443 [ACK] Seq=724 Ack=3820 Win=65535 Len=0"
"219","10.546528","104.244.42.66","10.8.0.1","TCP","54","443  >  54992 [FIN, ACK] Seq=3820 Ack=724 Win=65535 Len=0"
"220","10.549648","10.8.0.1","104.244.42.66","TCP","54","54992  >  443 [RST, ACK] Seq=724 Ack=3821 Win=65535 Len=0"
"221","10.559731","104.244.42.66","10.8.0.1","TLSv1.3","528","Application Data, Application Data"
"222","10.609930","10.8.0.1","104.244.42.66","TCP","54","54996  >  443 [RST] Seq=724 Win=0 Len=0"
"223","10.610316","104.244.42.66","10.8.0.1","TLSv1.3","1114","Application Data, Application Data"
"224","10.610335","10.8.0.1","104.244.42.66","TCP","54","55000  >  443 [ACK] Seq=2363 Ack=5724 Win=65535 Len=0"
"225","10.662800","ec2-34-213-215-106.us-west-2.compute.amazonaws.com","10.8.0.1","TLSv1.2","413","New Session Ticket, Change Cipher Spec, Encrypted Handshake Message, Application Data"
"226","10.713022","10.8.0.1","ec2-34-213-215-106.us-west-2.compute.amazonaws.com","TCP","54","56878  >  443 [ACK] Seq=644 Ack=5875 Win=65535 Len=0"
"227","10.713061","10.8.0.1","ec2-34-213-215-106.us-west-2.compute.amazonaws.com","TLSv1.2","107","Application Data"
"228","10.713202","ec2-34-213-215-106.us-west-2.compute.amazonaws.com","10.8.0.1","TCP","54","443  >  56878 [ACK] Seq=5875 Ack=697 Win=65535 Len=0"
"229","10.713215","10.8.0.1","ec2-34-213-215-106.us-west-2.compute.amazonaws.com","TLSv1.2","590","Application Data, Application Data"
"230","10.713236","ec2-34-213-215-106.us-west-2.compute.amazonaws.com","10.8.0.1","TCP","54","443  >  56878 [ACK] Seq=5875 Ack=1233 Win=65535 Len=0"
"231","10.713251","10.8.0.1","ec2-34-213-215-106.us-west-2.compute.amazonaws.com","TCP","590","56878  >  443 [ACK] Seq=1233 Ack=5875 Win=65535 Len=536 [TCP segment of a reassembled PDU]"
"232","10.713266","ec2-34-213-215-106.us-west-2.compute.amazonaws.com","10.8.0.1","TCP","54","443  >  56878 [ACK] Seq=5875 Ack=1769 Win=65535 Len=0"
"233","10.713274","10.8.0.1","ec2-34-213-215-106.us-west-2.compute.amazonaws.com","TCP","590","56878  >  443 [ACK] Seq=1769 Ack=5875 Win=65535 Len=536 [TCP segment of a reassembled PDU]"
"234","10.713288","ec2-34-213-215-106.us-west-2.compute.amazonaws.com","10.8.0.1","TCP","54","443  >  56878 [ACK] Seq=5875 Ack=2305 Win=65535 Len=0"
"235","10.713295","10.8.0.1","ec2-34-213-215-106.us-west-2.compute.amazonaws.com","TCP","590","56878  >  443 [PSH, ACK] Seq=2305 Ack=5875 Win=65535 Len=536 [TCP segment of a reassembled PDU]"
"236","10.713309","ec2-34-213-215-106.us-west-2.compute.amazonaws.com","10.8.0.1","TCP","54","443  >  56878 [ACK] Seq=5875 Ack=2841 Win=65535 Len=0"
"237","10.713317","10.8.0.1","ec2-34-213-215-106.us-west-2.compute.amazonaws.com","TCP","590","56878  >  443 [ACK] Seq=2841 Ack=5875 Win=65535 Len=536 [TCP segment of a reassembled PDU]"
"238","10.713330","ec2-34-213-215-106.us-west-2.compute.amazonaws.com","10.8.0.1","TCP","54","443  >  56878 [ACK] Seq=5875 Ack=3377 Win=65535 Len=0"
"239","10.713341","10.8.0.1","ec2-34-213-215-106.us-west-2.compute.amazonaws.com","TCP","590","56878  >  443 [PSH, ACK] Seq=3377 Ack=5875 Win=65535 Len=536 [TCP segment of a reassembled PDU]"
"240","10.713380","ec2-34-213-215-106.us-west-2.compute.amazonaws.com","10.8.0.1","TCP","54","443  >  56878 [ACK] Seq=5875 Ack=3913 Win=65535 Len=0"
"241","10.713388","10.8.0.1","ec2-34-213-215-106.us-west-2.compute.amazonaws.com","TLSv1.2","226","Application Data, Application Data"
"242","10.713401","ec2-34-213-215-106.us-west-2.compute.amazonaws.com","10.8.0.1","TCP","54","443  >  56878 [ACK] Seq=5875 Ack=4085 Win=65535 Len=0"
"243","10.834642","ec2-34-213-215-106.us-west-2.compute.amazonaws.com","10.8.0.1","TLSv1.2","92","Application Data"
"244","10.885120","10.8.0.1","ec2-34-213-215-106.us-west-2.compute.amazonaws.com","TCP","54","56878  >  443 [ACK] Seq=4085 Ack=5913 Win=65535 Len=0"
"245","10.890603","10.8.0.1","server-65-8-47-252.ord52.r.cloudfront.net","TCP","74","46510  >  443 [SYN] Seq=0 Win=65535 Len=0 MSS=1460 SACK_PERM=1 TSval=2023663823 TSecr=0 WS=1024"
"246","10.892131","server-65-8-47-252.ord52.r.cloudfront.net","10.8.0.1","TCP","54","443  >  46510 [SYN, ACK] Seq=0 Ack=1 Win=65535 Len=0"
"247","10.892156","10.8.0.1","server-65-8-47-252.ord52.r.cloudfront.net","TCP","54","46510  >  443 [ACK] Seq=1 Ack=1 Win=65535 Len=0"
"248","10.899814","10.8.0.1","server-65-8-47-252.ord52.r.cloudfront.net","TLSv1.3","313","Client Hello"
"249","10.899908","server-65-8-47-252.ord52.r.cloudfront.net","10.8.0.1","TCP","54","443  >  46510 [ACK] Seq=1 Ack=260 Win=65535 Len=0"
"250","10.942776","ec2-34-213-215-106.us-west-2.compute.amazonaws.com","10.8.0.1","TLSv1.2","191","Application Data"
"251","10.992988","10.8.0.1","ec2-34-213-215-106.us-west-2.compute.amazonaws.com","TCP","54","56878  >  443 [ACK] Seq=4085 Ack=6050 Win=65535 Len=0"
"252","11.078986","server-65-8-47-252.ord52.r.cloudfront.net","10.8.0.1","TLSv1.3","1482","Server Hello, Change Cipher Spec, Application Data"
"253","11.129238","10.8.0.1","server-65-8-47-252.ord52.r.cloudfront.net","TCP","54","46510  >  443 [ACK] Seq=260 Ack=1429 Win=65535 Len=0"
"254","11.129506","server-65-8-47-252.ord52.r.cloudfront.net","10.8.0.1","TCP","1432","443  >  46510 [PSH, ACK] Seq=1429 Ack=260 Win=65535 Len=1378 [TCP segment of a reassembled PDU]"
"255","11.179733","10.8.0.1","server-65-8-47-252.ord52.r.cloudfront.net","TCP","54","46510  >  443 [ACK] Seq=260 Ack=2807 Win=65535 Len=0"
"256","11.179920","server-65-8-47-252.ord52.r.cloudfront.net","10.8.0.1","TLSv1.3","1241","Application Data, Application Data, Application Data"
"257","11.230055","10.8.0.1","server-65-8-47-252.ord52.r.cloudfront.net","TCP","54","46510  >  443 [ACK] Seq=260 Ack=3994 Win=65535 Len=0"
"258","11.234303","10.8.0.1","server-65-8-47-252.ord52.r.cloudfront.net","TLSv1.3","118","Change Cipher Spec, Application Data"
"259","11.234434","server-65-8-47-252.ord52.r.cloudfront.net","10.8.0.1","TCP","54","443  >  46510 [ACK] Seq=3994 Ack=324 Win=65535 Len=0"
"260","11.284880","10.8.0.1","server-65-8-47-252.ord52.r.cloudfront.net","TLSv1.3","317","Application Data"
"261","11.285060","server-65-8-47-252.ord52.r.cloudfront.net","10.8.0.1","TCP","54","443  >  46510 [ACK] Seq=3994 Ack=587 Win=65535 Len=0"
"262","11.335371","10.8.0.1","lga15s46-in-f35.1e100.net","TCP","74","44368  >  443 [SYN] Seq=0 Win=65535 Len=0 MSS=1460 SACK_PERM=1 TSval=2004929601 TSecr=0 WS=1024"
"263","11.338822","lga15s46-in-f35.1e100.net","10.8.0.1","TCP","54","443  >  44368 [SYN, ACK] Seq=0 Ack=1 Win=65535 Len=0"
"264","11.338879","10.8.0.1","lga15s46-in-f35.1e100.net","TCP","54","44368  >  443 [ACK] Seq=1 Ack=1 Win=65535 Len=0"
"265","11.359073","10.8.0.1","lga15s46-in-f35.1e100.net","TLSv1.3","571","Client Hello"
"266","11.359183","lga15s46-in-f35.1e100.net","10.8.0.1","TCP","54","443  >  44368 [ACK] Seq=1 Ack=518 Win=65535 Len=0"
"267","11.465985","lga15s46-in-f35.1e100.net","10.8.0.1","TLSv1.3","1432","Server Hello, Change Cipher Spec"
"268","11.516231","10.8.0.1","lga15s46-in-f35.1e100.net","TCP","54","44368  >  443 [ACK] Seq=518 Ack=1379 Win=65535 Len=0"
"269","11.516493","server-65-8-47-252.ord52.r.cloudfront.net","10.8.0.1","TLSv1.3","679","Application Data"
"270","11.516619","lga15s46-in-f35.1e100.net","10.8.0.1","TLSv1.3","3019","Application Data"
"271","11.516668","10.8.0.1","server-65-8-47-252.ord52.r.cloudfront.net","TCP","54","46510  >  443 [ACK] Seq=587 Ack=4619 Win=65535 Len=0"
"272","11.516691","10.8.0.1","lga15s46-in-f35.1e100.net","TCP","54","44368  >  443 [ACK] Seq=518 Ack=4344 Win=65535 Len=0"
"273","11.568383","10.8.0.1","lga15s46-in-f35.1e100.net","TLSv1.3","118","Change Cipher Spec, Application Data"
"274","11.568495","lga15s46-in-f35.1e100.net","10.8.0.1","TCP","54","443  >  44368 [ACK] Seq=4344 Ack=582 Win=65535 Len=0"
"275","11.618705","10.8.0.1","lga15s46-in-f35.1e100.net","TLSv1.3","304","Application Data"
"276","11.618835","lga15s46-in-f35.1e100.net","10.8.0.1","TCP","54","443  >  44368 [ACK] Seq=4344 Ack=832 Win=65535 Len=0"
"277","11.719189","10.8.0.1","server-65-8-47-252.ord52.r.cloudfront.net","TLSv1.3","78","Application Data"
"278","11.719302","server-65-8-47-252.ord52.r.cloudfront.net","10.8.0.1","TCP","54","443  >  46510 [ACK] Seq=4619 Ack=611 Win=65535 Len=0"
"279","11.769532","10.8.0.1","server-65-8-47-252.ord52.r.cloudfront.net","TCP","54","46510  >  443 [FIN, ACK] Seq=611 Ack=4619 Win=65535 Len=0"
"280","11.769700","server-65-8-47-252.ord52.r.cloudfront.net","10.8.0.1","TCP","54","443  >  46510 [ACK] Seq=4619 Ack=612 Win=65535 Len=0"
"281","11.769775","server-65-8-47-252.ord52.r.cloudfront.net","10.8.0.1","TCP","54","443  >  46510 [FIN, ACK] Seq=4619 Ack=612 Win=65535 Len=0"
"282","11.770000","10.8.0.1","ord37s36-in-f3.1e100.net","TCP","74","43986  >  443 [SYN] Seq=0 Win=65535 Len=0 MSS=1460 SACK_PERM=1 TSval=3890212629 TSecr=0 WS=1024"
"283","11.771629","ord37s36-in-f3.1e100.net","10.8.0.1","TCP","54","443  >  43986 [SYN, ACK] Seq=0 Ack=1 Win=65535 Len=0"
"284","11.771648","10.8.0.1","server-65-8-47-252.ord52.r.cloudfront.net","TCP","54","46510  >  443 [ACK] Seq=612 Ack=4620 Win=65535 Len=0"
"285","11.771656","10.8.0.1","ord37s36-in-f3.1e100.net","TCP","54","43986  >  443 [ACK] Seq=1 Ack=1 Win=65535 Len=0"
"286","11.776510","10.8.0.1","ord37s36-in-f3.1e100.net","TCP","590","43986  >  443 [ACK] Seq=1 Ack=1 Win=65535 Len=536 [TCP segment of a reassembled PDU]"
"287","11.776628","ord37s36-in-f3.1e100.net","10.8.0.1","TCP","54","443  >  43986 [ACK] Seq=1 Ack=537 Win=65535 Len=0"
"288","11.776648","10.8.0.1","ord37s36-in-f3.1e100.net","TLSv1.3","97","Client Hello"
"289","11.776681","ord37s36-in-f3.1e100.net","10.8.0.1","TCP","54","443  >  43986 [ACK] Seq=1 Ack=580 Win=65535 Len=0"
"290","11.809871","10.8.0.1","104.244.42.131","TCP","74","45738  >  443 [SYN] Seq=0 Win=65535 Len=0 MSS=1460 SACK_PERM=1 TSval=978621227 TSecr=0 WS=1024"
"291","11.812291","104.244.42.131","10.8.0.1","TCP","54","443  >  45738 [SYN, ACK] Seq=0 Ack=1 Win=65535 Len=0"
"292","11.812330","10.8.0.1","104.244.42.131","TCP","54","45738  >  443 [ACK] Seq=1 Ack=1 Win=65535 Len=0"
"293","11.822683","10.8.0.1","104.244.42.131","TLSv1.3","571","Client Hello"
"294","11.822812","104.244.42.131","10.8.0.1","TCP","54","443  >  45738 [ACK] Seq=1 Ack=518 Win=65535 Len=0"
"295","11.885099","lga15s46-in-f35.1e100.net","10.8.0.1","TLSv1.3","9415","Application Data, Application Data, Application Data, Application Data, Application Data, Application Data, Application Data"
"296","11.885327","10.8.0.1","lga15s46-in-f35.1e100.net","TCP","54","44368  >  443 [ACK] Seq=832 Ack=13705 Win=65535 Len=0"
"297","11.885560","lga15s46-in-f35.1e100.net","10.8.0.1","TLSv1.3","2810","Application Data, Application Data"
"298","11.935898","10.8.0.1","lga15s46-in-f35.1e100.net","TCP","54","44368  >  443 [ACK] Seq=832 Ack=16461 Win=65535 Len=0"
"299","11.936161","ord37s36-in-f3.1e100.net","10.8.0.1","TLSv1.3","272","Server Hello, Change Cipher Spec, Application Data"
"300","11.936306","lga15s46-in-f35.1e100.net","10.8.0.1","TLSv1.3","15212","Application Data, Application Data, Application Data, Application Data, Application Data, Application Data, Application Data, Application Data, Application Data, Application Data"
"301","11.936373","10.8.0.1","ord37s36-in-f3.1e100.net","TCP","54","43986  >  443 [ACK] Seq=580 Ack=219 Win=65535 Len=0"
"302","11.936388","10.8.0.1","lga15s46-in-f35.1e100.net","TCP","54","44368  >  443 [ACK] Seq=832 Ack=31619 Win=65535 Len=0"
"303","11.939147","10.8.0.1","ord37s36-in-f3.1e100.net","TLSv1.3","118","Change Cipher Spec, Application Data"
"304","11.939194","ord37s36-in-f3.1e100.net","10.8.0.1","TCP","54","443  >  43986 [ACK] Seq=219 Ack=644 Win=65535 Len=0"
"305","11.989434","10.8.0.1","ord37s36-in-f3.1e100.net","TLSv1.3","308","Application Data"
"306","11.989611","ord37s36-in-f3.1e100.net","10.8.0.1","TCP","54","443  >  43986 [ACK] Seq=219 Ack=898 Win=65535 Len=0"
"307","11.990013","lga15s46-in-f35.1e100.net","10.8.0.1","TLSv1.3","35882","Application Data, Application Data, Application Data, Application Data, Application Data, Application Data, Application Data, Application Data, Application Data, Application Data, Application Data, Application Data, Application Data, Application Data, Application Data, Application Data, Application Data, Application Data, Application Data, Application Data, Application Data, Application Data, Application Data, Application Data, Application Data, Application Data, Application Data"
