"No.","Time","Source","Destination","Protocol","Length","Info"
"1","0.000000","10.81.92.15","ord38s32-in-f10.1e100.net","TCP","66","50064  >  443 [ACK] Seq=1 Ack=1 Win=64 Len=0 TSval=259921772 TSecr=2549662120"
"2","0.000043","10.81.92.15","ord38s32-in-f10.1e100.net","TCP","66","50062  >  443 [ACK] Seq=1 Ack=1 Win=64 Len=0 TSval=259921772 TSecr=1045600958"
"3","0.000049","10.81.92.15","ord38s32-in-f10.1e100.net","TLSv1","611","Client Hello"
"4","0.000054","10.81.92.15","ord38s32-in-f10.1e100.net","TLSv1","611","Client Hello"
"5","0.358128","10.81.92.15","ord38s32-in-f10.1e100.net","TCP","611","[TCP Retransmission] 50062  >  443 [PSH, ACK] Seq=1 Ack=1 Win=64 Len=545 TSval=259922132 TSecr=1045600958"
"6","0.378947","10.81.92.15","ord38s32-in-f10.1e100.net","TCP","611","[TCP Retransmission] 50064  >  443 [PSH, ACK] Seq=1 Ack=1 Win=64 Len=545 TSval=259922152 TSecr=2549662120"
"7","0.794032","10.81.92.15","ord38s32-in-f10.1e100.net","TCP","611","[TCP Retransmission] 50064  >  443 [PSH, ACK] Seq=1 Ack=1 Win=64 Len=545 TSval=259922568 TSecr=2549662120"
"8","0.794099","10.81.92.15","ord38s32-in-f10.1e100.net","TCP","611","[TCP Retransmission] 50062  >  443 [PSH, ACK] Seq=1 Ack=1 Win=64 Len=545 TSval=259922568 TSecr=1045600958"
"9","1.073526","10.81.92.15","ord38s32-in-f10.1e100.net","TCP","66","[TCP Dup ACK 2#1] 50062  >  443 [ACK] Seq=546 Ack=1 Win=64 Len=0 TSval=259922846 TSecr=1045600958"
"10","1.073607","10.81.92.15","ord38s32-in-f10.1e100.net","TCP","66","[TCP Dup ACK 1#1] 50064  >  443 [ACK] Seq=546 Ack=1 Win=64 Len=0 TSval=259922846 TSecr=2549662120"
"11","1.627202","10.81.92.15","ord38s32-in-f10.1e100.net","TCP","611","[TCP Retransmission] 50062  >  443 [PSH, ACK] Seq=1 Ack=1 Win=64 Len=545 TSval=259923400 TSecr=1045600958"
"12","1.627300","10.81.92.15","ord38s32-in-f10.1e100.net","TCP","611","[TCP Retransmission] 50064  >  443 [PSH, ACK] Seq=1 Ack=1 Win=64 Len=545 TSval=259923401 TSecr=2549662120"
"13","2.124660","10.8.0.1","gh-in-f188.1e100.net","TCP","74","52968  >  5228 [SYN] Seq=0 Win=65535 Len=0 MSS=1460 SACK_PERM=1 TSval=2828402521 TSecr=0 WS=1024"
"14","2.128357","gh-in-f188.1e100.net","10.8.0.1","TCP","54","5228  >  52968 [SYN, ACK] Seq=0 Ack=1 Win=65535 Len=0"
"15","2.128403","10.8.0.1","gh-in-f188.1e100.net","TCP","54","52968  >  5228 [ACK] Seq=1 Ack=1 Win=65535 Len=0"
"16","2.130671","10.8.0.1","gh-in-f188.1e100.net","TLSv1.3","587","Client Hello"
"17","2.130748","gh-in-f188.1e100.net","10.8.0.1","TCP","54","5228  >  52968 [ACK] Seq=1 Ack=534 Win=65535 Len=0"
"18","2.356799","gh-in-f188.1e100.net","10.8.0.1","TLSv1.3","257","Server Hello, Change Cipher Spec, Application Data"
"19","2.407948","10.8.0.1","gh-in-f188.1e100.net","TCP","54","52968  >  5228 [ACK] Seq=534 Ack=204 Win=65535 Len=0"
"20","2.408019","10.8.0.1","gh-in-f188.1e100.net","TLSv1.3","118","Change Cipher Spec, Application Data"
"21","2.408190","gh-in-f188.1e100.net","10.8.0.1","TCP","54","5228  >  52968 [ACK] Seq=204 Ack=598 Win=65535 Len=0"
"22","2.408221","10.8.0.1","gh-in-f188.1e100.net","TLSv1.3","408","Application Data"
"23","2.408276","gh-in-f188.1e100.net","10.8.0.1","TCP","54","5228  >  52968 [ACK] Seq=204 Ack=952 Win=65535 Len=0"
"24","2.603975","gh-in-f188.1e100.net","10.8.0.1","TLSv1.3","701","Application Data, Application Data, Application Data, Application Data"
"25","2.655455","10.8.0.1","gh-in-f188.1e100.net","TCP","54","52968  >  5228 [ACK] Seq=952 Ack=851 Win=65535 Len=0"
"26","3.258838","10.81.92.15","ord38s32-in-f10.1e100.net","TCP","611","[TCP Retransmission] 50062  >  443 [PSH, ACK] Seq=1 Ack=1 Win=64 Len=545 TSval=259925032 TSecr=1045600958"
"27","3.258954","10.81.92.15","ord38s32-in-f10.1e100.net","TCP","611","[TCP Retransmission] 50064  >  443 [PSH, ACK] Seq=1 Ack=1 Win=64 Len=545 TSval=259925032 TSecr=2549662120"
"28","3.322340","10.81.92.15","ord38s32-in-f10.1e100.net","TCP","66","[TCP Dup ACK 2#2] 50062  >  443 [ACK] Seq=546 Ack=1 Win=64 Len=0 TSval=259925096 TSecr=1045600958"
"29","3.322411","10.81.92.15","ord38s32-in-f10.1e100.net","TCP","66","[TCP Dup ACK 1#2] 50064  >  443 [ACK] Seq=546 Ack=1 Win=64 Len=0 TSval=259925096 TSecr=2549662120"
"30","4.337160","10.8.0.1","4.163.120.34.bc.googleusercontent.com","GQUIC","1392","Client Hello, PKN: 1, CID: 18305389013508390359"
"31","4.443237","4.163.120.34.bc.googleusercontent.com","10.8.0.1","GQUIC","1392","Rejection, PKN: 1, CID: 18305389013508390359"
"32","4.443334","10.8.0.1","103.140.107.34.bc.googleusercontent.com","GQUIC","1392","Client Hello, PKN: 1, CID: 12026407937593276295"
"33","4.673298","103.140.107.34.bc.googleusercontent.com","10.8.0.1","GQUIC","1392","Rejection, PKN: 1, CID: 12026407937593276295"
"34","4.673365","10.8.0.1","231.176.107.34.bc.googleusercontent.com","GQUIC","1392","Client Hello, PKN: 1, CID: 8294557667192577363"
"35","4.769699","231.176.107.34.bc.googleusercontent.com","10.8.0.1","GQUIC","1392","Rejection, PKN: 1, CID: 8294557667192577363"
"36","4.769756","10.8.0.1","4.163.120.34.bc.googleusercontent.com","GQUIC","70","Payload (Encrypted), PKN: 2, CID: 18305389013508390359"
"37","5.231231","4.163.120.34.bc.googleusercontent.com","10.8.0.1","GQUIC","1392","Payload (Encrypted), PKN: 7, CID: 18305389013508390359"
"38","5.231340","10.8.0.1","103.140.107.34.bc.googleusercontent.com","GQUIC","1392","Client Hello, PKN: 2, CID: 12026407937593276295"
"39","5.318786","103.140.107.34.bc.googleusercontent.com","10.8.0.1","GQUIC","72","Payload (Encrypted), PKN: 10, CID: 12026407937593276295"
"40","5.318881","10.8.0.1","231.176.107.34.bc.googleusercontent.com","GQUIC","1392","Client Hello, PKN: 2, CID: 8294557667192577363"
"41","5.555389","231.176.107.34.bc.googleusercontent.com","10.8.0.1","GQUIC","72","Payload (Encrypted), PKN: 10, CID: 8294557667192577363"
"42","5.555476","10.8.0.1","103.140.107.34.bc.googleusercontent.com","TCP","74","50734  >  443 [SYN] Seq=0 Win=65535 Len=0 MSS=1460 SACK_PERM=1 TSval=719034736 TSecr=0 WS=1024"
"43","5.558803","103.140.107.34.bc.googleusercontent.com","10.8.0.1","TCP","54","443  >  50734 [SYN, ACK] Seq=0 Ack=1 Win=65535 Len=0"
"44","5.558862","10.8.0.1","103.140.107.34.bc.googleusercontent.com","GQUIC","70","Payload (Encrypted), PKN: 3, CID: 12026407937593276295"
"45","6.587466","10.8.0.1","103.140.107.34.bc.googleusercontent.com","TCP","74","50736  >  443 [SYN] Seq=0 Win=65535 Len=0 MSS=1460 SACK_PERM=1 TSval=719034857 TSecr=0 WS=1024"
"46","6.590321","103.140.107.34.bc.googleusercontent.com","10.8.0.1","TCP","54","443  >  50736 [SYN, ACK] Seq=0 Ack=1 Win=65535 Len=0"
"47","6.590385","10.8.0.1","a23-77-218-171.deploy.static.akamaitechnologies.com","TCP","74","58144  >  443 [SYN] Seq=0 Win=65535 Len=0 MSS=1460 SACK_PERM=1 TSval=2751403938 TSecr=0 WS=1024"
"48","6.592982","a23-77-218-171.deploy.static.akamaitechnologies.com","10.8.0.1","TCP","54","443  >  58144 [SYN, ACK] Seq=0 Ack=1 Win=65535 Len=0"
"49","6.593028","10.8.0.1","231.176.107.34.bc.googleusercontent.com","GQUIC","70","Payload (Encrypted), PKN: 3, CID: 8294557667192577363"
"50","7.610064","10.8.0.1","103.140.107.34.bc.googleusercontent.com","TCP","74","50740  >  443 [SYN] Seq=0 Win=65535 Len=0 MSS=1460 SACK_PERM=1 TSval=719034982 TSecr=0 WS=1024"
"51","7.611329","103.140.107.34.bc.googleusercontent.com","10.8.0.1","TCP","54","443  >  50740 [SYN, ACK] Seq=0 Ack=1 Win=65535 Len=0"
"52","7.611365","10.8.0.1","a23-77-218-171.deploy.static.akamaitechnologies.com","TCP","74","58148  >  443 [SYN] Seq=0 Win=65535 Len=0 MSS=1460 SACK_PERM=1 TSval=2751404128 TSecr=0 WS=1024"
"53","7.612435","a23-77-218-171.deploy.static.akamaitechnologies.com","10.8.0.1","TCP","54","443  >  58148 [SYN, ACK] Seq=0 Ack=1 Win=65535 Len=0"
"54","7.612457","10.8.0.1","103.140.107.34.bc.googleusercontent.com","TCP","74","50744  >  443 [SYN] Seq=0 Win=65535 Len=0 MSS=1460 SACK_PERM=1 TSval=719035191 TSecr=0 WS=1024"
"55","7.613563","103.140.107.34.bc.googleusercontent.com","10.8.0.1","TCP","54","443  >  50744 [SYN, ACK] Seq=0 Ack=1 Win=65535 Len=0"
"56","7.613593","10.8.0.1","a23-77-218-137.deploy.static.akamaitechnologies.com","TCP","74","43152  >  443 [SYN] Seq=0 Win=65535 Len=0 MSS=1460 SACK_PERM=1 TSval=622027637 TSecr=0 WS=1024"
"57","7.614688","a23-77-218-137.deploy.static.akamaitechnologies.com","10.8.0.1","TCP","54","443  >  43152 [SYN, ACK] Seq=0 Ack=1 Win=65535 Len=0"
"58","7.614709","10.8.0.1","103.140.107.34.bc.googleusercontent.com","TCP","74","50748  >  443 [SYN] Seq=0 Win=65535 Len=0 MSS=1460 SACK_PERM=1 TSval=719035249 TSecr=0 WS=1024"
"59","7.615625","103.140.107.34.bc.googleusercontent.com","10.8.0.1","TCP","54","443  >  50748 [SYN, ACK] Seq=0 Ack=1 Win=65535 Len=0"
"60","7.615645","10.8.0.1","103.140.107.34.bc.googleusercontent.com","TCP","74","50750  >  443 [SYN] Seq=0 Win=65535 Len=0 MSS=1460 SACK_PERM=1 TSval=719035329 TSecr=0 WS=1024"
"61","7.616432","103.140.107.34.bc.googleusercontent.com","10.8.0.1","TCP","54","443  >  50750 [SYN, ACK] Seq=0 Ack=1 Win=65535 Len=0"
"62","7.616450","10.8.0.1","4.163.120.34.bc.googleusercontent.com","GQUIC","73","Payload (Encrypted), PKN: 3, CID: 18305389013508390359"
"63","7.670618","4.163.120.34.bc.googleusercontent.com","10.8.0.1","GQUIC","1392","Payload (Encrypted), PKN: 11, CID: 18305389013508390359"
"64","7.670723","10.8.0.1","a23-77-218-242.deploy.static.akamaitechnologies.com","TCP","74","34492  >  443 [SYN] Seq=0 Win=65535 Len=0 MSS=1460 SACK_PERM=1 TSval=564462434 TSecr=0 WS=1024"
"65","7.672280","a23-77-218-242.deploy.static.akamaitechnologies.com","10.8.0.1","TCP","54","443  >  34492 [SYN, ACK] Seq=0 Ack=1 Win=65535 Len=0"
"66","7.672347","10.8.0.1","a23-77-218-137.deploy.static.akamaitechnologies.com","TCP","74","43160  >  443 [SYN] Seq=0 Win=65535 Len=0 MSS=1460 SACK_PERM=1 TSval=622027832 TSecr=0 WS=1024"
"67","7.674133","a23-77-218-137.deploy.static.akamaitechnologies.com","10.8.0.1","TCP","54","443  >  43160 [SYN, ACK] Seq=0 Ack=1 Win=65535 Len=0"
"68","7.674166","10.8.0.1","a23-77-218-242.deploy.static.akamaitechnologies.com","TCP","74","34496  >  443 [SYN] Seq=0 Win=65535 Len=0 MSS=1460 SACK_PERM=1 TSval=564462586 TSecr=0 WS=1024"
"69","7.675371","a23-77-218-242.deploy.static.akamaitechnologies.com","10.8.0.1","TCP","54","443  >  34496 [SYN, ACK] Seq=0 Ack=1 Win=65535 Len=0"
"70","7.675398","10.8.0.1","a23-77-218-161.deploy.static.akamaitechnologies.com","TCP","74","50810  >  443 [SYN] Seq=0 Win=65535 Len=0 MSS=1460 SACK_PERM=1 TSval=3230067585 TSecr=0 WS=1024"
"71","7.676788","a23-77-218-161.deploy.static.akamaitechnologies.com","10.8.0.1","TCP","54","443  >  50810 [SYN, ACK] Seq=0 Ack=1 Win=65535 Len=0"
"72","7.676812","10.8.0.1","103.140.107.34.bc.googleusercontent.com","TCP","54","50734  >  443 [ACK] Seq=1 Ack=1 Win=65535 Len=0"
"73","7.676830","10.8.0.1","103.140.107.34.bc.googleusercontent.com","TCP","590","50734  >  443 [ACK] Seq=1 Ack=1 Win=65535 Len=536 [TCP segment of a reassembled PDU]"
"74","7.676870","103.140.107.34.bc.googleusercontent.com","10.8.0.1","TCP","54","443  >  50734 [ACK] Seq=1 Ack=537 Win=65535 Len=0"
"75","7.676883","10.8.0.1","103.140.107.34.bc.googleusercontent.com","TLSv1.3","123","Client Hello"
"76","7.676907","103.140.107.34.bc.googleusercontent.com","10.8.0.1","TCP","54","443  >  50734 [ACK] Seq=1 Ack=606 Win=65535 Len=0"
"77","7.676918","10.8.0.1","a23-77-218-226.deploy.static.akamaitechnologies.com","TCP","74","57662  >  443 [SYN] Seq=0 Win=65535 Len=0 MSS=1460 SACK_PERM=1 TSval=4122653270 TSecr=0 WS=1024"
"78","7.677974","a23-77-218-226.deploy.static.akamaitechnologies.com","10.8.0.1","TCP","54","443  >  57662 [SYN, ACK] Seq=0 Ack=1 Win=65535 Len=0"
"79","7.678047","10.8.0.1","a23-77-218-161.deploy.static.akamaitechnologies.com","TCP","74","50816  >  443 [SYN] Seq=0 Win=65535 Len=0 MSS=1460 SACK_PERM=1 TSval=3230067771 TSecr=0 WS=1024"
"80","7.679461","a23-77-218-161.deploy.static.akamaitechnologies.com","10.8.0.1","TCP","54","443  >  50816 [SYN, ACK] Seq=0 Ack=1 Win=65535 Len=0"
"81","7.679482","10.8.0.1","103.140.107.34.bc.googleusercontent.com","TCP","74","[TCP Retransmission] 50736  >  443 [SYN] Seq=0 Win=65535 Len=0 MSS=1460 SACK_PERM=1 TSval=719035861 TSecr=0 WS=1024"
"82","7.680734","103.140.107.34.bc.googleusercontent.com","10.8.0.1","TCP","54","[TCP Retransmission] 443  >  50736 [SYN, ACK] Seq=0 Ack=1 Win=65535 Len=0"
"83","7.680754","10.8.0.1","a23-77-218-226.deploy.static.akamaitechnologies.com","TCP","74","57666  >  443 [SYN] Seq=0 Win=65535 Len=0 MSS=1460 SACK_PERM=1 TSval=4122653422 TSecr=0 WS=1024"
"84","7.682170","a23-77-218-226.deploy.static.akamaitechnologies.com","10.8.0.1","TCP","54","443  >  57666 [SYN, ACK] Seq=0 Ack=1 Win=65535 Len=0"
"85","7.682191","10.8.0.1","a23-77-218-144.deploy.static.akamaitechnologies.com","TCP","74","57660  >  443 [SYN] Seq=0 Win=65535 Len=0 MSS=1460 SACK_PERM=1 TSval=2561179696 TSecr=0 WS=1024"
"86","7.683764","a23-77-218-144.deploy.static.akamaitechnologies.com","10.8.0.1","TCP","54","443  >  57660 [SYN, ACK] Seq=0 Ack=1 Win=65535 Len=0"
"87","7.683783","10.8.0.1","103.140.107.34.bc.googleusercontent.com","TCP","74","[TCP Retransmission] 50740  >  443 [SYN] Seq=0 Win=65535 Len=0 MSS=1460 SACK_PERM=1 TSval=719035989 TSecr=0 WS=1024"
"88","7.685074","103.140.107.34.bc.googleusercontent.com","10.8.0.1","TCP","54","[TCP Retransmission] 443  >  50740 [SYN, ACK] Seq=0 Ack=1 Win=65535 Len=0"
"89","7.685092","10.8.0.1","a23-77-218-235.deploy.static.akamaitechnologies.com","TCP","74","42852  >  443 [SYN] Seq=0 Win=65535 Len=0 MSS=1460 SACK_PERM=1 TSval=204990851 TSecr=0 WS=1024"
"90","7.686383","a23-77-218-235.deploy.static.akamaitechnologies.com","10.8.0.1","TCP","54","443  >  42852 [SYN, ACK] Seq=0 Ack=1 Win=65535 Len=0"
"91","7.686403","10.8.0.1","a23-77-218-144.deploy.static.akamaitechnologies.com","TCP","74","57664  >  443 [SYN] Seq=0 Win=65535 Len=0 MSS=1460 SACK_PERM=1 TSval=2561179893 TSecr=0 WS=1024"
"92","7.687965","a23-77-218-144.deploy.static.akamaitechnologies.com","10.8.0.1","TCP","54","443  >  57664 [SYN, ACK] Seq=0 Ack=1 Win=65535 Len=0"
"93","7.687986","10.8.0.1","a23-77-218-235.deploy.static.akamaitechnologies.com","TCP","74","42856  >  443 [SYN] Seq=0 Win=65535 Len=0 MSS=1460 SACK_PERM=1 TSval=204991004 TSecr=0 WS=1024"
"94","7.689218","a23-77-218-235.deploy.static.akamaitechnologies.com","10.8.0.1","TCP","54","443  >  42856 [SYN, ACK] Seq=0 Ack=1 Win=65535 Len=0"
"95","7.689237","10.8.0.1","a23-77-218-146.deploy.static.akamaitechnologies.com","TCP","74","45184  >  443 [SYN] Seq=0 Win=65535 Len=0 MSS=1460 SACK_PERM=1 TSval=2388955545 TSecr=0 WS=1024"
"96","7.690826","a23-77-218-146.deploy.static.akamaitechnologies.com","10.8.0.1","TCP","54","443  >  45184 [SYN, ACK] Seq=0 Ack=1 Win=65535 Len=0"
"97","7.690848","10.8.0.1","103.140.107.34.bc.googleusercontent.com","TCP","74","[TCP Retransmission] 50744  >  443 [SYN] Seq=0 Win=65535 Len=0 MSS=1460 SACK_PERM=1 TSval=719036213 TSecr=0 WS=1024"
"98","7.692063","103.140.107.34.bc.googleusercontent.com","10.8.0.1","TCP","54","[TCP Retransmission] 443  >  50744 [SYN, ACK] Seq=0 Ack=1 Win=65535 Len=0"
"99","7.692082","10.8.0.1","103.140.107.34.bc.googleusercontent.com","TCP","74","[TCP Retransmission] 50748  >  443 [SYN] Seq=0 Win=65535 Len=0 MSS=1460 SACK_PERM=1 TSval=719036277 TSecr=0 WS=1024"
"100","7.693273","103.140.107.34.bc.googleusercontent.com","10.8.0.1","TCP","54","[TCP Retransmission] 443  >  50748 [SYN, ACK] Seq=0 Ack=1 Win=65535 Len=0"
"101","7.693292","10.8.0.1","103.140.107.34.bc.googleusercontent.com","TCP","74","[TCP Retransmission] 50750  >  443 [SYN] Seq=0 Win=65535 Len=0 MSS=1460 SACK_PERM=1 TSval=719036341 TSecr=0 WS=1024"
"102","7.694553","103.140.107.34.bc.googleusercontent.com","10.8.0.1","TCP","54","[TCP Retransmission] 443  >  50750 [SYN, ACK] Seq=0 Ack=1 Win=65535 Len=0"
"103","7.694573","10.8.0.1","a23-77-218-219.deploy.static.akamaitechnologies.com","TCP","74","56744  >  443 [SYN] Seq=0 Win=65535 Len=0 MSS=1460 SACK_PERM=1 TSval=2271351583 TSecr=0 WS=1024"
"104","7.695730","a23-77-218-219.deploy.static.akamaitechnologies.com","10.8.0.1","TCP","54","443  >  56744 [SYN, ACK] Seq=0 Ack=1 Win=65535 Len=0"
"105","7.695749","10.8.0.1","a23-77-218-146.deploy.static.akamaitechnologies.com","TCP","74","45188  >  443 [SYN] Seq=0 Win=65535 Len=0 MSS=1460 SACK_PERM=1 TSval=2388955742 TSecr=0 WS=1024"
"106","7.697062","a23-77-218-146.deploy.static.akamaitechnologies.com","10.8.0.1","TCP","54","443  >  45188 [SYN, ACK] Seq=0 Ack=1 Win=65535 Len=0"
"107","7.697082","10.8.0.1","a23-77-218-219.deploy.static.akamaitechnologies.com","TCP","74","56748  >  443 [SYN] Seq=0 Win=65535 Len=0 MSS=1460 SACK_PERM=1 TSval=2271351738 TSecr=0 WS=1024"
"108","7.698103","a23-77-218-219.deploy.static.akamaitechnologies.com","10.8.0.1","TCP","54","443  >  56748 [SYN, ACK] Seq=0 Ack=1 Win=65535 Len=0"
"109","7.698118","10.8.0.1","a23-77-218-145.deploy.static.akamaitechnologies.com","TCP","74","38702  >  443 [SYN] Seq=0 Win=65535 Len=0 MSS=1460 SACK_PERM=1 TSval=4239110224 TSecr=0 WS=1024"
"110","7.698981","a23-77-218-145.deploy.static.akamaitechnologies.com","10.8.0.1","TCP","54","443  >  38702 [SYN, ACK] Seq=0 Ack=1 Win=65535 Len=0"
"111","7.698996","10.8.0.1","a23-77-218-217.deploy.static.akamaitechnologies.com","TCP","74","59496  >  443 [SYN] Seq=0 Win=65535 Len=0 MSS=1460 SACK_PERM=1 TSval=3653890899 TSecr=0 WS=1024"
"112","7.699683","a23-77-218-217.deploy.static.akamaitechnologies.com","10.8.0.1","TCP","54","443  >  59496 [SYN, ACK] Seq=0 Ack=1 Win=65535 Len=0"
"113","7.699697","10.8.0.1","a23-77-218-145.deploy.static.akamaitechnologies.com","TCP","74","38706  >  443 [SYN] Seq=0 Win=65535 Len=0 MSS=1460 SACK_PERM=1 TSval=4239110421 TSecr=0 WS=1024"
"114","7.700660","a23-77-218-145.deploy.static.akamaitechnologies.com","10.8.0.1","TCP","54","443  >  38706 [SYN, ACK] Seq=0 Ack=1 Win=65535 Len=0"
"115","7.700675","10.81.92.15","ord38s32-in-f10.1e100.net","TCP","611","[TCP Retransmission] 50062  >  443 [PSH, ACK] Seq=1 Ack=1 Win=64 Len=545 TSval=259928360 TSecr=1045600958"
"116","7.700683","10.81.92.15","ord38s32-in-f10.1e100.net","TCP","611","[TCP Retransmission] 50064  >  443 [PSH, ACK] Seq=1 Ack=1 Win=64 Len=545 TSval=259928360 TSecr=2549662120"
"117","7.700689","10.8.0.1","103.140.107.34.bc.googleusercontent.com","TCP","54","50736  >  443 [ACK] Seq=1 Ack=1 Win=67107840 Len=0"
"118","7.700698","10.8.0.1","103.140.107.34.bc.googleusercontent.com","TCP","590","50736  >  443 [ACK] Seq=1 Ack=1 Win=67107840 Len=536 [TCP segment of a reassembled PDU]"
"119","7.700728","103.140.107.34.bc.googleusercontent.com","10.8.0.1","TCP","54","443  >  50736 [ACK] Seq=1 Ack=537 Win=65535 Len=0"
"120","7.700735","10.8.0.1","103.140.107.34.bc.googleusercontent.com","TLSv1.3","123","Client Hello"
"121","7.700749","103.140.107.34.bc.googleusercontent.com","10.8.0.1","TCP","54","443  >  50736 [ACK] Seq=1 Ack=606 Win=65535 Len=0"
"122","7.700756","10.8.0.1","a23-77-218-171.deploy.static.akamaitechnologies.com","TCP","54","58144  >  443 [RST] Seq=1 Win=0 Len=0"
"123","7.700802","10.8.0.1","a23-77-218-217.deploy.static.akamaitechnologies.com","TCP","74","59504  >  443 [SYN] Seq=0 Win=65535 Len=0 MSS=1460 SACK_PERM=1 TSval=3653891056 TSecr=0 WS=1024"
"124","7.701570","a23-77-218-217.deploy.static.akamaitechnologies.com","10.8.0.1","TCP","54","443  >  59504 [SYN, ACK] Seq=0 Ack=1 Win=65535 Len=0"
"125","7.701585","10.8.0.1","a23-77-218-152.deploy.static.akamaitechnologies.com","TCP","74","34608  >  443 [SYN] Seq=0 Win=65535 Len=0 MSS=1460 SACK_PERM=1 TSval=3995856942 TSecr=0 WS=1024"
"126","7.702491","a23-77-218-152.deploy.static.akamaitechnologies.com","10.8.0.1","TCP","54","443  >  34608 [SYN, ACK] Seq=0 Ack=1 Win=65535 Len=0"
"127","7.702525","10.8.0.1","a23-77-218-209.deploy.static.akamaitechnologies.com","TCP","74","50040  >  443 [SYN] Seq=0 Win=65535 Len=0 MSS=1460 SACK_PERM=1 TSval=3508760822 TSecr=0 WS=1024"
"128","7.703272","a23-77-218-209.deploy.static.akamaitechnologies.com","10.8.0.1","TCP","54","443  >  50040 [SYN, ACK] Seq=0 Ack=1 Win=65535 Len=0"
"129","7.703287","10.8.0.1","a23-77-218-152.deploy.static.akamaitechnologies.com","TCP","74","34612  >  443 [SYN] Seq=0 Win=65535 Len=0 MSS=1460 SACK_PERM=1 TSval=3995857140 TSecr=0 WS=1024"
"130","7.704247","a23-77-218-152.deploy.static.akamaitechnologies.com","10.8.0.1","TCP","54","443  >  34612 [SYN, ACK] Seq=0 Ack=1 Win=65535 Len=0"
"131","7.704262","10.8.0.1","a23-77-218-209.deploy.static.akamaitechnologies.com","TCP","74","50044  >  443 [SYN] Seq=0 Win=65535 Len=0 MSS=1460 SACK_PERM=1 TSval=3508760979 TSecr=0 WS=1024"
"132","7.705034","a23-77-218-209.deploy.static.akamaitechnologies.com","10.8.0.1","TCP","54","443  >  50044 [SYN, ACK] Seq=0 Ack=1 Win=65535 Len=0"
"133","7.705048","10.8.0.1","a23-77-218-162.deploy.static.akamaitechnologies.com","TCP","74","55376  >  443 [SYN] Seq=0 Win=65535 Len=0 MSS=1460 SACK_PERM=1 TSval=2738360798 TSecr=0 WS=1024"
"134","7.706034","a23-77-218-162.deploy.static.akamaitechnologies.com","10.8.0.1","TCP","54","443  >  55376 [SYN, ACK] Seq=0 Ack=1 Win=65535 Len=0"
"135","7.706048","10.8.0.1","a23-77-218-203.deploy.static.akamaitechnologies.com","TCP","74","54924  >  443 [SYN] Seq=0 Win=65535 Len=0 MSS=1460 SACK_PERM=1 TSval=1875823047 TSecr=0 WS=1024"
"136","7.707274","a23-77-218-203.deploy.static.akamaitechnologies.com","10.8.0.1","TCP","54","443  >  54924 [SYN, ACK] Seq=0 Ack=1 Win=65535 Len=0"
"137","7.707290","10.8.0.1","a23-77-218-162.deploy.static.akamaitechnologies.com","TCP","74","55380  >  443 [SYN] Seq=0 Win=65535 Len=0 MSS=1460 SACK_PERM=1 TSval=2738360996 TSecr=0 WS=1024"
"138","7.708311","a23-77-218-162.deploy.static.akamaitechnologies.com","10.8.0.1","TCP","54","443  >  55380 [SYN, ACK] Seq=0 Ack=1 Win=65535 Len=0"
"139","7.708325","10.8.0.1","4.163.120.34.bc.googleusercontent.com","TCP","74","41332  >  443 [SYN] Seq=0 Win=65535 Len=0 MSS=1460 SACK_PERM=1 TSval=3660346794 TSecr=0 WS=1024"
"140","7.709187","4.163.120.34.bc.googleusercontent.com","10.8.0.1","TCP","54","443  >  41332 [SYN, ACK] Seq=0 Ack=1 Win=65535 Len=0"
"141","7.709202","10.8.0.1","a23-77-218-203.deploy.static.akamaitechnologies.com","TCP","74","54930  >  443 [SYN] Seq=0 Win=65535 Len=0 MSS=1460 SACK_PERM=1 TSval=1875823197 TSecr=0 WS=1024"
"142","7.710041","a23-77-218-203.deploy.static.akamaitechnologies.com","10.8.0.1","TCP","54","443  >  54930 [SYN, ACK] Seq=0 Ack=1 Win=65535 Len=0"
"143","7.710057","10.8.0.1","a23-77-218-139.deploy.static.akamaitechnologies.com","TCP","74","45894  >  443 [SYN] Seq=0 Win=65535 Len=0 MSS=1460 SACK_PERM=1 TSval=537423121 TSecr=0 WS=1024"
"144","7.710839","a23-77-218-139.deploy.static.akamaitechnologies.com","10.8.0.1","TCP","54","443  >  45894 [SYN, ACK] Seq=0 Ack=1 Win=65535 Len=0"
"145","7.710853","10.8.0.1","199.232.6.73","TCP","74","51504  >  443 [SYN] Seq=0 Win=65535 Len=0 MSS=1460 SACK_PERM=1 TSval=1076371906 TSecr=0 WS=1024"
"146","7.711579","199.232.6.73","10.8.0.1","TCP","54","443  >  51504 [SYN, ACK] Seq=0 Ack=1 Win=65535 Len=0"
"147","7.711594","10.81.92.15","ord38s32-in-f10.1e100.net","TCP","66","[TCP Dup ACK 2#3] 50062  >  443 [ACK] Seq=546 Ack=1 Win=64 Len=0 TSval=259929181 TSecr=1045600958"
"148","7.711601","10.81.92.15","ord38s32-in-f10.1e100.net","TCP","66","[TCP Dup ACK 1#3] 50064  >  443 [ACK] Seq=546 Ack=1 Win=64 Len=0 TSval=259929181 TSecr=2549662120"
"149","7.711607","10.8.0.1","a23-77-218-216.deploy.static.akamaitechnologies.com","TCP","74","34822  >  443 [SYN] Seq=0 Win=65535 Len=0 MSS=1460 SACK_PERM=1 TSval=2335260097 TSecr=0 WS=1024"
"150","7.712351","a23-77-218-216.deploy.static.akamaitechnologies.com","10.8.0.1","TCP","54","443  >  34822 [SYN, ACK] Seq=0 Ack=1 Win=65535 Len=0"
"151","7.712365","10.8.0.1","a23-77-218-139.deploy.static.akamaitechnologies.com","TCP","74","45900  >  443 [SYN] Seq=0 Win=65535 Len=0 MSS=1460 SACK_PERM=1 TSval=537423321 TSecr=0 WS=1024"
"152","7.713243","a23-77-218-139.deploy.static.akamaitechnologies.com","10.8.0.1","TCP","54","443  >  45900 [SYN, ACK] Seq=0 Ack=1 Win=65535 Len=0"
"153","7.713258","10.8.0.1","4.163.120.34.bc.googleusercontent.com","TCP","74","41344  >  443 [SYN] Seq=0 Win=65535 Len=0 MSS=1460 SACK_PERM=1 TSval=3660347042 TSecr=0 WS=1024"
"154","7.713966","4.163.120.34.bc.googleusercontent.com","10.8.0.1","TCP","54","443  >  41344 [SYN, ACK] Seq=0 Ack=1 Win=65535 Len=0"
"155","7.713981","10.8.0.1","199.232.6.73","TCP","74","51512  >  443 [SYN] Seq=0 Win=65535 Len=0 MSS=1460 SACK_PERM=1 TSval=1076372088 TSecr=0 WS=1024"
"156","7.714618","199.232.6.73","10.8.0.1","TCP","54","443  >  51512 [SYN, ACK] Seq=0 Ack=1 Win=65535 Len=0"
"157","7.714632","10.8.0.1","103.140.107.34.bc.googleusercontent.com","TCP","54","50740  >  443 [ACK] Seq=1 Ack=1 Win=67107840 Len=0"
"158","7.714643","10.8.0.1","103.140.107.34.bc.googleusercontent.com","TCP","590","50740  >  443 [ACK] Seq=1 Ack=1 Win=67107840 Len=536 [TCP segment of a reassembled PDU]"
"159","7.714669","103.140.107.34.bc.googleusercontent.com","10.8.0.1","TCP","54","443  >  50740 [ACK] Seq=1 Ack=537 Win=65535 Len=0"
"160","7.714675","10.8.0.1","103.140.107.34.bc.googleusercontent.com","TLSv1.3","123","Client Hello"
"161","7.714688","103.140.107.34.bc.googleusercontent.com","10.8.0.1","TCP","54","443  >  50740 [ACK] Seq=1 Ack=606 Win=65535 Len=0"
"162","7.714695","10.8.0.1","a23-77-218-171.deploy.static.akamaitechnologies.com","TCP","54","58148  >  443 [RST] Seq=1 Win=0 Len=0"
"163","7.714763","10.8.0.1","103.140.107.34.bc.googleusercontent.com","TCP","54","50744  >  443 [ACK] Seq=1 Ack=1 Win=67107840 Len=0"
"164","7.714773","10.8.0.1","103.140.107.34.bc.googleusercontent.com","TCP","590","50744  >  443 [ACK] Seq=1 Ack=1 Win=67107840 Len=536 [TCP segment of a reassembled PDU]"
"165","7.714811","103.140.107.34.bc.googleusercontent.com","10.8.0.1","TCP","54","443  >  50744 [ACK] Seq=1 Ack=537 Win=65535 Len=0"
"166","7.714819","10.8.0.1","103.140.107.34.bc.googleusercontent.com","TLSv1.3","123","Client Hello"
"167","7.714832","103.140.107.34.bc.googleusercontent.com","10.8.0.1","TCP","54","443  >  50744 [ACK] Seq=1 Ack=606 Win=65535 Len=0"
"168","7.714838","10.8.0.1","a23-77-218-137.deploy.static.akamaitechnologies.com","TCP","54","43152  >  443 [RST] Seq=1 Win=0 Len=0"
"169","7.714875","10.8.0.1","103.140.107.34.bc.googleusercontent.com","TCP","54","50748  >  443 [ACK] Seq=1 Ack=1 Win=67107840 Len=0"
"170","7.714885","10.8.0.1","103.140.107.34.bc.googleusercontent.com","TCP","54","50750  >  443 [ACK] Seq=1 Ack=1 Win=67107840 Len=0"
"171","7.714893","10.8.0.1","103.140.107.34.bc.googleusercontent.com","TCP","590","50748  >  443 [ACK] Seq=1 Ack=1 Win=67107840 Len=536 [TCP segment of a reassembled PDU]"
"172","7.714911","103.140.107.34.bc.googleusercontent.com","10.8.0.1","TCP","54","443  >  50748 [ACK] Seq=1 Ack=537 Win=65535 Len=0"
"173","7.714918","10.8.0.1","103.140.107.34.bc.googleusercontent.com","TLSv1.3","123","Client Hello"
"174","7.714941","103.140.107.34.bc.googleusercontent.com","10.8.0.1","TCP","54","443  >  50748 [ACK] Seq=1 Ack=606 Win=65535 Len=0"
"175","7.714948","10.8.0.1","103.140.107.34.bc.googleusercontent.com","TCP","590","50750  >  443 [ACK] Seq=1 Ack=1 Win=67107840 Len=536 [TCP segment of a reassembled PDU]"
"176","7.714962","103.140.107.34.bc.googleusercontent.com","10.8.0.1","TCP","54","443  >  50750 [ACK] Seq=1 Ack=537 Win=65535 Len=0"
"177","7.714968","10.8.0.1","103.140.107.34.bc.googleusercontent.com","TLSv1.3","123","Client Hello"
"178","7.714979","103.140.107.34.bc.googleusercontent.com","10.8.0.1","TCP","54","443  >  50750 [ACK] Seq=1 Ack=606 Win=65535 Len=0"
"179","7.714985","10.8.0.1","a23-77-218-216.deploy.static.akamaitechnologies.com","TCP","74","34842  >  443 [SYN] Seq=0 Win=65535 Len=0 MSS=1460 SACK_PERM=1 TSval=2335260248 TSecr=0 WS=1024"
"180","7.715637","a23-77-218-216.deploy.static.akamaitechnologies.com","10.8.0.1","TCP","54","443  >  34842 [SYN, ACK] Seq=0 Ack=1 Win=65535 Len=0"
"181","7.715651","10.8.0.1","a23-77-218-171.deploy.static.akamaitechnologies.com","TCP","74","58246  >  443 [SYN] Seq=0 Win=65535 Len=0 MSS=1460 SACK_PERM=1 TSval=2751406828 TSecr=0 WS=1024"
"182","7.716551","a23-77-218-171.deploy.static.akamaitechnologies.com","10.8.0.1","TCP","54","443  >  58246 [SYN, ACK] Seq=0 Ack=1 Win=65535 Len=0"
"183","7.716565","10.8.0.1","a23-77-218-242.deploy.static.akamaitechnologies.com","TCP","54","34492  >  443 [RST] Seq=1 Win=0 Len=0"
"184","7.716700","10.8.0.1","4.163.120.34.bc.googleusercontent.com","GQUIC","73","Payload (Encrypted), PKN: 4, CID: 18305389013508390359"
"185","8.730972","10.8.0.1","a23-77-218-137.deploy.static.akamaitechnologies.com","TCP","54","43160  >  443 [RST] Seq=1 Win=0 Len=0"
"186","8.731736","103.140.107.34.bc.googleusercontent.com","10.8.0.1","TLSv1.3","266","Server Hello, Change Cipher Spec, Application Data"
"187","8.731847","10.8.0.1","4.163.120.34.bc.googleusercontent.com","GQUIC","1392","Client Hello, PKN: 5, CID: 18305389013508390359"
"188","8.842807","4.163.120.34.bc.googleusercontent.com","10.8.0.1","GQUIC","1392","Payload (Encrypted), PKN: 12"
"189","8.842885","10.8.0.1","a23-77-218-242.deploy.static.akamaitechnologies.com","TCP","54","34496  >  443 [RST] Seq=1 Win=0 Len=0"
"190","8.843329","103.140.107.34.bc.googleusercontent.com","10.8.0.1","TLSv1.3","266","Server Hello, Change Cipher Spec, Application Data"
"191","8.843384","10.8.0.1","4.163.120.34.bc.googleusercontent.com","GQUIC","756","Payload (Encrypted), PKN: 6, CID: 18305389013508390359"
"192","8.921664","4.163.120.34.bc.googleusercontent.com","10.8.0.1","GQUIC","700","Payload (Encrypted), PKN: 13"
"193","8.921777","10.8.0.1","a23-77-218-161.deploy.static.akamaitechnologies.com","TCP","54","50810  >  443 [RST] Seq=1 Win=0 Len=0"
"194","8.922420","103.140.107.34.bc.googleusercontent.com","10.8.0.1","TLSv1.3","266","Server Hello, Change Cipher Spec, Application Data"
"195","8.922774","103.140.107.34.bc.googleusercontent.com","10.8.0.1","TLSv1.3","266","Server Hello, Change Cipher Spec, Application Data"
"196","8.923159","103.140.107.34.bc.googleusercontent.com","10.8.0.1","TLSv1.3","266","Server Hello, Change Cipher Spec, Application Data"
"197","8.923488","103.140.107.34.bc.googleusercontent.com","10.8.0.1","TLSv1.3","266","Server Hello, Change Cipher Spec, Application Data"
"198","8.923550","10.8.0.1","a23-77-218-226.deploy.static.akamaitechnologies.com","TCP","54","57662  >  443 [RST] Seq=1 Win=0 Len=0"
"199","8.923711","10.8.0.1","a23-77-218-161.deploy.static.akamaitechnologies.com","TCP","54","50816  >  443 [RST] Seq=1 Win=0 Len=0"
"200","8.923818","10.8.0.1","103.140.107.34.bc.googleusercontent.com","TCP","54","[TCP Dup ACK 117#1] 50736  >  443 [ACK] Seq=606 Ack=1 Win=67107840 Len=0"
"201","8.923844","10.8.0.1","a23-77-218-226.deploy.static.akamaitechnologies.com","TCP","54","57666  >  443 [RST] Seq=1 Win=0 Len=0"
"202","8.923935","10.8.0.1","a23-77-218-144.deploy.static.akamaitechnologies.com","TCP","54","57660  >  443 [RST] Seq=1 Win=0 Len=0"
"203","8.924074","10.8.0.1","103.140.107.34.bc.googleusercontent.com","TCP","54","[TCP Dup ACK 157#1] 50740  >  443 [ACK] Seq=606 Ack=1 Win=67107840 Len=0"
"204","8.924104","10.8.0.1","a23-77-218-235.deploy.static.akamaitechnologies.com","TCP","54","42852  >  443 [RST] Seq=1 Win=0 Len=0"
"205","8.924192","10.8.0.1","a23-77-218-144.deploy.static.akamaitechnologies.com","TCP","54","57664  >  443 [RST] Seq=1 Win=0 Len=0"
"206","8.924273","10.8.0.1","a23-77-218-235.deploy.static.akamaitechnologies.com","TCP","54","42856  >  443 [RST] Seq=1 Win=0 Len=0"
"207","8.924351","10.8.0.1","a23-77-218-146.deploy.static.akamaitechnologies.com","TCP","54","45184  >  443 [RST] Seq=1 Win=0 Len=0"
"208","8.924433","10.8.0.1","103.140.107.34.bc.googleusercontent.com","TCP","54","[TCP Dup ACK 163#1] 50744  >  443 [ACK] Seq=606 Ack=1 Win=67107840 Len=0"
"209","8.924456","10.8.0.1","103.140.107.34.bc.googleusercontent.com","TCP","54","[TCP Dup ACK 169#1] 50748  >  443 [ACK] Seq=606 Ack=1 Win=67107840 Len=0"
"210","8.924476","10.8.0.1","103.140.107.34.bc.googleusercontent.com","TCP","54","[TCP Dup ACK 170#1] 50750  >  443 [ACK] Seq=606 Ack=1 Win=67107840 Len=0"
"211","8.924495","10.8.0.1","a23-77-218-219.deploy.static.akamaitechnologies.com","TCP","54","56744  >  443 [RST] Seq=1 Win=0 Len=0"
"212","8.924572","10.8.0.1","a23-77-218-146.deploy.static.akamaitechnologies.com","TCP","54","45188  >  443 [RST] Seq=1 Win=0 Len=0"
"213","8.924730","10.8.0.1","a23-77-218-219.deploy.static.akamaitechnologies.com","TCP","54","56748  >  443 [RST] Seq=1 Win=0 Len=0"
"214","8.924839","10.8.0.1","a23-77-218-145.deploy.static.akamaitechnologies.com","TCP","54","38702  >  443 [RST] Seq=1 Win=0 Len=0"
"215","8.924922","10.8.0.1","a23-77-218-217.deploy.static.akamaitechnologies.com","TCP","54","59496  >  443 [RST] Seq=1 Win=0 Len=0"
"216","8.924999","10.8.0.1","a23-77-218-145.deploy.static.akamaitechnologies.com","TCP","54","38706  >  443 [RST] Seq=1 Win=0 Len=0"
"217","8.925070","10.8.0.1","a23-77-218-217.deploy.static.akamaitechnologies.com","TCP","54","59504  >  443 [RST] Seq=1 Win=0 Len=0"
"218","8.925145","10.8.0.1","a23-77-218-152.deploy.static.akamaitechnologies.com","TCP","54","34608  >  443 [RST] Seq=1 Win=0 Len=0"
"219","8.925221","10.8.0.1","a23-77-218-209.deploy.static.akamaitechnologies.com","TCP","54","50040  >  443 [RST] Seq=1 Win=0 Len=0"
"220","8.925298","10.8.0.1","a23-77-218-152.deploy.static.akamaitechnologies.com","TCP","54","34612  >  443 [RST] Seq=1 Win=0 Len=0"
"221","8.925371","10.8.0.1","a23-77-218-209.deploy.static.akamaitechnologies.com","TCP","54","50044  >  443 [RST] Seq=1 Win=0 Len=0"
"222","8.925447","10.8.0.1","a23-77-218-162.deploy.static.akamaitechnologies.com","TCP","54","55376  >  443 [RST] Seq=1 Win=0 Len=0"
"223","8.925517","10.8.0.1","a23-77-218-203.deploy.static.akamaitechnologies.com","TCP","54","54924  >  443 [RST] Seq=1 Win=0 Len=0"
"224","8.925589","10.8.0.1","a23-77-218-162.deploy.static.akamaitechnologies.com","TCP","54","55380  >  443 [RST] Seq=1 Win=0 Len=0"
"225","8.925665","10.8.0.1","4.163.120.34.bc.googleusercontent.com","TCP","54","41332  >  443 [ACK] Seq=1 Ack=1 Win=65535 Len=0"
"226","8.925691","10.8.0.1","a23-77-218-203.deploy.static.akamaitechnologies.com","TCP","54","54930  >  443 [RST] Seq=1 Win=0 Len=0"
"227","8.925769","10.8.0.1","4.163.120.34.bc.googleusercontent.com","TLSv1.3","571","Client Hello"
"228","8.925936","4.163.120.34.bc.googleusercontent.com","10.8.0.1","TCP","54","443  >  41332 [ACK] Seq=1 Ack=518 Win=65535 Len=0"
"229","8.925972","10.8.0.1","a23-77-218-139.deploy.static.akamaitechnologies.com","TCP","54","45894  >  443 [RST] Seq=1 Win=0 Len=0"
"230","8.926164","10.8.0.1","199.232.6.73","TCP","54","51504  >  443 [ACK] Seq=1 Ack=1 Win=65535 Len=0"
"231","8.926196","10.8.0.1","199.232.6.73","TLSv1.3","571","Client Hello"
"232","8.926281","199.232.6.73","10.8.0.1","TCP","54","443  >  51504 [ACK] Seq=1 Ack=518 Win=65535 Len=0"
"233","8.926307","10.8.0.1","a23-77-218-216.deploy.static.akamaitechnologies.com","TCP","54","34822  >  443 [ACK] Seq=1 Ack=1 Win=65535 Len=0"
"234","8.926383","10.8.0.1","a23-77-218-216.deploy.static.akamaitechnologies.com","TLSv1.3","571","Client Hello"
"235","8.926441","a23-77-218-216.deploy.static.akamaitechnologies.com","10.8.0.1","TCP","54","443  >  34822 [ACK] Seq=1 Ack=518 Win=65535 Len=0"
"236","8.926463","10.8.0.1","a23-77-218-139.deploy.static.akamaitechnologies.com","TCP","54","45900  >  443 [ACK] Seq=1 Ack=1 Win=65535 Len=0"
"237","8.926532","10.8.0.1","a23-77-218-139.deploy.static.akamaitechnologies.com","TLSv1.3","571","Client Hello"
"238","8.926584","a23-77-218-139.deploy.static.akamaitechnologies.com","10.8.0.1","TCP","54","443  >  45900 [ACK] Seq=1 Ack=518 Win=65535 Len=0"
"239","8.926629","10.8.0.1","4.163.120.34.bc.googleusercontent.com","TCP","54","41344  >  443 [ACK] Seq=1 Ack=1 Win=65535 Len=0"
"240","8.926717","10.8.0.1","199.232.6.73","TCP","54","51512  >  443 [ACK] Seq=1 Ack=1 Win=65535 Len=0"
"241","8.926746","10.8.0.1","4.163.120.34.bc.googleusercontent.com","TLSv1.3","571","Client Hello"
"242","8.926797","4.163.120.34.bc.googleusercontent.com","10.8.0.1","TCP","54","443  >  41344 [ACK] Seq=1 Ack=518 Win=65535 Len=0"
"243","8.926819","10.8.0.1","199.232.6.73","TLSv1.3","571","Client Hello"
"244","8.926859","199.232.6.73","10.8.0.1","TCP","54","443  >  51512 [ACK] Seq=1 Ack=518 Win=65535 Len=0"
"245","8.926927","10.8.0.1","a23-77-218-216.deploy.static.akamaitechnologies.com","TCP","54","34842  >  443 [ACK] Seq=1 Ack=1 Win=65535 Len=0"
"246","8.927021","10.8.0.1","a23-77-218-216.deploy.static.akamaitechnologies.com","TLSv1.3","571","Client Hello"
"247","8.927148","a23-77-218-216.deploy.static.akamaitechnologies.com","10.8.0.1","TCP","54","443  >  34842 [ACK] Seq=1 Ack=518 Win=65535 Len=0"
"248","8.927178","10.8.0.1","a23-77-218-171.deploy.static.akamaitechnologies.com","TCP","54","58246  >  443 [ACK] Seq=1 Ack=1 Win=65535 Len=0"
"249","8.927280","10.8.0.1","a23-77-218-171.deploy.static.akamaitechnologies.com","TLSv1.3","571","Client Hello"
"250","8.927357","a23-77-218-171.deploy.static.akamaitechnologies.com","10.8.0.1","TCP","54","443  >  58246 [ACK] Seq=1 Ack=518 Win=65535 Len=0"
"251","8.927381","10.8.0.1","a23-77-218-171.deploy.static.akamaitechnologies.com","TLSv1.3","571","[TCP Spurious Retransmission] , Client Hello"
"252","8.927418","a23-77-218-171.deploy.static.akamaitechnologies.com","10.8.0.1","TCP","54","[TCP Dup ACK 250#1] 443  >  58246 [ACK] Seq=1 Ack=518 Win=65535 Len=0"
"253","8.927479","10.8.0.1","a23-77-218-216.deploy.static.akamaitechnologies.com","TLSv1.3","571","[TCP Spurious Retransmission] , Client Hello"
"254","8.927518","a23-77-218-216.deploy.static.akamaitechnologies.com","10.8.0.1","TCP","54","[TCP Dup ACK 247#1] 443  >  34842 [ACK] Seq=1 Ack=518 Win=65535 Len=0"
"255","8.927537","10.8.0.1","199.232.6.73","TLSv1.3","571","[TCP Spurious Retransmission] , Client Hello"
"256","8.927569","199.232.6.73","10.8.0.1","TCP","54","[TCP Dup ACK 244#1] 443  >  51512 [ACK] Seq=1 Ack=518 Win=65535 Len=0"
"257","8.927605","10.8.0.1","4.163.120.34.bc.googleusercontent.com","TLSv1.3","571","[TCP Spurious Retransmission] , Client Hello"
"258","8.927639","4.163.120.34.bc.googleusercontent.com","10.8.0.1","TCP","54","[TCP Dup ACK 242#1] 443  >  41344 [ACK] Seq=1 Ack=518 Win=65535 Len=0"
"259","8.927672","10.8.0.1","a23-77-218-139.deploy.static.akamaitechnologies.com","TLSv1.3","571","[TCP Spurious Retransmission] , Client Hello"
"260","8.927705","a23-77-218-139.deploy.static.akamaitechnologies.com","10.8.0.1","TCP","54","[TCP Dup ACK 238#1] 443  >  45900 [ACK] Seq=1 Ack=518 Win=65535 Len=0"
"261","8.927737","10.8.0.1","4.163.120.34.bc.googleusercontent.com","GQUIC","1392","Client Hello, PKN: 7, CID: 18305389013508390359"
"262","9.947039","10.8.0.1","a23-77-218-216.deploy.static.akamaitechnologies.com","TLSv1.3","571","[TCP Spurious Retransmission] , Client Hello"
"263","9.947169","a23-77-218-216.deploy.static.akamaitechnologies.com","10.8.0.1","TCP","54","[TCP Dup ACK 235#1] 443  >  34822 [ACK] Seq=1 Ack=518 Win=65535 Len=0"
"264","9.947337","a23-77-218-139.deploy.static.akamaitechnologies.com","10.8.0.1","TLSv1.3","4159","Server Hello, Change Cipher Spec, Application Data, Application Data, Application Data, Application Data"
"265","9.947481","a23-77-218-216.deploy.static.akamaitechnologies.com","10.8.0.1","TLSv1.3","4189","Server Hello, Change Cipher Spec, Application Data, Application Data, Application Data, Application Data, Application Data"
"266","9.947549","a23-77-218-216.deploy.static.akamaitechnologies.com","10.8.0.1","TCP","54","443  >  34842 [FIN, ACK] Seq=4136 Ack=518 Win=65535 Len=0"
"267","9.947703","199.232.6.73","10.8.0.1","TLSv1.3","4228","Server Hello, Change Cipher Spec, Application Data, Application Data, Application Data, Application Data, Application Data, Application Data"
"268","9.947771","199.232.6.73","10.8.0.1","TCP","54","443  >  51512 [FIN, ACK] Seq=4175 Ack=518 Win=65535 Len=0"
